"タイトル","コメント","URLアドレス","座標","詳細情報","親リスト","一覧抽出方法","前文"
"横浜市緑の協会","","https://ja.wikipedia.org/wiki/横浜市緑の協会","","","Category:横浜市の公園","箇条書き,制限あり",""
"横浜市の市民の森","","https://ja.wikipedia.org/wiki/横浜市の市民の森","","","Category:横浜市の公園","箇条書き,制限あり",""
"アメリカ山公園","","https://ja.wikipedia.org/wiki/アメリカ山公園","北緯35度26分29秒東経139度39分6秒","分類: 都市公園（風致公園）;所在地: 日本横浜市中区山手町97-1;面積: 5,519 m2;開園: 2009年8月7日（一部開園）2012年4月1日（全面開園）;運営者: 横浜市アメリカ山公園パートナーズ（西武造園株式会社）;設備・遊具: 庭園、トイレ;駐車場: なし;アクセス: みなとみらい線元町・中華街駅東側改札口（元町口）直結;事務所: 環境創造局 南部公園緑地事務所 都心部公園担当;事務所所在地: 横浜市中区真砂町2-22（関内中央ビル）;備考: 開園時間は朝6時から夜11時、入園料は無料、年中無休だが公園管理の際に休園日を設ける場合がある。;公式サイト: https://www.seibu-la.co.jp/mt_america/","Category:横浜市の公園","箇条書き,制限あり","横浜開港150周年となる2009年（平成21年）8月7日に一部開園。その後、2012年（平成24年）4月1日に全面開園となった。"
"海芝公園","","https://ja.wikipedia.org/wiki/海芝公園","北緯35度29分9.3秒東経139度42分1秒","所在地: 横浜市鶴見区末広町二丁目北緯35度29分9.3秒東経139度42分1秒﻿ / ﻿北緯35.485917度 東経139.70028度﻿ / 35.485917; 139.70028﻿ (海芝浦駅);駅番号: JI52;所属事業者: 東日本旅客鉄道（JR東日本）;所属路線: ■鶴見線（海芝浦支線）;キロ程: 1.7 km（浅野起点）鶴見から4.7 km;電報略号: ウミ;駅構造: 地上駅;ホーム: 1面1線;乗車人員-統計年度-: 3,250人/日（降車客含まず）-2008年-;開業年月日: 1940年（昭和15年）11月1日;備考: 無人駅（乗車駅証明書発行機 有）横浜市内駅","Category:横浜市の公園","箇条書き,制限あり","東芝の事業子会社である東芝エネルギーシステムズの京浜事業所が改札より隣接している。同社の社員や子会社の東芝プラントシステムなど、会社より認められた関係者でないと、事業所の構内に入る事ができない。"
"海の公園","","https://ja.wikipedia.org/wiki/海の公園","北緯35度20分22.2秒東経139度38分6.5秒","分類: 都市公園(総合公園);所在地: 日本神奈川県横浜市金沢区海の公園10;座標: 北緯35度20分22.2秒東経139度38分6.5秒﻿ / ﻿北緯35.339500度 東経139.635139度﻿ / 35.339500; 139.635139座標: 北緯35度20分22.2秒東経139度38分6.5秒﻿ / ﻿北緯35.339500度 東経139.635139度﻿ / 35.339500; 139.635139;面積: 170,155m2;開園: 1988年7月;運営者: 横浜市（指定管理者：公益財団法人横浜市緑の協会）;駐車場: 1688台（有料）;公式サイト: http://www.umino-kouen.net/","Category:横浜市の公園","箇条書き,制限あり","金沢地先埋め立て事業の一環として整備された。横浜市内で唯一海水浴場が有る海浜公園。海水浴場の砂は対岸の千葉県富津市の山砂を運び、海底に5年ほど仮置きしたものを使用した。公園部分の埋め立てには、能見台の開発で発生した土を使用した。八景島駅前の海岸には安山岩を使用し磯遊びが出来るようにした。"
"大倉山公園 (横浜市)","","https://ja.wikipedia.org/wiki/大倉山公園_(横浜市)","北緯35度31分31.1秒東経139度37分38.7秒","分類: 都市公園(地区公園);所在地: 日本神奈川県横浜市港北区大倉山二丁目;座標: 北緯35度31分31.1秒東経139度37分38.7秒﻿ / ﻿北緯35.525306度 東経139.627417度﻿ / 35.525306; 139.627417座標: 北緯35度31分31.1秒東経139度37分38.7秒﻿ / ﻿北緯35.525306度 東経139.627417度﻿ / 35.525306; 139.627417;面積: 約6.9ha;開園: 1984年(都市公園として);設計者: 高村弘平;運営者: 横浜市;設備・遊具: 池","Category:横浜市の公園","箇条書き,制限あり","敷地6.9万平米(=6.9ha)。うち1.1haの梅林には約20種150本の梅が植えられ、観梅の時期には多くの人出がある。"
"大塚・歳勝土遺跡","","https://ja.wikipedia.org/wiki/大塚・歳勝土遺跡","北緯35度33分5.1秒東経139度34分50.0秒","分類: 都市公園（歴史公園）;所在地: 日本横浜市都筑区大棚西1;座標: 北緯35度33分5.1秒東経139度34分50.0秒﻿ / ﻿北緯35.551417度 東経139.580556度﻿ / 35.551417; 139.580556座標: 北緯35度33分5.1秒東経139度34分50.0秒﻿ / ﻿北緯35.551417度 東経139.580556度﻿ / 35.551417; 139.580556;面積: 54,640m2;開園: 1996年3月25日;運営者: 横浜市;公式サイト: 大塚・歳勝土遺跡公園（横浜市歴史博物館）","Category:横浜市の公園","箇条書き,制限あり","1972年（昭和47年）に港北ニュータウンの開発に伴う事前の発掘調査で存在が明らかとなる。大塚遺跡は高台に作られた弥生時代中期の環濠集落であることが確認された。歳勝土遺跡では、大塚遺跡の環濠とその周囲に広がる土塁に近接した一帯から方形周溝墓群が発見されて、年代的にも同時代であることが確かめられ、環濠集落（大塚遺跡）に住んだ人びとの墓地であることが明らかになった。"
"大通り公園","","https://ja.wikipedia.org/wiki/大通り公園","北緯35度26分25.2秒東経139度37分52秒","分類: 都市公園(地区公園);所在地: 日本神奈川県横浜市中区蓬莱町、南区高根町ほか;座標: 北緯35度26分25.2秒東経139度37分52秒﻿ / ﻿北緯35.440333度 東経139.63111度﻿ / 35.440333; 139.63111座標: 北緯35度26分25.2秒東経139度37分52秒﻿ / ﻿北緯35.440333度 東経139.63111度﻿ / 35.440333; 139.63111;面積: 約3.6ha;前身: 運河;開園: 1978年9月9日;運営者: 横浜市;駐車場: 近隣民間有料駐車場を利用;アクセス: 関内駅および伊勢佐木長者町駅、阪東橋駅より近距離にある;事務所: 環境創造局 南部公園緑地事務所 都心部公園担当;事務所所在地: 横浜市中区真砂町2-22（関内中央ビル）","Category:横浜市の公園","箇条書き,制限あり","この公園の真下に横浜市営地下鉄ブルーラインが通っている。"
"岡村公園","","https://ja.wikipedia.org/wiki/岡村公園","北緯35度24分54.7秒東経139度36分44.4秒","分類: 都市公園（地区公園）;所在地: 日本神奈川県横浜市磯子区岡村2-17;座標: 北緯35度24分54.7秒東経139度36分44.4秒﻿ / ﻿北緯35.415194度 東経139.612333度﻿ / 35.415194; 139.612333座標: 北緯35度24分54.7秒東経139度36分44.4秒﻿ / ﻿北緯35.415194度 東経139.612333度﻿ / 35.415194; 139.612333;面積: 68,139m2;開園: 1950年5月25日;運営者: 横浜緑地（指定管理者）;設備・遊具: テニスコート6面、野球場、遊具広場、梅林;駐車場: 62台;アクセス: 京浜急行・横浜市営地下鉄上大岡駅より京浜急行バス上7系統「岡村梅林入口」下車すぐ。JR根岸線根岸駅または磯子駅より横浜市営バス78系統、市営地下鉄弘明寺駅より、横浜市営バス9系統「天神前」下車10分。JR根岸線磯子駅より徒歩30分。;公式サイト: www.kanagawaparks.com/okamura/","Category:横浜市の公園","箇条書き,制限あり","岡村天満宮の南側の丘に位置し、かつては「天満宮の梅林」として、杉田梅林と並ぶ景勝地として知られた。1937年（昭和12年）頃、現在テニスコートとなっている付近に岡村天満宮の新たな社殿を建て、鶴岡八幡宮に匹敵する大きな神社にする計画が建てられたが、不景気や満州事変・支那事変による社会情勢の変化で立ち消えになった。"
"開港広場公園","","https://ja.wikipedia.org/wiki/開港広場公園","北緯35度26分50.3秒東経139度38分39.2秒","分類: 都市公園（街区公園）;所在地: 日本横浜市中区山下町1;座標: 北緯35度26分50.3秒東経139度38分39.2秒﻿ / ﻿北緯35.447306度 東経139.644222度﻿ / 35.447306; 139.644222座標: 北緯35度26分50.3秒東経139度38分39.2秒﻿ / ﻿北緯35.447306度 東経139.644222度﻿ / 35.447306; 139.644222;面積: 2,479m2;開園: 1982年12月18日;設計者: 高橋志保彦建築設計事務所;アクセス: みなとみらい線日本大通り駅から徒歩2分市営地下鉄・JR根岸線関内駅から徒歩15分","Category:横浜市の公園","箇条書き,制限あり","1854年（安政元年）3月3日。マシュー・ペリー提督は、現在横浜開港資料館の講堂がある付近の応接所で日本側全権委員との間で日米和親条約を締結した。これに先立ち、同年2月23日には幕府に献上するための汽車模型の試運転、その翌日には電信の送信実験が行われ、日本人が西洋の実情を知るとともに日本の近代化の幕を開ける契機となった。横浜が交渉の地となった経緯として、「鎌倉か浦賀を交渉の場としたい」とする幕府側に対し、「首都である江戸で行うのが国際的な慣行である」とするペリー側が江戸湾の奥まで艦隊を進めた結果、幕府側の妥協を引き出したものである。実際には江戸付近は水深が浅く、街を艦隊の砲弾の射程距離に納めるには危険があった。横浜は十分な水深と艦隊を停泊させるスペースがあり、湾口からの波浪が本牧岬により防がれていることから、条件は良好であった。幕府側にとっても、江戸や、東海道の宿場町の神奈川に入れずに食い止めたことで面子が立った。"
"笠間中央公園","","https://ja.wikipedia.org/wiki/笠間中央公園","北緯35度21分32.6秒東経139度32分17.0秒","分類: 近隣公園;所在地: 日本神奈川県横浜市栄区笠間2丁目26;座標: 北緯35度21分32.6秒東経139度32分17.0秒﻿ / ﻿北緯35.359056度 東経139.538056度﻿ / 35.359056; 139.538056座標: 北緯35度21分32.6秒東経139度32分17.0秒﻿ / ﻿北緯35.359056度 東経139.538056度﻿ / 35.359056; 139.538056;面積: 11163平方メートル;開園: 2003年（平成15年）3月25日;運営者: 横浜市（管理者：笹下中央公園愛護会）;設備・遊具: 複合遊具・ペア懸垂・多目的広場・トイレ;駐車場: なし;アクセス: 神奈中バス・江ノ電バス「岩井口」バス停から徒歩5分;事務所: 栄土木事務所;公式サイト: “栄区の公園へ行こう!（栄土木事務所所管113公園の紹介）”. 横浜市栄区(2020年7月6日). 2020年8月9日閲覧。","Category:横浜市の公園","箇条書き,制限あり","公園は大船駅の北東900メートルにある、周囲を平野に囲まれた小山にある。小山の上は比較的平らで、1990年代から公園整備ための工事が行われ、2003年（平成15年）3月25日に開園した。"
"神奈川公園","","https://ja.wikipedia.org/wiki/神奈川公園","北緯35度28分13.21秒東経139度37分53.25秒","分類: 都市公園（近隣公園）;所在地: 日本神奈川県横浜市神奈川区栄町12;座標: 北緯35度28分13.21秒東経139度37分53.25秒﻿ / ﻿北緯35.4703361度 東経139.6314583度﻿ / 35.4703361; 139.6314583座標: 北緯35度28分13.21秒東経139度37分53.25秒﻿ / ﻿北緯35.4703361度 東経139.6314583度﻿ / 35.4703361; 139.6314583;面積: 14,190 m2;開園: 1930年4月10日;運営者: 横浜市;年来園者数: 統計無し;現況: 年中開放;設備・遊具: 集会所・トイレ・遊歩道・ベンチ・花壇・ターザンロープ・すべり台・砂場・時計など;駐車場: なし;アクセス: 神奈川駅徒歩約5分神奈川公園前バス停徒歩0分;事務所: 神奈川土木事務所","Category:横浜市の公園","箇条書き,制限あり","山下公園などとともに関東大震災の政府復興事業の一環として造成された由緒ある公園で、1930年（昭和5年）4月10日開園。面積は14,190m2。公園内の北の角にコンサートホールの神奈川会館（現存せず）も建設され、公園と同時にオープンした。神奈川会館のステンドグラスは、公園内にある幸ヶ谷（こうがや）集会所に保存されている。"
"金沢自然公園","","https://ja.wikipedia.org/wiki/金沢自然公園","北緯35度21分5.7秒東経139度36分0.8秒","分類: 都市公園（広域公園）;所在地: 横浜市金沢区釜利谷東五丁目15-1;座標: 北緯35度21分5.7秒東経139度36分0.8秒﻿ / ﻿北緯35.351583度 東経139.600222度﻿ / 35.351583; 139.600222座標: 北緯35度21分5.7秒東経139度36分0.8秒﻿ / ﻿北緯35.351583度 東経139.600222度﻿ / 35.351583; 139.600222;面積: 577,593m2;開園: 1982年3月17日;運営者: 横浜市（指定管理者：公益財団法人横浜市緑の協会）;駐車場: あり（有料）;公式サイト: 公式サイト","Category:横浜市の公園","箇条書き,制限あり","園内に動物園があり、釜利谷市民の森や金沢市民の森、氷取沢市民の森に隣接している自然豊かな公園である。"
"貨物線の森緑道","","https://ja.wikipedia.org/wiki/貨物線の森緑道","北緯35度29分11.3秒東経139度40分20秒","分類: 緑道;所在地: 日本神奈川県横浜市鶴見区大黒町、神奈川区宝町・恵比須町;座標: 北緯35度29分11.3秒東経139度40分20秒﻿ / ﻿北緯35.486472度 東経139.67222度﻿ / 35.486472; 139.67222座標: 北緯35度29分11.3秒東経139度40分20秒﻿ / ﻿北緯35.486472度 東経139.67222度﻿ / 35.486472; 139.67222;面積: 約2.0ha;前身: 貨物線;開園: 2008年6月29日（一部開園）;運営者: 横浜市;駐車場: なし;公式サイト: 貨物線の森緑道（横浜市）","Category:横浜市の公園","箇条書き,制限あり","横浜開港150周年を記念して2007年（平成19年）12月より東海道本線貨物支線（通称・新興線）の廃線跡を整備し、2008年（平成20年）6月29日に一部開園した。京浜臨海部における「京浜の森」づくり事業の一つである。"
"掃部山公園","","https://ja.wikipedia.org/wiki/掃部山公園","北緯35度27分11秒東経139度37分32秒","分類: 近隣公園;所在地: 日本神奈川県横浜市西区紅葉ケ丘57;座標: 北緯35度27分11秒東経139度37分32秒﻿ / ﻿北緯35.45306度 東経139.62556度﻿ / 35.45306; 139.62556;面積: 24,727m2;開園: 1914年（大正3年）11月7日;運営者: 横浜市;設備・遊具: 幼児・児童用遊具、井伊直弼像、能楽堂;バリアフリー: 身障者対応トイレ","Category:横浜市の公園","箇条書き,制限あり","江戸時代までは海に面した高台で、不動山と呼ばれていた。"
"川和富士公園","","https://ja.wikipedia.org/wiki/川和富士公園","北緯35度31分58.6秒東経139度33分25.9秒","分類: 都市公園(近隣公園);所在地: 日本神奈川県横浜市都筑区富士見が丘20;座標: 北緯35度31分58.6秒東経139度33分25.9秒﻿ / ﻿北緯35.532944度 東経139.557194度﻿ / 35.532944; 139.557194座標: 北緯35度31分58.6秒東経139度33分25.9秒﻿ / ﻿北緯35.532944度 東経139.557194度﻿ / 35.532944; 139.557194;面積: 約2.2ha;運営者: 横浜市;公式サイト: 川和富士公園","Category:横浜市の公園","箇条書き,制限あり","川和富士は江戸時代の末期に築かれた富士塚。元々は現在地より川和高校寄りの地点（現在の富士見が丘17番14）にあったが、港北ニュータウン建設のため、現在の場所に移転・再現された。標高は74メートル。"
"神大寺中央公園","","https://ja.wikipedia.org/wiki/神大寺中央公園","北緯35度29分2.3秒東経139度36分22.2秒","分類: 都市公園;所在地: 日本横浜市神奈川区神大寺三丁目;座標: 北緯35度29分2.3秒東経139度36分22.2秒﻿ / ﻿北緯35.483972度 東経139.606167度﻿ / 35.483972; 139.606167座標: 北緯35度29分2.3秒東経139度36分22.2秒﻿ / ﻿北緯35.483972度 東経139.606167度﻿ / 35.483972; 139.606167;面積: 1.2ha;開園: 1991年4月20日;運営者: NPO法人こらぼネット・かながわ、横浜市;現況: ログハウスは第三月曜日と12月29日～1月3日が定休日。;設備・遊具: ログハウス、複合遊具(雲梯、滑り台、吊り橋など)、噴水、野球場、ブランコ;駐車場: なし;アクセス: 横浜市営地下鉄ブルーライン片倉町駅から徒歩10分横浜市営バス西神大寺または神大寺入口停留所から徒歩5分","Category:横浜市の公園","箇条書き,制限あり","こらぼネット・かながわと神奈川区の共同事業で、2階建ての「こどもログハウストムソーヤ」という施設が運営されている。１階には読書コーナー、粘土コーナーなど、２階部分にはアスレチック、地下には地下迷路もある。また２階からすべり台が降りてきている。また、対象は小学生までである。"
"岸根公園","","https://ja.wikipedia.org/wiki/岸根公園","北緯35度29分37.6秒東経139度36分55.9秒","分類: 都市公園(運動公園);所在地: 日本神奈川県横浜市港北区岸根町725;座標: 北緯35度29分37.6秒東経139度36分55.9秒﻿ / ﻿北緯35.493778度 東経139.615528度﻿ / 35.493778; 139.615528座標: 北緯35度29分37.6秒東経139度36分55.9秒﻿ / ﻿北緯35.493778度 東経139.615528度﻿ / 35.493778; 139.615528;面積: 140,587m2;開園: 1971年4月;運営者: 横浜市(指定管理者：横浜市緑の協会);設備・遊具: 幼児・児童用遊具、野球場、武道館;駐車場: 157台(有料)","Category:横浜市の公園","箇条書き,制限あり","第二次世界大戦後、現在の公園の敷地は米軍岸根部隊が駐留する「岸根キャンプ」（岸根基地）であった。当時の施設として、病院、教会等があり、ベトナム戦争時（特に1968年頃）には、ヘリコプターが毎日飛来し、戦争の激しさを示していた。また、園内にある篠原池は、米軍施設よる排水により、汚染された歴史がある。なお、現在の篠原池は公園整備の過程で、武道館建設等により規模が縮小され以前の面影は少ない。1972年にキャンプの撤収に伴い横浜市に土地が返還され、公園として整備されることとなった。園内には、野球場などがあり、周辺住民の憩いの場となっている。"
"汽車道","","https://ja.wikipedia.org/wiki/汽車道","北緯35度27分10.6秒東経139度38分5.7秒","分類: 港湾緑地;所在地: 日本横浜市中区新港二丁目、西区みなとみらい二丁目;座標: 北緯35度27分10.6秒東経139度38分5.7秒﻿ / ﻿北緯35.452944度 東経139.634917度﻿ / 35.452944; 139.634917座標: 北緯35度27分10.6秒東経139度38分5.7秒﻿ / ﻿北緯35.452944度 東経139.634917度﻿ / 35.452944; 139.634917;面積: 9,129 m2;前身: 鉄道線路;開園: 1997年7月19日;運営者: 横浜市","Category:横浜市の公園","箇条書き,制限あり","本項ではプロムナードとしての汽車道だけでなく、その歴史や産業遺産としての価値についても触れる。"
"弘明寺公園","","https://ja.wikipedia.org/wiki/弘明寺公園","北緯35度25分28.5秒東経139度35分44秒","分類: 都市公園（地区公園）;所在地: 日本神奈川県横浜市南区弘明寺町244-5;座標: 北緯35度25分28.5秒東経139度35分44秒﻿ / ﻿北緯35.424583度 東経139.59556度﻿ / 35.424583; 139.59556座標: 北緯35度25分28.5秒東経139度35分44秒﻿ / ﻿北緯35.424583度 東経139.59556度﻿ / 35.424583; 139.59556;面積: 45,543m2;開園: 1943年6月1日;アクセス: 京急本線弘明寺駅からすぐ横浜市営地下鉄ブルーライン弘明寺駅から徒歩8分","Category:横浜市の公園","箇条書き,制限あり","元は弘明寺の寺林で、第二次世界大戦の防空緑地計画に基づき1940年（昭和15年）より公園整備が始まった。一時期は不要不急であるとして公園整備が中断され、高射砲陣地となったが1949年（昭和24年）より遊具やプール、散策路の整備が再開され、1958年（昭和33年）に完成した。1992年（平成4年）12月には横浜市南図書館が完成した。この図書館は4階建で、屋上にはプールを備える。1993年（平成5年）には丘の上に高さ10mの展望台が完成した。"
"久良岐公園","","https://ja.wikipedia.org/wiki/久良岐公園","北緯35度24分19.4秒東経139度36分26.6秒","分類: 都市公園（総合公園）;所在地: 日本神奈川県横浜市港南区上大岡東三丁目磯子区岡村八丁目汐見台1丁目、3丁目;座標: 北緯35度24分19.4秒東経139度36分26.6秒﻿ / ﻿北緯35.405389度 東経139.607389度﻿ / 35.405389; 139.607389座標: 北緯35度24分19.4秒東経139度36分26.6秒﻿ / ﻿北緯35.405389度 東経139.607389度﻿ / 35.405389; 139.607389;面積: 230,762m2;開園: 1973年（昭和48年）3月24日;運営者: 横浜市;駐車場: 90台（有料）;アクセス: 京浜急行屏風浦駅・JR根岸線磯子駅より横浜市営バス、または横浜市営地下鉄ブルーライン・京浜急行上大岡駅から京浜急行バス「久良岐公園前」下車京浜急行屏風浦駅から徒歩20分;告示: 1960年（昭和35年）8月29日;公式サイト: 横浜市環境創造局南部公園緑地事務所","Category:横浜市の公園","箇条書き,制限あり","面積は、約23万m2。汐見台団地の造成にあわせて整備され、1973年（昭和48年）に開園した。名称はこの一帯の古い地名である久良岐郡から採られ、公募により決定した。中央付近に池があり、北側は散策路のある雑木林の先に久良岐能舞台がある。南側は運動広場や芝生広場、桜の林、横浜市電の保存車両などがあり、春には花見客でにぎわう。"
"グランモール公園","","https://ja.wikipedia.org/wiki/グランモール公園","北緯35度27分25.8秒東経139度37分52.2秒","分類: 都市公園（近隣公園）;所在地: 日本神奈川県横浜市西区みなとみらい三丁目（美術の広場の所在地）;座標: 北緯35度27分25.8秒東経139度37分52.2秒﻿ / ﻿北緯35.457167度 東経139.631167度﻿ / 35.457167; 139.631167座標: 北緯35度27分25.8秒東経139度37分52.2秒﻿ / ﻿北緯35.457167度 東経139.631167度﻿ / 35.457167; 139.631167;面積: 約2.3ha;開園: 一部開園：1991年12月14日全面開園：1999年11月（リニューアル: 2015年度〜2017年度）;設計者: 東京ランドスケープ研究所、再整備：三菱地所設計;運営者: 横浜市;事務所: 環境創造局 南部公園緑地事務所 都心部公園担当;事務所所在地: 横浜市中区真砂町2-22（関内中央ビル）;備考: 歩行者動線の「グランモール軸」を形成しており、公園沿いには美術館や店舗が並ぶ。;公式サイト: 環境創造局サイト内","Category:横浜市の公園","箇条書き,制限あり","1987年（昭和62年）度に着工し、1989年（平成元年）の横浜博覧会の開催とともに博覧会のパビリオンとして横浜美術館が完成、現在ではグランモール公園の一部に当たる美術館前の「美術の広場」も同時に利用可能となった。その後、1991年（平成3年）12月に同広場などを含み一部開園すると、1999年（平成11年）11月にはグランモール公園として全面開園している。"
"小柴貯油施設","","https://ja.wikipedia.org/wiki/小柴貯油施設","北緯35度21分37.4秒東経139度39分32.6秒","","Category:横浜市の公園","箇条書き,制限あり",""
"小雀公園","","https://ja.wikipedia.org/wiki/小雀公園","","分類: 都市公園（総合公園）;所在地: 横浜市戸塚区小雀町;面積: 7.2ha;開園: 1974年（昭和49年）6月5日;運営者: 横浜市（指定管理者：緑とコミュニティグループ）;駐車場: あり;公式サイト: 指定管理者のサイト","Category:横浜市の公園","箇条書き,制限あり",""
