"タイトル","コメント","URLアドレス","座標","詳細情報","親リスト","一覧抽出方法","前文"
"長屋門公園","","https://ja.wikipedia.org/wiki/長屋門公園","北緯35度27分27.7秒東経139度30分15.2秒","分類: 都市緑地;所在地: 日本神奈川県横浜市瀬谷区阿久和東一丁目17;座標: 北緯35度27分27.7秒東経139度30分15.2秒﻿ / ﻿北緯35.457694度 東経139.504222度﻿ / 35.457694; 139.504222座標: 北緯35度27分27.7秒東経139度30分15.2秒﻿ / ﻿北緯35.457694度 東経139.504222度﻿ / 35.457694; 139.504222;面積: 35,000m2;運営者: 横浜市;設備・遊具: 長屋門、古民家、土蔵、せせらぎの水辺、雑木広場、自然観察林、散策路、売店;駐車場: なし;告示: 1993年11月5日;公式サイト: http://members2.jcom.home.ne.jp/9327mzss/","Category:横浜市の公園","箇条書き,制限あり","長屋門公園は、古民家を中心とする歴史体験ゾーンと、杉林・散策路を中心とする自然観察ゾーン分けることができる。"
"新治里山公園","","https://ja.wikipedia.org/wiki/新治里山公園","北緯35度31分6.6秒東経139度31分6.7秒","分類: 都市公園（総合公園）;所在地: 横浜市緑区新治町887;座標: 北緯35度31分6.6秒東経139度31分6.7秒﻿ / ﻿北緯35.518500度 東経139.518528度﻿ / 35.518500; 139.518528座標: 北緯35度31分6.6秒東経139度31分6.7秒﻿ / ﻿北緯35.518500度 東経139.518528度﻿ / 35.518500; 139.518528;面積: 約0.89ha（計画約15.3ha）;開園: 2009年（平成21年）4月24日;運営者: 横浜市（指定管理者：特定非営利活動法人新治里山「わ」を広げる会）;公式サイト: 公式サイト","Category:横浜市の公園","箇条書き,制限あり",""
"日本丸メモリアルパーク","","https://ja.wikipedia.org/wiki/日本丸メモリアルパーク","北緯35度27分13.2秒東経139度37分58.8秒","分類: 港湾緑地;所在地: 日本神奈川県横浜市西区みなとみらい二丁目1-1;座標: 北緯35度27分13.2秒東経139度37分58.8秒﻿ / ﻿北緯35.453667度 東経139.633000度﻿ / 35.453667; 139.633000座標: 北緯35度27分13.2秒東経139度37分58.8秒﻿ / ﻿北緯35.453667度 東経139.633000度﻿ / 35.453667; 139.633000;面積: 約3.81ha;前身: 三菱重工業横浜製作所;開園: 1985年（一部完成・開園）;運営者: 横浜市（指定管理者：帆船日本丸記念財団・JTB共同事業体）;駐車場: なし（近隣民間駐車場を利用）;公式サイト: http://www.nippon-maru.or.jp/index.html","Category:横浜市の公園","箇条書き,制限あり","現在は日本丸の展示ドックとなっている横浜船渠第一号船渠は、海軍技師・恒川柳作が設計、1898年竣工した。大正時代に内陸方向に延長され、総長204m、上幅34m、渠底幅23m、渠内深さ11mとなる。2000年12月には「旧横浜船渠株式会社第一号船渠」の名称で、国から重要文化財の指定を受けた。さらに2007年11月、経済産業省による近代化産業遺産にも認定されている。"
"根岸森林公園","","https://ja.wikipedia.org/wiki/根岸森林公園","北緯35度25分23秒東経139度38分19秒","分類: 都市公園(総合公園);所在地: 日本横浜市中区根岸台、山元町、簑沢;座標: 北緯35度25分23秒東経139度38分19秒﻿ / ﻿北緯35.42306度 東経139.63861度﻿ / 35.42306; 139.63861座標: 北緯35度25分23秒東経139度38分19秒﻿ / ﻿北緯35.42306度 東経139.63861度﻿ / 35.42306; 139.63861;面積: 193,102m2;前身: 横浜競馬場;開園: 1977年3月;運営者: 宮川一清(尿氏);駐車場: 200台(有料);事務所: 環境創造局 南部公園緑地事務所 都心部公園担当;事務所所在地: 横浜市中区真砂町2-22（関内中央ビル）;公式サイト: 横浜市環境創造局","Category:横浜市の公園","箇条書き,制限あり","横浜競馬場（根岸競馬場）の跡地である。公園は根岸住宅地区の施設を挟んで馬場内エリアとスタンドエリアに分かれており、馬場内エリアには広大な芝生エリアが広がっている。根岸競馬記念公苑とも隣接しており、馬の博物館をはじめとして遊歩道や桜並木などが整備されている。特に桜は県内でも有数の見所となっており、花見シーズンには人出が多い。駐車場と売店もこちらに用意されている。"
"根岸なつかし公園","","https://ja.wikipedia.org/wiki/根岸なつかし公園","北緯35度25分5.6秒東経139度37分45.7秒","国: 日本;都道府県: 神奈川県;市町村: 横浜市;区: 磯子区;• 合計: 0.094km2;• 合計: 1,104人;等時帯: UTC+9(日本標準時);郵便番号: 235-0004;市外局番: 045 (横浜MA);ナンバープレート: 横浜","Category:横浜市の公園","箇条書き,制限あり","磯子区の北部に位置する。堀割川の左岸にあたる。北で坂下町、東で中区寺久保・根岸旭台、西で堀割川を跨いで滝頭、南で西町・原町と接する他、磯子橋上の一点で中浜町と接している。。町内は大半が平地であるが、東端に南北に走る崖があり、ここで警察署の管轄が分かれる。東の高台は山手警察署の管内で、近年マンションが建った他、一部は戦後米軍に接収され根岸住宅地区となっている。西側大部分を占める平地は磯子警察署の管内で、住宅地になっている。町内全域が横浜市立根岸小学校・横浜市立根岸中学校の学区である。"
"野毛山公園","","https://ja.wikipedia.org/wiki/野毛山公園","北緯35度26分45秒東経139度37分25秒","分類: 都市公園(総合公園);所在地: 日本神奈川県横浜市西区老松町、東ケ丘;座標: 北緯35度26分45秒東経139度37分25秒﻿ / ﻿北緯35.44583度 東経139.62361度﻿ / 35.44583; 139.62361座標: 北緯35度26分45秒東経139度37分25秒﻿ / ﻿北緯35.44583度 東経139.62361度﻿ / 35.44583; 139.62361;面積: 90,793 m2;開園: 1926年（大正15年）9月18日;運営者: 横浜市（指定管理者：公益財団法人横浜市緑の協会）;駐車場: なし;告示: 1925年1月26日;事務所: 環境創造局 南部公園緑地事務所 都心部公園担当;事務所所在地: 横浜市中区真砂町2-22（関内中央ビル）;公式サイト: 横浜市のサイト","Category:横浜市の公園","箇条書き,制限あり","古くから、野毛浦（現:野毛町）に面した標高50mの丘陵一帯を野毛山と称していた。"
"野島公園","","https://ja.wikipedia.org/wiki/野島公園","北緯35度19分37.5秒東経139度38分8.9秒","分類: 都市公園(総合公園);所在地: 日本神奈川県横浜市金沢区野島町、乙舳町;面積: 175,215m2;開園: 1956年4月;設計者: 旧伊藤博文金沢別邸周辺及び牡丹園 : 戸田芳樹風景計画;運営者: 横浜市(指定管理者：横浜市緑の協会);駐車場: 104台(有料)混雑時には臨時駐車場あり;事務所所在地: 神奈川県横浜市金沢区野島町24;公式サイト: http://www.nojima-park.org/","Category:横浜市の公園","箇条書き,制限あり","バーベキュー場"
"ハンマーヘッドパーク","","https://ja.wikipedia.org/wiki/ハンマーヘッドパーク","北緯35度27分22秒東経139度38分30秒","用途: 客船ターミナル、商業施設、ホテル;設計者: 設計・監理：梓設計商業エリア内装デザイン：リックデザインホテルエリア内装デザイン：日建スペースデザインランドスケープデザイン：戸田芳樹風景計画商業エリア植栽：SOLSO FARM照明デザイン：WORKTECHT;施工: 建築：五洋建設空調・衛生：川本工業電気：東光電気工事;建築主: 新港ふ頭客船ターミナル（構成：YNP〈横浜岡田屋・藤木企業・小此木・川本工業〉、T・Yホールディングス、ヨコハマグランドインターコンチネンタルホテル、野村不動産）、T・Yホールディングス;管理運営: 新港ふ頭客船ターミナル;構造形式: 主体構造：鉄骨造杭・基礎：既成杭;敷地面積: 17,370.00 m²;建築面積: 9,351.31 m² ※建蔽率：53.83%（許容：80%）;延床面積: 29,570.69 m² ※容積率：165.30%（許容：400%）;状態: 完成;階数: 地上5階;高さ: 最高高：19,870 mm軒高：19,030 mm階高：4,350 mm（1階）、4,200 mm（2階）、3,400 mm（3 - 5階）天井高：約2,700 mm（ホテルエリア）主なスパン：9,000×9,000 mm;エレベーター数: 商業・CIQエリア：3台ホテルエリア：5台;駐車台数: 第1駐車場（併設）：88台第2駐車場（6-2街区）：106台第3駐車場（7街区）：165台;着工: 2018年（平成30年）6月;竣工: 2019年（令和元年）9月;開館開所: 2019年（令和元年）10月31日;所在地: 〒231-0001横浜市中区新港2-14-1;座標: 北緯35度27分22秒東経139度38分30秒﻿ / ﻿北緯35.45611度 東経139.64167度﻿ / 35.45611; 139.64167﻿ (新港ふ頭客船ターミナル横浜ハンマーヘッドYOKOHAMA HAMMERHEAD)座標: 北緯35度27分22秒東経139度38分30秒﻿ / ﻿北緯35.45611度 東経139.64167度﻿ / 35.45611; 139.64167﻿ (新港ふ頭客船ターミナル横浜ハンマーヘッドYOKOHAMA HAMMERHEAD);商業施設面積: 約5,000 m²※1F：約1500 m² / 2F：約3500 m²;店舗数: 25テナント（開業時点）;最寄駅: みなとみらい線　馬車道駅（徒歩約10分）　みなとみらい駅（徒歩約12分）JR桜木町駅（徒歩約15分）※詳細は#アクセス参照;最寄IC: 首都高速神奈川1号横羽線　みなとみらい出入口（約1.5km）※詳細は#アクセス参照;外部リンク: www.hammerhead.co.jp;用途: 客船ターミナル、商業施設、ホテル;設計者: 設計・監理：梓設計商業エリア内装デザイン：リックデザインホテルエリア内装デザイン：日建スペースデザインランドスケープデザイン：戸田芳樹風景計画商業エリア植栽：SOLSO FARM照明デザイン：WORKTECHT;施工: 建築：五洋建設空調・衛生：川本工業電気：東光電気工事;建築主: 新港ふ頭客船ターミナル（構成：YNP〈横浜岡田屋・藤木企業・小此木・川本工業〉、T・Yホールディングス、ヨコハマグランドインターコンチネンタルホテル、野村不動産）、T・Yホールディングス;管理運営: 新港ふ頭客船ターミナル;構造形式: 主体構造：鉄骨造杭・基礎：既成杭;敷地面積: 17,370.00 m²;建築面積: 9,351.31 m² ※建蔽率：53.83%（許容：80%）;延床面積: 29,570.69 m² ※容積率：165.30%（許容：400%）;状態: 完成;階数: 地上5階;高さ: 最高高：19,870 mm軒高：19,030 mm階高：4,350 mm（1階）、4,200 mm（2階）、3,400 mm（3 - 5階）天井高：約2,700 mm（ホテルエリア）主なスパン：9,000×9,000 mm;エレベーター数: 商業・CIQエリア：3台ホテルエリア：5台;駐車台数: 第1駐車場（併設）：88台第2駐車場（6-2街区）：106台第3駐車場（7街区）：165台;着工: 2018年（平成30年）6月;竣工: 2019年（令和元年）9月;開館開所: 2019年（令和元年）10月31日;所在地: 〒231-0001横浜市中区新港2-14-1;座標: 北緯35度27分22秒東経139度38分30秒﻿ / ﻿北緯35.45611度 東経139.64167度﻿ / 35.45611; 139.64167﻿ (新港ふ頭客船ターミナル横浜ハンマーヘッドYOKOHAMA HAMMERHEAD)座標: 北緯35度27分22秒東経139度38分30秒﻿ / ﻿北緯35.45611度 東経139.64167度﻿ / 35.45611; 139.64167﻿ (新港ふ頭客船ターミナル横浜ハンマーヘッドYOKOHAMA HAMMERHEAD);商業施設面積: 約5,000 m²※1F：約1500 m² / 2F：約3500 m²;店舗数: 25テナント（開業時点）;最寄駅: みなとみらい線　馬車道駅（徒歩約10分）　みなとみらい駅（徒歩約12分）JR桜木町駅（徒歩約15分）※詳細は#アクセス参照;最寄IC: 首都高速神奈川1号横羽線　みなとみらい出入口（約1.5km）※詳細は#アクセス参照;外部リンク: www.hammerhead.co.jp","Category:横浜市の公園","箇条書き,制限あり","横浜港に寄港する大型客船（クルーズ客船）について、大さん橋単独では対応に限界があることから新港埠頭でも受け入れを可能とするため、9号岸壁の耐震化および延伸・増深整備と、公民連携（事業提案方式）でかつての新港客船ターミナルに代わる新たな客船施設を整備する計画が立てられた。"
"日吉公園","","https://ja.wikipedia.org/wiki/日吉公園","","分類: 都市公園(近隣公園);所在地: 日本横浜市港北区日吉二丁目;面積: 13,074 m2;開園: 1995年3月24日;運営者: 横浜市;駐車場: なし;公式サイト: 港北区役所","Category:横浜市の公園","箇条書き,制限あり","矢上川沿いの高台に存在し、春には梅の名所として知られる。"
"ポートサイド公園","","https://ja.wikipedia.org/wiki/ポートサイド公園","北緯35度28分02.3秒東経139度37分50.1秒","分類: 都市公園（近隣公園）;所在地: 日本神奈川県横浜市神奈川区大野町;座標: 北緯35度28分02.3秒東経139度37分50.1秒﻿ / ﻿北緯35.467306度 東経139.630583度﻿ / 35.467306; 139.630583座標: 北緯35度28分02.3秒東経139度37分50.1秒﻿ / ﻿北緯35.467306度 東経139.630583度﻿ / 35.467306; 139.630583;面積: 約1.7ha;開園: 1998年;設計者: 長谷川浩己;運営者: 横浜市;年来園者数: 統計無し;現況: 年中開放（ただし、横浜ベイクォーターと直結する入口は21:00～翌6:30まで閉鎖される）;設備・遊具: 遊歩道・ベンチ・木製デッキ・トイレなど;駐車場: なし;バリアフリー: 対応;アクセス: 横浜駅徒歩約7分;事務所: 横浜市環境創造局北部公園緑地事務所;備考: 2001年グッドデザイン賞受賞","Category:横浜市の公園","箇条書き,制限あり","ポートサイド公園（都市計画公園帷子川親水公園）は、ポートサイド地区（C街区〜D-2街区）の帷子川下流・港湾部沿いに位置し、一部は帷子川を挟んで高島水際線公園と相対する。当公園は、1991年から翌1992年にかけて実施された国際設計コンペにおいて、応募件数171件の中から最優秀賞になった長谷川浩己のデザインによるデザイナーズ・パークである。ギャラリーロード側から公園に入ると「うねる芝生」があり、長谷川は、広報誌『GARRELY ROAD』第4号の中で「幾重にも折り畳まれた芝生は太陽の動きによって刻々と姿を変える」「適度な傾斜は腰を下ろしたり、寝そべるのに最適であり、水面を臨む観客席となる」と語っている。水際に沿って約400m続くプロムナードはエノキの並木と石畳が特徴となっている。一方、水際には葦原が復元され、葦原の上に突き出る形の木製デッキが設置されている。この他、公園の東端と西端にはアルファベットと数字が表記された円柱が設置されており、中にベンチを設けたり岸壁付近の音を拾う集音器と接続するなど様々な機能を持たせている。当公園は、「アート&デザインの街」をコンセプトとして開発された、ポートサイド地区を代表する芸術作品の一つであり、公園自体の魅力に加えて、その立地や景観の良さから市民や観光客の憩いの場として親しまれているほか、対岸のJR高島線（貨物線）を走る貨物列車の編成全体が見渡せることから、子供たちにも人気がある。ただし、デザイナーズ・パークである当公園内に遊具は設置されていない。"
"保土ケ谷公園","","https://ja.wikipedia.org/wiki/保土ケ谷公園","北緯35度27分15秒東経139度35分2秒","分類: 都市公園（運動公園）;所在地: 日本神奈川県横浜市保土ケ谷区花見台・明神台・仏向町;座標: 北緯35度27分15秒東経139度35分2秒﻿ / ﻿北緯35.45417度 東経139.58389度﻿ / 35.45417; 139.58389座標: 北緯35度27分15秒東経139度35分2秒﻿ / ﻿北緯35.45417度 東経139.58389度﻿ / 35.45417; 139.58389;面積: 34.0ha;開園: 1957年（昭和32年）4月9日;運営者: 神奈川県（指定管理者：公益財団法人神奈川県公園協会）;設備・遊具: 野球場、サッカー場、ラグビー場、テニスコート、プール、アスレチック、噴水、梅園等;駐車場: あり（有料）;事務所: 県立保土ケ谷公園管理事務所;事務所所在地: 神奈川県横浜市保土ケ谷区花見台4-2;公式サイト: 神奈川県のサイト","Category:横浜市の公園","箇条書き,制限あり","1949年に球場が完成して以来、神奈川県で初めての都市公園のひとつ運動公園として整備され、1957年に完成した。神奈川県が運営しているが、指定管理者制度に基づき指定された法人が管理している。"
"本郷ふじやま公園","","https://ja.wikipedia.org/wiki/本郷ふじやま公園","北緯35度21分57.3秒東経139度33分50.8秒","分類: 都市公園（地区公園）;所在地: 日本横浜市栄区中野町56-1;座標: 北緯35度21分57.3秒東経139度33分50.8秒﻿ / ﻿北緯35.365917度 東経139.564111度﻿ / 35.365917; 139.564111座標: 北緯35度21分57.3秒東経139度33分50.8秒﻿ / ﻿北緯35.365917度 東経139.564111度﻿ / 35.365917; 139.564111;面積: 87,772m2;開園: 2000年6月1日;設計者: 戸田芳樹風景計画;運営者: 横浜市（指定管理者：古民家：本郷ふじやま公園運営委員会、弓道場：横浜市弓道協会）;駐車場: 有料(30台);アクセス: 大船駅、港南台駅、上大岡駅から路線バス、「中野町」もしくは「鍛冶ヶ谷」バス停下車、本郷台駅から徒歩23分;事務所: 本郷ふじやま公園運営委員会;事務所所在地: 横浜市栄区鍛冶ケ谷一丁目20;公式サイト: 本郷ふじやま公園","Category:横浜市の公園","箇条書き,制限あり","㹨川の谷底低地に面し、住宅街の中に取り残された小高い里山全体が公園である。"
"本牧海づり施設","","https://ja.wikipedia.org/wiki/本牧海づり施設","北緯35度25分48.5898秒東経139度41分11.8926秒","分類: 海浜公園（海釣り公園）;所在地: 日本神奈川県横浜市中区本牧ふ頭1番地;座標: 北緯35度25分48.5898秒東経139度41分11.8926秒﻿ / ﻿北緯35.430163833度 東経139.686636833度﻿ / 35.430163833; 139.686636833座標: 北緯35度25分48.5898秒東経139度41分11.8926秒﻿ / ﻿北緯35.430163833度 東経139.686636833度﻿ / 35.430163833; 139.686636833;開園: 1978年（昭和53年）7月30日;運営者: イオンディライト（指定管理者）;年来園者数: 168,000人（2016年度）;現況: 営業時間短縮・一部閉鎖の上で暫定的開園中（令和元年房総半島台風（台風15号）による甚大な被害のため）;駐車場: 230台（有料）;バリアフリー: 身体障害者用駐車スペース・車椅子用スロープ（新護岸つり場）;アクセス: 横浜駅・桜木町駅から横浜市営バス26系統に乗車し「海づり桟橋」バス停で下車;事務所: 管理棟あり;公式サイト: 本牧海づり施設","Category:横浜市の公園","箇条書き,制限あり","関東地方を代表する海釣り施設の草分け的存在として多くの釣り人から親しまれ、横浜市民の憩いの場となっている。2019年（令和元年）9月9日に上陸した令和元年房総半島台風（台風15号）により甚大な被害を受け休園していたが、2020年（令和2年）1月31日から暫定的に営業を再開している。"
"本牧山頂公園","","https://ja.wikipedia.org/wiki/本牧山頂公園","北緯35度25分31.7秒東経139度39分38.3秒","分類: 都市公園(総合公園);所在地: 日本横浜市中区和田山1-5;座標: 北緯35度25分31.7秒東経139度39分38.3秒﻿ / ﻿北緯35.425472度 東経139.660639度﻿ / 35.425472; 139.660639座標: 北緯35度25分31.7秒東経139度39分38.3秒﻿ / ﻿北緯35.425472度 東経139.660639度﻿ / 35.425472; 139.660639;面積: 227,031 m2;前身: 米軍接収地;開園: 1998年3月31日;運営者: 横浜市;設備・遊具: レストハウス、トイレ;駐車場: あり(有料);アクセス: 横浜市営バス本牧宮原バス停すぐ;告示: 1991年2月22日;事務所: 環境創造局 南部公園緑地事務所 都心部公園担当;事務所所在地: 横浜市中区真砂町2-22（関内中央ビル）","Category:横浜市の公園","箇条書き,制限あり","米軍横浜海浜住宅地区が1982年3月31日までに返還されたことから、跡地を横浜市が公園として整備し、1998年に開園した。なだらかな丘の上に広がる公園は、見晴らしが良く、横浜港や横浜ランドマークタワーなどの町並みから房総半島、丹沢山地や富士山など遠くまで望むことができる。第一期、第二期と場所が分かれている。"
"本牧市民公園","","https://ja.wikipedia.org/wiki/本牧市民公園","北緯35度24分58.1秒東経139度39分20.1秒","分類: 都市公園（総合公園）;所在地: 日本神奈川県横浜市中区本牧三之谷59;座標: 北緯35度24分58.1秒東経139度39分20.1秒﻿ / ﻿北緯35.416139度 東経139.655583度﻿ / 35.416139; 139.655583座標: 北緯35度24分58.1秒東経139度39分20.1秒﻿ / ﻿北緯35.416139度 東経139.655583度﻿ / 35.416139; 139.655583;面積: 103,336m2;開園: 1969年（昭和44年）9月;運営者: 横浜市;駐車場: 305台 (有料);事務所: 環境創造局 南部公園緑地事務所 都心部公園担当;事務所所在地: 横浜市中区真砂町2-22（関内中央ビル）;公式サイト: 本牧市民公園（横浜市環境創造局）","Category:横浜市の公園","箇条書き,制限あり","保存されている転車台"
"舞岡公園","","https://ja.wikipedia.org/wiki/舞岡公園","北緯35度23分12.5秒東経139度33分0.4秒","分類: 都市公園(広域公園);所在地: 日本神奈川県横浜市戸塚区舞岡町;座標: 北緯35度23分12.5秒東経139度33分0.4秒﻿ / ﻿北緯35.386806度 東経139.550111度﻿ / 35.386806; 139.550111座標: 北緯35度23分12.5秒東経139度33分0.4秒﻿ / ﻿北緯35.386806度 東経139.550111度﻿ / 35.386806; 139.550111;面積: 約28.5ha;開園: 1992年（平成4年）12月5日;運営者: 横浜市（指定管理者：特定非営利活動法人舞岡・やとひと未来）;駐車場: 119台(有料);公式サイト: 横浜市のサイト","Category:横浜市の公園","箇条書き,制限あり","この地区の特徴である谷戸や、山林、田畑を活かした自然公園で、野鳥や昆虫など多数の動植物も見られ、週末になるとハイキングやバードウォッチングをする人で賑わう。また、公園の周辺地域は戸塚区側は山林部は舞岡ふるさとの森として舞岡公園と連続した整備が行われており、平地部も「舞岡ふるさと村」として遊歩道や小川アメニティー（舞岡川）等が整備され、自然の雰囲気を損なわないようにされている。また、公園の東側の港南区側は野庭町にかけて市街化調整区域になっており生産緑地や雑木林となっており、南の栄区側は風致公園として配置された小菅ケ谷北公園が近接する、市内でも緑被率の高い地域となっている。"
