"タイトル","コメント","URLアドレス","座標","詳細情報","親リスト","一覧抽出方法","前文"
"こども自然公園","","https://ja.wikipedia.org/wiki/こども自然公園","北緯35度27分4.8秒東経139度32分6.1秒","分類: 都市公園（広域公園）;所在地: 日本神奈川県横浜市旭区大池町65-1;座標: 北緯35度27分4.8秒東経139度32分6.1秒﻿ / ﻿北緯35.451333度 東経139.535028度﻿ / 35.451333; 139.535028﻿ (こども自然公園)座標: 北緯35度27分4.8秒東経139度32分6.1秒﻿ / ﻿北緯35.451333度 東経139.535028度﻿ / 35.451333; 139.535028﻿ (こども自然公園);面積: 481,453m2;開園: 1972年6月5日;運営者: 横浜市;設備・遊具: バーベキュー広場、とりでの森、教育水田、ホタルの生息地、万騎が原ちびっこ動物園、青少年野外活動センター、野球場、売店;駐車場: 第1駐車場 95台、第2駐車場 182台、第3駐車場 47台、臨時駐車場 49台;告示: 1957年12月7日;事務所: 横浜市北部公園緑地事務所;公式サイト: 横浜市環境創造局 こども自然公園","Category:横浜市の公園","箇条書き,制限あり","横浜市が管理する都市公園であり、横浜市旭区最大の面積を持つ。大池と呼ばれる池が公園の中心にあり、この池にちなんで「大池公園」とも呼ばれる。"
"境川遊水地公園","","https://ja.wikipedia.org/wiki/境川遊水地公園","北緯35度23分19秒東経139度29分02秒","分類: 都市公園（総合公園）;所在地: 日本横浜市戸塚区俣野町、泉区下飯田町、藤沢市今田;座標: 北緯35度23分19秒東経139度29分02秒﻿ / ﻿北緯35.3887度 東経139.4839度﻿ / 35.3887; 139.4839座標: 北緯35度23分19秒東経139度29分02秒﻿ / ﻿北緯35.3887度 東経139.4839度﻿ / 35.3887; 139.4839;面積: 約30ha;開園: 2007年8月4日;運営者: 神奈川県(指定管理者:財団法人神奈川県公園協会);駐車場: あり(無料);事務所: 境川遊水地情報センター;事務所所在地: 横浜市泉区下飯田町5-5;公式サイト: 神奈川県のサイト","Category:横浜市の公園","箇条書き,制限あり",""
"笹下中央公園","","https://ja.wikipedia.org/wiki/笹下中央公園","北緯35度23分32.3秒東経139度35分47.8秒","所在地: 日本神奈川県横浜市港南区笹下五丁目3714-1;座標: 北緯35度23分32.3秒東経139度35分47.8秒﻿ / ﻿北緯35.392306度 東経139.596611度﻿ / 35.392306; 139.596611座標: 北緯35度23分32.3秒東経139度35分47.8秒﻿ / ﻿北緯35.392306度 東経139.596611度﻿ / 35.392306; 139.596611;面積: 7384㎡;運営者: 横浜市（管理者：笹下中央公園愛護会）;設備・遊具: トイレ・ぶらんこ・砂場・遊具・花壇・芝生;駐車場: なし;公式サイト: 横浜市環境創造局","Category:横浜市の公園","箇条書き,制限あり","高台にある公園で見晴らしがよく、公園からは都市計画道路環状2号線を見下ろし磯子方面、上大岡方面、松本・日野・桜道方面を一望でき、景色が楽しめる公園である。ただし周囲の道は細く駐車スペースはない。"
"四季の森公園","","https://ja.wikipedia.org/wiki/四季の森公園","北緯35度30分10秒東経139度32分13秒","分類: 都市公園(風致公園);所在地: 日本神奈川県横浜市緑区寺山町291;座標: 北緯35度30分10秒東経139度32分13秒﻿ / ﻿北緯35.50278度 東経139.53694度﻿ / 35.50278; 139.53694座標: 北緯35度30分10秒東経139度32分13秒﻿ / ﻿北緯35.50278度 東経139.53694度﻿ / 35.50278; 139.53694;面積: 45.3ha;開園: 1988年（昭和63年）4月1日;運営者: 神奈川県(指定管理者：四季の森公園パートナーズ);駐車場: 165台(平日：無料、土日祝日：有料);公式サイト: 四季の森公園（神奈川県のサイト）","Category:横浜市の公園","箇条書き,制限あり","横浜市緑区寺山町と旭区上白根町にまたがっており、管理事務所は緑区寺山町291にある。神奈川県が住宅用地として取得したが、貴重な天然林や湧水が残っていることもあり、用途が変更され1983年から公園として整備が進められた。総面積は45.3ヘクタールで、1988年4月1日に部分開園した。園内ではボランティアによる炭焼きや小学生による米作りが行われ、シーズンによってはホタルの観察も楽しめる。カワセミの採餌を観察できる機会が多く、写真愛好家やバードウォッチャーが訪れる。指定管理者は横浜緑地・西武造園グループ。"
"寺家ふるさと村","","https://ja.wikipedia.org/wiki/寺家ふるさと村","北緯35度34分1秒東経139度30分20秒","分類: 緑地保全地域;所在地: 日本神奈川県横浜市青葉区寺家町;座標: 北緯35度34分1秒東経139度30分20秒﻿ / ﻿北緯35.56694度 東経139.50556度﻿ / 35.56694; 139.50556座標: 北緯35度34分1秒東経139度30分20秒﻿ / ﻿北緯35.56694度 東経139.50556度﻿ / 35.56694; 139.50556;面積: 12.3ha;運営者: 横浜市","Category:横浜市の公園","箇条書き,制限あり","こどもの国の至近に位置する昔ながらの田園風景が色濃く残っているところで、水田と雑木林が織りなす景観に恵まれた地域となっている。また季節によっては横浜市内では、数少ないホタルを見られる地域でもある。"
"篠原園地","","https://ja.wikipedia.org/wiki/篠原園地","北緯35度29分31秒東経139度37分41秒","","Category:横浜市の公園","箇条書き,制限あり",""
"渋沢金井公園","","https://ja.wikipedia.org/wiki/渋沢金井公園","北緯35度30分49秒東経139度38分57秒","分類: 都市公園(街区公園);所在地: 日本神奈川県横浜市鶴見区北寺尾六丁目24;座標: 北緯35度30分49秒東経139度38分57秒﻿ / ﻿北緯35.51361度 東経139.64917度﻿ / 35.51361; 139.64917座標: 北緯35度30分49秒東経139度38分57秒﻿ / ﻿北緯35.51361度 東経139.64917度﻿ / 35.51361; 139.64917;面積: 3,564 m2;開園: 1994年3月25日(都市公園として);運営者: 横浜市","Category:横浜市の公園","箇条書き,制限あり","砂場、すべり台、ブランコ、足裏健康遊具のほか、樹齢300年以上と言われる大きな柿の木がある。"
"清水ケ丘公園","","https://ja.wikipedia.org/wiki/清水ケ丘公園","北緯35度26分20秒東経139度36分19秒","分類: 都市公園(運動公園);所在地: 日本神奈川県横浜市南区清水ケ丘73-1;座標: 北緯35度26分20秒東経139度36分19秒﻿ / ﻿北緯35.43889度 東経139.60528度﻿ / 35.43889; 139.60528座標: 北緯35度26分20秒東経139度36分19秒﻿ / ﻿北緯35.43889度 東経139.60528度﻿ / 35.43889; 139.60528;面積: 95,494m2;前身: 横浜国立大学清水ケ丘キャンパス;開園: 1983年3月;運営者: 横浜市(指定管理者：横浜市緑の協会);駐車場: 125台(有料);公式サイト: http://www.simizugaoka-park.org/","Category:横浜市の公園","箇条書き,制限あり","温水プール"
"白幡池公園","","https://ja.wikipedia.org/wiki/白幡池公園","北緯35度29分29秒東経139度37分34秒","所在地: 日本神奈川県横浜市神奈川区白幡町4;座標: 北緯35度29分30秒東経139度37分41秒﻿ / ﻿北緯35.49167度 東経139.62806度﻿ / 35.49167; 139.62806座標: 北緯35度29分30秒東経139度37分41秒﻿ / ﻿北緯35.49167度 東経139.62806度﻿ / 35.49167; 139.62806;駐車場: 近隣にコインパーキングあり;アクセス: 東急東横線白楽駅","Category:横浜市の公園","箇条書き,制限あり","東急東横線白楽駅から徒歩6分。"
"陣ケ下渓谷","","https://ja.wikipedia.org/wiki/陣ケ下渓谷","北緯35度28分09秒東経139度33分58秒","分類: 都市公園（風致公園）;所在地: 日本横浜市保土ケ谷区川島町797;座標: 北緯35度28分09秒東経139度33分58秒﻿ / ﻿北緯35.46917度 東経139.56611度﻿ / 35.46917; 139.56611座標: 北緯35度28分09秒東経139度33分58秒﻿ / ﻿北緯35.46917度 東経139.56611度﻿ / 35.46917; 139.56611;面積: 34,387 平方メートル;運営者: 横浜市;告示: 1992年（平成4年）7月24日;公式サイト: 陣ケ下渓谷公園（横浜市保土ケ谷区役所）;国:  日本;所在地: 横浜市;交差物件: 帷子川水系（二級水系）;設計者施工者: 向山辰夫・篠原修・杉山和雄・大野美代子・伊東靖;建設: 横浜市道路建設事業団;形式: PC中空床版連続ラーメン橋;全長: 164.0m / 206.0m / 215.0m / 237.3m;最大支間長: 29.0m;分類: 都市公園（風致公園）;所在地: 日本横浜市保土ケ谷区川島町797;座標: 北緯35度28分09秒東経139度33分58秒﻿ / ﻿北緯35.46917度 東経139.56611度﻿ / 35.46917; 139.56611座標: 北緯35度28分09秒東経139度33分58秒﻿ / ﻿北緯35.46917度 東経139.56611度﻿ / 35.46917; 139.56611;面積: 34,387 平方メートル;運営者: 横浜市;告示: 1992年（平成4年）7月24日;公式サイト: 陣ケ下渓谷公園（横浜市保土ケ谷区役所）;国:  日本;所在地: 横浜市;交差物件: 帷子川水系（二級水系）;設計者施工者: 向山辰夫・篠原修・杉山和雄・大野美代子・伊東靖;建設: 横浜市道路建設事業団;形式: PC中空床版連続ラーメン橋;全長: 164.0m / 206.0m / 215.0m / 237.3m;最大支間長: 29.0m","Category:横浜市の公園","箇条書き,制限あり","鎌倉時代に源頼朝の御家人である和田義盛が狩の陣を張ったのでこの名が付けられたとされる。環状2号線が通るのに伴い、都市公園（風致公園）として整備された。2004年（平成16年）4月、陣ケ下渓谷公園として公開された。"
"新横浜公園","","https://ja.wikipedia.org/wiki/新横浜公園","北緯35度30分43秒東経139度36分20秒","分類: 都市公園（運動公園）;所在地: 日本神奈川県横浜市港北区小机町3300;座標: 北緯35度30分43秒東経139度36分20秒﻿ / ﻿北緯35.51194度 東経139.60556度﻿ / 35.51194; 139.60556座標: 北緯35度30分43秒東経139度36分20秒﻿ / ﻿北緯35.51194度 東経139.60556度﻿ / 35.51194; 139.60556;面積: 501,667 m2（計画:約70.4ha）;開園: 1998年3月1日;運営者: 横浜市（指定管理者：横浜市スポーツ協会・横浜マリノス・管理JV共同事業体）;駐車場: あり（有料）;告示: 1993年1月19日;事務所: 日産スタジアム;事務所所在地: 横浜市港北区小机町3300;公式サイト: 新横浜公園－Shin-yokohama Park－（運営者サイト）","Category:横浜市の公園","箇条書き,制限あり","横浜市内で最大の運動公園であり、約72,000人を収容できる横浜国際総合競技場（日産スタジアム）のほか、プール、野球場、テニスコートなど様々な運動施設が設置されている。"
"せせらぎ公園 (横浜市)","","https://ja.wikipedia.org/wiki/せせらぎ公園_(横浜市)","北緯35度32分18.1秒東経139度35分32.7秒","分類: 地区公園;所在地: 日本神奈川県横浜市都筑区新栄町17;座標: 北緯35度32分18.1秒東経139度35分32.7秒﻿ / ﻿北緯35.538361度 東経139.592417度﻿ / 35.538361; 139.592417座標: 北緯35度32分18.1秒東経139度35分32.7秒﻿ / ﻿北緯35.538361度 東経139.592417度﻿ / 35.538361; 139.592417;面積: 約55,955m2;設備・遊具: 多目的広場・古民家;駐車場: 無し","Category:横浜市の公園","箇条書き,制限あり","1974年（昭和49年）に着工した港北ニュータウンに設置された公園で、面積は55,955平方メートル。園内にある池の奥には江戸時代中期から後期の古民家などが移築されており、6月ごろには池のスイレンが咲いて、市民の憩いの場となっている。"
"象の鼻パーク","","https://ja.wikipedia.org/wiki/象の鼻パーク","北緯35度26分58.6秒東経139度38分35.4秒","分類: 港湾緑地;所在地: 日本神奈川県横浜市中区海岸通1丁目;座標: 北緯35度26分58.6秒東経139度38分35.4秒﻿ / ﻿北緯35.449611度 東経139.643167度﻿ / 35.449611; 139.643167座標: 北緯35度26分58.6秒東経139度38分35.4秒﻿ / ﻿北緯35.449611度 東経139.643167度﻿ / 35.449611; 139.643167;面積: 約4ha;開園: 2009年（平成21年）6月2日;運営者: 横浜市;駐車場: なし（近隣民間駐車場を利用）;公式サイト: 象の鼻パーク 公式サイト","Category:横浜市の公園","箇条書き,制限あり","象の鼻波止場を明治中期の形状に復元し、横浜港開港150周年となる2009年（平成21年）6月2日に開園した。なお、今後も山下臨港線プロムナードの一部撤去など周辺の整備等が行われる予定である。"
"高島水際線公園","","https://ja.wikipedia.org/wiki/高島水際線公園","北緯35度27分57.19秒東経139度37分48.26秒","分類: 近隣公園;所在地: 日本神奈川県横浜市西区みなとみらい六丁目;座標: 北緯35度27分57.19秒東経139度37分48.26秒﻿ / ﻿北緯35.4658861度 東経139.6300722度﻿ / 35.4658861; 139.6300722座標: 北緯35度27分57.19秒東経139度37分48.26秒﻿ / ﻿北緯35.4658861度 東経139.6300722度﻿ / 35.4658861; 139.6300722;面積: 約1.3ha;開園: 2011年;運営者: 横浜市;事務所: 環境創造局 南部公園緑地事務所 都心部公園担当;事務所所在地: 横浜市中区真砂町2-22（関内中央ビル）","Category:横浜市の公園","箇条書き,制限あり","みなとみらい中央地区の帷子川下流・港湾部沿岸（水際線）にあたる63街区・64街区にて、2011年5月25日に開園した。園内には親水ゾーンである「潮入の池」（通常は柵がしてあり、無断立入禁止）を設けている。潮位の変化により、池の水位も変化する。"
"高島中央公園","","https://ja.wikipedia.org/wiki/高島中央公園","北緯35度27分43秒東経139度37分50秒","分類: 都市公園（近隣公園）;所在地: 日本神奈川県横浜市西区みなとみらい五丁目2;座標: 北緯35度27分43秒東経139度37分50秒﻿ / ﻿北緯35.46194度 東経139.63056度﻿ / 35.46194; 139.63056座標: 北緯35度27分43秒東経139度37分50秒﻿ / ﻿北緯35.46194度 東経139.63056度﻿ / 35.46194; 139.63056;面積: 13,962 m2;開園: 2007年7月25日;運営者: 横浜市;事務所: 環境創造局 南部公園緑地事務所 都心部公園担当;事務所所在地: 横浜市中区真砂町2-22（関内中央ビル）","Category:横浜市の公園","箇条書き,制限あり","横浜みなとみらい21の中央地区51街区にて2007年7月25日に開園した。当公園は同地区において重要な歩行者ネットワークを構成する3つのペデストリアン軸の一つ、「キング軸」の中央部分に位置する（軸の詳細は「横浜みなとみらい21#ペデストリアン軸（歩行者動線）」を参照）。園内においても軸の一部となる幅員15mの歩行者用通路が南北二等分するように設けられている。"
"たちばなの丘公園","","https://ja.wikipedia.org/wiki/たちばなの丘公園","","","Category:横浜市の公園","箇条書き,制限あり",""
"反町公園","","https://ja.wikipedia.org/wiki/反町公園","北緯35度28分32.061秒東経139度37分44.841秒","分類: 都市公園（近隣公園）;所在地: 日本神奈川県横浜市神奈川区反町1-12;座標: 北緯35度28分32.061秒東経139度37分44.841秒﻿ / ﻿北緯35.47557250度 東経139.62912250度﻿ / 35.47557250; 139.62912250;面積: 23,000m2;前身: 横浜市役所市庁舎;開園: 1963年;運営者: 横浜市環境創造局;設備・遊具: 砂場・すべり台・噴水など;駐車場: なし;事務所: 横浜市環境創造局北部公園緑地事務所;事務所所在地: 神奈川区三ツ沢西町3-1（三ツ沢公園内）;公式サイト: 横浜市環境創造局","Category:横浜市の公園","箇条書き,制限あり","東急東横線反町駅から東に300mほど離れたビル街の中にある。これといった遊具はないため人は少ないが、昼間は近隣住民の憩いの場所になっている。JR線の東神奈川駅- 横浜駅間および京急本線の京急東神奈川駅- 神奈川駅間において車窓からも見ることができる。"
"茅ケ崎公園","","https://ja.wikipedia.org/wiki/茅ケ崎公園","","分類: 都市公園（地区公園）;所在地: 横浜市都筑区茅ケ崎南一丁目4;面積: 94,828平方メートル;開園: 1995年（平成7年）3月24日;運営者: 横浜市;公式サイト: 都筑区役所のサイト","Category:横浜市の公園","箇条書き,制限あり",""
"茅ヶ崎城址公園","","https://ja.wikipedia.org/wiki/茅ヶ崎城址公園","北緯35度32分40.44秒東経139度34分44.12秒","分類: 都市公園（歴史公園）;所在地: 日本神奈川県横浜市都筑区茅ケ崎東二丁目25;座標: 北緯35度32分40.44秒東経139度34分44.12秒﻿ / ﻿北緯35.5445667度 東経139.5789222度﻿ / 35.5445667; 139.5789222座標: 北緯35度32分40.44秒東経139度34分44.12秒﻿ / ﻿北緯35.5445667度 東経139.5789222度﻿ / 35.5445667; 139.5789222;面積: 24,876 m2;開園: 2008年6月25日;設計者: 戸田芳樹風景計画;運営者: 横浜市;設備・遊具: 遺構体験施設、 広場、自然散策林、トイレ、ベンチ;公式サイト: 都筑区役所","Category:横浜市の公園","箇条書き,制限あり","以前はただの雑木林だったが、1990年（平成2年）から1998年（平成10年）にかけて横浜市ふるさと歴史財団が城跡を発掘調査し、2005年（平成17年）から整備を進め、2008年（平成20年）に完成した。園内には曲輪（郭）や土塁、空堀などの城郭遺構が保存公開されている。"
"都筑中央公園","","https://ja.wikipedia.org/wiki/都筑中央公園","北緯35度32分56.86秒東経139度34分12.04秒","分類: 都市公園(総合公園)里山保全型;所在地: 日本神奈川県横浜市都筑区荏田東四丁目11;面積: 19.6ha（東京ドーム 約4個）;開園: 1998年（平成10年）3月;運営者: 横浜市（指定管理者：NPO法人 都筑里山倶楽部）;駐車場: 55台（有料）","Category:横浜市の公園","箇条書き,制限あり","横浜市都筑区最大の公園で、港北ニュータウン土地区画整理事業により生まれたグリーンマトリックスシステムの中心的な機能を担った公園である。東端には杉山神社が鎮座している。"
"綱島公園","","https://ja.wikipedia.org/wiki/綱島公園","北緯35度32分23.1秒東経139度38分07.2秒","分類: 都市公園（近隣公園）;所在地: 日本神奈川県横浜市港北区綱島台1;座標: 北緯35度32分23.1秒東経139度38分07.2秒﻿ / ﻿北緯35.539750度 東経139.635333度﻿ / 35.539750; 139.635333座標: 北緯35度32分23.1秒東経139度38分07.2秒﻿ / ﻿北緯35.539750度 東経139.635333度﻿ / 35.539750; 139.635333;面積: 約28,819m2;前身: 防空緑地;開園: 1944年4月1日;運営者: 横浜市;駐車場: なし;公式サイト: 綱島公園（横浜市HP）","Category:横浜市の公園","箇条書き,制限あり","市北部、鶴見川の平野部に立地する標高30メートル程の独立丘（綱島台）上部に所在し、雑木林の広がる緑豊かな公園で、春には花見も楽しめる。また、プールやテニスコートの運動施設も併設されている。"
"東横フラワー緑道","","https://ja.wikipedia.org/wiki/東横フラワー緑道","","分類: 都市緑道;所在地: 日本横浜市神奈川区広台太田町;面積: 14,587 m2;前身: 東急東横線の線路;開園: 2006年8月25日;運営者: 横浜市","Category:横浜市の公園","箇条書き,制限あり","2006年7月に新太田町駅跡を含む広台太田町付近から反町3丁目付近までの第1期区間約250m、2007年4月に反町3・4丁目の第2期区間約180mが完成。さらに2011年4月に高島山トンネルが整備されて全線開通となった。"
"常盤公園 (横浜市)","","https://ja.wikipedia.org/wiki/常盤公園_(横浜市)","北緯35度28分9.9秒東経139度35分17.7秒","分類: 都市公園（地区公園）;所在地: 横浜市保土ケ谷区常盤台;座標: 北緯35度28分9.9秒東経139度35分17.7秒﻿ / ﻿北緯35.469417度 東経139.588250度﻿ / 35.469417; 139.588250座標: 北緯35度28分9.9秒東経139度35分17.7秒﻿ / ﻿北緯35.469417度 東経139.588250度﻿ / 35.469417; 139.588250;面積: 約49.2ha;前身: 岡野家別荘「常盤園」;開園: 1942年（昭和17年）10月15日;運営者: 横浜市（指定管理者：（弓道場を除く）緑とコミュニティーグループ、（弓道場）横浜市弓道協会）;駐車場: あり（有料）;公式サイト: 指定管理者のサイト","Category:横浜市の公園","箇条書き,制限あり","保土ケ谷の実業家、岡野欣之助が、所有していた別荘を造成し、1921年（大正10年）10月に「常盤園」として一般に開放した。その後、1940年（昭和15年）に横浜市が常盤園の一部を購入し公園として整備して、1942年（昭和17年）に公開され、現在の「常盤公園」となった。"
"徳生公園","","https://ja.wikipedia.org/wiki/徳生公園","北緯35度33分18.396秒東経139度35分9.928秒","分類: 都市公園（近隣公園）;所在地: 日本神奈川県横浜市都筑区南山田;座標: 北緯35度33分18.396秒東経139度35分9.928秒﻿ / ﻿北緯35.55511000度 東経139.58609111度﻿ / 35.55511000; 139.58609111座標: 北緯35度33分18.396秒東経139度35分9.928秒﻿ / ﻿北緯35.55511000度 東経139.58609111度﻿ / 35.55511000; 139.58609111;面積: 40,120㎡;開園: 平成10年12月25日;アクセス: 東急バス 「南山田二丁目」より徒歩0分・横浜市営地下鉄「センター北」徒歩15分;事務所: 徳生公園愛護会","Category:横浜市の公園","箇条書き,制限あり",""
"富岡総合公園","","https://ja.wikipedia.org/wiki/富岡総合公園","北緯35度22分34.39秒東経139度37分54.38秒","分類: 都市公園（総合公園）;所在地: 日本神奈川県横浜市金沢区富岡東二丁目9;座標: 北緯35度22分34.39秒東経139度37分54.38秒﻿ / ﻿北緯35.3762194度 東経139.6317722度﻿ / 35.3762194; 139.6317722座標: 北緯35度22分34.39秒東経139度37分54.38秒﻿ / ﻿北緯35.3762194度 東経139.6317722度﻿ / 35.3762194; 139.6317722;面積: 219,208m2;前身: 旧日本海軍基地、米軍倉庫;開園: 1975年3月20日;運営者: 横浜市;駐車場: あり(無料);公式サイト: 公式サイト","Category:横浜市の公園","箇条書き,制限あり","中にはアーチェリー射撃場、テニスコート、運動広場、見晴台、金沢区の花である牡丹園がある。アーチェリー射撃場は90mの射程のものが20レーンあり、公営施設としては日本最初のものである。中央の道路沿いには桜並木があるので、桜の開花時期になると大勢の花見客が押し寄せることで有名である。また、道路の両脇には横浜海軍航空隊当時の石門が残されており、横浜海軍航空隊の守護神とされた横浜伊勢山皇大神宮を祀ってある浜空神社があることでも知られる。"
"長浜公園","","https://ja.wikipedia.org/wiki/長浜公園","北緯35度21分46秒東経139度38分6秒","分類: 都市公園（運動公園）;所在地: 横浜市金沢区長浜106-6;座標: 北緯35度21分46秒東経139度38分6秒﻿ / ﻿北緯35.36278度 東経139.63500度﻿ / 35.36278; 139.63500座標: 北緯35度21分46秒東経139度38分6秒﻿ / ﻿北緯35.36278度 東経139.63500度﻿ / 35.36278; 139.63500;面積: 154,182平方メートル;開園: 1982年（昭和57年）7月10日;運営者: 横浜市（指定管理者：金澤・海と森のコミュニティグループ）;駐車場: あり（有料）;公式サイト: 横浜市のサイト","Category:横浜市の公園","箇条書き,制限あり",""
"長浜野口記念公園","","https://ja.wikipedia.org/wiki/長浜野口記念公園","北緯35度21分26.3秒東経139度38分11.4秒","分類: 都市公園（歴史公園）;所在地: 日本横浜市金沢区長浜94-1;座標: 北緯35度21分26.3秒東経139度38分11.4秒﻿ / ﻿北緯35.357306度 東経139.636500度﻿ / 35.357306; 139.636500座標: 北緯35度21分26.3秒東経139度38分11.4秒﻿ / ﻿北緯35.357306度 東経139.636500度﻿ / 35.357306; 139.636500;面積: 11,352 平方メートル;前身: 横浜検疫所長浜措置場;開園: 1997年（平成9年）3月31日;運営者: 横浜市;アクセス: 金沢シーサイドライン幸浦駅、京急本線能見台駅いずれも徒歩15分;公式サイト: 横浜市長浜ホール","Category:横浜市の公園","箇条書き,制限あり",""
