"タイトル","コメント","URLアドレス","座標","詳細情報","親リスト","一覧抽出方法","前文"
"金剛生駒紀泉国定公園","金剛生駒紀泉国定公園1958年4月10日※3金剛山地、生駒山地、和泉葛城山麓","https://ja.wikipedia.org/wiki/金剛生駒紀泉国定公園","","","国定公園","表形式",""
"氷ノ山後山那岐山国定公園","氷ノ山後山那岐山国定公園1969年4月10日氷ノ山、那岐山、天滝渓谷、芦津渓谷、神鍋高原、瀞川平、阿瀬渓谷、蘇武岳","https://ja.wikipedia.org/wiki/氷ノ山後山那岐山国定公園","","","国定公園","表形式",""
"大和青垣国定公園","大和青垣国定公園1970年12月28日大和三山一帯の丘陵地","https://ja.wikipedia.org/wiki/大和青垣国定公園","","","国定公園","表形式",""
"高野竜神国定公園","高野竜神国定公園1967年3月23日高野山及び龍神温泉一帯","https://ja.wikipedia.org/wiki/高野竜神国定公園","","","国定公園","表形式",""
"比婆道後帝釈国定公園","比婆道後帝釈国定公園1963年7月24日比婆山、道後山、吾妻山及び帝釈峡","https://ja.wikipedia.org/wiki/比婆道後帝釈国定公園","","","国定公園","表形式",""
"西中国山地国定公園","西中国山地国定公園1969年1月10日中国山地西部（三段峡、匹見峡、寂地峡含む）","https://ja.wikipedia.org/wiki/西中国山地国定公園","","","国定公園","表形式",""
"北長門海岸国定公園","北長門海岸国定公園1955年11月1日青海島、須佐湾など","https://ja.wikipedia.org/wiki/北長門海岸国定公園","","","国定公園","表形式",""
"秋吉台国定公園","秋吉台国定公園1955年11月1日秋芳洞、秋吉台","https://ja.wikipedia.org/wiki/秋吉台国定公園","","","国定公園","表形式",""
"剣山国定公園","剣山国定公園1964年3月3日剣山山麓一帯、大歩危、小歩危、祖谷渓","https://ja.wikipedia.org/wiki/剣山国定公園","北緯33度46分27秒東経134度01分43秒","","国定公園","表形式",""
"室戸阿南海岸国定公園","室戸阿南海岸国定公園1964年6月1日室戸岬～阿南海岸に亘る海岸線一帯","https://ja.wikipedia.org/wiki/室戸阿南海岸国定公園","","","国定公園","表形式",""
"石鎚国定公園","石鎚国定公園1955年11月1日石鎚山、面河渓","https://ja.wikipedia.org/wiki/石鎚国定公園","","","国定公園","表形式",""
"北九州国定公園","北九州国定公園1972年10月16日皿倉山、平尾台","https://ja.wikipedia.org/wiki/北九州国定公園","","","国定公園","表形式",""
"玄海国定公園","玄海国定公園1956年6月1日若松北海岸、芥屋大門、虹の松原、唐津湾","https://ja.wikipedia.org/wiki/玄海国定公園","","","国定公園","表形式",""
"耶馬日田英彦山国定公園","耶馬日田英彦山国定公園1950年7月29日耶馬渓、八面山、英彦山","https://ja.wikipedia.org/wiki/耶馬日田英彦山国定公園","","","国定公園","表形式",""
"壱岐対馬国定公園","壱岐対馬国定公園1968年7月22日壱岐、浅茅湾など","https://ja.wikipedia.org/wiki/壱岐対馬国定公園","","","国定公園","表形式",""
"九州中央山地国定公園","九州中央山地国定公園1982年5月15日市房山、五木、五家荘、米良荘、綾照葉樹林帯","https://ja.wikipedia.org/wiki/九州中央山地国定公園","","地域: 熊本県、宮崎県;面積: 27,096ha;創立日: 1982年5月15日;運営組織: 熊本県、宮崎県","国定公園","表形式","公園名のごとく、九州の中央部に分布する。降水量が非常に多いため、山には森林が発達しており、常緑樹や落葉樹が垂直に分布する。また綾北川や綾南川上流域には河谷が発達しており、さながら深山幽谷の世界を呈する。指定区域に含まれる著名な山に国見岳や市房山などがある。また、周辺には椎葉、五木、五家荘、米良荘など古くから平家の落ち武者が隠棲したといわれる隠れ里がある。この隠田集落は、「五木の子守唄」や椎葉の「ひえつき節」など数々の民謡や伝承、説話が伝わり、民俗学の宝庫として知られ、観光客を多く集める要因となっている。また、綾には国内最大級の照葉樹林帯があることで知られる。"
"日豊海岸国定公園","日豊海岸国定公園1974年2月15日日豊海岸、枇榔島","https://ja.wikipedia.org/wiki/日豊海岸国定公園","","地域: 大分県、宮崎県;面積: 8,518ha;創立日: 1974年（昭和49年）2月15日;運営組織: 大分県、宮崎県","国定公園","表形式","名称中の日豊とは日向国（現在の宮崎県）と豊後国（現在の大分県）とを指す（日豊本線などが著名）。北端は大分県大分市の佐賀関、南端は日向市の美々津地区近辺に位置する。"
"祖母傾国定公園","祖母傾国定公園1965年3月25日祖母山、高千穂峡","https://ja.wikipedia.org/wiki/祖母傾国定公園","北緯32度49分41.2728秒東経131度20分49.3647秒","指定区域: 日本大分県、宮崎県北緯32度49分41.2728秒東経131度20分49.3647秒﻿ / ﻿北緯32.828131333度 東経131.347045750度﻿ / 32.828131333; 131.347045750座標: 北緯32度49分41.2728秒東経131度20分49.3647秒﻿ / ﻿北緯32.828131333度 東経131.347045750度﻿ / 32.828131333; 131.347045750;分類: 国定公園;面積: 22,000ha;指定日: 1965年3月25日;運営者: 大分県、宮崎県;事務所: 大分県生活環境部生活環境企画課宮崎県自然環境課;事務所所在地: 大分県大分市大手町3-1-1 大分県庁舎別館宮崎県宮崎市旭1丁目3-6 宮崎県庁7号館","国定公園","表形式","祖母傾国定公園という名称は、県境に位置する祖母山（標高1,756m）及び傾山（標高1,602m）に由来する。公園区域には他に大崩山（おおくえやま、標高1,643m）などを含む。祖母傾山系は褶曲等で形成された構造山地としては、九州本土で最も標高が高い。"
"日南海岸国定公園","日南海岸国定公園1955年6月1日青島、日南海岸、都井岬","https://ja.wikipedia.org/wiki/日南海岸国定公園","北緯31度34分44秒東経131度25分48秒","","国定公園","表形式",""
"甑島国定公園","甑島国定公園2015年3月16日海鼠池、貝池、鹿島断崖、鹿の子断層、珊瑚礁、照葉樹林帯など","https://ja.wikipedia.org/wiki/甑島国定公園","北緯31度45分24秒東経129度47分17秒","場所: 東シナ海;座標: 北緯31度45分24秒東経129度47分17秒﻿ / ﻿北緯31.75667度 東経129.78806度﻿ / 31.75667; 129.78806座標: 北緯31度45分24秒東経129度47分17秒﻿ / ﻿北緯31.75667度 東経129.78806度﻿ / 31.75667; 129.78806;主要な島: 上甑島、中甑島、下甑島;面積: 117.56 km2(45.39 sq mi);長さ: 38 km (23.6 mi);最高標高: 604 m (1,982 ft);最高峰: 尾岳;都道府県: 鹿児島県;市町村: 薩摩川内市;人口: 5576（2011年時点）;人口密度: 47.4 /km2(122.8 /sq mi);言語: 日本語;時間帯: 日本標準時（UTC+9）;上甑島: 里;中甑島:;下甑島:;平均最高気温 °C（°F）: 12.0(53.6);日平均気温 °C（°F）: 9.1(48.4);平均最低気温 °C（°F）: 6.1(43);降水量mm （inch）: 105.6(4.157);平均月間日照時間: 77.4;日平均気温 °C（°F）: 6.5(43.7);降水量mm （inch）: 91.1(3.587);現存する学校: 中学校;閉校した学校: 中学校","国定公園","表形式","従来、「こしきじま」という呼称であったが、薩摩川内市は国土地理院に変更を申請し、2014年8月に「こしきしま」に呼称が変更された（#名称参照）。"
"沖縄海岸国定公園","沖縄海岸国定公園※41972年5月15日北部海岸、中部海岸、恩納ビーチ、万座毛、与那覇岳など","https://ja.wikipedia.org/wiki/沖縄海岸国定公園","北緯26度37分00秒東経128度00分00秒","指定区域: 日本沖縄本島北部西海岸、本部半島北緯26度37分00秒東経128度00分00秒﻿ / ﻿北緯26.61667度 東経128.00000度﻿ / 26.61667; 128.00000﻿ (沖縄海岸国定公園)座標: 北緯26度37分00秒東経128度00分00秒﻿ / ﻿北緯26.61667度 東経128.00000度﻿ / 26.61667; 128.00000﻿ (沖縄海岸国定公園);分類: 国定公園;面積: 15,857ha（陸域：4,872ha、海域：10,985ha）;前身: 沖縄海岸政府立公園;指定日: 1972年5月15日;運営者: 沖縄県;公式サイト: 沖縄海岸国定公園（沖縄県）","国定公園","表形式",""
"沖縄戦跡国定公園","沖縄戦跡国定公園※41972年5月15日ひめゆりの塔など県南部海岸地帯の戦争史跡","https://ja.wikipedia.org/wiki/沖縄戦跡国定公園","北緯26度05分42.7秒東経127度43分30.1秒","指定区域: 日本沖縄県糸満市、島尻郡八重瀬町北緯26度05分42.7秒東経127度43分30.1秒﻿ / ﻿北緯26.095194度 東経127.725028度﻿ / 26.095194; 127.725028﻿ (沖縄戦跡国定公園)座標: 北緯26度05分42.7秒東経127度43分30.1秒﻿ / ﻿北緯26.095194度 東経127.725028度﻿ / 26.095194; 127.725028﻿ (沖縄戦跡国定公園);分類: 国定公園;面積: 5,059ha（陸域：3,127ha、海域：1,932ha）;前身: 沖縄戦跡政府立公園;指定日: 1972年5月15日;運営者: 沖縄県;公式サイト: 沖縄戦跡国定公園（沖縄県）","国定公園","表形式","沖縄戦跡国定公園の指定区域の面積は5,059ha（陸域3,127ha、海域1,932ha）。戦跡としては唯一の国定公園である。"
