"タイトル","コメント","URLアドレス","座標","詳細情報","親リスト","一覧抽出方法","前文"
"新堂駅","新堂駅（しんどうえき）","https://ja.wikipedia.org/wiki/新堂駅","北緯34度49分15.95秒東経136度12分24.06秒","所在地: 三重県伊賀市新堂中出318北緯34度49分15.95秒東経136度12分24.06秒﻿ / ﻿北緯34.8210972度 東経136.2066833度﻿ / 34.8210972; 136.2066833座標: 北緯34度49分15.95秒東経136度12分24.06秒﻿ / ﻿北緯34.8210972度 東経136.2066833度﻿ / 34.8210972; 136.2066833;所属事業者: 西日本旅客鉄道（JR西日本）;所属路線: V関西本線;キロ程: 86.1 km（名古屋起点）亀山から26.2 km;電報略号: シト;駅構造: 地上駅;ホーム: 1面2線;乗車人員-統計年度-: 195人/日（降車客含まず）-2019年-;開業年月日: 1921年（大正10年）7月15日;備考: 簡易委託駅POS端末設置;北側: V関西本線;南側: 下り","日本の鉄道駅一覧_しや-しん","箇条書き","島式ホーム1面2線を有し、列車交換が可能な地上駅。出発信号機・場内信号機とも一方向のみの設置のため、逆線入線はできない。最盛期には単式ホーム・島式ホーム混合の2面3線を有したが、後に列車本数の削減により中線の線路を撤去、2面2線の構造となった。その後、ホーム上に簡易駅舎が作られ上り本線が旧来の駅舎のある単式ホームから中線の位置に移され、島式ホームの構造となった。案内上ののりば番号は割り当てられていない。"
"新道東駅","新道東駅（しんどうひがしえき）","https://ja.wikipedia.org/wiki/新道東駅","北緯43度6分16.79秒東経141度22分8.71秒","所在地: 札幌市東区北34条東16丁目北緯43度6分16.79秒東経141度22分8.71秒﻿ / ﻿北緯43.1046639度 東経141.3690861度﻿ / 43.1046639; 141.3690861﻿ (新道東駅)座標: 北緯43度6分16.79秒東経141度22分8.71秒﻿ / ﻿北緯43.1046639度 東経141.3690861度﻿ / 43.1046639; 141.3690861﻿ (新道東駅);駅番号: ○H02;所属事業者: 札幌市交通局;所属路線: 札幌市営地下鉄東豊線;キロ程: 0.9 km（栄町起点）;駅構造: 地下駅;ホーム: 2面2線;乗車人員-統計年度-: 7,977人/日（降車客含まず）-2019年-;開業年月日: 1988年（昭和63年）12月2日;1:  東豊線;2: 栄町方面","日本の鉄道駅一覧_しや-しん","箇条書き","札幌新道の東側に位置する駅であることから。開業前の仮称は「札幌新道駅」だった。"
"新得駅","新得駅（しんとくえき）","https://ja.wikipedia.org/wiki/新得駅","北緯43度4分56.71秒東経142度49分56.96秒","所在地: 北海道上川郡新得町本通北1丁目北緯43度4分56.71秒東経142度49分56.96秒﻿ / ﻿北緯43.0824194度 東経142.8324889度﻿ / 43.0824194; 142.8324889座標: 北緯43度4分56.71秒東経142度49分56.96秒﻿ / ﻿北緯43.0824194度 東経142.8324889度﻿ / 43.0824194; 142.8324889;駅番号: ○K23;所属事業者: 北海道旅客鉄道（JR北海道）;電報略号: トク;駅構造: 地上駅;ホーム: 2面3線;乗車人員-統計年度-: 221人/日（降車客含まず）-2019年-;開業年月日: 1907年（明治40年）9月8日;所属路線: ■■根室本線;キロ程: 136.3 km（滝川起点）;所属路線: ■石勝線;キロ程: 132.4 km（南千歳起点）;備考: 直営駅（管理駅）みどりの窓口有;所属事業者: 日本国有鉄道（国鉄）;所属路線: 根室本線（旧線）;廃止年月日: 1966年（昭和41年）10月1日;備考: 線路付け替えにより廃止。;所属事業者: 北海道拓殖鉄道;所属路線: 北海道拓殖鉄道線;キロ程: 0.0 km（新得起点）;開業年月日: 1928年（昭和3年）12月15日;廃止年月日: 1968年（昭和43年）10月1日;備考: 路線廃止による。;1: ■根室本線;2: ■根室本線;3: ■根室本線;所在地: 北海道上川郡新得町本通北1丁目北緯43度4分56.71秒東経142度49分56.96秒﻿ / ﻿北緯43.0824194度 東経142.8324889度﻿ / 43.0824194; 142.8324889座標: 北緯43度4分56.71秒東経142度49分56.96秒﻿ / ﻿北緯43.0824194度 東経142.8324889度﻿ / 43.0824194; 142.8324889;駅番号: ○K23;所属事業者: 北海道旅客鉄道（JR北海道）;電報略号: トク;駅構造: 地上駅;ホーム: 2面3線;乗車人員-統計年度-: 221人/日（降車客含まず）-2019年-;開業年月日: 1907年（明治40年）9月8日;所属路線: ■■根室本線;キロ程: 136.3 km（滝川起点）;所属路線: ■石勝線;キロ程: 132.4 km（南千歳起点）;備考: 直営駅（管理駅）みどりの窓口有;所属事業者: 日本国有鉄道（国鉄）;所属路線: 根室本線（旧線）;廃止年月日: 1966年（昭和41年）10月1日;備考: 線路付け替えにより廃止。;所属事業者: 北海道拓殖鉄道;所属路線: 北海道拓殖鉄道線;キロ程: 0.0 km（新得起点）;開業年月日: 1928年（昭和3年）12月15日;廃止年月日: 1968年（昭和43年）10月1日;備考: 路線廃止による。;1: ■根室本線;2: ■根室本線;3: ■根室本線;所在地: 北海道上川郡新得町本通北1丁目北緯43度4分56.71秒東経142度49分56.96秒﻿ / ﻿北緯43.0824194度 東経142.8324889度﻿ / 43.0824194; 142.8324889座標: 北緯43度4分56.71秒東経142度49分56.96秒﻿ / ﻿北緯43.0824194度 東経142.8324889度﻿ / 43.0824194; 142.8324889;駅番号: ○K23;所属事業者: 北海道旅客鉄道（JR北海道）;電報略号: トク;駅構造: 地上駅;ホーム: 2面3線;乗車人員-統計年度-: 221人/日（降車客含まず）-2019年-;開業年月日: 1907年（明治40年）9月8日;所属路線: ■■根室本線;キロ程: 136.3 km（滝川起点）;所属路線: ■石勝線;キロ程: 132.4 km（南千歳起点）;備考: 直営駅（管理駅）みどりの窓口有;所属事業者: 日本国有鉄道（国鉄）;所属路線: 根室本線（旧線）;廃止年月日: 1966年（昭和41年）10月1日;備考: 線路付け替えにより廃止。;所属事業者: 北海道拓殖鉄道;所属路線: 北海道拓殖鉄道線;キロ程: 0.0 km（新得起点）;開業年月日: 1928年（昭和3年）12月15日;廃止年月日: 1968年（昭和43年）10月1日;備考: 路線廃止による。;1: ■根室本線;2: ■根室本線;3: ■根室本線","日本の鉄道駅一覧_しや-しん","箇条書き",""
"新所沢駅","新所沢駅（しんところざわえき）","https://ja.wikipedia.org/wiki/新所沢駅","北緯35度48分24秒東経139度27分22秒","所在地: 埼玉県所沢市緑町一丁目21-25北緯35度48分24秒東経139度27分22秒﻿ / ﻿北緯35.80667度 東経139.45611度﻿ / 35.80667; 139.45611座標: 北緯35度48分24秒東経139度27分22秒﻿ / ﻿北緯35.80667度 東経139.45611度﻿ / 35.80667; 139.45611;駅番号: SS24;所属事業者: 西武鉄道;所属路線: ■新宿線;キロ程: 31.7 km（西武新宿起点）;駅構造: 地上駅（橋上駅）;ホーム: 2面4線;乗降人員-統計年度-: 54,822人/日-2019年-;開業年月日: 1951年（昭和26年）6月11日;備考: 前身である所沢御幸町駅の開業日は1938年（昭和13年）6月21日;1・2:  新宿線;3・4: 上り","日本の鉄道駅一覧_しや-しん","箇条書き","周辺地域は「しんとこ」（新所）の略称で呼称されることもある。"
"新鳥栖駅","新鳥栖駅（しんとすえき）","https://ja.wikipedia.org/wiki/新鳥栖駅","北緯33度22分12.7秒東経130度29分28.3秒","所在地: 佐賀県鳥栖市原古賀町220-2北緯33度22分12.7秒東経130度29分28.3秒﻿ / ﻿北緯33.370194度 東経130.491194度﻿ / 33.370194; 130.491194座標: 北緯33度22分12.7秒東経130度29分28.3秒﻿ / ﻿北緯33.370194度 東経130.491194度﻿ / 33.370194; 130.491194;所属事業者: 九州旅客鉄道（JR九州）;電報略号: シト;駅構造: 高架駅（新幹線）地上駅（在来線）;ホーム: 2面4線（新幹線）2面2線（在来線）;乗車人員-統計年度-: 1,642人/日（降車客含まず）-2019年-;開業年月日: 2011年（平成23年）3月12日;所属路線: ■九州新幹線（鹿児島ルート）;キロ程: 28.6km（博多起点）新大阪から650.9 km;所属路線: JH長崎本線;駅番号: JH  02;キロ程: 2.9 km（鳥栖起点）;備考: 新幹線：直営駅在来線：業務委託駅みどりの窓口有;1: JH長崎本線;2: 下り;11・12:  九州新幹線;13・14: 下り","日本の鉄道駅一覧_しや-しん","箇条書き","2021年時点で佐賀県内にある唯一の新幹線駅である。"
"新栃木駅","新栃木駅（しんとちぎえき）","https://ja.wikipedia.org/wiki/新栃木駅","北緯36度23分23.01秒東経139度44分32.11秒","所在地: 栃木県栃木市平柳町一丁目8-18北緯36度23分23.01秒東経139度44分32.11秒﻿ / ﻿北緯36.3897250度 東経139.7422528度﻿ / 36.3897250; 139.7422528﻿ (新栃木駅)座標: 北緯36度23分23.01秒東経139度44分32.11秒﻿ / ﻿北緯36.3897250度 東経139.7422528度﻿ / 36.3897250; 139.7422528﻿ (新栃木駅);駅番号: TN12;所属事業者: 東武鉄道;電報略号: トチ;駅構造: 地上駅;ホーム: 2面3線;乗降人員-統計年度-: 4,163人/日-2019年-;開業年月日: 1929年（昭和4年）4月1日;所属路線: ■日光線;キロ程: 47.9 km（東武動物公園起点）;所属路線: ■宇都宮線;キロ程: 0.0 km（新栃木起点）;1:  日光線;2・3:  日光線","日本の鉄道駅一覧_しや-しん","箇条書き","単式ホーム1面1線と島式ホーム1面2線を有する地上駅。駅舎は線路の西側にあり、島式ホームとは跨線橋により連絡している。PASMO対応自動改札機設置駅。"
"新富町駅","新富町駅（しんとみちょうえき・東京地下鉄有楽町線）","https://ja.wikipedia.org/wiki/新富町駅","北緯35度40分13.8秒東経139度46分25.4秒","所在地: 東京都中央区築地一丁目1-1北緯35度40分13.8秒東経139度46分25.4秒﻿ / ﻿北緯35.670500度 東経139.773722度﻿ / 35.670500; 139.773722﻿ (新富町駅)座標: 北緯35度40分13.8秒東経139度46分25.4秒﻿ / ﻿北緯35.670500度 東経139.773722度﻿ / 35.670500; 139.773722﻿ (新富町駅);駅番号: Y20;所属事業者: 東京地下鉄（東京メトロ）;所属路線: ●有楽町線;キロ程: 22.4 km（和光市起点）;電報略号: トミ;駅構造: 地下駅;ホーム: 2面2線;乗降人員-統計年度-: 29,547人/日-2020年-;開業年月日: 1980年（昭和55年）3月27日;乗換: H11築地駅（東京メトロ日比谷線）;1:  有楽町線;2: 池袋・和光市・森林公園・飯能方面","日本の鉄道駅一覧_しや-しん","箇条書き","相対式ホーム2面2線を有する地下駅。有楽町線の駅で相対式ホームを有するのは氷川台駅と当駅のみである。"
"新富町停留場","新富町停留場（しんとみちょうていりゅうじょう・富山地方鉄道富山市内軌道線）","https://ja.wikipedia.org/wiki/新富町停留場","北緯36度41分55.6秒東経137度12分40.7秒","所在地: 富山県富山市新富町北緯36度41分55.6秒東経137度12分40.7秒﻿ / ﻿北緯36.698778度 東経137.211306度﻿ / 36.698778; 137.211306﻿ (新富町停留場*)座標: 北緯36度41分55.6秒東経137度12分40.7秒﻿ / ﻿北緯36.698778度 東経137.211306度﻿ / 36.698778; 137.211306﻿ (新富町停留場*);駅番号: C16;所属事業者: 富山地方鉄道;所属路線: 富山軌道線（支線）;キロ程: 0.3km（電鉄富山駅・エスタ前起点）南富山駅前から3.9 km;駅構造: 地上駅;ホーム: 相対式2面2線;乗降人員-統計年度-: 526人/日-2019年-;開業年月日: 1913年（大正2年）9月1日","日本の鉄道駅一覧_しや-しん","箇条書き","併用軌道に設置されている。"
"新豊洲駅","新豊洲駅（しんとよすえき）","https://ja.wikipedia.org/wiki/新豊洲駅","北緯35度38分55.2秒東経139度47分24.2秒","所在地: 東京都江東区豊洲六丁目北緯35度38分55.2秒東経139度47分24.2秒﻿ / ﻿北緯35.648667度 東経139.790056度﻿ / 35.648667; 139.790056﻿ (新豊洲駅)座標: 北緯35度38分55.2秒東経139度47分24.2秒﻿ / ﻿北緯35.648667度 東経139.790056度﻿ / 35.648667; 139.790056﻿ (新豊洲駅);駅番号: U15;所属事業者: ゆりかもめ;所属路線: 東京臨海新交通臨海線;キロ程: 14.0 km（新橋起点）;駅構造: 高架駅;ホーム: 1面2線;乗降人員-統計年度-: 6,600人/日-2018年-;開業年月日: 2006年（平成18年）3月27日;備考: 無人駅;1:  ゆりかもめ;2: 台場・新橋方面","日本の鉄道駅一覧_しや-しん","箇条書き","島式ホーム1面2線の高架駅であり、改札階共に道路の直上に位置しており、歩道から改札階に上がり、その後上階のホームへ入ることとなる。"
"新豊田駅","新豊田駅（しんとよたえき）","https://ja.wikipedia.org/wiki/新豊田駅","北緯35度5分16.1秒東経137度9分12.8秒","所在地: 愛知県豊田市小坂本町1-16北緯35度5分16.1秒東経137度9分12.8秒﻿ / ﻿北緯35.087806度 東経137.153556度﻿ / 35.087806; 137.153556座標: 北緯35度5分16.1秒東経137度9分12.8秒﻿ / ﻿北緯35.087806度 東経137.153556度﻿ / 35.087806; 137.153556;駅番号: ○12;所属事業者: 愛知環状鉄道*;所属路線: ■愛知環状鉄道線;キロ程: 19.5 km（岡崎起点）;電報略号: トタ;駅構造: 高架駅;ホーム: 2面2線;乗降人員-統計年度-: 15,694人/日-2019年-;開業年月日: 1976年（昭和51年）4月26日;乗換: 豊田市駅（名鉄三河線・名鉄豊田線）;備考: * 1988年にJR東海から移管;1: ■愛知環状鉄道線;2: 下り","日本の鉄道駅一覧_しや-しん","箇条書き","相対式2面2線ホームを持つ高架駅である。上り1番線ホームは愛知環状鉄道開業時に増設されたもので、国鉄岡多線延伸開業時から使用されている下り2番線ホーム（20m車8両分の有効長）の半分の有効長（20m車4両分）である。ホーム幅も狭く朝は非常に混雑していたが、2008年1月に拡幅および上屋延長が行われた。"
"新豊津駅","新豊津駅（しんとよつえき）","https://ja.wikipedia.org/wiki/新豊津駅","北緯33度40分46.42秒東経130度57分49.95秒","所在地: 福岡県京都郡みやこ町彦徳523-2北緯33度40分46.42秒東経130度57分49.95秒﻿ / ﻿北緯33.6795611度 東経130.9638750度﻿ / 33.6795611; 130.9638750座標: 北緯33度40分46.42秒東経130度57分49.95秒﻿ / ﻿北緯33.6795611度 東経130.9638750度﻿ / 33.6795611; 130.9638750;駅番号: HC26;所属事業者: ■平成筑豊鉄道;所属路線: ■田川線;キロ程: 5.8 km（行橋起点）;駅構造: 地上駅;ホーム: 1面1線;開業年月日: 1990年（平成2年）10月1日;備考: 無人駅","日本の鉄道駅一覧_しや-しん","箇条書き","東京都八王子市に本社を置くソフトウェア開発会社「エナジーソフト」がネーミングライツを取得し、2009年（平成21年）4月1日より愛称付きの駅名がエナジーソフト新豊津駅となっていた。2020年4月現在は契約終了しており、新豊津駅に戻っている。"
"新豊橋駅","新豊橋駅（しんとよはしえき）","https://ja.wikipedia.org/wiki/新豊橋駅","北緯34度45分44秒東経137度22分58.6秒","所在地: 愛知県豊橋市花田町西宿41番地北緯34度45分44秒東経137度22分58.6秒﻿ / ﻿北緯34.76222度 東経137.382944度﻿ / 34.76222; 137.382944座標: 北緯34度45分44秒東経137度22分58.6秒﻿ / ﻿北緯34.76222度 東経137.382944度﻿ / 34.76222; 137.382944;駅番号:  1;所属事業者: 豊橋鉄道;所属路線: 渥美線;キロ程: 0.0 km（新豊橋起点）;駅構造: 地上駅;ホーム: 1面2線;乗車人員-統計年度-: 8,936人/日（降車客含まず）-2019年-;乗降人員-統計年度-: 17,989人/日-2019年-;開業年月日: 1927年（昭和2年）10月1日;乗換: 豊橋駅（JR・名鉄線）駅前停留場（豊橋鉄道東田本線）;備考: 駅員配置駅 5:45-23:30* 1927年（昭和2年）10月13日豊橋駅前駅より改称;1: ■渥美線;2: ■渥美線;3階: 東進衛星予備校豊橋駅前校;2階: ファミリーマート新豊橋駅店;1階: 新豊橋駅;合計: 通勤定期;1978年（昭和53年）: 1,762,660;1979年（昭和54年）: 1,758,950;1980年（昭和55年）: 1,727,060;1981年（昭和56年）: 1,220,170;1982年（昭和57年）: 1,107,310;1983年（昭和58年）: 1,075,627;1984年（昭和59年）: 1,456,709;1985年（昭和60年）: 1,419,826;1986年（昭和61年）: 1,425,068;1987年（昭和62年）: 1,413,971;1988年（昭和63年）: 1,447,136;1989年（平成元年）: 1,459,808;1990年（平成2年）: 1,521,361;1991年（平成3年）: 1,593,923;1992年（平成4年）: 1,594,928;1993年（平成5年）: 1,576,108;1994年（平成6年）: 1,596,001;1995年（平成7年）: 1,559,766;1996年（平成8年）: 1,545,132;1997年（平成9年）: 1,507,809;1998年（平成10年）: 1,526,352;1999年（平成11年）: 1,487,856;2000年（平成12年）: 1,522,100;2001年（平成13年）: 1,544,119;2002年（平成14年）: 1,536,388;2003年（平成15年）: 1,549,971;2004年（平成16年）: 1,525,868;2005年（平成17年）: 1,568,061;2006年（平成18年）: 1,583,715;2007年（平成19年）: 1,629,004;2008年（平成20年）: 1,725,154;2009年（平成21年）: 1,720,018;2010年（平成22年）: 1,719,455;2011年（平成23年）: 1,874,574;2012年（平成24年）: 1,574,203;2013年（平成25年）: 1,745,769;2014年（平成26年）: 1,762,330;2015年（平成27年）: 1,840,514;2016年（平成28年）: 1,889,084;2017年（平成29年）: 1,904,811","日本の鉄道駅一覧_しや-しん","箇条書き","東海旅客鉄道（JR東海）・名古屋鉄道（名鉄）の豊橋駅東側および豊橋鉄道東田本線の駅前停留場に隣接しており、乗り換えが可能である。"
"新取手駅","新取手駅（しんとりでえき）","https://ja.wikipedia.org/wiki/新取手駅","北緯35度55分2.94秒東経140度2分34.18秒","所在地: 茨城県取手市新取手一丁目1-1北緯35度55分2.94秒東経140度2分34.18秒﻿ / ﻿北緯35.9174833度 東経140.0428278度﻿ / 35.9174833; 140.0428278﻿ (新取手駅)座標: 北緯35度55分2.94秒東経140度2分34.18秒﻿ / ﻿北緯35.9174833度 東経140.0428278度﻿ / 35.9174833; 140.0428278﻿ (新取手駅);所属事業者: 関東鉄道;所属路線: ■常総線;キロ程: 3.4 km（取手起点）;駅構造: 地上駅;ホーム: 1面2線;乗降人員-統計年度-: 1,985人/日-2019年-;開業年月日: 1968年（昭和43年）4月1日;備考: 無人駅;1: ●常総線;2: 下り","日本の鉄道駅一覧_しや-しん","箇条書き","当駅は取手市の北西部に位置し、とげぬき地蔵尊の最寄り駅である。"
"新那加駅","新那加駅（しんなかえき）","https://ja.wikipedia.org/wiki/新那加駅","北緯35度24分0.46秒東経136度50分1.81秒","所在地: 岐阜県各務原市那加新那加町27北緯35度24分0.46秒東経136度50分1.81秒﻿ / ﻿北緯35.4001278度 東経136.8338361度﻿ / 35.4001278; 136.8338361﻿ (新那加駅)座標: 北緯35度24分0.46秒東経136度50分1.81秒﻿ / ﻿北緯35.4001278度 東経136.8338361度﻿ / 35.4001278; 136.8338361﻿ (新那加駅);駅番号: KG  10;所属事業者: 名古屋鉄道;所属路線: 各務原線;キロ程: 7.5 km（名鉄岐阜起点）;駅構造: 地上駅;ホーム: 1面2線;乗降人員-統計年度-: 3,194人/日-2019年-;開業年月日: 1926年（大正15年）1月21日;乗換: JR東海高山本線那加駅;備考: 終日駅員配置駅;1: KG各務原線;2: 上り","日本の鉄道駅一覧_しや-しん","箇条書き","当駅で種別変更する列車が多く、日中の半数の列車は当駅で種別変更する（岐阜行きは普通に、犬山行きは急行になる）。渡り線や引き上げ線がないため通常当駅発着の列車は設定されていないが、航空自衛隊岐阜基地で航空祭が行われるときなどに当駅始発犬山方面行きの急行などが臨時に設定されることがある（この場合名鉄岐阜駅から回送）。"
"新中川町停留場","新中川町停留場（しんなかがわまちていりゅうじょう）","https://ja.wikipedia.org/wiki/新中川町停留場","北緯32度45分8.26秒東経129度53分26.3秒","所在地: 長崎県長崎市新中川町1番地先北緯32度45分8.26秒東経129度53分26.3秒﻿ / ﻿北緯32.7522944度 東経129.890639度﻿ / 32.7522944; 129.890639﻿ (新中川町停留場);駅番号: 41;所属事業者: 長崎電気軌道;所属路線: 蛍茶屋支線（□2号系統・■3号系統・■4号系統・■5号系統）;キロ程: 1.9 km（西浜町起点）;駅構造: 地上駅;ホーム: 2面2線;乗降人員-統計年度-: 2,700人/日-2015年-;開業年月日: 1934年（昭和9年）12月20日","日本の鉄道駅一覧_しや-しん","箇条書き","当停留場は1934年（昭和9年）に中川町停留場（なかがわまちていりゅうじょう）として開業した。馬町- 蛍茶屋間の開通と同日の開業である。新中川町停留場に改称したのは1947年（昭和22年）のことで、改称に合わせて停留場は隣の新大工町停留場寄りに0.2キロメートル移設している。この新大工町停留場との間にはかつて桜馬場町停留場（さくらばばまちていりゅうじょう）が置かれていたが、太平洋戦争下の1944年（昭和19年）に急行運転が開始されたことにより廃止されている。1801号の4号系統は2011年度と2015年度、2016年度は一度ずつしか見られなかった。"
