"タイトル","コメント","URLアドレス","座標","詳細情報","親リスト","一覧抽出方法","前文"
"多気駅","多気駅（たきえき・東海旅客鉄道紀勢本線・参宮線）","https://ja.wikipedia.org/wiki/多気駅","北緯34度30分58.69秒東経136度34分22.12秒","所在地: 三重県多気郡多気町多気76-1北緯34度30分58.69秒東経136度34分22.12秒﻿ / ﻿北緯34.5163028度 東経136.5728111度﻿ / 34.5163028; 136.5728111座標: 北緯34度30分58.69秒東経136度34分22.12秒﻿ / ﻿北緯34.5163028度 東経136.5728111度﻿ / 34.5163028; 136.5728111;所属事業者: 東海旅客鉄道（JR東海）;電報略号: タキ;駅構造: 地上駅;ホーム: 2面4線;乗車人員-統計年度-: 560人/日（降車客含まず）-2019年-;開業年月日: 1893年（明治26年）12月31日;所属路線: 紀勢本線;キロ程: 42.5 km（亀山起点）;所属路線: 参宮線;キロ程: 0.0 km（多気起点）;備考: 駅長配置駅（管理駅）みどりの窓口有;1・2: ■紀勢本線;3・4: 下り;合 計: 通勤定期;1947年（昭和22年）:;1948年（昭和23年）: 129,330;1949年（昭和24年）: 133,590;1950年（昭和25年）: 129,531;1951年（昭和26年）: 143,566;1952年（昭和27年）: 135,908;1953年（昭和28年）: 143,080;1954年（昭和29年）: 158,552;1955年（昭和30年）: 146,634;1956年（昭和31年）: 150,077;1957年（昭和32年）: 161,910;1958年（昭和33年）: 167,533;1959年（昭和34年）:;1960年（昭和35年）:;1961年（昭和36年）: 212,859;1962年（昭和37年）: 225,268;1963年（昭和38年）: 246,014;1964年（昭和39年）: 261,861;1965年（昭和40年）: 280,160;1966年（昭和41年）: 294,483;1967年（昭和42年）: 266,236;1968年（昭和43年）: 261,820;1969年（昭和44年）: 247,655;1970年（昭和45年）: 246,633;1971年（昭和46年）: 232,335;1972年（昭和47年）: 218,228;1973年（昭和48年）: 200,703;1974年（昭和49年）: 190,139;1975年（昭和50年）: 180,236;1976年（昭和51年）: 190,137;1977年（昭和52年）:;1978年（昭和53年）:;1979年（昭和54年）:;1980年（昭和55年）: 94,092;1981年（昭和56年）: 85,070;1982年（昭和57年）: 79,124;1983年（昭和58年）: 75,937;1984年（昭和59年）: 84,084;1985年（昭和60年）: 75,120;1986年（昭和61年）: 78,645;1987年（昭和62年）: 68,309;1988年（昭和63年）: 74,061;1989年（平成元年）: 72,651;1990年（平成2年）: 133,670;1991年（平成3年）: 93,037;1992年（平成4年）: 102,202;1993年（平成5年）: 99,609;1994年（平成6年）: 150,388;1995年（平成7年）: 147,366;1996年（平成8年）: 143,764;1997年（平成9年）: 133,081;1998年（平成10年）: 144,448;1999年（平成11年）: 162,831;2000年（平成12年）: 163,589;2001年（平成13年）: 157,930;2002年（平成14年）: 156,001;2003年（平成15年）: 149,566;2004年（平成16年）: 149,609;2005年（平成17年）: 154,755;2006年（平成18年）: 154,946;2007年（平成19年）: 152,852;2008年（平成20年）: 158,384;2009年（平成21年）: 163,227;2010年（平成22年）: 165,744;2011年（平成23年）: 171,808;2012年（平成24年）: 175,113;2013年（平成25年）: 183,885;2014年（平成26年）: 164,156","日本の鉄道駅一覧_た","箇条書き","当駅の所属線である紀勢本線から、参宮線が分岐する。交通の要衝として、特急「南紀」を含む全ての列車が停車する。線路名称上は参宮線の起点駅であるが、紀勢本線松阪方面からの特急以外の列車については当駅から参宮線に直通するものが多く、運転系統上では紀勢本線新宮方面への普通列車の多くが当駅始発となっている。"
"田儀駅","田儀駅（たぎえき）","https://ja.wikipedia.org/wiki/田儀駅","北緯35度16分30.8秒東経132度35分24.84秒","所在地: 島根県出雲市多伎町口田儀2016北緯35度16分30.8秒東経132度35分24.84秒﻿ / ﻿北緯35.275222度 東経132.5902333度﻿ / 35.275222; 132.5902333﻿ (田儀駅);所属事業者: 西日本旅客鉄道（JR西日本）;所属路線: D山陰本線;キロ程: 404.0 km（京都起点）;電報略号: タキ;駅構造: 地上駅;ホーム: 1面2線;乗車人員-統計年度-: 34人/日（降車客含まず）-2018年-;開業年月日: 1915年（大正4年）7月11日;備考: 無人駅;1・2: D山陰本線","日本の鉄道駅一覧_た","箇条書き","現在は当駅の構内から出雲市寄りが米子支社直轄区間となっている。隣の波根駅からは同支社浜田鉄道部の管理区間となるため、当駅がその境界となっている。快速列車については、下り1本のみが停車する（2021年3月現在）。"
"滝井駅","滝井駅（たきいえき）","https://ja.wikipedia.org/wiki/滝井駅","北緯34度43分39.66秒東経135度33分26.97秒","所在地: 大阪府守口市紅屋町8番8号北緯34度43分39.66秒東経135度33分26.97秒﻿ / ﻿北緯34.7276833度 東経135.5574917度﻿ / 34.7276833; 135.5574917﻿ (滝井駅)座標: 北緯34度43分39.66秒東経135度33分26.97秒﻿ / ﻿北緯34.7276833度 東経135.5574917度﻿ / 34.7276833; 135.5574917﻿ (滝井駅);駅番号: KH  09;所属事業者: 京阪電気鉄道;所属路線: ■京阪本線;キロ程: 7.2 km（淀屋橋起点）;電報略号: 滝（駅名略称方式）;駅構造: 高架駅;ホーム: 2面2線*;乗降人員-統計年度-: 6,814人/日-2019年-;開業年月日: 1931年（昭和6年）10月14日;備考: * この間に通過線2本あり無人駅（自動券売機有）;1: ■京阪本線;2: 下り","日本の鉄道駅一覧_た","箇条書き","無人駅である。また、改札内にはトイレがある。"
"滝尾駅","滝尾駅（たきおえき）","https://ja.wikipedia.org/wiki/滝尾駅","北緯33度12分33.56秒東経131度37分22.98秒","所在地: 大分県大分市大字津守北緯33度12分33.56秒東経131度37分22.98秒﻿ / ﻿北緯33.2093222度 東経131.6230500度﻿ / 33.2093222; 131.6230500;所属事業者: 九州旅客鉄道（JR九州）;所属路線: ■豊肥本線;キロ程: 5.1 km（大分起点）;電報略号: タキ;駅構造: 地上駅;ホーム: 2面2線;乗車人員-統計年度-: 376人/日（降車客含まず）-2019年-;開業年月日: 1914年（大正3年）4月1日;備考: 無人駅駅集中管理システム（Smart Support Station）採用;1: ■豊肥本線;2: ■豊肥本線","日本の鉄道駅一覧_た","箇条書き","当初は現在の滝尾駅よりもやや南の軒田と宮崎の中間で、現在の敷戸駅に近い位置に駅が設けられる計画だった。しかし、当時の滝尾駅の周辺には製糸工場、酒造所、醤油工場等があり、工場関係者が燃料とする石炭の運輸のために地元住民に働きかけて期成会を結成して陳情を行うとともに、用地を寄付して現在の位置に駅を誘致した。"
"滝川駅","滝川駅（たきかわえき）","https://ja.wikipedia.org/wiki/滝川駅","北緯43度33分18.5秒東経141度54分4.3秒","所在地: 北海道滝川市栄町4丁目9-15北緯43度33分18.5秒東経141度54分4.3秒﻿ / ﻿北緯43.555139度 東経141.901194度﻿ / 43.555139; 141.901194;駅番号: ○A21;所属事業者: 北海道旅客鉄道（JR北海道）日本貨物鉄道（JR貨物）;電報略号: タキ;駅構造: 地上駅;ホーム: 3面5線;乗車人員-統計年度-: 1,584人/日（降車客含まず）-2019年-;開業年月日: 1898年（明治31年）7月16日;所属路線: ■函館本線;キロ程: 369.8 km（函館起点）;所属路線: ■根室本線;キロ程: 0.0 km（滝川起点）;備考: 直営駅（管理駅）みどりの窓口有;1: ■根室本線;4: ■函館本線;5: ■函館本線;6: 下り;7: 上り","日本の鉄道駅一覧_た","箇条書き","函館本線を所属線としており、当駅を起点とする根室本線を加えた2路線が乗り入れている。臨時列車を含めてすべての列車が停車する。また、どちらの路線もJR貨物が第二種鉄道事業者として貨物の営業を行っている。"
"滝沢駅","滝沢駅（たきざわえき）","https://ja.wikipedia.org/wiki/滝沢駅","北緯39度47分56.1秒東経141度8分57.8秒","所在地: 岩手県滝沢市野沢90北緯39度47分56.1秒東経141度8分57.8秒﻿ / ﻿北緯39.798917度 東経141.149389度﻿ / 39.798917; 141.149389座標: 北緯39度47分56.1秒東経141度8分57.8秒﻿ / ﻿北緯39.798917度 東経141.149389度﻿ / 39.798917; 141.149389;所属事業者: IGRいわて銀河鉄道;所属路線: ■いわて銀河鉄道線（■JR花輪線直通含む）;キロ程: 12.2km（盛岡起点）東京から547.5 km;電報略号: タキ;駅構造: 地上駅;ホーム: 2面3線;乗降人員-統計年度-: 3,044人/日-2019年-;開業年月日: 1906年（明治39年）1月21日;備考: 直営駅;1: ■いわて銀河鉄道線;2: ■いわて銀河鉄道線;3: ■いわて銀河鉄道線（■花輪線を含む）","日本の鉄道駅一覧_た","箇条書き","好摩駅から乗り入れる東日本旅客鉄道（JR東日本）花輪線の列車も利用可能である。"
"滝谷駅 (大阪府)","滝谷駅 (大阪府)（たきだにえき・南海高野線）","https://ja.wikipedia.org/wiki/滝谷駅_(大阪府)","北緯34度28分45.1秒東経135度33分44.6秒","所在地: 大阪府富田林市須賀二丁目26番1号北緯34度28分45.1秒東経135度33分44.6秒﻿ / ﻿北緯34.479194度 東経135.562389度﻿ / 34.479194; 135.562389座標: 北緯34度28分45.1秒東経135度33分44.6秒﻿ / ﻿北緯34.479194度 東経135.562389度﻿ / 34.479194; 135.562389;駅番号: NK 67;所属事業者: 南海電気鉄道;所属路線: ■高野線;キロ程: 24.6 km（汐見橋起点）難波から23.9 km;電報略号: タキ;駅構造: 地上駅;ホーム: 2面2線;乗降人員-統計年次-: 5,292人/日-2019年-;開業年月日: 1898年（明治31年）3月29日;備考: 無人駅;1:  高野線;2: 上り","日本の鉄道駅一覧_た","箇条書き","相対式2面2線のホームを持つ地平駅である。有効長は8両。駅舎は高野山方面行ホーム側にあり、互いのホームは跨線橋で繋がっている。なお、難波方面行きホームで下車する場合、難波寄りの方が跨線橋に近い。"
"滝谷不動駅","滝谷不動駅（たきだにふどうえき）","https://ja.wikipedia.org/wiki/滝谷不動駅","北緯34度28分51.6秒東経135度35分11.0秒","所在地: 大阪府富田林市錦織東二丁目15-1北緯34度28分51.6秒東経135度35分11.0秒﻿ / ﻿北緯34.481000度 東経135.586389度﻿ / 34.481000; 135.586389座標: 北緯34度28分51.6秒東経135度35分11.0秒﻿ / ﻿北緯34.481000度 東経135.586389度﻿ / 34.481000; 135.586389;駅番号:  O21;所属事業者: 近畿日本鉄道（近鉄）;所属路線: O長野線;キロ程: 8.7km（古市起点）大阪阿部野橋から27.0 km;電報略号: フト;駅構造: 地上駅;ホーム: 2面2線;乗降人員-統計年度-: （特定日）6,914人/日-2018年-;開業年月日: 1902年（明治35年）3月25日;1: O長野線;2: 上り","日本の鉄道駅一覧_た","箇条書き","「大阪大谷大学前」の副名称が付いている（2006年3月までは「大谷女子大学前」であった）。"
"滝野駅","滝野駅（たきのえき）","https://ja.wikipedia.org/wiki/滝野駅","北緯34度56分28.73秒東経134度57分20.57秒","所在地: 兵庫県加東市上滝野宮前887北緯34度56分28.73秒東経134度57分20.57秒﻿ / ﻿北緯34.9413139度 東経134.9557139度﻿ / 34.9413139; 134.9557139﻿ (滝野駅);所属事業者: 西日本旅客鉄道（JR西日本）;所属路線: I加古川線;キロ程: 27.3 km（加古川起点）;電報略号: タノ;駅構造: 地上駅;ホーム: 1面1線;乗車人員-統計年度-: 265人/日（降車客含まず）-2019年-;開業年月日: 1913年（大正2年）9月1日;備考: 無人駅（自動券売機 有）","日本の鉄道駅一覧_た","箇条書き","地上駅で、谷川方面に向かって右側に1面1線の単式ホームを有する停留所になっている。"
"滝ノ上駅","滝ノ上駅（たきのうええき）","https://ja.wikipedia.org/wiki/滝ノ上駅","北緯42度54分36.9秒東経141度58分34.57秒","所在地: 北海道夕張市滝ノ上北緯42度54分36.9秒東経141度58分34.57秒﻿ / ﻿北緯42.910250度 東経141.9762694度﻿ / 42.910250; 141.9762694﻿ (滝ノ上駅);駅番号: ○K18;所属事業者: 北海道旅客鉄道（JR北海道）;所属路線: ■石勝線;キロ程: 35.8 km（南千歳起点）;電報略号: ウヘ;駅構造: 地上駅;ホーム: 2面3線;乗降人員-統計年度-: 6人/日-2014年-;開業年月日: 1897年（明治30年）2月16日;備考: 無人駅;1: ■石勝線;2: 上り","日本の鉄道駅一覧_た","箇条書き","駅付近の千鳥の淵（千鳥ヶ滝）の上流にあることからこの名称となった、とされている。"
"滝野川一丁目停留場","滝野川一丁目停留場（たきのがわいっちょうめていりゅうじょう）","https://ja.wikipedia.org/wiki/滝野川一丁目停留場","北緯35度44分50.5秒東経139度44分7.4秒","所在地: 東京都北区滝野川一丁目北緯35度44分50.5秒東経139度44分7.4秒﻿ / ﻿北緯35.747361度 東経139.735389度﻿ / 35.747361; 139.735389座標: 北緯35度44分50.5秒東経139度44分7.4秒﻿ / ﻿北緯35.747361度 東経139.735389度﻿ / 35.747361; 139.735389;駅番号: SA18;所属事業者: 東京都交通局;所属路線: 都電荒川線（東京さくらトラム）;キロ程: 6.9 km（三ノ輪橋起点）;駅構造: 地上駅;ホーム: 2面2線;乗降人員-統計年度-: 1,610人/日-2019年-;開業年月日: 1911年（明治44年）8月20日;東側:  都電荒川線（東京さくらトラム）;西側: 下り","日本の鉄道駅一覧_た","箇条書き","相対式ホーム2面2線を有する地上駅である。"
"滝の茶屋駅","滝の茶屋駅（たきのちゃやえき）","https://ja.wikipedia.org/wiki/滝の茶屋駅","北緯34度37分51.30秒東経135度4分19.37秒","所在地: 神戸市垂水区城が山1丁目1-1北緯34度37分51.30秒東経135度4分19.37秒﻿ / ﻿北緯34.6309167度 東経135.0720472度﻿ / 34.6309167; 135.0720472﻿ (滝の茶屋駅)座標: 北緯34度37分51.30秒東経135度4分19.37秒﻿ / ﻿北緯34.6309167度 東経135.0720472度﻿ / 34.6309167; 135.0720472﻿ (滝の茶屋駅);駅番号: ●SY 09;所属事業者: 山陽電気鉄道;所属路線: 本線;キロ程: 7.8km（西代起点）梅田から44.9 km;駅構造: 地上駅（橋上駅）;ホーム: 2面2線;乗車人員-統計年度-: 2,740人/日（降車客含まず）-2017年-;開業年月日: 1917年（大正6年）4月12日;南側:  本線;北側: 上り;1969(S44): 8,705;1970(S45): 8,896;1971(S46): 9,215;1972(S47): 9,126;1973(S48): 8,868;1974(S49): 8,623;1975(S50): 8,345;1976(S51): 8,092;1977(S52): 8,007;1978(S53): 7,716;1979(S54): 7,464;1980(S55): 6,880;1981(S56): 6,860;1982(S57): 6,655;1983(S58): 6,485;1984(S59): 5,899;1985(S60): 5,581;1986(S61): 5,000;1987(S62): 4,849;1988(S63): 4,838;1989(H01): 4,751;1990(H02): 4,863;1991(H03): 4,871;1992(H04): 5,052;1993(H05): 4,934;1994(H06): 3,942;1995(H07): 3,479;1996(H08): 4,164;1997(H09): 3,888;1998(H10): 3,707;1999(H11): 3,548;2000(H12): 3,449;2001(H13): 3,433;2002(H14): 3,230;2003(H15): 3,126;2004(H16): 3,058;2005(H17): 3,030;2006(H18): 3,011;2007(H19): 2,923;2008(H20): 2,879;2009(H21): 2,764;2010(H22): 2,775;2011(H23): 2,701;2012(H24): 2,710;2013(H25): 2,764;2014(H26): 2,707;2015(H27): 2,737;2016(H28): 2,726;2017(H29): 2,740;2018(H30): 2,814","日本の鉄道駅一覧_た","箇条書き","↑山陽塩屋駅"
"滝ノ間駅","滝ノ間駅（たきのまえき）","https://ja.wikipedia.org/wiki/滝ノ間駅","北緯40度22分47.7秒東経140度0分8.1秒","所属事業者: 東日本旅客鉄道（JR東日本）;所属路線: ■五能線;キロ程: 24.5 km（東能代起点）;電報略号: タキ;駅構造: 地上駅;ホーム: 1面1線;開業年月日: 1963年（昭和38年）4月20日;備考: 無人駅","日本の鉄道駅一覧_た","箇条書き","単式ホーム1面1線を有する地上駅。駅舎はなく、ホーム上に待合所が置かれるのみとなっている。トイレが待合室下方にある。東能代駅管理の無人駅。"
"滝宮駅","滝宮駅（たきのみやえき）","https://ja.wikipedia.org/wiki/滝宮駅","北緯34度14分53.3秒東経133度55分19.8秒","所在地: 香川県綾歌郡綾川町滝宮546北緯34度14分53.3秒東経133度55分19.8秒﻿ / ﻿北緯34.248139度 東経133.922167度﻿ / 34.248139; 133.922167座標: 北緯34度14分53.3秒東経133度55分19.8秒﻿ / ﻿北緯34.248139度 東経133.922167度﻿ / 34.248139; 133.922167;駅番号:  K15;所属事業者: 高松琴平電気鉄道;所属路線: ■琴平線;キロ程: 20.7 km（高松築港起点）;駅構造: 地上駅;ホーム: 相対式2面2線;乗降人員-統計年度-: 550人/日-2018年-;開業年月日: 1926年（大正15年）12月21日;1: ■琴平線","日本の鉄道駅一覧_た","箇条書き","↑綾川駅"
"多喜浜駅","多喜浜駅（たきはまえき）","https://ja.wikipedia.org/wiki/多喜浜駅","北緯33度58分13.94秒東経133度19分27.19秒","所在地: 愛媛県新居浜市又野一丁目北緯33度58分13.94秒東経133度19分27.19秒﻿ / ﻿北緯33.9705389度 東経133.3242194度﻿ / 33.9705389; 133.3242194座標: 北緯33度58分13.94秒東経133度19分27.19秒﻿ / ﻿北緯33.9705389度 東経133.3242194度﻿ / 33.9705389; 133.3242194;駅番号: ○Y28;所属事業者: 四国旅客鉄道（JR四国）;所属路線: ■予讃線;キロ程: 99.4 km（高松起点）;電報略号: タハ;駅構造: 地上駅;ホーム: 1面2線;乗降人員-統計年度-: 156人/日-2019年-;開業年月日: 1921年（大正10年）6月21日;備考: 無人駅;1・2: ■予讃線","日本の鉄道駅一覧_た","箇条書き","1番線が上下本線（制限速度90km/h）、2番線が上下副本線となっている一線スルーで、島式1面2線の地上駅。行違いがない場合は両方向とも1番のりばを優先して使用する。駅舎は開業当時の駅舎をリフォームする形で使用している。無人駅で自動券売機はない。無人化後しばらく簡易委託され近距離乗車券を扱っていたが、JRになってから旧事務室部分に直営のパン屋ウィリーウィンキーが入居（現在は撤退）し簡易委託は廃止された。現在は構内に「健康食工房 まる」が営業している。"
"滝原駅","滝原駅（たきはらえき）","https://ja.wikipedia.org/wiki/滝原駅","北緯34度21分36.37秒東経136度24分43.38秒","所在地: 三重県多気郡大台町大ヶ所155北緯34度21分36.37秒東経136度24分43.38秒﻿ / ﻿北緯34.3601028度 東経136.4120500度﻿ / 34.3601028; 136.4120500;所属事業者: 東海旅客鉄道（JR東海）;所属路線: 紀勢本線;キロ程: 73.0 km（亀山起点）;電報略号: タラ;駅構造: 地上駅;ホーム: 2面2線;乗車人員-統計年度-: 37人/日（降車客含まず）-2019年-;開業年月日: 1926年（大正15年）8月18日;備考: 駅員無配置駅;1: ■紀勢本線;2: 上り","日本の鉄道駅一覧_た","箇条書き","相対式ホーム2面2線を有する地上駅。2006年ごろに駅本屋はコンクリート製の簡易なものに建て替えられたが、上りホームには木造の待合所が残る。駅前には自治体によって水洗式便所が設置されている。ホーム間の移動は屋根なし跨線橋を使う。"
"滝不動駅","滝不動駅（たきふどうえき）","https://ja.wikipedia.org/wiki/滝不動駅","北緯35度44分15.8秒東経140度1分33.5秒","所在地: 千葉県船橋市南三咲三丁目23番1号北緯35度44分15.8秒東経140度1分33.5秒﻿ / ﻿北緯35.737722度 東経140.025972度﻿ / 35.737722; 140.025972座標: 北緯35度44分15.8秒東経140度1分33.5秒﻿ / ﻿北緯35.737722度 東経140.025972度﻿ / 35.737722; 140.025972;駅番号: SL16;所属事業者: 新京成電鉄;所属路線: ■新京成線;キロ程: 18.5 km（松戸起点）;駅構造: 地上駅（橋上駅）;ホーム: 相対式、2面2線;乗降人員-統計年度-: 7,496人/日-2019年-;開業年月日: 1948年（昭和23年）8月26日;1:  新京成線;2: 上り","日本の鉄道駅一覧_た","箇条書き","↑三咲駅"
"滝部駅","滝部駅（たきべえき）","https://ja.wikipedia.org/wiki/滝部駅","北緯34度17分2.56秒東経130度56分48.02秒","所在地: 山口県下関市豊北町大字滝部字森友452北緯34度17分2.56秒東経130度56分48.02秒﻿ / ﻿北緯34.2840444度 東経130.9466722度﻿ / 34.2840444; 130.9466722座標: 北緯34度17分2.56秒東経130度56分48.02秒﻿ / ﻿北緯34.2840444度 東経130.9466722度﻿ / 34.2840444; 130.9466722;所属事業者: 西日本旅客鉄道（JR西日本）;所属路線: ■山陰本線;キロ程: 635.1 km（京都起点）;電報略号: キヘ;駅構造: 地上駅;ホーム: 2面2線;乗車人員-統計年度-: 212人/日（降車客含まず）-2019年-;開業年月日: 1925年（大正14年）8月16日;備考: 簡易委託駅POS端末設置;1・2: ■山陰本線","日本の鉄道駅一覧_た","箇条書き","長門市駅- 幡生駅間における、数少ない有人駅のひとつで、朝晩には両方向へ折返し列車が設定される。かつては特急「いそかぜ」号も停車していた。"
"滝水駅","滝水駅（たきみずえき）","https://ja.wikipedia.org/wiki/滝水駅","北緯32度56分0.38秒東経131度14分34.20秒","所在地: 熊本県阿蘇市波野大字滝水北緯32度56分0.38秒東経131度14分34.20秒﻿ / ﻿北緯32.9334389度 東経131.2428333度﻿ / 32.9334389; 131.2428333;所属事業者: 九州旅客鉄道（JR九州）;所属路線: ■豊肥本線;キロ程: 78.8 km（大分起点）;電報略号: タキ;駅構造: 地上駅;ホーム: 1面1線;開業年月日: 1928年（昭和3年）12月2日;備考: 無人駅","日本の鉄道駅一覧_た","箇条書き","↑波野駅"
