"タイトル","コメント","URLアドレス","座標","詳細情報","親リスト","一覧抽出方法"
"横浜市","","https://ja.wikipedia.org/wiki/横浜市","北緯35度27分01.2秒東経139度38分03.2秒","国: 日本;地方: 関東地方;都道府県: 神奈川県;市町村コード: 14100-3;法人番号: 3000020141003;面積: 437.56km2;総人口: 3,757,630人 [編集]（推計人口、2020年9月1日）;人口密度: 8,588人/km2;隣接自治体: 川崎市藤沢市大和市横須賀市鎌倉市逗子市東京都町田市;市の木: イチョウ、ケヤキ、サザンカ、サンゴジュ、シイ、ツバキ;市の花: バラ;市の歌: 横浜市歌;市長: [編集]林文子;所在地: 〒231-0005神奈川県横浜市中区本町6丁目50番地の10北緯35度27分01.2秒東経139度38分03.2秒座標: 北緯35度27分01.2秒 東経139度38分03.2秒横浜市本庁舎外観市庁舎位置;外部リンク: 公式ウェブサイト;特記事項: 21世紀の横浜市の状況;最高気温記録 °C（°F）: 20.8(69.4);平均最高気温 °C（°F）: 9.9(49.8);日平均気温 °C（°F）: 5.9(42.6);平均最低気温 °C（°F）: 2.3(36.1);最低気温記録 °C（°F）: −8.2(17.2);降水量mm （inch）: 58.9(2.319);降雪量cm （inch）: 5(2);平均降水日数 （≥0.5 mm）: 6.0;平均降雪日数 （≥0 cm）: 3.0;% 湿度: 53;平均月間日照時間: 186.4;平均気温の推移: 平均気温の推移@media all and (max-width:720px){body.skin-minerva .mw-parser-output div.mw-graph{min-width:auto!important;max-width:100%;overflow-x:auto;overflow-y:visible}}.mw-parser-output .mw-graph-img{width:inherit;height:inherit}最高気温・最低気温・湿度の推移平均最高気温最高気温（最高値）最高気温（最低値）平均最低気温最低気温（最低値）最低気温（最高値）各階級の日数平均湿度の推移;現存する町名: 現・西区;現存しない町名カッコ内は現在の町名: 現・西区;選挙区: 鶴見区;定数: 3;選挙区: 金沢区;定数: 2;選挙区: 各区ごとの定数議員定数：86人選挙区定数選挙区定数選挙区定数鶴見区006神奈川区005西区002中区003南区005港南区005保土ケ谷区005旭区006磯子区004金沢区005港北区008緑区004青葉区007都筑区005戸塚区006栄区003泉区004瀬谷区003※2018年（平成30年）4月現在;鶴見区: 14101-1;神奈川区: 14102-0;西区: 14103-8;中区: 14104-6;南区: 14105-4;保土ケ谷区: 14106-2;磯子区: 14107-1;金沢区: 14108-9;港北区: 14109-7;戸塚区: 14110-1;港南区: 14111-9;旭区: 14112-7;緑区: 14113-5;瀬谷区: 14114-3;栄区: 14115-1;泉区: 14116-0;青葉区: 14117-8;都筑区: 14118-6;施設: 金沢文庫- 三溪園- 山下公園- 横浜中華街- 横浜外国人墓地- 横浜みなとみらい21-よこはまコスモワールド- 三井アウトレットパーク 横浜ベイサイド（旧横浜ベイサイドマリーナショップス&amp;レストランツ）- 横浜ワールドポーターズ- 横浜赤レンガ倉庫- 横浜マリンタワー- 大さん橋- 伊勢山皇大神宮- 總持寺- 横浜・八景島シーパラダイス- よこはま動物園ズーラシア- 野毛山動物園- 金沢自然公園;祭り: 野毛大道芸- みなと祭国際仮装行列 - 開港記念バザー - 横浜開港祭- フランス映画祭- 神奈川新聞花火大会- みなと祭国際花火大会 - サマーナイトフェスティバル- ヨコハマカーニバル- お三の宮例大祭 - 三蹊園観月会 - JATA国際観光会議&amp;世界旅行博 - ワールドフェスタ・ヨコハマ - 横浜オクトーバーフェスト - 横浜ジャズプロムナード- 横浜マラソン- 横浜トリエンナーレ- ヨコハマ・フットボール映画祭;芸能[注釈 15]: 横浜 7th AVENUE;東証1部上場: 日産自動車- 京浜急行電鉄- 相鉄ホールディングス- 日本発条- 芝浦メカトロニクス- クリエートメディック - JVCケンウッド（旧・日本ビクター）- 京三製作所- レイズネクスト- 宇徳- CIJ - あい ホールディングス- サカタのタネ- コロワイド- カッパ・クリエイト- 横浜冷凍- オカムラ- コナカ- 図研- ナイス- ユニプレス- フィード・ワン- ヨロズ- アネスト岩田- アマノ- パイオラックス- 古河電池- コーエーテクモホールディングス- マクニカ・富士エレ ホールディングス- アイネット- 小野測器- 富士ソフト- 日揮- 丸全昭和運輸- クリエイトエス・ディー- ファンケル- エーアンドエーマテリアル - アルプス技研- ランド- 東京エレクトロン デバイス- テクノメディカ- エバラ食品工業- トーエル- AOKIホールディングス- ココカラファイン- 日新- ブイ・テクノロジー- ソディック- ピーシーデポコーポレーション- イリソ電子工業- ハイマックス- レーザーテック;東証2部上場: ベリテ - 工藤建設 - アルプス物流- スリーエフ- 千代田化工建設- DNAチップ研究所- 東京汽船- 日本アビオニクス- ウインテスト- PALTEK- テラプローブ;JASDAQ上場: ヒップ - ASIAN STAR- タウンニュース社- 創健社- 菊水電子工業- ミナトホールディングス- ワットマン- テイン- アイエーグループ- ホテル、ニューグランド;マザーズ上場: フォーライフ;非上場等: 日本飛行機- エルナー- 劇団四季（四季株式会社）- タカナシ乳業- パナソニック モバイルコミュニケーションズ（旧・松下通信工業） - 花月園観光- 崎陽軒- 富士通ワイエフシー- 三和エナジー- 富士シティオ- 大倉陶園- グラフテック- 日立システムズエンジニアリングサービス- 日本ヒルティ- 日本農産工業- スルガコーポレーション- チップワンストップ- 東芝プラントシステム- 東京濾器- トオカツフーズ- ニューフレアテクノロジー- 横浜フリエスポーツクラブ- 横浜スポーツアンドカルチャークラブ;幼稚園: 247;認定こども園: 36;小学校: 352;中学校: 179;義務教育学校: 2;高等学校: 93;中等教育学校: 2;特別支援学校: 24;専修学校: 61;各種学校: 10;大学: 横浜国立大学東京工業大学東京芸術大学;公立: 横浜市立大学;私立: 神奈川大学関東学院大学鶴見大学桐蔭横浜大学フェリス女学院大学横浜薬科大学横浜商科大学慶應義塾大学東京都市大学明治学院大学日本体育大学横浜美術大学國學院大學洗足学園音楽大学玉川大学東洋英和女学院大学横浜創英大学;短期大学: 横浜女子短期大学鶴見大学短期大学部;演劇: 人間万事金世中（1879年）;映画: 港の日本娘（1933年）- 悲しき口笛（1949年）- 霧笛（1952年）- 俺は待ってるぜ（1957年）- 霧笛が俺を呼んでいる（1960年）- 涙を、獅子のたて髪に（1962年）- 天国と地獄（1963年）- 三大怪獣 地球最大の決戦（1964年）- 夜霧のブルース（1963年）- 月曜日のユカ（1964年）- 赤いハンカチ（1964年）- カミカゼ野郎 真昼の決斗（1966年 - ひき逃げ（1966年）- 帰らざる波止場（1966年）- 夜霧よ今夜も有り難う（1967年）- やくざ刑事（1970年）- 狼やくざ 殺しは俺がやる（1971年）- 麻薬売春Gメン（1972年）- 虹をわたって（1972年）- 正義だ!味方だ!全員集合!!（1975年）- 冬の華（1978年）- 薔薇の標的（1980年）- ヨコハマBJブルース（1981年）- 喜劇　家族同盟（1983年）- キャバレー（1986年）- あぶない刑事（1987年）- またまたあぶない刑事（1988年）- もっともあぶない刑事（1989年）- ゴジラvsモスラ（1992年）- 我が人生最悪の時（1993年）- 遥かな時代の階段を（1994年）- 居酒屋ゆうれい（1994年）- 横浜ばっくれ隊 夏の湘南純愛篇（1994年）- あぶない刑事リターンズ（1996年）- 罠（1996年）- あぶない刑事フォーエヴァー THE MOVIE（1998年）- ジャンクフード（1998年）- ゴジラ・モスラ・キングギドラ 大怪獣総攻撃（2001年）- ゴジラ×メカゴジラ（2002年）- まだまだあぶない刑事（2005年）- ヨコハマメリー（2005年）- 名探偵コナン 探偵たちの鎮魂歌（2006年）- 犯人に告ぐ（2007年）- 大決戦!超ウルトラ8兄弟（2008年）- 映画 プリキュアオールスターズDX みんなともだちっ☆奇跡の全員大集合!（2009年）- ねこタクシー（2010年）- コクリコ坂から（2011年）- 夜明けの街で（2011年）- 映画 プリキュアオールスターズNewStage みらいのともだち（2012年)- さらばあぶない刑事（2016年）- シン・ゴジラ（2016年）- 未来のミライ（2018年）;テレビドラマ: ウルトラマン（1966年）- キイハンター（1968 - 1973年）※複数話- 追跡（1973年）- 俺たちの勲章（1975年）- 大追跡（1978年）- 探偵物語※複数話（1979 - 1980年）- プロハンター（1981年）- 早春スケッチブック（1983年）- 牟田刑事官事件ファイル（1983年 - ）- あぶない刑事（1986 - 1987年）- ベイシティ刑事（1987 - 1988年）- もっとあぶない刑事（1988 - 1989年）- 法医学教室の事件ファイル（1992年 - ）- しあわせの決断(1992年)- あぶない刑事フォーエヴァー TVスペシャル'98（1998年）- おばはん刑事!流石姫子（1998 - 2003, 2006年）- Sweet Season（1998年）- あきまへんで!（1998年）- ストロベリー・オンザ・ショートケーキ（2001年）- 救急救命士・牧田さおり（2002年 - 2015年）- 私立探偵 濱マイク（2002年）- ホットマン（2003 - 2004年）- 喰いタン（2006 - 2007年）- 海猿（2005年）- 14才の母（2006年）- たったひとつの恋（2006年）- どんど晴れ（2007年）- 正義の味方（2008年）- 打撃天使ルリ（2008年）- シバトラ〜童顔刑事・柴田竹虎〜（2008年）- イノセント・ラヴ（2008年）- 相棒Season 7 第10話 ノアの方舟〜聖夜の大停電は殺人招待状!（2009年1月1日）- RESCUE〜特別高度救助隊（2009年）- 時々迷々（2009 - 2019年）- ねこタクシー（2010年）- ジョーカー 許されざる捜査官（2010年） - Piece（2012年）- ダブルフェイス (テレビドラマ)（2012年）- まれ（2015年）- 逃げるは恥だが役に立つ（2016年）- 私の家政夫ナギサさん（2020年）;アニメ: Kanon（京都アニメーション版）- 超神伝説うろつき童子- センチメンタルジャーニー- 鋼鉄天使くるみ2式- MAJOR（メジャー）- 君が主で執事が俺で- ミラクル☆ガールズ- 探偵オペラ ミルキィホームズ- 攻殻機動隊 STAND ALONE COMPLEX- プリティーリズム・オーロラドリーム-コクリコ坂から- ココロコネクト- 超速変形ジャイロゼッター- ハマトラ- デジモンセイバーズ- 少女たちは荒野を目指す- 文豪ストレイドッグス;漫画: 夜回り先生- 新世紀エヴァンゲリオン- ハチミツとクローバー- MAJOR- 夏のあらし!- 絶対少年（横浜編）- ヨコハマ買い出し紀行- スクールランブル- ケンタウロスの伝説- 疾風伝説 特攻の拓- あいしてる（守村大）- あいつとララバイ（楠みちはる）- B・B（石渡治）- 僕といっしょ（古谷実）- ミラクル☆ガールズ（秋元奈美）- 探偵オペラ ミルキィホームズ- バンビ〜ノ!SECONDO（せきやてつじ）- とっとこハム太郎- 文豪ストレイドッグス- 湾岸ミッドナイト（楠みちはる） - 吸血鬼すぐ死ぬ;ゲーム: 君が望む永遠- マブラヴ- マブラヴ サプリメント- マブラヴ オルタネイティヴ- マブラヴ ALTERED FABLE- レーシングラグーン- 電車でGO!（京浜東北線で横浜市の駅が出てくる）- 金色のコルダ(3- ときめきメモリアル3- KAIDO-峠の伝説-（ショートコースで収録、コース中に外国人墓地が出てくる）- 潮風の消える海に- 探偵 神宮寺三郎 横浜港連続殺人事件- 探偵オペラ ミルキィホームズ- 青空の見える丘- 首都高バトル01-コマンド&amp;コンカー：レッドアラート3（英語版）;文学: 田園の憂鬱（佐藤春夫）- 一房の葡萄（有島武郎）- 霧笛（大佛次郎）- 黄金伝説（石川淳）- 海の沈黙（三好徹）- 午後の曳航（三島由紀夫）- 砂の上の植物群（吉行淳之介）- マイク・ハマーへ伝言（矢作俊彦）- 横浜殺人事件（内田康夫）- 花園の迷宮（山崎洋子）- ゴールドラッシュ（柳美里）- 海を見ていたジョニー（五木寛之）- 傷痕の町（生島次郎）- 夜明けの街で（東野圭吾）- ぼくらの奇跡の七日間[115]（宗田理）;絵画: Y市の橋（松本竣介）;イベントのキャラクター: たねまる（横浜開港150周年）- toMtoM21（トムトム21、市政100周年横浜市泉区地域イベント）-ブルアちゃん（横浜博覧会）-ハマこい君（ヨコハマカーニバル）;行政機関のキャラクター: はまりん（交通局）- はまピョン（水道局）- ハマサイ（行政運営調整局・横浜市債マスコット）- とつか再開発くん（都市整備局・戸塚駅西口再開発事業）- へら星人ミーオ（資源循環局「ヨコハマはG30」）- イーオ（資源循環局「横浜3R夢!」）[117]- クリーンバード（資源循環局のシンボルマーク）- ふや星人ゴミーオ（資源循環局・中事務所）- にこりん（コールセンター）- イコットちゃん（選挙管理委員会）- イコットJr.（選挙管理委員会）- だいちゃん（環境創造局）- はま菜ちゃん（環境創造局）- エコぽん（環境創造局）- ひだまりちゃん（こども青少年局）- すくすくん（こども青少年局）- ハマくん（消防局）- みんなのアース君（地球温暖化対策事業本部地球温暖化対策課）;区でのキャラクター: ワッくん（鶴見区）- かめ太郎（神奈川区）- にしまろちゃん（西区）- スウィンギー（中区）- みなっち（南区）- こう・なん・くぅ（港南区）- かるがも隊（保土ケ谷区）- あさひくん（旭区）- てっくるちゃん（旭区・グリーンロードシンボルマーク）- いそっぴ（磯子区、磯子まつりマスコット）- ミズキー（港北区）- なしかちゃん（青葉区）- えら坊（青葉区選挙管理委員会）- ミドリン（緑区）- ウナシー（戸塚区）- ララ・ミミ・キキ（戸塚区・とつか緑と暮らそうキャンペーン）- せやまる・このは家族（瀬谷区）- いっずん（泉区）- タッチーくん（栄区、いたち川マスコット）- ぼたんちゃん（金沢区）- どぼくねこ（港北土木事務所）- あいちゃん（都筑区・地域福祉保健計画マスコット）;その他: いこあら（金沢区明るい選挙推進協議会）- ヨッチー（横浜市立大学）- キャプテンわん（横浜市スポーツ協会）- みどりちゃん（横浜市緑の協会.※ミドリ電化のミドリちゃんとは無関係）","日本の寺院一覧","参照"
"泉区 (横浜市)","","https://ja.wikipedia.org/wiki/泉区_(横浜市)","北緯35度25分4.3秒東経139度29分19.4秒","国: 日本;地方: 関東地方;都道府県: 神奈川県;市: 横浜市;市町村コード: 14116-0;面積: 23.58km2;総人口: 151,855人 [編集]（推計人口、2020年9月1日）;人口密度: 6,440人/km2;隣接自治体隣接行政区: 横浜市（戸塚区、旭区、瀬谷区）藤沢市、大和市;区の木: サクラ・キンモクセイ・ハナミズキ・アジサイ・コムラサキ・モミジ;区の花: あやめ;マスコットキャラクター: いっずん;所在地: 〒245-0016神奈川県横浜市泉区和泉中央北5丁目1-1北緯35度25分4.3秒東経139度29分19.4秒座標: 北緯35度25分4.3秒 東経139度29分19.4秒;外部リンク: 泉区役所ホームページ","日本の寺院一覧","参照"
"普済寺 (立川市)","","https://ja.wikipedia.org/wiki/普済寺_(立川市)","","所在地: 東京都立川市柴崎町4-20-46;山号: 玄武山[1];宗派: 臨済宗建長寺派;本尊: 聖観音菩薩[2];創建年: 文和年間;開山: 物外可什[2];開基: 立河宗恒;中興: 立川宮内大輔[2];文化財: 石幢（国宝・考古資料）;公式HP: 玄武山普済寺","日本の寺院一覧","参照"
"葛井寺","","https://ja.wikipedia.org/wiki/葛井寺","北緯34度34分12.67秒東経135度35分47.60秒","所在地: 大阪府藤井寺市藤井寺1-16-21;位置: 北緯34度34分12.67秒東経135度35分47.60秒座標: 北緯34度34分12.67秒 東経135度35分47.60秒;山号: 紫雲山;宗派: 真言宗御室派;本尊: 十一面千手千眼観音菩薩（国宝）;創建年: 伝・神亀2年（725年）;開山: 伝・行基;開基: 聖武天皇（勅願）;正式名: 紫雲山 葛井寺;別称: 藤井寺、剛琳寺;札所等: 西国三十三所第5番河内西国霊場特別客番神仏霊場巡拝の道第59番河内飛鳥古寺霊場第4番;文化財: 乾漆千手観音坐像（国宝）四脚門（重要文化財）;公式HP: 西国五番 葛井寺(ふじいでら)ホームページ〜大阪｜藤井寺｜厄除け｜安産祈願〜;法人番号: 8120105005016","日本の寺院一覧","参照"
"不退寺","","https://ja.wikipedia.org/wiki/不退寺","北緯34度41分41.22秒東経135度48分45.08秒","所在地: 奈良県奈良市法蓮町517;位置: 北緯34度41分41.22秒東経135度48分45.08秒座標: 北緯34度41分41.22秒 東経135度48分45.08秒;山号: 金龍山;宗派: 真言律宗;本尊: 聖観音（重要文化財）;創建年: 伝・承和12年（845年）;開基: 伝・在原業平;正式名: 金龍山 不退転法輪寺;別称: 業平寺;札所等: 大和北部八十八ヶ所霊場第18番;文化財: 本堂、木造聖観世音菩薩立像ほか（重要文化財）;法人番号: 4150005000365","日本の寺院一覧","参照"
"補陀洛山寺","","https://ja.wikipedia.org/wiki/補陀洛山寺","北緯33度38分41.01秒東経135度56分3.97秒","所在地: 和歌山県東牟婁郡那智勝浦町大字浜の宮348;位置: 北緯33度38分41.01秒東経135度56分3.97秒座標: 北緯33度38分41.01秒 東経135度56分3.97秒;山号: 熊野山;宗派: 天台宗;本尊: 三貌十一面千手千眼観音;創建年: 伝・仁徳天皇治世（4世紀）;開基: 伝・裸形上人;文化財: 木造千手観音立像（重要文化財）熊野三山（国の史跡）世界遺産;法人番号: 8170005005532","日本の寺院一覧","参照"
"佛光寺","","https://ja.wikipedia.org/wiki/佛光寺","北緯35度0分2.9秒東経135度45分43.6秒","所在地: 京都府京都市下京区高倉通仏光寺下ル新開町397番地;位置: 北緯35度0分2.9秒東経135度45分43.6秒﻿ / ﻿北緯35.000806度 東経135.762111度﻿ / 35.000806; 135.762111座標: 北緯35度0分2.9秒東経135度45分43.6秒﻿ / ﻿北緯35.000806度 東経135.762111度﻿ / 35.000806; 135.762111;山号: 渋谷山（汁谷山）;宗旨: 浄土真宗;宗派: 真宗佛光寺派;寺格: 本山;本尊: 阿弥陀如来（重要文化財）;創建年: （寺伝）建暦2年（1212年）;開基: （寺伝）親鸞;中興年: 元応2年（1320年）;中興: 了源;文化財: （重要文化財）木造聖徳太子立像紙本着色一流相承系図木造阿弥陀如来立像木造阿弥陀如来立像;公式HP: 真宗佛光寺派 本山佛光寺;法人番号: 4130005001068","日本の寺院一覧","参照"
"仏隆寺","","https://ja.wikipedia.org/wiki/仏隆寺","北緯34度30分55.1秒東経136度0分34.8秒","所在地: 奈良県宇陀市榛原赤埴1684;位置: 北緯34度30分55.1秒東経136度0分34.8秒座標: 北緯34度30分55.1秒 東経136度0分34.8秒;山号: 摩尼山;宗派: 真言宗室生寺派;本尊: 十一面観音;創建年: 伝・嘉祥3年（850年）;開基: 伝・堅恵;文化財: 石室（国の重要文化財）;法人番号: 1150005004550","日本の寺院一覧","参照"
"普門寺 (高槻市)","","https://ja.wikipedia.org/wiki/普門寺_(高槻市)","北緯34度49分49.99秒東経135度35分34.41秒","所在地: 大阪府高槻市富田町4-10-10;位置: 北緯34度49分49.99秒東経135度35分34.41秒座標: 北緯34度49分49.99秒 東経135度35分34.41秒;山号: 慈雲山;宗派: 臨済宗妙心寺派;本尊: 釈迦如来十一面千手観音菩薩;創建年: 1390年（明徳元年）;開山: 設巌;正式名: 慈雲山 普門寺;文化財: 本堂（重要文化財）庭園（国の名勝）;法人番号: 5120905002198","日本の寺院一覧","参照"
"豊楽寺","","https://ja.wikipedia.org/wiki/豊楽寺","北緯33度47分31.5秒東経133度43分37.6秒","所在地: 高知県長岡郡大豊町寺内314;位置: 北緯33度47分31.5秒東経133度43分37.6秒座標: 北緯33度47分31.5秒 東経133度43分37.6秒;山号: 太田山;宗派: 真言宗智山派;本尊: 薬師如来;創建年: 伝・724年（神亀元年）;開基: 伝・行基、聖武天皇（勅願）;正式名: 大田山 大願院 豊楽寺;別称: 柴折薬師;札所等: 日本三大薬師;文化財: 薬師堂（国宝）薬師如来坐像、薬師如来及び両脇侍像・二天王像、阿弥陀如来坐像（国の重要文化財）;法人番号: 1490005005151","日本の寺院一覧","参照"
"芬陀院","","https://ja.wikipedia.org/wiki/芬陀院","北緯34度58分34.69秒東経135度46分19.41秒","所在地: 京都府京都市東山区本町15丁目803;位置: 北緯34度58分34.69秒東経135度46分19.41秒;宗派: 臨済宗東福寺派;寺格: 東福寺塔頭;本尊: 阿弥陀如来;創建年: （伝）元亨年間（1321年～1324年）;開山: 定山祖禅;開基: 一条経通;別称: 雪舟寺;法人番号: 8130005001304","日本の寺院一覧","参照"
"不動院 (広島市)","","https://ja.wikipedia.org/wiki/不動院_(広島市)","北緯34度25分37.3秒東経132度28分16.0秒","所在地: 広島県広島市東区牛田新町3-4-9;位置: 北緯34度25分37.3秒東経132度28分16.0秒座標: 北緯34度25分37.3秒 東経132度28分16.0秒;山号: 新日山;宗派: 真言宗別格本山;本尊: 薬師如来;創建年: 平安時代（推定）;開基: 伝・空窓;正式名: 新日山 安国寺 不動院;別称: 安芸安国寺;文化財: 金堂（国宝）、鐘楼、楼門、薬師如来坐像、梵鐘（重要文化財）他;法人番号: 3240005000539","日本の寺院一覧","参照"
"不動院 (豊中市)","","https://ja.wikipedia.org/wiki/不動院_(豊中市)","北緯34度45分50.4秒東経135度28分39.8秒","所在地: 大阪府豊中市服部本町1-8-21;位置: 北緯34度45分50.4秒東経135度28分39.8秒;山号: 安楽山;宗派: 高野山真言宗;本尊: 不動明王;創建年: 大正時代末期;開基: 貞照尼;法人番号: 1120905003951","日本の寺院一覧","参照"
"節を編集: へ","","https://ja.wikipedia.org/w/index.php?title=日本の寺院一覧&amp;action=edit&amp;section=29","","","日本の寺院一覧","参照"
"平間寺","","https://ja.wikipedia.org/wiki/平間寺","北緯35度32分05.0秒東経139度43分46.0秒","所在地: 神奈川県川崎市川崎区大師町4-48;位置: 北緯35度32分05.0秒東経139度43分46.0秒座標: 北緯35度32分05.0秒 東経139度43分46.0秒;山号: 金剛山[1];院号: 金乗院[1];宗旨: 新義真言宗;宗派: 真言宗智山派;寺格: 大本山;本尊: 弘法大師;創建年: 1128年（大治3年）;開山: 尊賢[1];開基: 平間兼乗;正式名: 金剛山金乗院平間寺[2];別称: 厄除弘法大師または川崎大師[2];札所等: 関東八十八箇所特別霊場関東三十六不動7番新四国東国八十八箇所1番武相不動尊1番京浜四大本山;法人番号: 6020005007454","日本の寺院一覧","参照"
"川崎大師","","https://ja.wikipedia.org/wiki/川崎大師","北緯35度32分05.0秒東経139度43分46.0秒","所在地: 神奈川県川崎市川崎区大師町4-48;位置: 北緯35度32分05.0秒東経139度43分46.0秒座標: 北緯35度32分05.0秒 東経139度43分46.0秒;山号: 金剛山[1];院号: 金乗院[1];宗旨: 新義真言宗;宗派: 真言宗智山派;寺格: 大本山;本尊: 弘法大師;創建年: 1128年（大治3年）;開山: 尊賢[1];開基: 平間兼乗;正式名: 金剛山金乗院平間寺[2];別称: 厄除弘法大師または川崎大師[2];札所等: 関東八十八箇所特別霊場関東三十六不動7番新四国東国八十八箇所1番武相不動尊1番京浜四大本山;法人番号: 6020005007454","日本の寺院一覧","参照"
