"タイトル","コメント","URLアドレス","座標","詳細情報","親リスト","一覧抽出方法","前文"
"白石駅 (熊本県)","白石駅 (熊本県)（しろいしえき・九州旅客鉄道肥薩線）","https://ja.wikipedia.org/wiki/白石駅_(熊本県)","北緯32度18分20.72秒東経130度36分30.33秒","所在地: 熊本県葦北郡芦北町大字白石834北緯32度18分20.72秒東経130度36分30.33秒﻿ / ﻿北緯32.3057556度 東経130.6084250度﻿ / 32.3057556; 130.6084250﻿ (白石駅);所属事業者: 九州旅客鉄道（JR九州）;所属路線: 肥薩線;キロ程: 29.8 km（八代起点）;電報略号: シロ;駅構造: 地上駅;ホーム: 2面2線;開業年月日: 1908年（明治41年）6月1日;備考: 無人駅;1: ■肥薩線;2: 上り","日本の鉄道駅一覧_しや-しん","箇条書き","相対式ホーム2面2線を有する地上駅。中央に通過線がある。互いのホームは構内踏切で連絡している。かつては有人駅で一部の急行列車が停車していた。"
"白石蔵王駅","白石蔵王駅（しろいしざおうえき）","https://ja.wikipedia.org/wiki/白石蔵王駅","北緯37度59分43.96秒東経140度37分59.11秒","所在地: 宮城県白石市大鷹沢三沢字桜田11-1北緯37度59分43.96秒東経140度37分59.11秒﻿ / ﻿北緯37.9955444度 東経140.6330861度﻿ / 37.9955444; 140.6330861座標: 北緯37度59分43.96秒東経140度37分59.11秒﻿ / ﻿北緯37.9955444度 東経140.6330861度﻿ / 37.9955444; 140.6330861;所属事業者: 東日本旅客鉄道（JR東日本）;所属路線: 東北新幹線;キロ程: 306.8 km（東京起点）;電報略号: シサ;駅構造: 高架駅;ホーム: 2面3線;乗車人員-統計年度-: 537人/日（降車客含まず）-2020年-;開業年月日: 1982年（昭和57年）6月23日;備考: 直営駅（管理駅）みどりの窓口有;1:  東北新幹線;2: 上り;3: （臨時ホーム）","日本の鉄道駅一覧_しや-しん","箇条書き","当駅は東北新幹線（大宮駅- 盛岡駅）暫定開業に合わせて新設された駅であり、1982年（昭和57年）6月23日に開業した。"
"四郎ケ原駅","四郎ケ原駅（しろうがはらえき）","https://ja.wikipedia.org/wiki/四郎ケ原駅","北緯34度8分14.38秒東経131度9分39.86秒","所属事業者: 西日本旅客鉄道（JR西日本）;所属路線: ■美祢線;キロ程: 13.2 km（厚狭起点）;電報略号: シロ;駅構造: 地上駅;ホーム: 2面2線;乗車人員-統計年度-: 6人/日（降車客含まず）-2019年-;開業年月日: 1905年（明治38年）9月13日;備考: 無人駅;駅舎側: ■美祢線;反対側: ■美祢線","日本の鉄道駅一覧_しや-しん","箇条書き","相対式ホーム2面2線で、交換設備を有する地上駅。分岐は片開きであるが、場内・出発信号機は片方向のみの対応であり、一線スルーではない。"
"白兎駅","白兎駅（しろうさぎえき）","https://ja.wikipedia.org/wiki/白兎駅","北緯38度9分0.92秒東経140度2分27.94秒","所在地: 山形県長井市白兎北緯38度9分0.92秒東経140度2分27.94秒﻿ / ﻿北緯38.1502556度 東経140.0410944度﻿ / 38.1502556; 140.0410944座標: 北緯38度9分0.92秒東経140度2分27.94秒﻿ / ﻿北緯38.1502556度 東経140.0410944度﻿ / 38.1502556; 140.0410944;所属事業者: 山形鉄道;所属路線: フラワー長井線;キロ程: 23.2 km（赤湯起点）;駅構造: 地上駅;ホーム: 1面1線;乗車人員-統計年度-: 15人/日（降車客含まず）-2017年-;開業年月日: 1989年（平成元年）12月16日;備考: 無人駅","日本の鉄道駅一覧_しや-しん","箇条書き","単式ホーム1面1線の地上駅。ホーム上に待合室がある。"
"次郎丸駅","次郎丸駅（じろうまるえき）","https://ja.wikipedia.org/wiki/次郎丸駅","北緯33度33分9.82秒東経130度19分46.36秒","所在地: 福岡市早良区次郎丸一丁目北緯33度33分9.82秒東経130度19分46.36秒﻿ / ﻿北緯33.5527278度 東経130.3295444度﻿ / 33.5527278; 130.3295444﻿ (次郎丸駅)座標: 北緯33度33分9.82秒東経130度19分46.36秒﻿ / ﻿北緯33.5527278度 東経130.3295444度﻿ / 33.5527278; 130.3295444﻿ (次郎丸駅);駅番号: ○N02;所属事業者: 福岡市交通局;所属路線: 地下鉄七隈線;キロ程: 1.0 km（橋本起点）;駅構造: 地下駅;ホーム: 1面2線;乗車人員-統計年度-: 3,181人/日（降車客含まず）-2019年-;開業年月日: 2005年（平成17年）2月3日;備考: 業務委託駅","日本の鉄道駅一覧_しや-しん","箇条書き",""
"治良門橋駅","治良門橋駅（じろえんばしえき）","https://ja.wikipedia.org/wiki/治良門橋駅","北緯36度19分58.77秒東経139度20分28.1秒","所在地: 群馬県太田市成塚町1024北緯36度19分58.77秒東経139度20分28.1秒﻿ / ﻿北緯36.3329917度 東経139.341139度﻿ / 36.3329917; 139.341139﻿ (治良門橋駅)座標: 北緯36度19分58.77秒東経139度20分28.1秒﻿ / ﻿北緯36.3329917度 東経139.341139度﻿ / 36.3329917; 139.341139﻿ (治良門橋駅);駅番号: TI52;所属事業者: 東武鉄道;所属路線: ■桐生線;キロ程: 5.9 km（太田起点）;電報略号: ジロ;駅構造: 地上駅;ホーム: 2面2線;乗降人員-統計年度-: 398人/日-2020年-;開業年月日: 1913年（大正2年）3月19日;1:  桐生線;2: 上り","日本の鉄道駅一覧_しや-しん","箇条書き","相対式ホーム2面2線を有する地上駅。駅舎は赤城方面ホーム側にあり、太田方面ホームとは跨線橋により連絡している。"
"白銀駅","白銀駅（しろがねえき）","https://ja.wikipedia.org/wiki/白銀駅","北緯40度31分19.38秒東経141度32分31.02秒","所在地: 青森県八戸市大字白銀町字大沢片平北緯40度31分19.38秒東経141度32分31.02秒﻿ / ﻿北緯40.5220500度 東経141.5419500度﻿ / 40.5220500; 141.5419500座標: 北緯40度31分19.38秒東経141度32分31.02秒﻿ / ﻿北緯40.5220500度 東経141.5419500度﻿ / 40.5220500; 141.5419500;所属事業者: 東日本旅客鉄道（JR東日本）;所属路線: ■八戸線;キロ程: 10.3 km（八戸起点）;電報略号: シカ;駅構造: 地上駅;ホーム: 1面1線;乗車人員-統計年度-: 779人/日（降車客含まず）-2004年-;開業年月日: 1934年（昭和9年）6月1日;備考: 無人駅（自動券売機 有）","日本の鉄道駅一覧_しや-しん","箇条書き","単式ホーム1面1線を有する地上駅。2005年まではPOS端末（白銀451）が設置され、鮫駅より駅員が派遣されていた。現在は八戸駅管理の無人駅となり、便所は撤去され、簡易自動券売機が設置されているのみである。"
"白金台駅","白金台駅（しろかねだいえき）","https://ja.wikipedia.org/wiki/白金台駅","北緯35度38分16.4秒東経139度43分34秒","所在地: 東京都港区白金台四丁目5-10北緯35度38分16.4秒東経139度43分34秒﻿ / ﻿北緯35.637889度 東経139.72611度﻿ / 35.637889; 139.72611座標: 北緯35度38分16.4秒東経139度43分34秒﻿ / ﻿北緯35.637889度 東経139.72611度﻿ / 35.637889; 139.72611;所属事業者: 東京地下鉄（東京メトロ）東京都交通局（都営地下鉄）;電報略号: カネ（東京メトロ）金（東京都交通局、駅名略称）;駅構造: 地下駅;ホーム: 2面2線（共用）;乗降人員-統計年度-: （東京メトロ）-2020年-11,311*人/日（東京都交通局）-2019年-10,663人/日;開業年月日: 2000年（平成12年）9月26日;所属路線: ●東京メトロ南北線**;駅番号: N02;キロ程: 1.3 km（目黒起点）;所属路線: ●都営地下鉄三田線**;駅番号: I02;キロ程: 1.3 km（目黒起点）;備考: 共同使用駅（東京メトロの管轄駅）直営駅;1:  南北線;2:  南北線 都営三田線","日本の鉄道駅一覧_しや-しん","箇条書き","東京メトロの南北線と、都営地下鉄の三田線の重複区間に位置する駅で、両路線の列車が乗り入れている。両社局の共同使用駅であり、駅業務は東京メトロが行っている。駅番号は南北線がN 02、三田線がI 02である。"
"白金高輪駅","白金高輪駅（しろかねたかなわえき）","https://ja.wikipedia.org/wiki/白金高輪駅","北緯35度38分34.4秒東経139度44分2.9秒","所在地: 東京都港区高輪一丁目3-20北緯35度38分34.4秒東経139度44分2.9秒﻿ / ﻿北緯35.642889度 東経139.734139度﻿ / 35.642889; 139.734139座標: 北緯35度38分34.4秒東経139度44分2.9秒﻿ / ﻿北緯35.642889度 東経139.734139度﻿ / 35.642889; 139.734139;所属事業者: 東京地下鉄（東京メトロ）東京都交通局（都営地下鉄）;電報略号: シタ（東京メトロ）白高（東京都交通局、駅名略称）;駅構造: 地下駅;ホーム: 2面4線（共用）;乗降人員-統計年度-: （東京メトロ）-2020年-27,250*人/日（東京都交通局）-2019年-28,223人/日;開業年月日: 2000年（平成12年）9月26日;所属路線: ●東京メトロ南北線**;駅番号: N03;キロ程: 2.3 km（目黒起点）;所属路線: ●都営地下鉄三田線**;駅番号: I03;キロ程: 2.3 km（目黒起点）;備考: 共同使用駅（東京メトロの管轄駅）直営駅;1:  都営三田線;2:  南北線;3: 目黒・日吉方面;4:  都営三田線;1:  都営三田線;2:  南北線;3: エメラルド・グリーン;4:  都営三田線","日本の鉄道駅一覧_しや-しん","箇条書き","東京メトロ南北線と、都営地下鉄三田線が乗り入れている。改札は共用となっており、東京メトロと東京都交通局の共同使用駅である（東京メトロの管轄）。なお、当駅から目黒駅までの間は南北線・三田線の重複（共用）区間であり、この区間は東京メトロが第一種鉄道事業者、東京都交通局が第二種鉄道事業者となっている。"
"城北公園通駅","城北公園通駅（しろきたこうえんどおりえき）","https://ja.wikipedia.org/wiki/城北公園通駅","北緯34度43分24.5秒東経135度31分50.5秒","所在地: 大阪市旭区赤川一丁目1-3北緯34度43分24.5秒東経135度31分50.5秒﻿ / ﻿北緯34.723472度 東経135.530694度﻿ / 34.723472; 135.530694﻿ (城北公園通駅)座標: 北緯34度43分24.5秒東経135度31分50.5秒﻿ / ﻿北緯34.723472度 東経135.530694度﻿ / 34.723472; 135.530694﻿ (城北公園通駅);駅番号: JR-F05;所属事業者: 西日本旅客鉄道（JR西日本）（大阪外環状鉄道）;所属路線: Fおおさか東線;キロ程: 5.4 km（新大阪起点）;電報略号: ミヤ;駅構造: 高架駅;ホーム: 2面2線;乗車人員-統計年度-: 4,079人/日（降車客含まず）-2019年-;開業年月日: 2019年（平成31年）3月16日;備考: 業務委託駅みどりの券売機設置駅大阪市内駅;1: Fおおさか東線;2: 放出・久宝寺方面","日本の鉄道駅一覧_しや-しん","箇条書き","建設中の仮称は「都島駅」であったが、大阪市営地下鉄（現：Osaka Metro）谷町線の都島駅とは1.6 kmも離れており、地元住民から「都島駅に決定したら乗客の混乱をきたす可能性がある」との指摘の声が上がっていた。2016年（平成28年）12月6日、旭区役所や同区内の地域団体会長らで構成される「旭区おおさか東線新駅名称期成会」の決起集会が旭区の区民センターで開催され、新駅名を「城北公園通」とする決議案を採択した。期成会は1か月かけ区民から約1万7800人分の署名を集め、2017年（平成29年）1月31日、JR西日本大阪支社に要望書と共に提出した。一方、駅西側の都島区は同区毛馬町が与謝蕪村の生誕地であることから「蕪村」が付いた駅名を希望していた。"
"白久駅","白久駅（しろくえき）","https://ja.wikipedia.org/wiki/白久駅","北緯35度57分31.88秒東経138度59分35.94秒","所在地: 埼玉県秩父市荒川白久字原524-8北緯35度57分31.88秒東経138度59分35.94秒﻿ / ﻿北緯35.9588556度 東経138.9933167度﻿ / 35.9588556; 138.9933167座標: 北緯35度57分31.88秒東経138度59分35.94秒﻿ / ﻿北緯35.9588556度 東経138.9933167度﻿ / 35.9588556; 138.9933167;所属事業者: 秩父鉄道;所属路線: ■秩父本線;キロ程: 70.4 km（羽生起点）;電報略号: シロ;駅構造: 地上駅;ホーム: 1面1線;乗車人員-統計年度-: 54人/日（降車客含まず）-2019年-;乗降人員-統計年度-: 118人/日-2019年-;開業年月日: 1930年（昭和5年）3月15日","日本の鉄道駅一覧_しや-しん","箇条書き","単式ホーム1面1線を有する地上駅。業務委託駅である。（管理駅：三峰口駅）"
"白子駅","白子駅（しろこえき）","https://ja.wikipedia.org/wiki/白子駅","北緯34度50分2.49秒東経136度35分22.5秒","所在地: 三重県鈴鹿市白子駅前22-1北緯34度50分2.49秒東経136度35分22.5秒﻿ / ﻿北緯34.8340250度 東経136.589583度﻿ / 34.8340250; 136.589583座標: 北緯34度50分2.49秒東経136度35分22.5秒﻿ / ﻿北緯34.8340250度 東経136.589583度﻿ / 34.8340250; 136.589583;駅番号:  E31;所属事業者: 近畿日本鉄道(近鉄);所属路線: E名古屋線;キロ程: 25.9 km（伊勢中川起点）;電報略号: シロ;駅構造: 地上駅（橋上駅）;ホーム: 2面4線;乗車人員-統計年度-: 8,366人/日（降車客含まず）-2019年-;開業年月日: 1915年（大正4年）9月10日;備考: * 正式な起点は伊勢中川駅;1・2: E名古屋線;3・4: 上り;合 計: 通勤定期;1950年（昭和25年）: 771,900;1951年（昭和26年）: 863,490;1952年（昭和27年）: 807,210;1953年（昭和28年）: 835,890;1954年（昭和29年）: 833,130;1955年（昭和30年）: 892,800;1956年（昭和31年）: 984,660;1957年（昭和32年）: 1,016,250;1958年（昭和33年）: 1,064,280;1959年（昭和34年）: 1,157,100;1960年（昭和35年）: 1,293,570;1961年（昭和36年）: 1,420,260;1962年（昭和37年）: 1,689,600;1963年（昭和38年）: 1,751,250;1964年（昭和39年）: 1,908,840;1965年（昭和40年）: 1,944,300;1966年（昭和41年）: 1,980,330;1967年（昭和42年）: 1,992,960;1968年（昭和43年）: 2,016,810;1969年（昭和44年）: 2,042,250;1970年（昭和45年）: 2,106,000;1971年（昭和46年）: 2,038,020;1972年（昭和47年）: 2,050,440;1973年（昭和48年）: 2,011,500;1974年（昭和49年）: 2,254,200;1975年（昭和50年）: 2,281,560;1976年（昭和51年）: 2,154,750;1977年（昭和52年）: 2,136,810;1978年（昭和53年）: 2,154,660;1979年（昭和54年）: 2,131,140;1980年（昭和55年）: 2,140,470;1981年（昭和56年）: 2,124,660;1982年（昭和57年）: 2,065,050;1983年（昭和58年）: 2,043,990;1984年（昭和59年）: 1,970,010;1985年（昭和60年）: 1,964,550;1986年（昭和61年）: 1,987,980;1987年（昭和62年）: 1,977,180;1988年（昭和63年）: 1,988,910;1989年（平成元年）: 2,029,380;1990年（平成2年）: 2,078,280;1991年（平成3年）: 2,112,690;1992年（平成4年）: 2,096,100;1993年（平成5年）: 2,114,940;1994年（平成6年）: 2,092,860;1995年（平成7年）: 2,082,600;1996年（平成8年）: 1,959,690;1997年（平成9年）: 1,770,840;1998年（平成10年）: 1,715,490;1999年（平成11年）: 1,676,250;2000年（平成12年）: 1,675,170;2001年（平成13年）: 1,630,050;2002年（平成14年）: 1,611,660;2003年（平成15年）: 1,608,540;2004年（平成16年）: 1,604,520;2005年（平成17年）: 1,603,560;2006年（平成18年）: 1,624,320;2007年（平成19年）: 1,619,490;2008年（平成20年）: 1,633,830;2009年（平成21年）: 1,626,930;2010年（平成22年）: 1,663,410;2011年（平成23年）: 1,701,360;2012年（平成24年）: 1,706,550;2013年（平成25年）: 1,797,990","日本の鉄道駅一覧_しや-しん","箇条書き","鈴鹿市南東部に位置し、中心市街地のひとつである白子地区の中心駅である。当駅は市内で最も利用客の多い駅だが、名古屋線が市役所のある神戸地区を避けて通っているため、『鈴鹿市』の名は市役所最寄り駅の近鉄鈴鹿線・鈴鹿市駅に譲った形となっている。市内の近鉄の駅では唯一の特急停車駅である。"
"城下駅","城下駅（しろしたえき・上田電鉄別所線）","https://ja.wikipedia.org/wiki/城下駅","北緯36度23分33.13秒東経138度14分33.36秒","所在地: 長野県上田市諏訪形字中田982北緯36度23分33.13秒東経138度14分33.36秒﻿ / ﻿北緯36.3925361度 東経138.2426000度﻿ / 36.3925361; 138.2426000座標: 北緯36度23分33.13秒東経138度14分33.36秒﻿ / ﻿北緯36.3925361度 東経138.2426000度﻿ / 36.3925361; 138.2426000;駅番号: BE02;所属事業者: 上田電鉄;所属路線: 別所線;キロ程: 0.8 km（上田起点）;駅構造: 地上駅;ホーム: 相対式2面2線;乗車人員-統計年度-: 15人/日（降車客含まず）-2017年-;開業年月日: 1921年（大正10年）6月17日;備考: 無人駅;南側: ■別所線;北側: ■別所線","日本の鉄道駅一覧_しや-しん","箇条書き","相対式ホーム2面2線を有する地上駅。各ホームの中ほどに上田駅側へ伸びる緩やかな階段の出入口があり、各ホームは出入り口付近にある構内踏切で接続されている。この構内踏切は警報器および遮断機が無いため、横断の際には左右の厳重な確認が必要となる。"
"城下停留場","城下停留場（しろしたていりゅうじょう・岡山電気軌道東山本線）","https://ja.wikipedia.org/wiki/城下停留場","北緯34度39分56.29秒東経133度55分47.36秒","所在地: 岡山市北区天神町・表町一丁目北緯34度39分56.29秒東経133度55分47.36秒﻿ / ﻿北緯34.6656361度 東経133.9298222度﻿ / 34.6656361; 133.9298222﻿ (城下停留場 *)座標: 北緯34度39分56.29秒東経133度55分47.36秒﻿ / ﻿北緯34.6656361度 東経133.9298222度﻿ / 34.6656361; 133.9298222﻿ (城下停留場 *);駅番号: ○H04;所属事業者: 岡山電気軌道;所属路線: ■東山本線（1系統）;キロ程: 0.9 km（岡山駅前起点）;駅構造: 地上駅;ホーム: 1面2線;乗降人員-統計年度-: 2,238人/日-2019年-;開業年月日: 1912年（明治45年）5月5日;南行: ■001;北行: ■018;南行: ■001;西行: ■;東行: ■","日本の鉄道駅一覧_しや-しん","箇条書き","島式ホーム1面2線。東山方に地下へ降りる階段があり、交差点の真下は「しろちか」という地下広場となっている。この地下広場は当停留場の目の前にある岡山シンフォニーホールに直結している他、後楽園、県立美術館方面に交差点を介さず行くことが可能である。"
"白鳥高原駅","白鳥高原駅（しろとりこうげんえき）","https://ja.wikipedia.org/wiki/白鳥高原駅","北緯35度54分47.51秒東経136度50分32.58秒","所在地: 岐阜県郡上市白鳥町二日町字清水垣内北緯35度54分47.51秒東経136度50分32.58秒﻿ / ﻿北緯35.9131972度 東経136.8423833度﻿ / 35.9131972; 136.8423833座標: 北緯35度54分47.51秒東経136度50分32.58秒﻿ / ﻿北緯35.9131972度 東経136.8423833度﻿ / 35.9131972; 136.8423833;駅番号: 35;所属事業者: 長良川鉄道;所属路線: 越美南線;キロ程: 69.6 km（美濃太田起点）;電報略号: コウフツカマチ（転換前）;駅構造: 地上駅;ホーム: 1面1線;乗車人員-統計年度-: 5人/日（降車客含まず）-2015年-;開業年月日: 1955年8月1日;備考: 無人駅","日本の鉄道駅一覧_しや-しん","箇条書き","単式ホーム1面1線の地上駅である。ホーム中央に数人が入れる待合室がある。"
"城西駅","城西駅（しろにしえき）","https://ja.wikipedia.org/wiki/城西駅","北緯35度7分54.63秒東経137度51分43.40秒","所在地: 浜松市天竜区佐久間町相月2105北緯35度7分54.63秒東経137度51分43.40秒﻿ / ﻿北緯35.1318417度 東経137.8620556度﻿ / 35.1318417; 137.8620556座標: 北緯35度7分54.63秒東経137度51分43.40秒﻿ / ﻿北緯35.1318417度 東経137.8620556度﻿ / 35.1318417; 137.8620556;所属事業者: 東海旅客鉄道（JR東海）;所属路線: CD飯田線;キロ程: 70.5 km（豊橋起点）;電報略号: ロシ;駅構造: 地上駅;ホーム: 1面1線;乗車人員-統計年度-: 15人/日（降車客含まず）-2019年-;開業年月日: 1955年（昭和30年）11月11日;備考: 駅員無配置駅","日本の鉄道駅一覧_しや-しん","箇条書き","単式ホーム1面1線を有する地上駅。かつては島式ホーム1面2線と側線を有していたが、2008年（平成20年）1月に1線に減らされた。"
"白丸駅 (東京都)","白丸駅（しろまるえき）","https://ja.wikipedia.org/wiki/白丸駅_(東京都)","北緯35度48分42.8秒東経139度6分53.2秒","所在地: 東京都西多摩郡奥多摩町白丸62北緯35度48分42.8秒東経139度6分53.2秒﻿ / ﻿北緯35.811889度 東経139.114778度﻿ / 35.811889; 139.114778座標: 北緯35度48分42.8秒東経139度6分53.2秒﻿ / ﻿北緯35.811889度 東経139.114778度﻿ / 35.811889; 139.114778;駅番号: JC73;所属事業者: 東日本旅客鉄道（JR東日本）;所属路線: ■青梅線（東京アドベンチャーライン）;キロ程: 35.2 km（立川起点）;電報略号: シロ;駅構造: 地上駅;ホーム: 1面1線;乗車人員-統計年度-: 74人/日（降車客含まず）-2010年-;開業年月日: 1944年（昭和19年）7月1日;備考: 無人駅（乗車駅証明書発行機有）","日本の鉄道駅一覧_しや-しん","箇条書き","単式ホーム1面1線を有する地上駅。ホーム立川方に駅舎があり、乗車駅証明書発行機が設置されている。2010年（平成22年）11月より、待合室の建て替え工事が行われ、2011年（平成23年）2月14日に膜構造の屋根を取り入れた新しい待合室が供用開始された。駅前の踏切を渡ったところに郵便ポストが設置されており、ホームの奥多摩寄りには、奥多摩町が管理する公衆便所がある。駅のすぐ脇に踏切があり、両端はトンネルではさまれている。青梅駅管理の無人駅で簡易Suica改札機が設置されている。"
"城見ヶ丘駅","城見ヶ丘駅（しろみがおかえき）","https://ja.wikipedia.org/wiki/城見ヶ丘駅","北緯35度17分30.0秒東経140度15分9.4秒","所在地: 千葉県夷隅郡大多喜町船子681-3北緯35度17分30.0秒東経140度15分9.4秒﻿ / ﻿北緯35.291667度 東経140.252611度﻿ / 35.291667; 140.252611座標: 北緯35度17分30.0秒東経140度15分9.4秒﻿ / ﻿北緯35.291667度 東経140.252611度﻿ / 35.291667; 140.252611;所属事業者: いすみ鉄道;所属路線: ■いすみ線;キロ程: 14.7 km（大原起点）;電報略号: シロ;駅構造: 地上駅;ホーム: 1面1線;乗車人員-統計年度-: 30人/日（降車客含まず）-2018年-;開業年月日: 2008年（平成20年）8月9日;備考: 無人駅","日本の鉄道駅一覧_しや-しん","箇条書き","大型商業施設おおたきショッピングプラザ オリブ（1997年（平成9年）10月7日開業）に近いことからオリブ前という副駅名が付与されていた。その後、大多喜ハーブガーデンが命名権（ネーミングライツ）を取得しており、大多喜ハーブガーデンを冠した愛称としている。"
"志和口駅","志和口駅（しわぐちえき）","https://ja.wikipedia.org/wiki/志和口駅","北緯34度33分16.81秒東経132度39分28.94秒","所在地: 広島市安佐北区白木町大字市川2193-2北緯34度33分16.81秒東経132度39分28.94秒﻿ / ﻿北緯34.5546694度 東経132.6580389度﻿ / 34.5546694; 132.6580389座標: 北緯34度33分16.81秒東経132度39分28.94秒﻿ / ﻿北緯34.5546694度 東経132.6580389度﻿ / 34.5546694; 132.6580389;所属事業者: 西日本旅客鉄道（JR西日本）;所属路線: P芸備線;キロ程: 126.0km（備中神代起点）三次から35.7 km;電報略号: シク;駅構造: 地上駅;ホーム: 1面2線;乗車人員-統計年度-: 243人/日（降車客含まず）-2019年-;開業年月日: 1925年（大正14年）11月1日;備考: 無人駅（自動券売機 有）広島市内駅;1: P芸備線;2: 下り","日本の鉄道駅一覧_しや-しん","箇条書き","旧白木町の中心、旧市川村・旧秋越村の境界に位置する。駅名の「志和」は、近接の東広島市志和町が由来。当初、市川村が駅を現在より北側の自村内に設置すること、駅名を「市川」にするよう強く求めた。しかし、前者は地形上の理由で、後者は既に市川駅があったことからかなわず、村同士で協議した結果、「志和口駅」になった。"
