"タイトル","コメント","URLアドレス","座標","詳細情報","親リスト","一覧抽出方法","前文"
"棚方駅","棚方駅（たながたえき）","https://ja.wikipedia.org/wiki/棚方駅","北緯33度12分7.28秒東経129度39分7.01秒","所在地: 長崎県佐世保市棚方町北緯33度12分7.28秒東経129度39分7.01秒﻿ / ﻿北緯33.2020222度 東経129.6519472度﻿ / 33.2020222; 129.6519472;所属事業者: 松浦鉄道;所属路線: ■西九州線;キロ程: 78.3 km（有田起点）;駅構造: 地上駅;ホーム: 1面1線;乗降人員-統計年度-: 195人/日-2019年-;開業年月日: 1989年（平成元年）3月11日","日本の鉄道駅一覧_た","箇条書き","単式1面1線のホームの地上駅である。無人駅で駅舎は無いが、待合室がある。"
"多奈川駅","多奈川駅（たながわえき）","https://ja.wikipedia.org/wiki/多奈川駅","北緯34度18分59.83秒東経135度8分12.04秒","所在地: 大阪府泉南郡岬町多奈川谷川2290番地北緯34度18分59.83秒東経135度8分12.04秒﻿ / ﻿北緯34.3166194度 東経135.1366778度﻿ / 34.3166194; 135.1366778座標: 北緯34度18分59.83秒東経135度8分12.04秒﻿ / ﻿北緯34.3166194度 東経135.1366778度﻿ / 34.3166194; 135.1366778;駅番号: NK 41-3;所属事業者: 南海電気鉄道;所属路線: ■多奈川線;キロ程: 2.6 km（みさき公園起点）;電報略号: タナ;駅構造: 地上駅;ホーム: 2面1線*;乗降人員-統計年次-: 602人/日-2019年-;開業年月日: 1944年（昭和19年）6月1日;備考: *現在は1面1線のみ使用","日本の鉄道駅一覧_た","箇条書き","大阪府内で最も西に位置する駅である。"
"棚倉駅","棚倉駅（たなくらえき）","https://ja.wikipedia.org/wiki/棚倉駅","北緯34度46分28.95秒東経135度48分58.26秒","所在地: 京都府木津川市山城町平尾里屋敷北緯34度46分28.95秒東経135度48分58.26秒﻿ / ﻿北緯34.7747083度 東経135.8161833度﻿ / 34.7747083; 135.8161833座標: 北緯34度46分28.95秒東経135度48分58.26秒﻿ / ﻿北緯34.7747083度 東経135.8161833度﻿ / 34.7747083; 135.8161833;駅番号: JR-D17;所属事業者: 西日本旅客鉄道（JR西日本）;所属路線: D奈良線;キロ程: 4.4 km（木津起点）;電報略号: タナ;駅構造: 地上駅;ホーム: 2面2線;乗車人員-統計年度-: 552人/日（降車客含まず）-2019年-;開業年月日: 1896年（明治29年）3月13日;備考: 簡易委託駅;1: D奈良線;2: 上下","日本の鉄道駅一覧_た","箇条書き","相対式ホーム2面2線を持つ行違い可能な地上駅である。駅本屋側ホームが2番のりば（下り）、跨線橋を渡って反対側のホームが1番のりば（上り）である。2018年10月27日まで行き先別にホームが分けられていたが、10月28日以降は2番のりばを上下本線とした一線スルー配線となった。みやこ路快速および快速は、多くが当駅で行違いをするため、上り列車が運転停車を行う（2018年10月現在）。"
"田無駅","田無駅（たなしえき）","https://ja.wikipedia.org/wiki/田無駅","北緯35度43分38.5秒東経139度32分21.3秒","所在地: 東京都西東京市田無町四丁目1-1北緯35度43分38.5秒東経139度32分21.3秒﻿ / ﻿北緯35.727361度 東経139.539250度﻿ / 35.727361; 139.539250﻿ (田無駅)座標: 北緯35度43分38.5秒東経139度32分21.3秒﻿ / ﻿北緯35.727361度 東経139.539250度﻿ / 35.727361; 139.539250﻿ (田無駅);駅番号: SS17;所属事業者: 西武鉄道;所属路線: ■新宿線;キロ程: 17.6 km（西武新宿起点）;駅構造: 地上駅（橋上駅）;ホーム: 2面3線;乗降人員-統計年度-: 75,418人/日-2019年-;開業年月日: 1927年（昭和2年）4月16日;備考: ホーム有効長は10両編成分。;1・2:  新宿線;3・4: 下り","日本の鉄道駅一覧_た","箇条書き","1962年（昭和37年）に建てられた旧駅舎が老朽化したため、田無駅北口再開発計画にあわせ、1996年（平成8年）に解体した。新駅舎を建設するため、仮駅舎（現・りそな銀行の場所）での営業を開始した後、新駅舎は1999年（平成11年）3月に完成した。同年3月23日から使用を開始し、旧駅舎時代から要望が多かったバリアフリー設備としてエレベーター・エスカレーターを設置している。"
"田辺駅","田辺駅（たなべえき）","https://ja.wikipedia.org/wiki/田辺駅","北緯34度37分41.57秒東経135度31分31.85秒","所在地: 大阪市東住吉区田辺一丁目4-4北緯34度37分41.57秒東経135度31分31.85秒﻿ / ﻿北緯34.6282139度 東経135.5255139度﻿ / 34.6282139; 135.5255139﻿ (田辺駅);駅番号:  T30;所属事業者: 大阪市高速電気軌道(Osaka Metro);所属路線: ●谷町線;キロ程: 20.5 km（大日起点）;駅構造: 地下駅;ホーム: 1面2線;乗車人員-統計年度-: 4,453人/日（降車客含まず）-2020年-;乗降人員-統計年度-: 8,729人/日-2020年-;開業年月日: 1980年（昭和55年）11月27日;1:  谷町線;2: 天王寺・東梅田・大日方面","日本の鉄道駅一覧_た","箇条書き","旧南海平野線田辺停留場の代替駅（代替なく廃止された股ヶ池停留場の替わりもある程度果たしていると考えられる）。"
"田並駅","田並駅（たなみえき）","https://ja.wikipedia.org/wiki/田並駅","北緯33度29分16.66秒東経135度43分7.89秒","所在地: 和歌山県東牟婁郡串本町田並1550北緯33度29分16.66秒東経135度43分7.89秒﻿ / ﻿北緯33.4879611度 東経135.7188583度﻿ / 33.4879611; 135.7188583;所属事業者: 西日本旅客鉄道（JR西日本）;所属路線: W紀勢本線（きのくに線）;キロ程: 229.4km（亀山起点）新宮から49.2 km;電報略号: タミ;駅構造: 地上駅;ホーム: 1面2線;乗車人員-統計年度-: 7人/日（降車客含まず）-2019年-;開業年月日: 1940年（昭和15年）8月8日;備考: 無人駅;1: Wきのくに線;2: 串本・新宮方面","日本の鉄道駅一覧_た","箇条書き","島式ホーム1面2線を有する、列車交換設備を備えた地上駅。駅舎は線路南側（海側）にある。ホームと駅舎は周参見寄りの構内踏切（遮断機あり）で連絡している。"
"谷頭駅","谷頭駅（たにがしらえき）","https://ja.wikipedia.org/wiki/谷頭駅","北緯31度47分18.74秒東経131度3分15.17秒","所在地: 宮崎県都城市山田町中霧島3108北緯31度47分18.74秒東経131度3分15.17秒﻿ / ﻿北緯31.7885389度 東経131.0542139度﻿ / 31.7885389; 131.0542139;所属事業者: 九州旅客鉄道（JR九州）;所属路線: 吉都線;キロ程: 54.5 km（吉松起点）;電報略号: タニ;駅構造: 地上駅;ホーム: 1面2線;乗車人員-統計年度-: 65人/日（降車客含まず）-2015年-;開業年月日: 1913年（大正2年）5月11日;備考: 無人駅;1: ■吉都線;2: 下り","日本の鉄道駅一覧_た","箇条書き","島式ホーム1面2線を有する地上駅。木造駅舎が撤去された跡に待合所が設けられている。トイレは駅横の児童公園に設けられている。"
"谷上駅","谷上駅（たにがみえき）","https://ja.wikipedia.org/wiki/谷上駅","北緯34度45分42.59秒東経135度10分16.84秒","所在地: 神戸市北区谷上東町1-1北緯34度45分42.59秒東経135度10分16.84秒﻿ / ﻿北緯34.7618306度 東経135.1713444度﻿ / 34.7618306; 135.1713444﻿ (谷上駅)座標: 北緯34度45分42.59秒東経135度10分16.84秒﻿ / ﻿北緯34.7618306度 東経135.1713444度﻿ / 34.7618306; 135.1713444﻿ (谷上駅);所属事業者: 神戸市交通局（神戸市営地下鉄）神戸電鉄;駅構造: 高架駅;ホーム: 3面5線;乗車人員-統計年度-: （神戸電鉄）-2019年-902人/日（降車客含まず）（北神急行電鉄）-2019年-12,224人/日（降車客含まず）;開業年月日: 1928年（昭和3年）11月28日;所属路線: 神戸市営地下鉄北神線;駅番号:  S01;キロ程: 7.5 km（新神戸起点）;所属路線: 神戸電鉄有馬線;駅番号: ○KB10;キロ程: 13.7km（湊川起点）新開地から14.1 km;備考: 共同使用駅（神戸市交通局の管轄駅）;1: 神戸電鉄;3: 下りは平日昼間時及び夜間・土休日朝以降に発着;4:  神戸市交通局;6: 朝夕のみ","日本の鉄道駅一覧_た","箇条書き","↑1・2・3花山駅"
"谷川駅","谷川駅（たにかわえき）","https://ja.wikipedia.org/wiki/谷川駅","北緯35度4分56.39秒東経135度3分0.32秒","所属事業者: 西日本旅客鉄道（JR西日本）;電報略号: タニ;駅構造: 地上駅;ホーム: 2面3線;乗車人員-統計年度-: 453人/日（降車客含まず）-2016年-;開業年月日: 1899年（明治32年）5月25日;所属路線: G福知山線;キロ程: 73.0 km（尼崎起点）;所属路線: I加古川線;キロ程: 48.5 km（加古川起点）;備考: 業務委託駅みどりの窓口有;1・2: G福知山線;加古川線のりば: I加古川線","日本の鉄道駅一覧_た","箇条書き","地元では「たにがわ」と濁って発音されることもある。"
"谷汲口駅","谷汲口駅（たにぐみぐちえき）","https://ja.wikipedia.org/wiki/谷汲口駅","北緯35度31分39.18秒東経136度38分31.87秒","所在地: 岐阜県揖斐郡揖斐川町谷汲長瀬北緯35度31分39.18秒東経136度38分31.87秒﻿ / ﻿北緯35.5275500度 東経136.6421861度﻿ / 35.5275500; 136.6421861座標: 北緯35度31分39.18秒東経136度38分31.87秒﻿ / ﻿北緯35.5275500度 東経136.6421861度﻿ / 35.5275500; 136.6421861;所属事業者: 樽見鉄道;所属路線: 樽見線;キロ程: 21.6 km（大垣起点）;駅構造: 地上駅;ホーム: 1面1線;乗車人員-統計年度-: 12人/日（降車客含まず）-2016年-;開業年月日: 1956年（昭和31年）3月20日","日本の鉄道駅一覧_た","箇条書き","単式ホーム1面1線を有する地上駅である。北側が旧ホーム（写真の手前）、南側が新ホーム（写真の奥）で、もっぱら列車は後者に停車している。なお、旧ホームには美江寺駅と同様に、島式ホーム1面2線であった遺構が残っている。また、駅構内にはオハフ502（旧 国鉄オハフ33形）が保存されている。"
"谷之口駅","谷之口駅（たにのくちえき）","https://ja.wikipedia.org/wiki/谷之口駅","北緯31度32分1.30秒東経131度20分41.17秒","所在地: 宮崎県日南市南郷町谷之口北緯31度32分1.30秒東経131度20分41.17秒﻿ / ﻿北緯31.5336944度 東経131.3447694度﻿ / 31.5336944; 131.3447694座標: 北緯31度32分1.30秒東経131度20分41.17秒﻿ / ﻿北緯31.5336944度 東経131.3447694度﻿ / 31.5336944; 131.3447694;所属事業者: 九州旅客鉄道（JR九州）;所属路線: 日南線;キロ程: 56.1 km（南宮崎起点）;電報略号: クチ;駅構造: 地上駅;ホーム: 1面1線;乗車人員-統計年度-: 4人/日（降車客含まず）-2015年-;開業年月日: 1949年（昭和24年）1月15日;備考: 無人駅","日本の鉄道駅一覧_た","箇条書き","単式ホーム1面1線を有する地上駅。無人駅である。かつては有人駅で駅舎も建っていた。駅舎は無人化後に解体撤去され基礎部分のみが残っている。"
"谷浜駅","谷浜駅（たにはまえき）","https://ja.wikipedia.org/wiki/谷浜駅","北緯37度9分44.59秒東経138度10分26.31秒","所在地: 新潟県上越市大字長浜字家の下112北緯37度9分44.59秒東経138度10分26.31秒﻿ / ﻿北緯37.1623861度 東経138.1739750度﻿ / 37.1623861; 138.1739750座標: 北緯37度9分44.59秒東経138度10分26.31秒﻿ / ﻿北緯37.1623861度 東経138.1739750度﻿ / 37.1623861; 138.1739750;所属事業者: えちごトキめき鉄道;所属路線: ■日本海ひすいライン;キロ程: 52.7 km（市振起点）泊から62.1 km米原から347.2 km;電報略号: タニ;駅構造: 地上駅;ホーム: 2面3線;乗車人員-統計年度-: 14人/日（降車客含まず）-2020年-;開業年月日: 1911年（明治44年）7月1日;備考: 無人駅;1: ■日本海ひすいライン;2: （使用停止中）;3: 下り","日本の鉄道駅一覧_た","箇条書き","糸魚川地域鉄道部が管理する無人駅であった。一時期自動券売機が設置されていたが、運賃改定に伴い撤去されている。"
"谷町九丁目駅","谷町九丁目駅（たにまちきゅうちょうめえき）","https://ja.wikipedia.org/wiki/谷町九丁目駅","北緯34度40分1.72秒東経135度30分57.03秒","所在地: 大阪市天王寺区生玉前町北緯34度40分1.72秒東経135度30分57.03秒﻿ / ﻿北緯34.6671444度 東経135.5158417度﻿ / 34.6671444; 135.5158417﻿ (谷町九丁目駅);所属事業者: 大阪市高速電気軌道(Osaka Metro);駅構造: 地下駅;ホーム: 計3面4線;乗車人員-統計年度-: 30,351人/日（降車客含まず）-2020年-;乗降人員-統計年度-: 61,996人/日-2020年-;開業年月日: 1968年（昭和43年）12月17日;所属路線: ●谷町線;駅番号:  T25;キロ程: 16.1 km（大日起点）;所属路線: ●千日前線;駅番号:  S18;キロ程: 6.6 km（野田阪神起点）;乗換: 大阪上本町駅（近鉄大阪線・難波線（奈良線））;備考: キロ程は営業キロ;1:  谷町線;2: 東梅田・都島・大日方面;1:  千日前線;2: なんば・野田阪神方面","日本の鉄道駅一覧_た","箇条書き","近接して近畿日本鉄道（近鉄）の大阪上本町駅があり、同駅とは地下通路で連絡している。"
"谷町四丁目駅","谷町四丁目駅（たにまちよんちょうめえき）","https://ja.wikipedia.org/wiki/谷町四丁目駅","北緯34度40分54.89秒東経135度31分2.23秒","所在地: 大阪市中央区谷町四丁目北緯34度40分54.89秒東経135度31分2.23秒﻿ / ﻿北緯34.6819139度 東経135.5172861度﻿ / 34.6819139; 135.5172861﻿ (谷町四丁目駅)座標: 北緯34度40分54.89秒東経135度31分2.23秒﻿ / ﻿北緯34.6819139度 東経135.5172861度﻿ / 34.6819139; 135.5172861﻿ (谷町四丁目駅);所属事業者: 大阪市高速電気軌道(Osaka Metro);駅構造: 地下駅;ホーム: 各2面2線;乗車人員-統計年度-: 38,932人/日（降車客含まず）-2020年-;乗降人員-統計年度-: 78,357人/日-2020年-;開業年月日: 1967年（昭和42年）3月24日;所属路線: ●谷町線;駅番号:  T23;キロ程: 14.2 km（大日起点）;所属路線: ●中央線;駅番号:  C18;キロ程: 11.1 km（コスモスクエア起点）;備考: キロ程は営業キロ;1:  谷町線;2: 東梅田・都島・大日方面;1:  中央線;2: 本町・大阪港・コスモスクエア方面","日本の鉄道駅一覧_た","箇条書き","谷町線・中央線ともに相対式2面2線ホームの地下駅。谷町線ホームの方が中央線ホームより下層にあり、中央線ホーム本町寄りに、谷町線ホーム天王寺寄りに通じる連絡階段が設けられている。改札口は中央線ホーム双方の本町寄りに1ヶ所ずつあるほか、森ノ宮寄り付近と東梅田寄り付近にも1ヶ所ずつあり、合計4ヶ所。"
"谷町六丁目駅","谷町六丁目駅（たにまちろくちょうめえき）","https://ja.wikipedia.org/wiki/谷町六丁目駅","北緯34度40分29.7秒東経135度31分1.05秒","所在地: 大阪市中央区谷町六丁目北緯34度40分29.7秒東経135度31分1.05秒﻿ / ﻿北緯34.674917度 東経135.5169583度﻿ / 34.674917; 135.5169583﻿ (谷町六丁目駅);所属事業者: 大阪市高速電気軌道(Osaka Metro);駅構造: 地下駅;ホーム: 2面4線（各線1面2線）;乗車人員-統計年度-: 14,507人/日（降車客含まず）-2020年-;乗降人員-統計年度-: 28,976人/日-2020年-;開業年月日: 1968年（昭和43年）12月17日;所属路線: ●谷町線;駅番号:  T24;キロ程: 15.2 km（大日起点）;所属路線: ●長堀鶴見緑地線;駅番号:  N18;キロ程: 4.4 km（大正起点）;備考: キロ程は営業キロ;1:  谷町線;2: 東梅田・都島・大日方面;1:  長堀鶴見緑地線;2: 心斎橋・ドーム前千代崎・大正方面","日本の鉄道駅一覧_た","箇条書き","両路線とも島式ホーム1面2線の地下駅である。谷町線ホーム東梅田寄りに、長堀鶴見緑地線ホーム大正寄りにつながる連絡通路が設けられている。改札口は谷町線ホーム南側と中央に付近の上層に1ヶ所ずつ、長堀鶴見緑地線ホーム中央の上層に1ヶ所、合計3ヶ所。"
"谷山駅 (鹿児島県)","谷山駅（たにやまえき・九州旅客鉄道指宿枕崎線）","https://ja.wikipedia.org/wiki/谷山駅_(鹿児島県)","北緯31度31分37.38秒東経130度31分9.23秒","所属事業者: 九州旅客鉄道（JR九州）;所属路線: 指宿枕崎線;キロ程: 7.5 km（鹿児島中央起点）;電報略号: タヤ;駅構造: 高架駅;ホーム: 1面2線;乗車人員-統計年度-: 2,772人/日（降車客含まず）-2019年-;開業年月日: 1930年（昭和5年）12月7日;備考: 業務委託駅みどりの窓口有駅集中管理システム（Smart Support Station）採用;1: ■指宿枕崎線;2: 上り","日本の鉄道駅一覧_た","箇条書き","島式ホーム1面2線を有する高架駅。"
"谷山停留場","谷山停留場（たにやまていりゅうじょう・鹿児島市電谷山線）","https://ja.wikipedia.org/wiki/谷山停留場","北緯31度31分48.39秒東経130度31分24.27秒","所在地: 鹿児島県鹿児島市東谷山二丁目北緯31度31分48.39秒東経130度31分24.27秒﻿ / ﻿北緯31.5301083度 東経130.5234083度﻿ / 31.5301083; 130.5234083座標: 北緯31度31分48.39秒東経130度31分24.27秒﻿ / ﻿北緯31.5301083度 東経130.5234083度﻿ / 31.5301083; 130.5234083;駅番号: ●I25;所属事業者: 鹿児島市交通局;所属路線: 鹿児島市電谷山線（1系統）;キロ程: 6.4km（武之橋起点）鹿児島駅前から9.4 km;駅構造: 地上駅;ホーム: 3面2線;乗降人員-統計年度-: 5,785人/日-2015年-;開業年月日: 1912年12月1日","日本の鉄道駅一覧_た","箇条書き","鹿児島市電1系統の終点であり、同じ1系統の起点である鹿児島駅前停留場以外の他の停留場にはない大きな駅舎がある。"
"段山町停留場","段山町停留場（だにやままちていりゅうじょう）","https://ja.wikipedia.org/wiki/段山町停留場","北緯32度48分23.22秒東経130度41分43.45秒","所在地: 熊本県熊本市中央区段山本町・古京町北緯32度48分23.22秒東経130度41分43.45秒﻿ / ﻿北緯32.8064500度 東経130.6954028度﻿ / 32.8064500; 130.6954028座標: 北緯32度48分23.22秒東経130度41分43.45秒﻿ / ﻿北緯32.8064500度 東経130.6954028度﻿ / 32.8064500; 130.6954028;駅番号: □B5;所属事業者: 熊本市交通局;所属路線: 上熊本線（■B系統）;キロ程: 1.5km（辛島町起点）健軍町から8.4 km;駅構造: 地上駅;ホーム: 2面2線;乗降人員-統計年度-: 595人/日-2015年-;開業年月日: 1929年（昭和4年）6月20日;西側: ■B系統（上熊本線）;東側: 下り","日本の鉄道駅一覧_た","箇条書き","熊本市交通局"
"狸小路停留場","狸小路停留場（たぬきこうじていりゅうじょう）","https://ja.wikipedia.org/wiki/狸小路停留場","北緯43度3分26.2秒東経141度21分10.5秒","所在地: 北海道札幌市中央区南3条西4丁目(内回り)北海道札幌市中央区南2条西3丁目(外回り)北緯43度3分26.2秒東経141度21分10.5秒﻿ / ﻿北緯43.057278度 東経141.352917度﻿ / 43.057278; 141.352917﻿ (狸小路停留場)座標: 北緯43度3分26.2秒東経141度21分10.5秒﻿ / ﻿北緯43.057278度 東経141.352917度﻿ / 43.057278; 141.352917﻿ (狸小路停留場);駅番号: ○SC24;所属事業者: 札幌市交通局（札幌市電）;所属路線: 都心線;キロ程: 0.247 km（すすきの起点）;駅構造: 地上駅（停留場）;ホーム: 2面2線（サイドリザベーション）;乗降人員-統計年度-: 3,458人/日-2019年-;開業年月日: 2015年（平成27年）12月20日;乗換: 大通駅（札幌市営地下鉄南北線(N07)、東西線(T09)、東豊線(H08)） - 乗継指定駅すすきの駅（札幌市営地下鉄南北線 (N08) - 乗継指定駅豊水すすきの駅（札幌市営地下鉄東豊線 (H09) - 乗継指定駅","日本の鉄道駅一覧_た","箇条書き","2015年の札幌市電ループ化開業に伴い、都心線の停留場として開業。"
"田主丸駅","田主丸駅（たぬしまるえき）","https://ja.wikipedia.org/wiki/田主丸駅","北緯33度20分20.09秒東経130度41分32.25秒","所在地: 福岡県久留米市田主丸町田主丸2000北緯33度20分20.09秒東経130度41分32.25秒﻿ / ﻿北緯33.3389139度 東経130.6922917度﻿ / 33.3389139; 130.6922917;所属事業者: 九州旅客鉄道（JR九州）;所属路線: ■久大本線;キロ程: 20.8 km（久留米起点）;電報略号: ヌシ;駅構造: 地上駅;ホーム: 2面2線;乗車人員-統計年度-: 587人/日（降車客含まず）-2018年-;開業年月日: 1928年（昭和3年）12月24日;備考: 簡易委託駅POS端末設置;1: ■久大本線;2: 上り","日本の鉄道駅一覧_た","箇条書き","相対式ホーム2面2線を有する地上駅。"
"田沼駅","田沼駅（たぬまえき）","https://ja.wikipedia.org/wiki/田沼駅","北緯36度22分0.98秒東経139度34分53.71秒","所在地: 栃木県佐野市栃本町1766北緯36度22分0.98秒東経139度34分53.71秒﻿ / ﻿北緯36.3669389度 東経139.5815861度﻿ / 36.3669389; 139.5815861﻿ (田沼駅)座標: 北緯36度22分0.98秒東経139度34分53.71秒﻿ / ﻿北緯36.3669389度 東経139.5815861度﻿ / 36.3669389; 139.5815861﻿ (田沼駅);駅番号: TI37;所属事業者: 東武鉄道;所属路線: ■佐野線;キロ程: 17.7 km（館林起点）;電報略号: ヌマ;駅構造: 地上駅;ホーム: 1面2線;乗降人員-統計年度-: 979人/日-2019年-;開業年月日: 1894年（明治27年）3月20日;1:  佐野線;2: 上り","日本の鉄道駅一覧_た","箇条書き","島式ホーム1面2線を有する地上駅。駅舎は線路の西側にあり、ホームとは地下道により連絡している。"
"種市駅","種市駅（たねいちえき）","https://ja.wikipedia.org/wiki/種市駅","北緯40度24分37.07秒東経141度42分54.97秒","所在地: 岩手県九戸郡洋野町種市第23地割70北緯40度24分37.07秒東経141度42分54.97秒﻿ / ﻿北緯40.4102972度 東経141.7152694度﻿ / 40.4102972; 141.7152694座標: 北緯40度24分37.07秒東経141度42分54.97秒﻿ / ﻿北緯40.4102972度 東経141.7152694度﻿ / 40.4102972; 141.7152694;所属事業者: 東日本旅客鉄道（JR東日本）;所属路線: ■八戸線;キロ程: 34.2 km（八戸起点）;電報略号: タネ;駅構造: 地上駅;ホーム: 1面1線;乗車人員-統計年度-: 112人/日（降車客含まず）-2019年-;開業年月日: 1924年（大正13年）11月10日;備考: 業務委託駅みどりの窓口有","日本の鉄道駅一覧_た","箇条書き","単式ホーム1面1線を有する地上駅。駅舎は鉄筋コンクリート平屋建て。かつては相対式ホーム2面2線で、タブレットを交換していた。業務委託駅で、久慈駅が管理する。"
"種差海岸駅","種差海岸駅（たねさしかいがんえき）","https://ja.wikipedia.org/wiki/種差海岸駅","北緯40度30分25.26秒東経141度36分26.37秒","所在地: 青森県八戸市大字鮫町字棚久保北緯40度30分25.26秒東経141度36分26.37秒﻿ / ﻿北緯40.5070167度 東経141.6073250度﻿ / 40.5070167; 141.6073250座標: 北緯40度30分25.26秒東経141度36分26.37秒﻿ / ﻿北緯40.5070167度 東経141.6073250度﻿ / 40.5070167; 141.6073250;所属事業者: 東日本旅客鉄道（JR東日本）;所属路線: ■八戸線;キロ程: 19.6 km（八戸起点）;電報略号: タサ;駅構造: 地上駅;ホーム: 1面1線;開業年月日: 1924年（大正13年）11月10日;備考: 無人駅* 2002年に種差駅から改称。","日本の鉄道駅一覧_た","箇条書き","東北新幹線八戸延伸に合わせ、種差海岸への観光客を誘致するため種差駅から現在の駅名に変更された。なお、駅名変更にかかる費用の一部はユニバースなどの地元企業が負担している。"
