"タイトル","コメント","URLアドレス","座標","詳細情報","親リスト","一覧抽出方法"
"興福寺","","https://ja.wikipedia.org/wiki/興福寺","北緯34度40分59.7秒東経135度49分52.2秒","所在地: 奈良県奈良市登大路町48;位置: 北緯34度40分59.7秒東経135度49分52.2秒座標: 北緯34度40分59.7秒 東経135度49分52.2秒;山号: 無し;宗派: 法相宗;寺格: 大本山;本尊: 釈迦如来;創建年: 天智天皇8年（669年）;開基: 藤原不比等;札所等: 西国三十三所第9番（南円堂）南都七大寺第2番西国薬師四十九霊場第4番（東金堂）神仏霊場巡拝の道第16番大和北部八十八ヶ所霊場第62番（菩提院）;文化財: 五重塔、木造弥勒仏坐像、乾漆八部衆像ほか（国宝）南円堂、木造薬王菩薩、薬上菩薩立像ほか（重要文化財）世界遺産;公式HP: 法相宗大本山 興福寺;法人番号: 7150005000123","日本の寺院一覧","参照"
"光明寺 (綾部市)","","https://ja.wikipedia.org/wiki/光明寺_(綾部市)","北緯35度23分23.6秒東経135度26分32秒","所在地: 京都府綾部市睦寄町君尾1-1;位置: 北緯35度23分23.6秒東経135度26分32秒座標: 北緯35度23分23.6秒 東経135度26分32秒;山号: 君尾山;宗派: 真言宗醍醐派;本尊: 千手観音;開基: （伝）聖徳太子;札所等: 綾部西国観音33番;文化財: 二王門（国宝）;法人番号: 7130005010553","日本の寺院一覧","参照"
"光明寺 (加東市)","","https://ja.wikipedia.org/wiki/光明寺_(加東市)","北緯34度56分54.7秒東経134度56分50.1秒","所在地: 兵庫県加東市光明寺433;位置: 北緯34度56分54.7秒東経134度56分50.1秒座標: 北緯34度56分54.7秒 東経134度56分50.1秒;山号: 五峯山;宗派: 高野山真言宗;寺格: 真言宗七十五名刹;本尊: 十一面千手千眼観世音菩薩;創建年: 伝・推古天皇2年（594年）;開山: 伝・法道;別称: 播磨高野;札所等: 新西国三十三箇所第28番播磨西国三十三箇所第18番;文化財: 銅造如来坐像（重要文化財）本堂（国の登録有形文化財）;法人番号: 6140005016724","日本の寺院一覧","参照"
"光明寺 (鎌倉市)","","https://ja.wikipedia.org/wiki/光明寺_(鎌倉市)","北緯35度18分11.7秒東経139度33分17秒","所在地: 神奈川県鎌倉市材木座六丁目17番19号;位置: 北緯35度18分11.7秒東経139度33分17秒座標: 北緯35度18分11.7秒 東経139度33分17秒;山号: 天照山;院号: 蓮華院;宗旨: 浄土宗;宗派: 浄土宗鎮西派;寺格: 大本山;本尊: 阿弥陀如来;創建年: 不明;中興年: 15世紀頃;中興: 祐崇;正式名: 天照山蓮華院光明寺;札所等: 鎌倉三十三観音18番鎌倉二十四地蔵22番東国花の寺百ヶ寺鎌倉2番;文化財: 当麻曼荼羅縁起2巻（国宝）本堂・当麻曼荼羅図一幅・浄土五祖絵伝一巻（重文）;公式HP: 浄土宗大本山 光明寺;法人番号: 5021005001885","日本の寺院一覧","参照"
"神奈川県","","https://ja.wikipedia.org/wiki/神奈川県","北緯35度26分51.9秒東経139度38分33.1秒","国: 日本;地方: 関東地方;団体コード: 14000-7;ISO 3166-2:JP: JP-14;面積: 2,416.17km2;総人口: 9,216,009人（推計人口、2020年9月1日）;人口密度: 3,814人/km2;隣接都道府県:  東京都 山梨県 静岡県 千葉県[注釈 1];県の木: イチョウ;県の花: ヤマユリ;県の鳥: カモメ;県の色県民歌: ■かながわブルー[注釈 2]光あらたに;知事: 黒岩祐治;法人番号: 1000020140007;所在地: 〒231-8588神奈川県横浜市中区日本大通1番北緯35度26分51.9秒東経139度38分33.1秒座標: 北緯35度26分51.9秒 東経139度38分33.1秒県庁舎位置神奈川県庁;外部リンク: 公式ウェブサイト;ウィキポータル: 日本の都道府県/神奈川県;平均気温(°C): 26.7（8月）;最寒月: 5.9（1月）;降水量(mm): 233.8（9月）;最少月: 54.8（12月）;自由民主党神奈川県議会議員団: 自民党;立憲民主党・民権クラブ神奈川県議会議員団: 立憲民主党・民権クラブ;公明党神奈川県議会議員団: 公明党;かながわ国民民主党・無所属クラブ神奈川県議会議員団: かながわ国民民主党・無所属クラブ;県政会神奈川県議会議員団: 県政会;日本共産党神奈川県議会議員団: 日本共産党;わが町: わが町;神奈川ネットワーク運動: 神奈川ネット;神奈川絆の会: 神奈川絆の会;愛甲クラブ: 愛甲クラブ;大志会: 大志会;民主みらい神奈川: 民主みらい神奈川;横浜緑の会: 横浜緑の会;川崎県民クラブ: 川崎県民クラブ;横浜市: 3;神奈川区: 3;西区: 1;中区: 2;南区: 2;港南区: 3;保土ケ谷区: 2;旭区: 3;磯子区: 2;金沢区: 2;横浜市: 4;緑区: 2;青葉区: 3;都筑区: 2;戸塚区: 3;栄区: 1;泉区: 2;瀬谷区: 1;川崎市: 2;幸区: 2;川崎市: 3;高津区: 2;宮前区: 3;多摩区: 2;麻生区: 2;相模原市: 2;中央区: 3;南区: 3;横須賀市: 5;平塚市: 3;鎌倉市: 2;藤沢市: 5;小田原市: 2;茅ヶ崎市: 3;逗子市・葉山町: 1;三浦市: 1;秦野市: 2;厚木市: 3;大和市: 3;伊勢原市: 1;海老名市: 1;座間市: 1;南足柄市: 1;綾瀬市: 1;寒川町: 1;大磯町・二宮町: 1;足柄上: 1;足柄下: 1;愛川町・清川村: 1;国: 日本;地方: 関東地方;団体コード: 14000-7;ISO 3166-2:JP: JP-14;面積: 2,416.17km2;総人口: 9,216,009人（推計人口、2020年9月1日）;人口密度: 3,814人/km2;隣接都道府県:  東京都 山梨県 静岡県 千葉県[注釈 1];県の木: イチョウ;県の花: ヤマユリ;県の鳥: カモメ;県の色県民歌: ■かながわブルー[注釈 2]光あらたに;知事: 黒岩祐治;法人番号: 1000020140007;所在地: 〒231-8588神奈川県横浜市中区日本大通1番北緯35度26分51.9秒東経139度38分33.1秒座標: 北緯35度26分51.9秒 東経139度38分33.1秒県庁舎位置神奈川県庁;外部リンク: 公式ウェブサイト;ウィキポータル: 日本の都道府県/神奈川県;平均気温(°C): 26.7（8月）;最寒月: 5.9（1月）;降水量(mm): 233.8（9月）;最少月: 54.8（12月）;自由民主党神奈川県議会議員団: 自民党;立憲民主党・民権クラブ神奈川県議会議員団: 立憲民主党・民権クラブ;公明党神奈川県議会議員団: 公明党;かながわ国民民主党・無所属クラブ神奈川県議会議員団: かながわ国民民主党・無所属クラブ;県政会神奈川県議会議員団: 県政会;日本共産党神奈川県議会議員団: 日本共産党;わが町: わが町;神奈川ネットワーク運動: 神奈川ネット;神奈川絆の会: 神奈川絆の会;愛甲クラブ: 愛甲クラブ;大志会: 大志会;民主みらい神奈川: 民主みらい神奈川;横浜緑の会: 横浜緑の会;川崎県民クラブ: 川崎県民クラブ;横浜市: 3;神奈川区: 3;西区: 1;中区: 2;南区: 2;港南区: 3;保土ケ谷区: 2;旭区: 3;磯子区: 2;金沢区: 2;横浜市: 4;緑区: 2;青葉区: 3;都筑区: 2;戸塚区: 3;栄区: 1;泉区: 2;瀬谷区: 1;川崎市: 2;幸区: 2;川崎市: 3;高津区: 2;宮前区: 3;多摩区: 2;麻生区: 2;相模原市: 2;中央区: 3;南区: 3;横須賀市: 5;平塚市: 3;鎌倉市: 2;藤沢市: 5;小田原市: 2;茅ヶ崎市: 3;逗子市・葉山町: 1;三浦市: 1;秦野市: 2;厚木市: 3;大和市: 3;伊勢原市: 1;海老名市: 1;座間市: 1;南足柄市: 1;綾瀬市: 1;寒川町: 1;大磯町・二宮町: 1;足柄上: 1;足柄下: 1;愛川町・清川村: 1","日本の寺院一覧","参照"
"鎌倉市","","https://ja.wikipedia.org/wiki/鎌倉市","北緯35度19分9.3秒東経139度32分48.1秒","国: 日本;地方: 関東地方;都道府県: 神奈川県;市町村コード: 14204-2;法人番号: 3000020142042;面積: 39.67km2;総人口: 172,929人 [編集]（推計人口、2020年9月1日）;人口密度: 4,359人/km2;隣接自治体: 横浜市、逗子市、藤沢市;市の木: ヤマザクラ;市の花: リンドウ;他のシンボル: -;市長: [編集]松尾崇;所在地: 〒248-8686神奈川県鎌倉市御成町18番10号北緯35度19分9.3秒東経139度32分48.1秒座標: 北緯35度19分9.3秒 東経139度32分48.1秒;外部リンク: 公式ウェブサイト;特記事項: 市外局番:0467（市内全域）","日本の寺院一覧","参照"
"材木座","","https://ja.wikipedia.org/wiki/材木座","","","日本の寺院一覧","参照"
"光明寺 (長岡京市)","","https://ja.wikipedia.org/wiki/光明寺_(長岡京市)","北緯34度56分18.48秒東経135度40分30.68秒","所在地: 京都府長岡京市粟生西条ノ内26-1;位置: 北緯34度56分18.48秒東経135度40分30.68秒座標: 北緯34度56分18.48秒 東経135度40分30.68秒;山号: 報国山;院号: 念仏三昧院;宗派: 西山浄土宗;寺格: 総本山;本尊: 阿弥陀如来;創建年: 建久9年（1198年）;開山: 法然;開基: 蓮生（熊谷直実）;正式名: 報国山念仏三昧院光明寺;別称: 粟生光明寺もみじ寺;札所等: 法然上人二十五霊跡第16番京都洛西観音霊場第7番西山国師遺跡霊場第13番;文化財: 千手観音立像ほか（重要文化財）光明寺 17棟ほか（市指定文化財）;公式HP: 京都 総本山 光明寺;法人番号: 7130005006436","日本の寺院一覧","参照"
"広隆寺","","https://ja.wikipedia.org/wiki/広隆寺","北緯35度0分55.80秒東経135度42分26.31秒","所在地: 京都府京都市右京区太秦蜂岡町32;位置: 北緯35度0分55.80秒東経135度42分26.31秒﻿ / ﻿北緯35.0155000度 東経135.7073083度﻿ / 35.0155000; 135.7073083座標: 北緯35度0分55.80秒東経135度42分26.31秒﻿ / ﻿北緯35.0155000度 東経135.7073083度﻿ / 35.0155000; 135.7073083;山号: 蜂岡山;宗派: 真言宗系単立;本尊: 聖徳太子（上宮王院本尊）;創建年: 推古天皇11年（603年）または推古天皇30年（622年）;開基: 秦河勝;別称: 蜂岡寺、秦公寺、太秦寺;札所等: 聖徳太子霊跡第24番;文化財: 木造弥勒菩薩半跏像、木造阿弥陀如来坐像（国宝）ほか絹本著色三千仏図、木造薬師如来立像、鉄鐘（重要文化財）ほか;法人番号: 1130005001731","日本の寺院一覧","参照"
"粉河寺","","https://ja.wikipedia.org/wiki/粉河寺","北緯34度16分51.46秒東経135度24分21.27秒","所在地: 和歌山県紀の川市粉河2787;位置: 北緯34度16分51.46秒東経135度24分21.27秒座標: 北緯34度16分51.46秒 東経135度24分21.27秒;山号: 風猛山;宗旨: 天台宗系;宗派: 粉河観音宗;寺格: 総本山;本尊: 千手千眼観音菩薩;創建年: 伝・宝亀元年（770年）;開基: 伝・大伴孔子古;正式名: 風猛山 粉河寺;札所等: 西国三十三所第3番;文化財: 粉河寺縁起絵巻（国宝）大門・中門・本堂・千手堂（重要文化財）粉河寺庭園（国の名勝）;公式HP: 粉河寺｜西国第三番札所｜厄除観音｜和歌山紀の川市;法人番号: 7170005003248","日本の寺院一覧","参照"
"護国寺","","https://ja.wikipedia.org/wiki/護国寺","北緯35度43分18.3秒東経139度43分32.3秒","所在地: 東京都文京区大塚五丁目40番1号;位置: 北緯35度43分18.3秒東経139度43分32.3秒座標: 北緯35度43分18.3秒 東経139度43分32.3秒;山号: 神齢山;院号: 悉地院;宗旨: 新義真言宗;宗派: 真言宗豊山派;寺格: 大本山;本尊: 如意輪観世音菩薩;創建年: 天和元年（1681年）;開基: 桂昌院、亮賢（開山）;正式名: 神齢山 悉地院 大聖護國寺;別称: 音羽護国寺;札所等: 御府内八十八箇所87番江戸三十三箇所13番東国花の寺百ヶ寺東京3番;文化財: 本堂、月光殿、絹本著色尊勝曼荼羅図ほか（重要文化財）;法人番号: 8010005000350","日本の寺院一覧","参照"
"孤篷庵","","https://ja.wikipedia.org/wiki/孤篷庵","北緯35度2分35.4秒東経135度44分23.0秒","所在地: 京都府京都市北区紫野大徳寺町66;位置: 北緯35度2分35.4秒東経135度44分23.0秒;宗派: 臨済宗大徳寺派;文化財: 井戸茶碗（国宝）;法人番号: 7130005001206","日本の寺院一覧","参照"
"金戒光明寺","","https://ja.wikipedia.org/wiki/金戒光明寺","北緯35度1分10.7秒東経135度47分16.9秒","所在地: 京都府京都市左京区黒谷町121;位置: 北緯35度1分10.7秒東経135度47分16.9秒﻿ / ﻿北緯35.019639度 東経135.788028度﻿ / 35.019639; 135.788028座標: 北緯35度1分10.7秒東経135度47分16.9秒﻿ / ﻿北緯35.019639度 東経135.788028度﻿ / 35.019639; 135.788028;山号: 紫雲山;宗派: 浄土宗;寺格: 大本山;本尊: 阿弥陀如来;創建年: 承安5年（1175年）;開基: 法然;正式名: 紫雲山金戒光明寺;別称: くろ谷さん白河禅房;札所等: 法然上人二十五霊場第24番洛陽三十三所観音霊場第6番;文化財: 三重塔（文殊塔）・木造千手観音立像・山越阿弥陀図・地獄極楽図（重要文化財）;公式HP: 浄土宗大本山・くろ谷 金戒光明寺;法人番号: 4130005002413","日本の寺院一覧","参照"
"金地院","","https://ja.wikipedia.org/wiki/金地院","北緯35度0分37.02秒東経135度47分25.56秒","所在地: 京都府京都市左京区南禅寺福地町86-12;位置: 北緯35度0分37.02秒東経135度47分25.56秒;宗派: 臨済宗南禅寺派;寺格: 南禅寺塔頭;本尊: 地蔵菩薩;創建年: 応永年間（1394年～1427年）;開基: 足利義持;文化財: 紙本墨画溪陰小築図・絹本着色秋景冬景山水図（国宝）方丈、東照宮、茶室(京都三名席)、本光国師日記ほか（重要文化財）庭園（特別名勝）;法人番号: 4130005001101","日本の寺院一覧","参照"
"金剛三昧院","","https://ja.wikipedia.org/wiki/金剛三昧院","北緯34度12分36.8秒東経135度35分13.1秒","所在地: 和歌山県伊都郡高野町高野山425;位置: 北緯34度12分36.8秒東経135度35分13.1秒座標: 北緯34度12分36.8秒 東経135度35分13.1秒;宗派: 高野山真言宗;寺格: 別格本山;本尊: 愛染明王;創建年: 建暦元年（1211年）;開基: 北条政子（発願）;札所等: 仏塔古寺十八尊第11番西国愛染十七霊場第17番;文化財: 多宝塔（国宝）経蔵、絹本著色愛染明王像ほか（重要文化財）世界遺産;法人番号: 2170005004845","日本の寺院一覧","参照"
"金剛寺 (河内長野市)","","https://ja.wikipedia.org/wiki/金剛寺_(河内長野市)","北緯34度25分46.42秒東経135度31分44.57秒","所在地: 大阪府河内長野市天野町996;位置: 北緯34度25分46.42秒東経135度31分44.57秒﻿ / ﻿北緯34.4295611度 東経135.5290472度﻿ / 34.4295611; 135.5290472座標: 北緯34度25分46.42秒東経135度31分44.57秒﻿ / ﻿北緯34.4295611度 東経135.5290472度﻿ / 34.4295611; 135.5290472;山号: 天野山;宗派: 真言宗御室派;寺格: 大本山;本尊: 大日如来坐像（国宝）;創建年: 伝・天平年間（729年- 748年）;開山: 伝・行基;開基: 聖武天皇（勅願）;正式名: 天野山金剛寺;別称: 女人高野;札所等: 新西国三十三箇所第7番河泉二十四地蔵霊場第12番河内飛鳥古社寺霊場第8番神仏霊場巡拝の道第55番;文化財: 延喜式神名帳、延喜式第十二残巻・第十四・第十六、紙本著色日月四季山水、剣 無銘、木造大日如来坐像・木造不動・降三世明王坐像 3躯（国宝）楼門・金堂ほか（重要文化財）;法人番号: 6120105005422","日本の寺院一覧","参照"
"金剛證寺","","https://ja.wikipedia.org/wiki/金剛證寺","北緯34度27分26.68秒東経136度47分7.56秒","所在地: 三重県伊勢市朝熊町岳548;位置: 北緯34度27分26.68秒東経136度47分7.56秒﻿ / ﻿北緯34.4574111度 東経136.7854333度﻿ / 34.4574111; 136.7854333座標: 北緯34度27分26.68秒東経136度47分7.56秒﻿ / ﻿北緯34.4574111度 東経136.7854333度﻿ / 34.4574111; 136.7854333;山号: 勝峰山;宗派: 臨済宗南禅寺派;本尊: 虚空蔵菩薩;創建年: （伝）6世紀中ば;開基: 暁台上人;正式名: 勝峰山 兜率院 金剛證寺;札所等: 伊勢西国三十三所観音霊場2番;文化財: 朝熊山経ヶ峯経塚出土品（国宝）本堂、九鬼嘉隆像ほか（重要文化財）国の史跡;法人番号: 4190005004791","日本の寺院一覧","参照"
"金剛峯寺","","https://ja.wikipedia.org/wiki/金剛峯寺","北緯34度12分50.7秒東経135度35分3秒","所在地: 和歌山県伊都郡高野町高野山132;位置: 北緯34度12分50.7秒東経135度35分3秒座標: 北緯34度12分50.7秒 東経135度35分3秒;山号: 高野山;宗派: 高野山真言宗;寺格: 総本山;本尊: 薬師如来（阿閦如来とも）[1];創建年: 弘仁7年（816年）;開基: 空海;中興年: 長和5年（1016年）;中興: 定誉、木食応其;正式名: 高野山真言宗 総本山金剛峯寺;札所等: 真言宗十八本山18番西国三十三所特別札所神仏霊場巡拝の道第13番;文化財: 不動堂、仏涅槃図ほか（国宝）大門、絹本著色大日如来像ほか（重要文化財）世界遺産;法人番号: 5170005004842","日本の寺院一覧","参照"
"金剛輪寺","","https://ja.wikipedia.org/wiki/金剛輪寺","北緯35度9分40.5秒東経136度16分59秒","所在地: 滋賀県愛知郡愛荘町松尾寺874;位置: 北緯35度9分40.5秒東経136度16分59秒﻿ / ﻿北緯35.161250度 東経136.28306度﻿ / 35.161250; 136.28306﻿ (金剛輪寺)座標: 北緯35度9分40.5秒東経136度16分59秒﻿ / ﻿北緯35.161250度 東経136.28306度﻿ / 35.161250; 136.28306﻿ (金剛輪寺);山号: 松峯山;宗旨: 天台宗;本尊: 聖観世音菩薩（秘仏）;創建年: 伝・天平13年（741年）;開山: 伝・行基;開基: 聖武天皇（勅願）;中興年: 嘉承年間（848年- 851年）;中興: 伝・円仁;札所等: 近江西国三十三観音霊場第15番湖国十一面観音菩薩霊場第11番びわ湖百八霊場第63番;文化財: 本堂（国宝） 三重塔、二天門、阿弥陀如来坐像、慈恵大師坐像ほか（重要文化財） 、明寿院庭園（名勝）;公式HP: 湖東三山まん中のお寺 - 天台宗 金剛輪寺;法人番号: 5160005005197","日本の寺院一覧","参照"
"金林寺","","https://ja.wikipedia.org/wiki/金林寺","北緯33度33分2.8秒東経134度2分48.4秒","所在地: 高知県安芸郡馬路村大字馬路4281番地;位置: 北緯33度33分2.8秒東経134度2分48.4秒座標: 北緯33度33分2.8秒 東経134度2分48.4秒;山号: 月光山;宗派: 高野山真言宗;本尊: 薬師如来;創建年: 伝・大同2年（807年）;開基: 伝・空海（弘法大師）;正式名: 月光山珠勝院金林寺;別称: 馬路薬師、馬路薬師堂;文化財: 薬師堂、木造不動明王立像、木造毘沙門天立像（以上は国の重要文化財）;法人番号: 8490005005558","日本の寺院一覧","参照"
"金蓮寺 (西尾市)","","https://ja.wikipedia.org/wiki/金蓮寺_(西尾市)","北緯34度48分33.72秒東経137度4分22.26秒","所在地: 愛知県西尾市吉良町饗庭七度ヶ入1;位置: 北緯34度48分33.72秒東経137度4分22.26秒;山号: 青龍山;宗派: 曹洞宗;本尊: 不動明王;創建年: 不詳;開基: 不詳;中興年: 暦応3年（1340年）;中興: 足利尊氏;別称: あいば不動;札所等: 三河三十三観音27番東海三十六不動尊20番;文化財: 弥陀堂（国宝）木造阿弥陀如来坐像（県文化財）;法人番号: 7180305007170","日本の寺院一覧","参照"
"節を編集: さ","","https://ja.wikipedia.org/w/index.php?title=日本の寺院一覧&amp;action=edit&amp;section=11","","","日本の寺院一覧","参照"
"西岸寺","","https://ja.wikipedia.org/wiki/西岸寺","","","日本の寺院一覧","参照"
"西教寺","","https://ja.wikipedia.org/wiki/西教寺","北緯35度4分53.6秒東経135度51分57.8秒","所在地: 滋賀県大津市坂本5丁目13-1;位置: 北緯35度4分53.6秒東経135度51分57.8秒﻿ / ﻿北緯35.081556度 東経135.866056度﻿ / 35.081556; 135.866056座標: 北緯35度4分53.6秒東経135度51分57.8秒﻿ / ﻿北緯35.081556度 東経135.866056度﻿ / 35.081556; 135.866056;山号: 戒光山（かいこうさん）;宗派: 天台真盛宗（てんだいしんせいしゅう）;寺格: 総本山;本尊: 阿弥陀如来（重要文化財）;創建年: 伝・飛鳥時代;開基: 伝・聖徳太子;中興年: 文明18年（1486年）;中興: 真盛;正式名: 天台真盛宗総本山 戒光山 兼法勝西教寺;札所等: 神仏霊場巡拝の道第148番（滋賀16番）聖徳太子霊跡第31番真盛上人二十五霊場第1番びわ湖百八霊場第11番;文化財: 本堂、客殿、木造阿弥陀如来坐像他（重要文化財）鐘楼（大津市指定文化財）;法人番号: 4160005000711","日本の寺院一覧","参照"
"西光寺 (長野市)","","https://ja.wikipedia.org/wiki/西光寺_(長野市)","北緯36度38分49.1秒東経138度11分15.1秒","所在地: 長野県長野市北石堂町1398;位置: 北緯36度38分49.1秒東経138度11分15.1秒座標: 北緯36度38分49.1秒 東経138度11分15.1秒;山号: 苅萱山;院号: 寂照院;宗派: 浄土宗;本尊: 阿弥陀如来苅萱親子地蔵;創建年: （伝）建仁元年（1201年）;開基: 苅萱上人（苅萱道心）;正式名: 苅萱山寂照院西光寺;別称: 苅萱山、かるかや山;札所等: 善光寺七福神（第一番寿老人）;文化財: 親子地蔵（市指定文化財)苅萱道心石童丸御親子御絵（無指定）;法人番号: 3100005000453","日本の寺院一覧","参照"
"西光寺 (福岡市)","","https://ja.wikipedia.org/wiki/西光寺_(福岡市)","北緯33度29分56.9秒東経130度20分17.8秒","所在地: 福岡県福岡市早良区内野2-7-13;位置: 北緯33度29分56.9秒東経130度20分17.8秒座標: 北緯33度29分56.9秒 東経130度20分17.8秒;山号: 狐峯山;宗派: 浄土真宗本願寺派;本尊: 阿弥陀如来;創建年: 文明元年（1469年）;開基: 天海;文化財: 梵鐘（国宝）;法人番号: 8290005000736","日本の寺院一覧","参照"
"最上稲荷","","https://ja.wikipedia.org/wiki/最上稲荷","北緯34度42分32.24秒東経133度50分0.28秒","所在地: 岡山県岡山市北区高松稲荷712;位置: 北緯34度42分32.24秒東経133度50分0.28秒座標: 北緯34度42分32.24秒 東経133度50分0.28秒;山号: 最上稲荷山;宗派: 日蓮宗;本尊: 久遠実成本師釈迦牟尼仏最上位経王大菩薩（祈祷本尊）;創建年: （伝）天平勝宝4年（752年）;開基: （伝）報恩大師;正式名: 最上稲荷山妙教寺;別称: 最上稲荷高松稲荷;文化財: 本堂ほか（国の登録有形文化財）霊應殿（市指定文化財）;公式HP: 最上稲荷妙教寺;法人番号: 8260005000466","日本の寺院一覧","参照"
"西大寺 (奈良市)","","https://ja.wikipedia.org/wiki/西大寺_(奈良市)","北緯34度41分37秒東経135度46分46.2秒","所在地: 奈良県奈良市西大寺芝町1-1-5;位置: 北緯34度41分37秒東経135度46分46.2秒座標: 北緯34度41分37秒 東経135度46分46.2秒;山号: 勝宝山;院号: 四王院;宗派: 真言律宗;寺格: 総本山;本尊: 釈迦如来（重要文化財）;創建年: 天平神護元年（765年）;開山: 常騰;開基: 孝謙上皇（勅願）;正式名: 勝宝山四王院西大寺;札所等: 真言宗十八本山第15番大和十三仏霊場第2番西国愛染十七霊場第13番神仏霊場巡拝の道第23番大和北部八十八ヶ所霊場第24番南都七大寺第5番;文化財: 絹本著色十二天像12幅・金銅宝塔及び納置品ほか（国宝）本堂・絹本著色釈迦三尊像・木造釈迦如来立像ほか（重要文化財）;公式HP: 真言律宗総本山 西大寺;法人番号: 2150005000193","日本の寺院一覧","参照"
"西福寺 (敦賀市)","","https://ja.wikipedia.org/wiki/西福寺_(敦賀市)","北緯35度39分25秒東経136度1分55.6秒","所在地: 〒914-0824 福井県敦賀市原13-7;位置: 北緯35度39分25秒東経136度1分55.6秒座標: 北緯35度39分25秒 東経136度1分55.6秒;山号: 大原山;宗派: 浄土宗鎮西派;寺格: 中本山;本尊: 阿弥陀三尊;創建年: 応安元年1368年;開基: 後光厳天皇（勅願）、良如（開山）;別称: 越の秀嶺;文化財: 書院庭園（国の名勝）御影堂、阿弥陀堂、書院及び庫裏、絹本著色観経変相曼荼羅図、西福寺一切経勧進経25巻ほか（重要文化財）;法人番号: 4210005006109","日本の寺院一覧","参照"
"西芳寺","","https://ja.wikipedia.org/wiki/西芳寺","北緯34度59分31.06秒東経135度40分59.93秒","所在地: 京都府京都市西京区松尾神ヶ谷町56;位置: 北緯34度59分31.06秒東経135度40分59.93秒﻿ / ﻿北緯34.9919611度 東経135.6833139度﻿ / 34.9919611; 135.6833139座標: 北緯34度59分31.06秒東経135度40分59.93秒﻿ / ﻿北緯34.9919611度 東経135.6833139度﻿ / 34.9919611; 135.6833139;山号: 洪隠山;宗派: 臨済宗系単立;本尊: 阿弥陀如来;創建年: (伝)天平年間（729年- 749年）中興：暦応2年（1339年）;開基: (伝)行基中興：夢窓疎石;別称: 苔寺;文化財: 湘南亭・夢窓国師画像（重要文化財）庭園（特別名勝、史跡）世界遺産;法人番号: 6130005001735","日本の寺院一覧","参照"
