"タイトル","コメント","URLアドレス","座標","詳細情報","親リスト","一覧抽出方法"
"本州","1本州227,942.3310,084世界第7位。本土。","https://ja.wikipedia.org/wiki/本州","北緯35度0分0秒東経135度0分0秒","所在地: 日本;所在海域: 太平洋（日本海・フィリピン海）;所属諸島: 日本列島;座標: .mw-parser-output .geo-default,.mw-parser-output .geo-dms,.mw-parser-output .geo-dec{display:inline}.mw-parser-output .geo-nondefault,.mw-parser-output .geo-multi-punct{display:none}.mw-parser-output .longitude,.mw-parser-output .latitude{white-space:nowrap}北緯35度0分0秒東経135度0分0秒﻿ / ﻿北緯35.00000度 東経135.00000度﻿ / 35.00000; 135.00000座標: 北緯35度0分0秒東経135度0分0秒﻿ / ﻿北緯35.00000度 東経135.00000度﻿ / 35.00000; 135.00000;面積: 227,942.85[1]km²;海岸線長: 10,084[2]km;最高標高: 3,776 m;最高峰: 富士山;最大都市: 東京;所在地: 日本;所在海域: 太平洋（日本海・フィリピン海）;所属諸島: 日本列島;座標: .mw-parser-output .geo-default,.mw-parser-output .geo-dms,.mw-parser-output .geo-dec{display:inline}.mw-parser-output .geo-nondefault,.mw-parser-output .geo-multi-punct{display:none}.mw-parser-output .longitude,.mw-parser-output .latitude{white-space:nowrap}北緯35度0分0秒東経135度0分0秒﻿ / ﻿北緯35.00000度 東経135.00000度﻿ / 35.00000; 135.00000座標: 北緯35度0分0秒東経135度0分0秒﻿ / ﻿北緯35.00000度 東経135.00000度﻿ / 35.00000; 135.00000;面積: 227,942.85[1]km²;海岸線長: 10,084[2]km;最高標高: 3,776 m;最高峰: 富士山;最大都市: 東京","日本の島の一覧","表形式"
"北海道","2北海道77,983.922,676北海道世界第21位。本土。","https://ja.wikipedia.org/wiki/北海道","北緯43度3分51.6秒東経141度20分48.8秒","国: 日本;地方: 北海道地方;団体コード: 01000-6;ISO 3166-2:JP: JP-01;面積: 83,423.84km2;総人口: 5,210,508人（住民基本台帳人口、2021年4月30日）;人口密度: 62.5人/km2;隣接都道府県:  青森県[* 1];道　の木: エゾマツ、アカエゾマツ;道　の花: ハマナス;道　の鳥: タンチョウ;道民のうた: 行進曲「光あふれて」ホームソング「むかしのむかし」音頭「北海ばやし」道民体操（どさんこ体操）;知事: 鈴木直道;所在地: 〒060-8588北海道札幌市中央区北3条西6丁目1番地北緯43度3分51.6秒東経141度20分48.8秒座標: 北緯43度3分51.6秒 東経141度20分48.8秒;外部リンク: 公式ウェブサイト;特記事項: 面積には北方地域5,036.14km2を含む;ウィキポータル: 日本の都道府県/北海道;所在地: 日本;所属諸島: 日本列島;面積: 77,983.90[1]km²;海岸線長: 2,676[2]km;最高標高: 2,291 m;最高峰: 旭岳;最大都市: 札幌市;国: 日本;面積: 83,423.84km2[3];推計人口: 5,210,508人;人口密度: 62.5人/km2;郡: 郡読み渡島国亀田郡かめだ茅部郡かやべ上磯郡かみいそ福島郡ふくしま津軽郡つがる檜山郡ひやま爾志郡にし後志国久遠郡くとう奥尻郡おくしり太櫓郡ふとろ瀬棚郡せたな島牧郡しままき寿都郡すつつ歌棄郡うたすつ磯谷郡いそや岩内郡いわない古宇郡ふるう積丹郡しやこたん美国郡びくに古平郡ふるひら余市郡よいち忍路郡おしよろ高島郡たかしま小樽郡おたる;国: 日本;地方: 北海道地方;団体コード: 01000-6;ISO 3166-2:JP: JP-01;面積: 83,423.84km2;総人口: 5,210,508人（住民基本台帳人口、2021年4月30日）;人口密度: 62.5人/km2;隣接都道府県:  青森県[* 1];道　の木: エゾマツ、アカエゾマツ;道　の花: ハマナス;道　の鳥: タンチョウ;道民のうた: 行進曲「光あふれて」ホームソング「むかしのむかし」音頭「北海ばやし」道民体操（どさんこ体操）;知事: 鈴木直道;所在地: 〒060-8588北海道札幌市中央区北3条西6丁目1番地北緯43度3分51.6秒東経141度20分48.8秒座標: 北緯43度3分51.6秒 東経141度20分48.8秒;外部リンク: 公式ウェブサイト;特記事項: 面積には北方地域5,036.14km2を含む;ウィキポータル: 日本の都道府県/北海道;所在地: 日本;所属諸島: 日本列島;面積: 77,983.90[1]km²;海岸線長: 2,676[2]km;最高標高: 2,291 m;最高峰: 旭岳;最大都市: 札幌市;国: 日本;面積: 83,423.84km2[3];推計人口: 5,210,508人;人口密度: 62.5人/km2;郡: 郡読み渡島国亀田郡かめだ茅部郡かやべ上磯郡かみいそ福島郡ふくしま津軽郡つがる檜山郡ひやま爾志郡にし後志国久遠郡くとう奥尻郡おくしり太櫓郡ふとろ瀬棚郡せたな島牧郡しままき寿都郡すつつ歌棄郡うたすつ磯谷郡いそや岩内郡いわない古宇郡ふるう積丹郡しやこたん美国郡びくに古平郡ふるひら余市郡よいち忍路郡おしよろ高島郡たかしま小樽郡おたる;国: 日本;地方: 北海道地方;団体コード: 01000-6;ISO 3166-2:JP: JP-01;面積: 83,423.84km2;総人口: 5,210,508人（住民基本台帳人口、2021年4月30日）;人口密度: 62.5人/km2;隣接都道府県:  青森県[* 1];道　の木: エゾマツ、アカエゾマツ;道　の花: ハマナス;道　の鳥: タンチョウ;道民のうた: 行進曲「光あふれて」ホームソング「むかしのむかし」音頭「北海ばやし」道民体操（どさんこ体操）;知事: 鈴木直道;所在地: 〒060-8588北海道札幌市中央区北3条西6丁目1番地北緯43度3分51.6秒東経141度20分48.8秒座標: 北緯43度3分51.6秒 東経141度20分48.8秒;外部リンク: 公式ウェブサイト;特記事項: 面積には北方地域5,036.14km2を含む;ウィキポータル: 日本の都道府県/北海道;所在地: 日本;所属諸島: 日本列島;面積: 77,983.90[1]km²;海岸線長: 2,676[2]km;最高標高: 2,291 m;最高峰: 旭岳;最大都市: 札幌市;国: 日本;面積: 83,423.84km2[3];推計人口: 5,210,508人;人口密度: 62.5人/km2;郡: 郡読み渡島国亀田郡かめだ茅部郡かやべ上磯郡かみいそ福島郡ふくしま津軽郡つがる檜山郡ひやま爾志郡にし後志国久遠郡くとう奥尻郡おくしり太櫓郡ふとろ瀬棚郡せたな島牧郡しままき寿都郡すつつ歌棄郡うたすつ磯谷郡いそや岩内郡いわない古宇郡ふるう積丹郡しやこたん美国郡びくに古平郡ふるひら余市郡よいち忍路郡おしよろ高島郡たかしま小樽郡おたる;国: 日本;地方: 北海道地方;団体コード: 01000-6;ISO 3166-2:JP: JP-01;面積: 83,423.84km2;総人口: 5,210,508人（住民基本台帳人口、2021年4月30日）;人口密度: 62.5人/km2;隣接都道府県:  青森県[* 1];道　の木: エゾマツ、アカエゾマツ;道　の花: ハマナス;道　の鳥: タンチョウ;道民のうた: 行進曲「光あふれて」ホームソング「むかしのむかし」音頭「北海ばやし」道民体操（どさんこ体操）;知事: 鈴木直道;所在地: 〒060-8588北海道札幌市中央区北3条西6丁目1番地北緯43度3分51.6秒東経141度20分48.8秒座標: 北緯43度3分51.6秒 東経141度20分48.8秒;外部リンク: 公式ウェブサイト;特記事項: 面積には北方地域5,036.14km2を含む;ウィキポータル: 日本の都道府県/北海道;所在地: 日本;所属諸島: 日本列島;面積: 77,983.90[1]km²;海岸線長: 2,676[2]km;最高標高: 2,291 m;最高峰: 旭岳;最大都市: 札幌市;国: 日本;面積: 83,423.84km2[3];推計人口: 5,210,508人;人口密度: 62.5人/km2;郡: 郡読み渡島国亀田郡かめだ茅部郡かやべ上磯郡かみいそ福島郡ふくしま津軽郡つがる檜山郡ひやま爾志郡にし後志国久遠郡くとう奥尻郡おくしり太櫓郡ふとろ瀬棚郡せたな島牧郡しままき寿都郡すつつ歌棄郡うたすつ磯谷郡いそや岩内郡いわない古宇郡ふるう積丹郡しやこたん美国郡びくに古平郡ふるひら余市郡よいち忍路郡おしよろ高島郡たかしま小樽郡おたる;国: 日本;地方: 北海道地方;団体コード: 01000-6;ISO 3166-2:JP: JP-01;面積: 83,423.84km2;総人口: 5,210,508人（住民基本台帳人口、2021年4月30日）;人口密度: 62.5人/km2;隣接都道府県:  青森県[* 1];道　の木: エゾマツ、アカエゾマツ;道　の花: ハマナス;道　の鳥: タンチョウ;道民のうた: 行進曲「光あふれて」ホームソング「むかしのむかし」音頭「北海ばやし」道民体操（どさんこ体操）;知事: 鈴木直道;所在地: 〒060-8588北海道札幌市中央区北3条西6丁目1番地北緯43度3分51.6秒東経141度20分48.8秒座標: 北緯43度3分51.6秒 東経141度20分48.8秒;外部リンク: 公式ウェブサイト;特記事項: 面積には北方地域5,036.14km2を含む;ウィキポータル: 日本の都道府県/北海道;所在地: 日本;所属諸島: 日本列島;面積: 77,983.90[1]km²;海岸線長: 2,676[2]km;最高標高: 2,291 m;最高峰: 旭岳;最大都市: 札幌市;国: 日本;面積: 83,423.84km2[3];推計人口: 5,210,508人;人口密度: 62.5人/km2;郡: 郡読み渡島国亀田郡かめだ茅部郡かやべ上磯郡かみいそ福島郡ふくしま津軽郡つがる檜山郡ひやま爾志郡にし後志国久遠郡くとう奥尻郡おくしり太櫓郡ふとろ瀬棚郡せたな島牧郡しままき寿都郡すつつ歌棄郡うたすつ磯谷郡いそや岩内郡いわない古宇郡ふるう積丹郡しやこたん美国郡びくに古平郡ふるひら余市郡よいち忍路郡おしよろ高島郡たかしま小樽郡おたる;国: 日本;地方: 北海道地方;団体コード: 01000-6;ISO 3166-2:JP: JP-01;面積: 83,423.84km2;総人口: 5,210,508人（住民基本台帳人口、2021年4月30日）;人口密度: 62.5人/km2;隣接都道府県:  青森県[* 1];道　の木: エゾマツ、アカエゾマツ;道　の花: ハマナス;道　の鳥: タンチョウ;道民のうた: 行進曲「光あふれて」ホームソング「むかしのむかし」音頭「北海ばやし」道民体操（どさんこ体操）;知事: 鈴木直道;所在地: 〒060-8588北海道札幌市中央区北3条西6丁目1番地北緯43度3分51.6秒東経141度20分48.8秒座標: 北緯43度3分51.6秒 東経141度20分48.8秒;外部リンク: 公式ウェブサイト;特記事項: 面積には北方地域5,036.14km2を含む;ウィキポータル: 日本の都道府県/北海道;所在地: 日本;所属諸島: 日本列島;面積: 77,983.90[1]km²;海岸線長: 2,676[2]km;最高標高: 2,291 m;最高峰: 旭岳;最大都市: 札幌市;国: 日本;面積: 83,423.84km2[3];推計人口: 5,210,508人;人口密度: 62.5人/km2;郡: 郡読み渡島国亀田郡かめだ茅部郡かやべ上磯郡かみいそ福島郡ふくしま津軽郡つがる檜山郡ひやま爾志郡にし後志国久遠郡くとう奥尻郡おくしり太櫓郡ふとろ瀬棚郡せたな島牧郡しままき寿都郡すつつ歌棄郡うたすつ磯谷郡いそや岩内郡いわない古宇郡ふるう積丹郡しやこたん美国郡びくに古平郡ふるひら余市郡よいち忍路郡おしよろ高島郡たかしま小樽郡おたる;国: 日本;地方: 北海道地方;団体コード: 01000-6;ISO 3166-2:JP: JP-01;面積: 83,423.84km2;総人口: 5,210,508人（住民基本台帳人口、2021年4月30日）;人口密度: 62.5人/km2;隣接都道府県:  青森県[* 1];道　の木: エゾマツ、アカエゾマツ;道　の花: ハマナス;道　の鳥: タンチョウ;道民のうた: 行進曲「光あふれて」ホームソング「むかしのむかし」音頭「北海ばやし」道民体操（どさんこ体操）;知事: 鈴木直道;所在地: 〒060-8588北海道札幌市中央区北3条西6丁目1番地北緯43度3分51.6秒東経141度20分48.8秒座標: 北緯43度3分51.6秒 東経141度20分48.8秒;外部リンク: 公式ウェブサイト;特記事項: 面積には北方地域5,036.14km2を含む;ウィキポータル: 日本の都道府県/北海道;所在地: 日本;所属諸島: 日本列島;面積: 77,983.90[1]km²;海岸線長: 2,676[2]km;最高標高: 2,291 m;最高峰: 旭岳;最大都市: 札幌市;国: 日本;面積: 83,423.84km2[3];推計人口: 5,210,508人;人口密度: 62.5人/km2;郡: 郡読み渡島国亀田郡かめだ茅部郡かやべ上磯郡かみいそ福島郡ふくしま津軽郡つがる檜山郡ひやま爾志郡にし後志国久遠郡くとう奥尻郡おくしり太櫓郡ふとろ瀬棚郡せたな島牧郡しままき寿都郡すつつ歌棄郡うたすつ磯谷郡いそや岩内郡いわない古宇郡ふるう積丹郡しやこたん美国郡びくに古平郡ふるひら余市郡よいち忍路郡おしよろ高島郡たかしま小樽郡おたる","日本の島の一覧","表形式"
"九州","3九州36,782.443,888世界第37位。本土。","https://ja.wikipedia.org/wiki/九州","","所在地: 日本;所属諸島: 日本列島;面積: 36,782.37[1]km²;海岸線長: 3,888[2]km;最高標高: 1,791 m;最高峰: 中岳;最大都市: 福岡市;所在地: 日本;所属諸島: 日本列島;面積: 36,782.37[1]km²;海岸線長: 3,888[2]km;最高標高: 1,791 m;最高峰: 中岳;最大都市: 福岡市;所在地: 日本;所属諸島: 日本列島;面積: 36,782.37[1]km²;海岸線長: 3,888[2]km;最高標高: 1,791 m;最高峰: 中岳;最大都市: 福岡市","日本の島の一覧","表形式"
