"タイトル","コメント","URLアドレス","座標","詳細情報","親リスト","一覧抽出方法"
"施福寺","","https://ja.wikipedia.org/wiki/施福寺","北緯34度23分34.47秒東経135度30分41.68秒","所在地: 大阪府和泉市槙尾山町136;位置: 北緯34度23分34.47秒東経135度30分41.68秒座標: 北緯34度23分34.47秒 東経135度30分41.68秒;山号: 槇尾山;宗派: 天台宗;本尊: 弥勒菩薩;創建年: 伝・欽明天皇時代（539年- 571年）;開山: 伝・行満;正式名: 槇尾山 施福寺;別称: 槇尾寺;札所等: 西国三十三所第4番和泉西国三十三箇所第1番西国愛染十七霊場第15番神仏霊場巡拝の道第52番;文化財: 槙尾山大縁起（重要文化財）施福寺参詣曼荼羅図（府指定文化財）;法人番号: 3120105006662","日本の寺院一覧","参照"
"泉岳寺","","https://ja.wikipedia.org/wiki/泉岳寺","北緯35度38分15.8秒東経139度44分10.6秒","所在地: 東京都港区高輪二丁目11番1号[1];位置: 北緯35度38分15.8秒東経139度44分10.6秒座標: 北緯35度38分15.8秒 東経139度44分10.6秒;山号: 萬松山;宗派: 曹洞宗;寺格: 江戸三箇寺;本尊: 釈迦如来;創建年: 慶長17年（1612年）;開基: 門庵宗関、徳川家康（願主）;文化財: 浅野長矩・赤穂浪士墓（国の史跡）;法人番号: 6010405001413","日本の寺院一覧","参照"
"千光寺 (生駒郡平群町)","","https://ja.wikipedia.org/wiki/千光寺_(生駒郡平群町)","","所在地: 奈良県生駒郡平群町鳴川188;山号: 鳴川山;宗旨: 真言宗;宗派: 醍醐派;札所等: 仏塔古寺十八尊第14番役行者霊蹟札所大和北部八十八ヶ所霊場第39番;文化財: 梵鐘（県指定）役行者・前鬼・後鬼像（町指定）十三重層塔・宝塔（町指定）;法人番号: 8150005003422","日本の寺院一覧","参照"
"善光寺","","https://ja.wikipedia.org/wiki/善光寺","北緯36度39分42.12秒東経138度11分15.76秒","所在地: 長野県長野市元善町491;位置: 北緯36度39分42.12秒東経138度11分15.76秒﻿ / ﻿北緯36.6617000度 東経138.1877111度﻿ / 36.6617000; 138.1877111座標: 北緯36度39分42.12秒東経138度11分15.76秒﻿ / ﻿北緯36.6617000度 東経138.1877111度﻿ / 36.6617000; 138.1877111;山号: 定額山;宗派: 無宗派[1];本尊: 一光三尊阿弥陀如来（絶対秘仏）;創建年: (伝)皇極天皇3年（644年）;開基: (伝)皇極天皇（勅願）;別称: 信州善光寺、信濃善光寺;札所等: 西国三十三所（番外）坂東三十三箇所（番外）秩父三十四箇所（番外）西山国師遺跡霊場（客番）真盛上人二十五霊場（番外）;文化財: 本堂（国宝）三門、銅造阿弥陀如来及び両脇侍立像ほか（重要文化財）;公式HP: 信州善光寺ホームページ;法人番号: 4100005000576","日本の寺院一覧","参照"
"千手院 (松江市)","","https://ja.wikipedia.org/wiki/千手院_(松江市)","北緯35度28分51.2秒東経133度3分21.6秒","所在地: 松江市石橋町385;位置: 北緯35度28分51.2秒東経133度3分21.6秒座標: 北緯35度28分51.2秒 東経133度3分21.6秒;山号: 尊照山;宗旨: 真言宗;宗派: 高野山真言宗;本尊: 不動明王;文化財: 千手院のしだれ桜;法人番号: 3280005000840","日本の寺院一覧","参照"
"専修寺","","https://ja.wikipedia.org/wiki/専修寺","北緯34度45分43.42秒東経136度30分12.8秒","所在地: 栃木県真岡市高田1482;山号: 高田山;宗派: 真宗高田派;本尊: 善光寺式阿弥陀三尊（一光三尊仏）;創建年: 嘉禄元年（1225年）;開山: 親鸞聖人;別称: 本寺専修寺;文化財: 如来堂、御影堂、楼門、総門など（重要文化財）;公式HP: 真宗高田派　本寺専修寺;法人番号: 7190005000763;所在地: 三重県津市一身田町2819;位置: 北緯34度45分43.42秒東経136度30分12.8秒;山号: 高田山;宗派: 真宗高田派;本尊: 阿弥陀如来（証拠の如来）;創建年: 文明年間（1469年- 1487年）;開山: 真慧;別称: 本山専修寺、一身田専修寺;文化財: 如来堂、御影堂、西方指南抄、三帖和讃（国宝）木造阿弥陀如来立像など（重要文化財）;公式HP: 真宗高田派本山 専修寺;法人番号: 7190005000763;所在地: 栃木県真岡市高田1482;山号: 高田山;宗派: 真宗高田派;本尊: 善光寺式阿弥陀三尊（一光三尊仏）;創建年: 嘉禄元年（1225年）;開山: 親鸞聖人;別称: 本寺専修寺;文化財: 如来堂、御影堂、楼門、総門など（重要文化財）;公式HP: 真宗高田派　本寺専修寺;法人番号: 7190005000763;所在地: 三重県津市一身田町2819;位置: 北緯34度45分43.42秒東経136度30分12.8秒;山号: 高田山;宗派: 真宗高田派;本尊: 阿弥陀如来（証拠の如来）;創建年: 文明年間（1469年- 1487年）;開山: 真慧;別称: 本山専修寺、一身田専修寺;文化財: 如来堂、御影堂、西方指南抄、三帖和讃（国宝）木造阿弥陀如来立像など（重要文化財）;公式HP: 真宗高田派本山 専修寺;法人番号: 7190005000763","日本の寺院一覧","参照"
"善水寺","","https://ja.wikipedia.org/wiki/善水寺","北緯35度0分23.2秒東経136度6分45.2秒","所在地: 滋賀県湖南市岩根3518;位置: 北緯35度0分23.2秒東経136度6分45.2秒﻿ / ﻿北緯35.006444度 東経136.112556度﻿ / 35.006444; 136.112556座標: 北緯35度0分23.2秒東経136度6分45.2秒﻿ / ﻿北緯35.006444度 東経136.112556度﻿ / 35.006444; 136.112556;山号: 岩根山（いわねさん）;院号: 医王院;宗派: 天台宗;本尊: 薬師如来（重要文化財、秘仏）;創建年: 和銅年間（708年- 715年）;開基: 元明天皇（勅願）;正式名: 岩根山医王院善水寺;札所等: 西国薬師四十九霊場第47番甲賀西国三十三所第21番びわ湖百八霊場第93番湖南三山;文化財: 本堂（国宝）木造薬師如来坐像他8件（重要文化財）;公式HP: 岩根山 国宝 善水寺;法人番号: 9160005002604","日本の寺院一覧","参照"
"浅草寺","","https://ja.wikipedia.org/wiki/浅草寺","北緯35度42分53秒東経139度47分48.3秒","所在地: 東京都台東区浅草二丁目3番1号;位置: 北緯35度42分53秒東経139度47分48.3秒﻿ / ﻿北緯35.71472度 東経139.796750度﻿ / 35.71472; 139.796750座標: 北緯35度42分53秒東経139度47分48.3秒﻿ / ﻿北緯35.71472度 東経139.796750度﻿ / 35.71472; 139.796750;山号: 金龍山;宗派: 聖観音宗（天台宗系単立）;寺格: 本山;本尊: 聖観世音菩薩（絶対秘仏）;創建年: （伝）推古天皇36年（628年）;開基: （伝）土師中知（真中知）;正式名: 金龍山淺草寺金龍山浅草寺;別称: 浅草観音、浅草の観音様;札所等: 坂東三十三箇所13番江戸三十三箇所1番;文化財: 法華経（国宝）二天門・伝法院・元版一切経（重要文化財）;法人番号: 2010505000327","日本の寺院一覧","参照"
"善通寺","","https://ja.wikipedia.org/wiki/善通寺","北緯34度13分30.4秒東経133度46分26.9秒","所在地: 香川県善通寺市善通寺町三丁目3番1号;位置: 北緯34度13分30.4秒東経133度46分26.9秒座標: 北緯34度13分30.4秒 東経133度46分26.9秒;山号: 屏風浦五岳山;宗派: 真言宗善通寺派;寺格: 総本山;本尊: 薬師如来;創建年: （伝）大同2年（807年）;開基: 佐伯善通;正式名: 屏風浦五岳山 誕生院 善通寺;札所等: 四国八十八箇所75番真言宗十八本山1番讃岐三十三観音礼参本山;文化財: 金銅錫杖頭・一字一仏法華経序品（国宝）金堂、五重塔ほか（重要文化財）;公式HP: 総本山善通寺;法人番号: 3470005002818","日本の寺院一覧","参照"
"善導寺 (久留米市)","","https://ja.wikipedia.org/wiki/善導寺_(久留米市)","北緯33度19分48.1秒東経130度36分13.7秒","所在地: 福岡県久留米市善導寺町飯田550;位置: 北緯33度19分48.1秒東経130度36分13.7秒﻿ / ﻿北緯33.330028度 東経130.603806度﻿ / 33.330028; 130.603806座標: 北緯33度19分48.1秒東経130度36分13.7秒﻿ / ﻿北緯33.330028度 東経130.603806度﻿ / 33.330028; 130.603806;山号: 井上山;宗派: 浄土宗;寺格: 大本山;本尊: 阿弥陀如来;創建年: 建長2年（1191年）;開基: 聖光（弁長）;文化財: 本堂、大門、大庫裏ほか（重要文化財）本朝祖師伝記絵詞、梵鐘（県指定文化財）;公式HP: 大本山善導寺ホームページ;法人番号: 4290005010037","日本の寺院一覧","参照"
"泉涌寺","","https://ja.wikipedia.org/wiki/泉涌寺","北緯34度58分41秒東経135度46分49.2秒","所在地: 京都府京都市東山区泉涌寺山内町27;位置: 北緯34度58分41秒東経135度46分49.2秒座標: 北緯34度58分41秒 東経135度46分49.2秒;山号: 東山（とうざん）泉山（せんざん）;宗派: 真言宗泉涌寺派;寺格: 総本山;本尊: 釈迦如来阿弥陀如来弥勒如来;創建年: 伝・斉衡3年（856年）;開山: 伝・神修;開基: 伝・藤原緒嗣;別称: 御寺;札所等: 真言宗十八本山第8番洛陽三十三所観音霊場第20番京都十三仏霊場第6番泉山七福神巡り番外;文化財: 泉涌寺勧縁疏・附法状（国宝）大門・仏殿・木造観音菩薩坐像ほか（重要文化財）;公式HP: 御寺 泉涌寺;法人番号: 2130005002225","日本の寺院一覧","参照"
"善福院","","https://ja.wikipedia.org/wiki/善福院","北緯34度7分50.0秒東経135度10分38.1秒","所在地: 和歌山県海南市下津町梅田271;位置: 北緯34度7分50.0秒東経135度10分38.1秒座標: 北緯34度7分50.0秒 東経135度10分38.1秒;山号: 宝遊山;院号: 善福院;宗派: 天台宗もと臨済宗、高野山真言宗;寺格: 臨済宗廣福寺（廣福禪寺）の塔頭;本尊: 釈迦如来;創建年: 建保3年（1215年）;開山: 栄西;正式名: 宝遊山 広福寺 善福院 釈迦堂寶遊山廣福寺善福院釋迦堂;文化財: 釈迦堂（国宝）;法人番号: 6170005002267","日本の寺院一覧","参照"
"禅瀧寺","","https://ja.wikipedia.org/wiki/禅瀧寺","北緯34度53分53.96秒東経135度1分6.24秒","所在地: 兵庫県加東市栄枝72;位置: 北緯34度53分53.96秒東経135度1分6.24秒;山号: 神谷山;宗派: 高野山真言宗;本尊: 薬師如来（秘仏）;創建年: 伝・大化年間（645年- 650年）;開基: 伝・法道;中興年: 明治14年（1881年）;中興: 瀧見常;別称: お大師さん（おだいっさん）曼珠沙華の寺;札所等: 播磨八薬師霊場6番加東四国八十八カ所霊場73番;文化財: 本堂（市文化財）、不動明王像（市文化財）、大般若経及び経櫃、経箱、経軸（市文化財）、弁天堂（市文化財）;公式HP: 神谷山禅瀧寺;法人番号: 6140005016740","日本の寺院一覧","参照"
"禅林寺 (京都市)","","https://ja.wikipedia.org/wiki/禅林寺_(京都市)","北緯35度0分52.29秒東経135度47分43.05秒","所在地: 京都府京都市左京区永観堂町48番地;位置: 北緯35度0分52.29秒東経135度47分43.05秒﻿ / ﻿北緯35.0145250度 東経135.7952917度﻿ / 35.0145250; 135.7952917座標: 北緯35度0分52.29秒東経135度47分43.05秒﻿ / ﻿北緯35.0145250度 東経135.7952917度﻿ / 35.0145250; 135.7952917;山号: 聖衆来迎山;院号: 無量寿院;宗派: 浄土宗西山禅林寺派;寺格: 総本山;本尊: 阿弥陀如来（重要文化財）;創建年: 仁寿3年（853年）;開基: 真紹;正式名: 聖衆來迎山無量壽院禪林寺;別称: 永観堂;札所等: 洛陽六阿弥陀めぐり第2番法然上人二十五霊跡縁故本山（番外）西山国師遺跡霊場第8番;文化財: 山越阿弥陀図、金銅蓮華文磬（国宝）木造阿弥陀如来立像、絹本著色薬師如来像ほか（重要文化財）;公式HP: 永観堂(Eikando,Kyoto);法人番号: 6130005000539","日本の寺院一覧","参照"
"節を編集: そ","","https://ja.wikipedia.org/w/index.php?title=日本の寺院一覧&amp;action=edit&amp;section=15","","","日本の寺院一覧","参照"
"總持寺 (足立区)","","https://ja.wikipedia.org/wiki/總持寺_(足立区)","北緯35度46分48.5秒東経139度46分48.0秒","所在地: 東京都足立区西新井一丁目15番1号;位置: 北緯35度46分48.5秒東経139度46分48.0秒座標: 北緯35度46分48.5秒 東経139度46分48.0秒;山号: 五智山（ごちさん）[1];院号: 遍照院[1];宗派: 真言宗豊山派;本尊: 十一面観世音菩薩、弘法大師[2];創建年: 伝・天長3年（826年）;開基: 伝・空海[1];正式名: 五智山 遍照院 總持寺;別称: 西新井大師、火伏せの大師、ボタン大師、お大師さま;札所等: 関東三大師関東八十八箇所特別霊場関東三十六不動26番東国花の寺百ヶ寺 東京1番;文化財: 鋳銅刻画蔵王権現像（国宝、東京国立博物館寄託）絹本著色弘法大師像、銅鐘ほか（重要文化財）;法人番号: 6011805000161","日本の寺院一覧","参照"
"總持寺","","https://ja.wikipedia.org/wiki/總持寺","北緯35度30分25.16秒東経139度40分17.25秒","所在地: 神奈川県横浜市鶴見区鶴見二丁目1番1号;位置: 北緯35度30分25.16秒東経139度40分17.25秒﻿ / ﻿北緯35.5069889度 東経139.6714583度﻿ / 35.5069889; 139.6714583座標: 北緯35度30分25.16秒東経139度40分17.25秒﻿ / ﻿北緯35.5069889度 東経139.6714583度﻿ / 35.5069889; 139.6714583;山号: 諸嶽山;宗旨: 曹洞宗;寺格: 大本山;本尊: 釈迦如来;創建年: 伝・奈良時代;開基: 伝・行基;中興年: 移転：明治44年（1911年）;中興: 移転：石川素童;札所等: 東海三十三観音霊場鶴見七福神京浜四大本山;文化財: 絹本著色紹瑾和尚像（重文）ほか;公式HP: 曹洞宗大本山總持寺;法人番号: 3020005000313","日本の寺院一覧","参照"
"総持寺 (茨木市)","","https://ja.wikipedia.org/wiki/総持寺_(茨木市)","北緯34度49分44.77秒東経135度34分53.65秒","所在地: 大阪府茨木市総持寺1丁目6番1号;位置: 北緯34度49分44.77秒東経135度34分53.65秒座標: 北緯34度49分44.77秒 東経135度34分53.65秒;山号: 補陀洛山;宗派: 高野山真言宗;本尊: 千手観音;創建年: 元慶3年（879年）頃;開基: 藤原山蔭;正式名: 補陀洛山 総持寺;札所等: 西国三十三所第22番摂津国八十八箇所第47番摂津国三十三箇所第27番ぼけ封じ近畿十楽観音霊場第6番神仏霊場巡拝の道第63番;文化財: 本堂・薬師金堂・仁王門など（市指定文化財）;法人番号: 3120905000071","日本の寺院一覧","参照"
"総持寺 (和歌山市)","","https://ja.wikipedia.org/wiki/総持寺_(和歌山市)","北緯34度15分11.2秒東経135度9分38.1秒","所在地: 和歌山県和歌山市梶取86番地;位置: 北緯34度15分11.2秒東経135度9分38.1秒座標: 北緯34度15分11.2秒 東経135度9分38.1秒;山号: 梶取本山;宗派: 浄土宗西山派;創建年: 1450年;開基: 明秀光雲;文化財: 絹本著色釈迦三尊像（重要文化財）総門、本堂、鐘楼（和歌山県指定文化財）他;法人番号: 9170005000549","日本の寺院一覧","参照"
"惣宗寺","","https://ja.wikipedia.org/wiki/惣宗寺","北緯36度18分39.32秒東経139度34分16.85秒","所在地: 栃木県佐野市金井上町2233;位置: 北緯36度18分39.32秒東経139度34分16.85秒座標: 北緯36度18分39.32秒 東経139度34分16.85秒;宗派: 天台宗;本尊: 如意輪観音元三大師;創建年: 天慶7年（944年）;開基: 藤原秀郷;正式名: 春日岡山転法輪院惣宗官寺;別称: 佐野厄除け大師;札所等: 関東三大師;法人番号: 4060005006941","日本の寺院一覧","参照"
"増上寺","","https://ja.wikipedia.org/wiki/増上寺","北緯35度39分26.7秒東経139度44分53.8秒","所在地: 東京都港区芝公園4丁目7番35号;位置: 北緯35度39分26.7秒東経139度44分53.8秒座標: 北緯35度39分26.7秒 東経139度44分53.8秒;山号: 三縁山（さんえんざん）;宗旨: 浄土宗;宗派: 鎮西派;寺格: 大本山;本尊: 阿弥陀如来;創建年: 明徳4年（1393年）;開基: 聖聡;正式名: 三縁山 広度院 増上寺;札所等: 江戸三十三箇所21番;文化財: 三解脱門、紙本著色法然上人絵伝ほか（重要文化財）徳川家霊廟;公式HP: 増上寺 公式ホームページ （日本語）;法人番号: 7010405001420","日本の寺院一覧","参照"
"増善寺","","https://ja.wikipedia.org/wiki/増善寺","北緯35度0分4.3秒東経138度20分40.4秒","所在地: 静岡県静岡市葵区慈悲尾302;位置: 北緯35度0分4.3秒東経138度20分40.4秒座標: 北緯35度0分4.3秒 東経138度20分40.4秒;山号: 慈悲山;宗派: 曹洞宗;本尊: 地蔵菩薩;創建年: 天武天皇10年（681年）;開基: 今川氏親;正式名: 慈悲山 増善寺;札所等: 駿河三十三箇所16番;文化財: 今川氏親公木木造今川氏親頌徳碑今川氏親文学碑今川家霊廟;法人番号: 9080005000401","日本の寺院一覧","参照"
"崇福寺 (長崎市)","","https://ja.wikipedia.org/wiki/崇福寺_(長崎市)","北緯32度44分32.1秒東経129度53分1.2秒","所在地: 長崎県長崎市鍛冶屋町;位置: 北緯32度44分32.1秒東経129度53分1.2秒座標: 北緯32度44分32.1秒 東経129度53分1.2秒;山号: 聖寿山;宗派: 黄檗宗;創建年: 寛永6年（1629年）;開基: 超然;文化財: 大雄宝殿・第一峰門（国宝）三門・鐘鼓楼・護法堂・媽姐門他（重文）;法人番号: 7310005000420","日本の寺院一覧","参照"
"節を編集: た","","https://ja.wikipedia.org/w/index.php?title=日本の寺院一覧&amp;action=edit&amp;section=16","","","日本の寺院一覧","参照"
"大安寺","","https://ja.wikipedia.org/wiki/大安寺","北緯34度40分4.8秒東経135度48分45.8秒","所在地: 奈良県奈良市大安寺2丁目18-1;位置: 北緯34度40分4.8秒東経135度48分45.8秒﻿ / ﻿北緯34.668000度 東経135.812722度﻿ / 34.668000; 135.812722座標: 北緯34度40分4.8秒東経135度48分45.8秒﻿ / ﻿北緯34.668000度 東経135.812722度﻿ / 34.668000; 135.812722;山号: 無し;宗派: 高野山真言宗;本尊: 十一面観音;創建年: 伝・飛鳥時代;開基: 伝・舒明天皇;札所等: 大和十三仏霊場第13番神仏霊場巡拝の道第17番（奈良第4番）聖徳太子霊跡第23番大和北部八十八ヶ所霊場第1・2番南都七大寺;文化財: 十一面観音立像・馬頭観音立像・不空羂索観音立像ほか（重要文化財）;公式HP: 病気平癒・癌封じの祈祷やお守り 奈良県のお寺｜大安寺 南都七大寺;法人番号: 3150005000283","日本の寺院一覧","参照"
"大雲寺 (京都市)","","https://ja.wikipedia.org/wiki/大雲寺_(京都市)","北緯35度4分48秒東経135度46分56秒","所在地: 京都府京都市左京区岩倉上蔵町305;位置: 北緯35度4分48秒東経135度46分56秒座標: 北緯35度4分48秒 東経135度46分56秒;山号: 紫雲山石座山;宗旨: 天台證門宗;寺格: 総本山;本尊: 十一面観音(秘仏);創建年: 天禄2年 (971年);開山: 真覚;公式HP: 京都 大雲寺公式ホームページ;法人番号: 2130005001788","日本の寺院一覧","参照"
"大雄寺 (大田原市)","","https://ja.wikipedia.org/wiki/大雄寺_(大田原市)","","所在地: 栃木県大田原市黒羽田町450;山号: 黒羽山;宗派: 曹洞宗;本尊: 釈迦如来坐像;創建年: 応永11年（1404年）;札所等: 東国花の寺百ヶ寺 栃木11番;文化財: 本堂、禅堂、庫裏、鐘楼、経蔵、総門、廻廊 3棟（重要文化財）御霊屋（県文化財）;法人番号: 6060005004539","日本の寺院一覧","参照"
"大覚寺","","https://ja.wikipedia.org/wiki/大覚寺","北緯35度1分41.65秒東経135度40分39.87秒","所在地: 京都府京都市右京区嵯峨大沢町4;位置: 北緯35度1分41.65秒東経135度40分39.87秒﻿ / ﻿北緯35.0282361度 東経135.6777417度﻿ / 35.0282361; 135.6777417座標: 北緯35度1分41.65秒東経135度40分39.87秒﻿ / ﻿北緯35.0282361度 東経135.6777417度﻿ / 35.0282361; 135.6777417;山号: 嵯峨山;宗派: 真言宗大覚寺派;寺格: 大本山;本尊: 五大明王（重要文化財）;創建年: 貞観18年（876年）;開基: 嵯峨天皇;正式名: 旧嵯峨御所大覚寺門跡;別称: 大覚寺門跡、旧嵯峨御所;札所等: 真言宗十八本山5番近畿三十六不動尊13番神仏霊場巡拝の道第89番;文化財: 後宇多天皇宸翰御手印遺告、後宇多天皇宸翰弘法大師伝（国宝）正寝殿、絹本著色五大虚空蔵像、木造五大明王像5躯ほか（重要文化財）御所跡（史跡）大沢池、附名古曽滝跡（名勝）;法人番号: 6130005002238","日本の寺院一覧","参照"
"泰岳寺","","https://ja.wikipedia.org/wiki/泰岳寺","北緯35度13分49.92秒東経136度59分2.19秒","所在地: 愛知県春日井市上条町10-198;位置: 北緯35度13分49.92秒東経136度59分2.19秒座標: 北緯35度13分49.92秒 東経136度59分2.19秒;山号: 寶雲山;宗派: 臨済宗妙心寺派;本尊: 聖観世音菩薩;創建年: 文明18年（1486年）;開山: 仁済宗恕;開基: 林重緒;公式HP: 禅宗 臨済宗妙心寺派 寶雲山泰岳寺;法人番号: 3180005008134","日本の寺院一覧","参照"
"退耕庵","","https://ja.wikipedia.org/wiki/退耕庵","","","日本の寺院一覧","参照"
"醍醐寺","","https://ja.wikipedia.org/wiki/醍醐寺","北緯34度57分5.4秒東経135度49分18.4秒","所在地: 京都府京都市伏見区醍醐東大路町22;位置: 北緯34度57分5.4秒東経135度49分18.4秒﻿ / ﻿北緯34.951500度 東経135.821778度﻿ / 34.951500; 135.821778座標: 北緯34度57分5.4秒東経135度49分18.4秒﻿ / ﻿北緯34.951500度 東経135.821778度﻿ / 34.951500; 135.821778;山号: 醍醐山深雪山（上醍醐寺）;宗派: 真言宗醍醐派;寺格: 総本山;本尊: 薬師如来（重要文化財）;創建年: 貞観16年（874年）;開山: 聖宝;札所等: 西国三十三所第11番（上醍醐）真言宗十八本山第12番近畿三十六不動尊霊場第23番（上醍醐）西国薬師四十九霊場第39番役行者霊蹟札所神仏霊場巡拝の道第126番（京都46番）;文化財: 醍醐寺境内（史跡）金堂、五重塔、木造薬師如来及両脇侍像ほか（国宝）清滝宮本殿、絹本著色阿弥陀三尊像、木造薬師如来及両脇侍像ほか（重要文化財）三宝院庭園（特別史跡、特別名勝）世界遺産;法人番号: 6130005002163","日本の寺院一覧","参照"
"大国寺 (丹波篠山市)","","https://ja.wikipedia.org/wiki/大国寺_(丹波篠山市)","北緯35度3分57.9秒東経135度8分51.3秒","所在地: 兵庫県丹波篠山市味間奥;位置: 北緯35度3分57.9秒東経135度8分51.3秒座標: 北緯35度3分57.9秒 東経135度8分51.3秒;山号: 安泰山;宗派: 天台宗;本尊: 大日如来坐像;創建年: （伝）大化年間（645年- 650年）;開基: （伝）法道仙人;文化財: 木造大日如来坐像（本尊）・木造大日如来坐像・木造阿弥陀如来坐像、木造持国天立像、木造増長天立像、本堂（重要文化財）;法人番号: 7140005008729","日本の寺院一覧","参照"
"太山寺 (神戸市)","","https://ja.wikipedia.org/wiki/太山寺_(神戸市)","北緯34度41分46.8秒東経135度4分2.1秒","所在地: 兵庫県神戸市西区伊川谷町前開224;位置: 北緯34度41分46.8秒東経135度4分2.1秒座標: 北緯34度41分46.8秒 東経135度4分2.1秒;山号: 三身山（さんしんざん）;宗派: 天台宗;本尊: 薬師如来、十一面観音;創建年: 霊亀2年（716年）;開山: 定恵（勧請開山）;開基: 藤原宇合、元正天皇（勅願）;札所等: 新西国三十三箇所第25番神戸十三仏霊場第4番神戸六地蔵第1番播州薬師霊場第1番明石西国観音霊場第23番（龍象院）・第26番;文化財: 本堂（国宝）仁王門、阿弥陀如来坐像ほか（重要文化財）;公式HP: 三身山「太山寺」;法人番号: 7140005001031","日本の寺院一覧","参照"
"大慈寺 (栃木市)","","https://ja.wikipedia.org/wiki/大慈寺_(栃木市)","","所在地: 栃木県栃木市岩舟町小野寺2247番地;山号: 小野寺山;宗派: 天台宗準別格本山;創建年: （伝）737年（天平9年）;開基: （伝）行基;文化財: 相輪橖銅製華鬘銅造聖観音菩薩坐像（栃木県指定文化財）手香炉慈覚大師堂ほか（市指定）;法人番号: 1060005005938","日本の寺院一覧","参照"
"大樹寺","","https://ja.wikipedia.org/wiki/大樹寺","北緯34度59分3.86秒東経137度9分55.09秒","所在地: 愛知県岡崎市鴨田町広元5-1;位置: 北緯34度59分3.86秒東経137度9分55.09秒座標: 北緯34度59分3.86秒 東経137度9分55.09秒;山号: 成道山（じょうどうさん）;宗派: 浄土宗;本尊: 一光千体阿弥陀如来、如意輪観世音菩薩;創建年: 天文4年（1535年）;開基: 松平親忠;正式名: 成道山 松安院 大樹寺;札所等: 三河三十三観音3番三河新四国八十八ヶ所霊場21番・22番（成道閣）;文化財: 多宝塔、絹本墨画淡彩如意輪観音図、大方丈障壁画（重要文化財）山門、木造阿弥陀如来坐像、絹本著色山越阿弥陀如来図ほか（愛知県指定文化財）;法人番号: 5180305000350","日本の寺院一覧","参照"
