"タイトル","コメント","URLアドレス","座標","詳細情報","親リスト","一覧抽出方法","前文"
"高島町駅","高島町駅（たかしまちょうえき）","https://ja.wikipedia.org/wiki/高島町駅","北緯35度27分30.9秒東経139度37分25.5秒","所在地: 横浜市西区花咲町7丁目41番地北緯35度27分30.9秒東経139度37分25.5秒﻿ / ﻿北緯35.458583度 東経139.623750度﻿ / 35.458583; 139.623750﻿ (高島町駅)座標: 北緯35度27分30.9秒東経139度37分25.5秒﻿ / ﻿北緯35.458583度 東経139.623750度﻿ / 35.458583; 139.623750﻿ (高島町駅);駅番号: B19;所属事業者: 横浜市交通局（横浜市営地下鉄）;所属路線: ■ブルーライン（3号線）;キロ程: 1.9km（関内*起点）湘南台から21.6 km;駅構造: 地下駅;ホーム: 1面2線;乗車人員-統計年度-: 5,319人/日（降車客含まず）-2019年-;乗降人員-統計年度-: 10,680人/日-2019年-;開業年月日: 1976年（昭和51年）9月4日;備考: 業務委託駅（横浜市交通局協力会);1:  ブルーライン;2: 横浜・あざみ野方面;所在地: 横浜市西区高島二丁目北緯35度27分38秒東経139度37分22.5秒﻿ / ﻿北緯35.46056度 東経139.622917度﻿ / 35.46056; 139.622917﻿ (旧・東急 高島町駅);所属事業者: 東京急行電鉄（東急）;所属路線: ■東横線;キロ程: 25.0 km（渋谷起点）;駅構造: 高架駅;ホーム: 1面2線;乗降人員-統計年度-: 9,433人/日-2003年-;開業年月日: 1928年（昭和3年）5月18日;廃止年月日: 2004年（平成16年）1月31日;1: ■東横線;2: 上り;1: 8・9・26・58・102・103・105;2: 8;3: 101;4: 101;所在地: 横浜市西区花咲町7丁目41番地北緯35度27分30.9秒東経139度37分25.5秒﻿ / ﻿北緯35.458583度 東経139.623750度﻿ / 35.458583; 139.623750﻿ (高島町駅)座標: 北緯35度27分30.9秒東経139度37分25.5秒﻿ / ﻿北緯35.458583度 東経139.623750度﻿ / 35.458583; 139.623750﻿ (高島町駅);駅番号: B19;所属事業者: 横浜市交通局（横浜市営地下鉄）;所属路線: ■ブルーライン（3号線）;キロ程: 1.9km（関内*起点）湘南台から21.6 km;駅構造: 地下駅;ホーム: 1面2線;乗車人員-統計年度-: 5,319人/日（降車客含まず）-2019年-;乗降人員-統計年度-: 10,680人/日-2019年-;開業年月日: 1976年（昭和51年）9月4日;備考: 業務委託駅（横浜市交通局協力会);1:  ブルーライン;2: 横浜・あざみ野方面;所在地: 横浜市西区高島二丁目北緯35度27分38秒東経139度37分22.5秒﻿ / ﻿北緯35.46056度 東経139.622917度﻿ / 35.46056; 139.622917﻿ (旧・東急 高島町駅);所属事業者: 東京急行電鉄（東急）;所属路線: ■東横線;キロ程: 25.0 km（渋谷起点）;駅構造: 高架駅;ホーム: 1面2線;乗降人員-統計年度-: 9,433人/日-2003年-;開業年月日: 1928年（昭和3年）5月18日;廃止年月日: 2004年（平成16年）1月31日;1: ■東横線;2: 上り;1: 8・9・26・58・102・103・105;2: 8;3: 101;4: 101","日本の鉄道駅一覧_た","箇条書き","当駅周辺地区（みなとみらい地区）は、横浜市における都心（ツインコア）の一つである「横浜都心」に指定されている。"
"高城駅","高城駅（たかじょうえき）","https://ja.wikipedia.org/wiki/高城駅","北緯33度14分33.81秒東経131度39分18.75秒","所在地: 大分県大分市高城新町219北緯33度14分33.81秒東経131度39分18.75秒﻿ / ﻿北緯33.2427250度 東経131.6552083度﻿ / 33.2427250; 131.6552083;所属事業者: 九州旅客鉄道（JR九州）;所属路線: ■日豊本線;キロ程: 138.0 km（小倉起点）;電報略号: タウ;駅構造: 地上駅;ホーム: 1面2線;乗車人員-統計年度-: 1,719人/日（降車客含まず）-2019年-;開業年月日: 1914年（大正3年）4月1日;備考: 業務委託駅POS端末設置;1: ■日豊本線;2: 上り","日本の鉄道駅一覧_た","箇条書き","島式ホーム1面2線の設備を有する地上駅。ホームの端に駅舎があり、そこから跨線橋で外部に出る。駅本屋は開業時より駅北側（現在の北口）の地上にあったが、2002年のサッカーワールドカップの開催に合わせて移転改築された。駅舎は大分スタジアムをイメージした駅舎で、屋根上にはサッカーボールのオブジェがある。駅本屋に多目的トイレ（車椅子対応）が設備されている。"
"多賀城駅","多賀城駅（たがじょうえき）","https://ja.wikipedia.org/wiki/多賀城駅","北緯38度17分30.29秒東経141度0分22.55秒","所在地: 宮城県多賀城市中央二丁目7-1北緯38度17分30.29秒東経141度0分22.55秒﻿ / ﻿北緯38.2917472度 東経141.0062639度﻿ / 38.2917472; 141.0062639﻿ (多賀城駅)座標: 北緯38度17分30.29秒東経141度0分22.55秒﻿ / ﻿北緯38.2917472度 東経141.0062639度﻿ / 38.2917472; 141.0062639﻿ (多賀城駅);所属事業者: 東日本旅客鉄道（JR東日本）;所属路線: ■仙石線;キロ程: 12.6 km（あおば通起点）;電報略号: タウ;駅構造: 高架駅;ホーム: 2面3線;乗車人員-統計年度-: 4,892人/日（降車客含まず）-2020年-;開業年月日: 1925年（大正14年）6月5日;備考: 直営駅（管理駅）みどりの窓口有;1・2: ■仙石線;3: 下り","日本の鉄道駅一覧_た","箇条書き","仙石線の前身である宮城電気鉄道は1925年（大正14年）6月5日に仙台駅から西塩釜駅まで路線を開通させた。多賀城駅はこの時に同時に開業したものである。当時、駅前に砂押川を利用した遊園地が設けられたり、また納涼盆踊り大会が開かれたりして賑わったという。宮城電気鉄道は貨物の運搬も行う鉄道で、多賀城駅は貨物取扱駅だった。年によって貨物の取扱量には著しい差があり、当時の多賀城村の社会情勢や経済状況がそのまま駅の貨物量に反映したのだろうと言われる。"
"高須駅","高須駅（たかすえき・広島電鉄宮島線）","https://ja.wikipedia.org/wiki/高須駅","北緯34度23分23.41秒東経132度25分1.28秒","所在地: 広島市西区庚午北三丁目11-1北緯34度23分23.41秒東経132度25分1.28秒﻿ / ﻿北緯34.3898361度 東経132.4170222度﻿ / 34.3898361; 132.4170222﻿ (高須駅)座標: 北緯34度23分23.41秒東経132度25分1.28秒﻿ / ﻿北緯34.3898361度 東経132.4170222度﻿ / 34.3898361; 132.4170222﻿ (高須駅);駅番号: ●M21;所属事業者: 広島電鉄;所属路線: ■宮島線;キロ程: 1.4 km（広電西広島起点）;駅構造: 地上駅;ホーム: 2面2線;乗車人員-統計年度-: 1,511人/日（降車客含まず）-2019年-;開業年月日: 1922年（大正11年）8月22日;備考: 1日当たりの乗車人員は、年間乗車人員を日数で除することで算出した参考値","日本の鉄道駅一覧_た","箇条書き","高須駅は宮島線が1922年（大正11年）に営業を開始した際に開設された。開業当時の路線は己斐町から草津町までの2.8キロメートルあまりで、当駅は古江駅とともに中間駅として設けられた。"
"高須停留場","高須停留場（たかすていりゅうじょう・とさでん交通後免線）","https://ja.wikipedia.org/wiki/高須停留場","北緯33度33分33.69秒東経133度34分37.19秒","所在地: 高知県高知市高須本町北緯33度33分33.69秒東経133度34分37.19秒﻿ / ﻿北緯33.5593583度 東経133.5769972度﻿ / 33.5593583; 133.5769972﻿ (高須停留場);所属事業者: とさでん交通;所属路線: 後免線;キロ程: 7.6 km（後免町起点）;駅構造: 地上駅;ホーム: 2面2線;開業年月日: 1910年（明治43年）10月15日","日本の鉄道駅一覧_た","箇条書き","高須停留場は1910年（明治43年）、後免線の葛島橋西詰停留場から鹿児停留場までの区間が開通したのに合わせて開業した。1942年（昭和17年）に停留場は一度休止されたが、10年後に復活している。"
"高須神社停留場","高須神社停留場（たかすじんしゃていりゅうじょう）","https://ja.wikipedia.org/wiki/高須神社停留場","北緯34度35分26.36秒東経135度29分7.06秒","所在地: 堺市堺区北旅籠町東2丁北緯34度35分26.36秒東経135度29分7.06秒﻿ / ﻿北緯34.5906556度 東経135.4852944度﻿ / 34.5906556; 135.4852944座標: 北緯34度35分26.36秒東経135度29分7.06秒﻿ / ﻿北緯34.5906556度 東経135.4852944度﻿ / 34.5906556; 135.4852944;駅番号:  HN17;所属事業者: 阪堺電気軌道;所属路線: ■阪堺線;キロ程: 7.3km（恵美須町起点）天王寺駅前から7.1 km;駅構造: 地上駅;ホーム: 相対式 2面2線;開業年月日: 1911年（明治44年）12月1日","日本の鉄道駅一覧_た","箇条書き","「神社」の読みは「じんじゃ」ではなく「じんしゃ」であり、車内アナウンスでもそのように放送されるが、由来は不明である。"
"高瀬駅 (山形県)","高瀬駅 (山形県)（たかせえき・東日本旅客鉄道仙山線）","https://ja.wikipedia.org/wiki/高瀬駅_(山形県)","北緯38度18分5.54秒東経140度23分45.65秒","所在地: 山形県山形市大字下東山132北緯38度18分5.54秒東経140度23分45.65秒﻿ / ﻿北緯38.3015389度 東経140.3960139度﻿ / 38.3015389; 140.3960139座標: 北緯38度18分5.54秒東経140度23分45.65秒﻿ / ﻿北緯38.3015389度 東経140.3960139度﻿ / 38.3015389; 140.3960139;所属事業者: 東日本旅客鉄道（JR東日本）;所属路線: ■仙山線;キロ程: 52.4 km（仙台起点）;電報略号: タセ;駅構造: 地上駅;ホーム: 1面1線;乗車人員-統計年度-: 68人/日（降車客含まず）-2004年-;開業年月日: 1950年（昭和25年）7月1日;備考: 無人駅","日本の鉄道駅一覧_た","箇条書き","単式ホーム1面1線を有する地上駅。"
"高瀬駅 (香川県)","高瀬駅 (香川県)（たかせえき・四国旅客鉄道予讃線）","https://ja.wikipedia.org/wiki/高瀬駅_(香川県)","北緯34度11分2.7秒東経133度42分41.03秒","所在地: 香川県三豊市高瀬町新名字松下715番地3北緯34度11分2.7秒東経133度42分41.03秒﻿ / ﻿北緯34.184083度 東経133.7113972度﻿ / 34.184083; 133.7113972座標: 北緯34度11分2.7秒東経133度42分41.03秒﻿ / ﻿北緯34.184083度 東経133.7113972度﻿ / 34.184083; 133.7113972;駅番号: ○Y16;所属事業者: 四国旅客鉄道（JR四国）;所属路線: ■予讃線;キロ程: 47.0 km（高松起点）;電報略号: タセ;駅構造: 地上駅;ホーム: 1面2線;乗車人員-統計年度-: 632人/日（降車客含まず）-2019年-;開業年月日: 1913年（大正2年）12月20日;備考: 直営駅POS端末設置;1・2: ■予讃線","日本の鉄道駅一覧_た","箇条書き","駅番号はY16、駅表示パネルのコメントは「茶畑が緑に輝く駅」である。"
"高田駅 (神奈川県)","高田駅 (神奈川県)（たかたえき・横浜市営地下鉄グリーンライン）","https://ja.wikipedia.org/wiki/高田駅_(神奈川県)","北緯35度32分58.6秒東経139度37分12.5秒","所在地: 神奈川県横浜市港北区高田東三丁目1番3号北緯35度32分58.6秒東経139度37分12.5秒﻿ / ﻿北緯35.549611度 東経139.620139度﻿ / 35.549611; 139.620139﻿ (高田駅)座標: 北緯35度32分58.6秒東経139度37分12.5秒﻿ / ﻿北緯35.549611度 東経139.620139度﻿ / 35.549611; 139.620139﻿ (高田駅);駅番号: G08;所属事業者: 横浜市交通局（横浜市営地下鉄）;所属路線: ■グリーンライン（4号線）;キロ程: 10.3 km（中山起点）;駅構造: 地下駅;ホーム: 2層式2面2線;乗車人員-統計年度-: 8,228人/日（降車客含まず）-2019年-;乗降人員-統計年度-: 16,305人/日-2019年-;開業年月日: 2008年（平成20年）3月30日;備考: 業務委託駅（横浜市交通局協力会）;1:  グリーンライン;2: 日吉方面;高田駅（バスターミナル）: 1番;高田駅前: A","日本の鉄道駅一覧_た","箇条書き",""
"高田駅 (香川県)","高田駅 (香川県)（たかたえき・高松琴平電気鉄道長尾線）","https://ja.wikipedia.org/wiki/高田駅_(香川県)","北緯34度17分18.6秒東経134度6分44秒","所在地: 香川県高松市亀田町字金崎380番地6北緯34度17分18.6秒東経134度6分44秒﻿ / ﻿北緯34.288500度 東経134.11222度﻿ / 34.288500; 134.11222座標: 北緯34度17分18.6秒東経134度6分44秒﻿ / ﻿北緯34.288500度 東経134.11222度﻿ / 34.288500; 134.11222;駅番号:  N09;所属事業者: 高松琴平電気鉄道;所属路線: ■長尾線;キロ程: 8.3km（瓦町起点）高松築港から10.0 km;駅構造: 地上駅;ホーム: 2面2線;乗降人員-統計年度-: 1,407人/日-2018年-;開業年月日: 1912年（明治45年）4月30日;1: ■長尾線;2: 下り","日本の鉄道駅一覧_た","箇条書き","↑西前田駅"
"高田駅 (福岡県)","高田駅 (福岡県)（たかたえき・甘木鉄道甘木線）","https://ja.wikipedia.org/wiki/高田駅_(福岡県)","北緯33度24分51.1秒東経130度38分1.5秒","所在地: 福岡県朝倉郡筑前町高田北緯33度24分51.1秒東経130度38分1.5秒﻿ / ﻿北緯33.414194度 東経130.633750度﻿ / 33.414194; 130.633750座標: 北緯33度24分51.1秒東経130度38分1.5秒﻿ / ﻿北緯33.414194度 東経130.633750度﻿ / 33.414194; 130.633750;所属事業者: ■甘木鉄道;所属路線: ■甘木鉄道甘木線;キロ程: 11.8 km（基山起点）;電報略号: チタ（転換前）;駅構造: 地上駅;ホーム: 1面1線;乗車人員-統計年度-: 73人/日（降車客含まず）-2018年-;開業年月日: 1960年（昭和35年）11月1日;備考: 無人駅","日本の鉄道駅一覧_た","箇条書き","単式ホーム1面1線を有する地上駅。無人駅となっている。駅舎はなく、トイレあり。"
"高田駅 (新潟県)","高田駅 (新潟県)（たかだえき・えちごトキめき鉄道妙高はねうまライン）","https://ja.wikipedia.org/wiki/高田駅_(新潟県)","北緯37度6分54.49秒東経138度14分31.77秒","所在地: 新潟県上越市仲町四丁目1番1号北緯37度6分54.49秒東経138度14分31.77秒﻿ / ﻿北緯37.1151361度 東経138.2421583度﻿ / 37.1151361; 138.2421583座標: 北緯37度6分54.49秒東経138度14分31.77秒﻿ / ﻿北緯37.1151361度 東経138.2421583度﻿ / 37.1151361; 138.2421583;所属事業者: えちごトキめき鉄道;所属路線: ■妙高はねうまライン;キロ程: 31.0 km（妙高高原起点）長野から68.3 km;電報略号: タタ;駅構造: 地上駅;ホーム: 2面3線;乗車人員-統計年度-: 1,875人/日（降車客含まず）-2020年-;開業年月日: 1886年（明治19年）8月15日;備考: 直営駅マルス端末設置;1: ■妙高はねうまライン;2: 下り;3: （臨時ホーム・主に当駅折り返し）","日本の鉄道駅一覧_た","箇条書き","当駅は江戸時代に高田藩の城下町として栄えた、上越市の高田市街地にある。"
"高田駅 (奈良県)","高田駅 (奈良県)（たかだえき・西日本旅客鉄道和歌山線・桜井線）","https://ja.wikipedia.org/wiki/高田駅_(奈良県)","北緯34度30分58.24秒東経135度44分41.33秒","所在地: 奈良県大和高田市高砂町1北緯34度30分58.24秒東経135度44分41.33秒﻿ / ﻿北緯34.5161778度 東経135.7448139度﻿ / 34.5161778; 135.7448139座標: 北緯34度30分58.24秒東経135度44分41.33秒﻿ / ﻿北緯34.5161778度 東経135.7448139度﻿ / 34.5161778; 135.7448139;所属事業者: 西日本旅客鉄道（JR西日本）;電報略号: タタ;駅構造: 地上駅（橋上駅）;ホーム: 2面3線;乗車人員-統計年度-: 2,192人/日（降車客含まず）-2018年-;開業年月日: 1891年（明治24年）3月1日。;所属路線: T和歌山線;キロ程: 11.5 km（王寺起点）;所属路線: U桜井線（万葉まほろば線）;キロ程: 29.4 km（奈良起点）;備考: 直営駅みどりの窓口有;1・2: T和歌山線;3: T和歌山線","日本の鉄道駅一覧_た","箇条書き","大和高田市の代表駅で、アーバンネットワークエリアに入っており、当駅の所属線である和歌山線に、当駅を終点とする桜井線（万葉まほろば線）を加えた2路線が乗り入れている。桜井線の列車は一部をのぞき和歌山線へ直通する。和歌山線の主要駅で運行上の境界駅になっているので当駅で折り返す列車が多く、当駅始発の関西本線（大和路線）直通の快速・普通列車も運転されている。"
"多賀大社前駅","多賀大社前駅（たがたいしゃまええき）","https://ja.wikipedia.org/wiki/多賀大社前駅","北緯35度13分35.05秒東経136度17分3.27秒","所在地: 滋賀県犬上郡多賀町大字多賀1322北緯35度13分35.05秒東経136度17分3.27秒﻿ / ﻿北緯35.2264028度 東経136.2842417度﻿ / 35.2264028; 136.2842417座標: 北緯35度13分35.05秒東経136度17分3.27秒﻿ / ﻿北緯35.2264028度 東経136.2842417度﻿ / 35.2264028; 136.2842417;駅番号: OR09;所属事業者: 近江鉄道;所属路線: ■多賀線（彦根・多賀大社線）;キロ程: 2.5 km（高宮起点）;駅構造: 地上駅;ホーム: 頭端式 3面2線;乗降人員-統計年度-: 226人/日-2015年-;開業年月日: 1914年（大正4年）3月8日;備考: 無人駅","日本の鉄道駅一覧_た","箇条書き","同線の終着駅で、多賀大社の最寄り駅である。"
"高滝駅","高滝駅（たかたきえき）","https://ja.wikipedia.org/wiki/高滝駅","北緯35度21分11.78秒東経140度9分1.44秒","所在地: 千葉県市原市高滝737-2北緯35度21分11.78秒東経140度9分1.44秒﻿ / ﻿北緯35.3532722度 東経140.1504000度﻿ / 35.3532722; 140.1504000座標: 北緯35度21分11.78秒東経140度9分1.44秒﻿ / ﻿北緯35.3532722度 東経140.1504000度﻿ / 35.3532722; 140.1504000;所属事業者: 小湊鉄道;所属路線: 小湊鉄道線;キロ程: 23.8 km（五井起点）;駅構造: 地上駅;ホーム: 1面1線;乗車人員-統計年度-: 19人/日（降車客含まず）-2019年-;開業年月日: 1925年（大正14年）3月7日;備考: 無人駅","日本の鉄道駅一覧_た","箇条書き","↑上総久保駅"
"高田高校前駅","高田高校前駅（たかたこうこうまええき）","https://ja.wikipedia.org/wiki/高田高校前駅","北緯39度00分59秒東経141度38分24.5秒","所在地: 岩手県陸前高田市高田町字太田北緯39度00分59秒東経141度38分24.5秒﻿ / ﻿北緯39.01639度 東経141.640139度﻿ / 39.01639; 141.640139﻿ (高田高校前駅)座標: 北緯39度00分59秒東経141度38分24.5秒﻿ / ﻿北緯39.01639度 東経141.640139度﻿ / 39.01639; 141.640139﻿ (高田高校前駅);所属事業者: 東日本旅客鉄道（JR東日本）;所属路線: ■大船渡線BRT;キロ程: 24.2km（気仙沼起点）一ノ関から86.2 km;駅構造: 地上駅;乗車人員-統計年度-: 45人/日（降車客含まず）-2020年-;開業年月日: 2015年（平成27年）3月14日;備考: 無人駅","日本の鉄道駅一覧_た","箇条書き","2015年3月14日に、岩手県立高田高等学校の新校舎への移転に合わせて、BRT区間上に新設された駅である。開業当初から鉄道事業における駅ではないため、JR東日本の総駅数には計上されていない。"
"高田市駅","高田市駅（たかだしえき）","https://ja.wikipedia.org/wiki/高田市駅","北緯34度30分24.52秒東経135度44分33.62秒","所在地: 奈良県大和高田市片塩町17-4北緯34度30分24.52秒東経135度44分33.62秒﻿ / ﻿北緯34.5068111度 東経135.7426722度﻿ / 34.5068111; 135.7426722座標: 北緯34度30分24.52秒東経135度44分33.62秒﻿ / ﻿北緯34.5068111度 東経135.7426722度﻿ / 34.5068111; 135.7426722;駅番号:  F24;所属事業者: 近畿日本鉄道（近鉄）;所属路線: F南大阪線;キロ程: 34.2 km（大阪阿部野橋起点）;電報略号: タカ;駅構造: 高架駅（盛土駅）;ホーム: 2面2線;乗車人員-統計年度-: 3,915人/日（降車客含まず）-2018年-;開業年月日: 1929年（昭和4年）3月29日;備考: * 1948年に高田町駅から改称;1: F南大阪線;2: 上り","日本の鉄道駅一覧_た","箇条書き","相対式2面2線ホームを持つ高架駅。ホーム長は8両。改札口は地上にあり、北側の1ヶ所のみ。"
"田県神社前駅","田県神社前駅（たがたじんじゃまええき）","https://ja.wikipedia.org/wiki/田県神社前駅","北緯35度19分3秒東経136度56分38秒","所在地: 愛知県小牧市大字久保一色1052-2北緯35度19分3秒東経136度56分38秒﻿ / ﻿北緯35.31750度 東経136.94389度﻿ / 35.31750; 136.94389座標: 北緯35度19分3秒東経136度56分38秒﻿ / ﻿北緯35.31750度 東経136.94389度﻿ / 35.31750; 136.94389;駅番号: KM  03;所属事業者: 名古屋鉄道;所属路線: 小牧線;キロ程: 13.3 km（上飯田起点）;駅構造: 地上駅;ホーム: 2面2線;乗降人員-統計年度-: 4,767人/日-2019年-;開業年月日: 1931年（昭和6年）4月29日;備考: 特殊勤務駅（駅集中管理システム導入駅）*1965年復活と同時に久保一色より改称;1: KM小牧線;2: 上り","日本の鉄道駅一覧_た","箇条書き","豊年祭で有名な田県神社に最も近い駅であり、当日は数万の人が押し寄せる。旧称：久保一色駅。"
"高田の鉄橋駅","高田の鉄橋駅（たかだのてっきょうえき）","https://ja.wikipedia.org/wiki/高田の鉄橋駅","北緯36度21分9.2秒東経140度34分48.1秒","所在地: 茨城県ひたちなか市横堰9748-2北緯36度21分9.2秒東経140度34分48.1秒﻿ / ﻿北緯36.352556度 東経140.580028度﻿ / 36.352556; 140.580028座標: 北緯36度21分9.2秒東経140度34分48.1秒﻿ / ﻿北緯36.352556度 東経140.580028度﻿ / 36.352556; 140.580028;所属事業者: ひたちなか海浜鉄道;所属路線: 湊線;キロ程: 7.1 km（勝田起点）;駅構造: 地上駅;ホーム: 1面1線;乗車人員-統計年度-: 100人/日（降車客含まず）-2019年-;開業年月日: 2014年（平成26年）10月1日;備考: 無人駅;合 計: 通勤定期;2014年（平成26年）:;2015年（平成27年）:;2016年（平成28年）:;2017年（平成29年）:;2018年（平成30年）:;2019年（令和元年）:","日本の鉄道駅一覧_た","箇条書き","当駅は、ひたちなか市（旧・那珂湊市）の国道245号跨線橋の直下に位置する。湊線では、ひたちなか海浜鉄道発足後に初めて開業した駅である。"
