"タイトル","コメント","URLアドレス","座標","詳細情報","親リスト","一覧抽出方法","前文"
"石神井公園駅","石神井公園駅（しゃくじいこうえんえき）","https://ja.wikipedia.org/wiki/石神井公園駅","北緯35度44分36.8秒東経139度36分25.3秒","所在地: 東京都練馬区石神井町三丁目23番10号北緯35度44分36.8秒東経139度36分25.3秒﻿ / ﻿北緯35.743556度 東経139.607028度﻿ / 35.743556; 139.607028座標: 北緯35度44分36.8秒東経139度36分25.3秒﻿ / ﻿北緯35.743556度 東経139.607028度﻿ / 35.743556; 139.607028;駅番号: SI10;所属事業者: 西武鉄道;所属路線: ■池袋線;キロ程: 10.6km（池袋起点）小竹向原から7.2 km;駅構造: 高架駅;ホーム: 2面4線;乗降人員-統計年度-: 61,897人/日-2020年-;開業年月日: 1915年（大正4年）4月15日;1・2:  池袋線;3・4: 上り","日本の鉄道駅一覧_しや-しん","箇条書き","特急ならびに平日朝ラッシュ時に運行される通勤準急を除いた、全旅客営業列車が停車する。終日にわたって当駅発着の列車が設定されている。"
"市役所駅","市役所駅（しやくしょえき）","https://ja.wikipedia.org/wiki/市役所駅","北緯35度10分54秒東経136度54分19秒","所在地: 名古屋市中区三の丸三丁目1番1号北緯35度10分54秒東経136度54分19秒﻿ / ﻿北緯35.18167度 東経136.90528度﻿ / 35.18167; 136.90528座標: 北緯35度10分54秒東経136度54分19秒﻿ / ﻿北緯35.18167度 東経136.90528度﻿ / 35.18167; 136.90528;駅番号: M07;所属事業者: 名古屋市交通局（名古屋市営地下鉄）;所属路線: 名城線;キロ程: 4.8 km（大曽根起点）;駅構造: 地下駅;ホーム: 1面2線;乗車人員-統計年度-: 21,659人/日（降車客含まず）-2019年-;乗降人員-統計年度-: 43,485人/日-2019年-;開業年月日: 1965年（昭和40年）10月15日;1:  名城線・ 名港線;2:  名城線;所在地: 名古屋市中区三の丸三丁目1番1号北緯35度10分54秒東経136度54分19秒﻿ / ﻿北緯35.18167度 東経136.90528度﻿ / 35.18167; 136.90528座標: 北緯35度10分54秒東経136度54分19秒﻿ / ﻿北緯35.18167度 東経136.90528度﻿ / 35.18167; 136.90528;駅番号: M07;所属事業者: 名古屋市交通局（名古屋市営地下鉄）;所属路線: 名城線;キロ程: 4.8 km（大曽根起点）;駅構造: 地下駅;ホーム: 1面2線;乗車人員-統計年度-: 21,659人/日（降車客含まず）-2019年-;乗降人員-統計年度-: 43,485人/日-2019年-;開業年月日: 1965年（昭和40年）10月15日;1:  名城線・ 名港線;2:  名城線","日本の鉄道駅一覧_しや-しん","箇条書き","名古屋市役所および愛知県庁・名古屋城の最寄駅である。駅名標には通常の漢字表記とローマ字表記に加え、英訳した"City Hall"が表記されているほか、附近の主要施設である「県庁 (Prefectural Office) / 名古屋城 (Nagoya Castle)」も副駅名として表記されているが、路線上で名古屋城の最寄り駅であることを確認する術が無いことから、2022年（令和4年）度を目途に「名古屋城駅」に改称されることになった。"
"市役所前停留場 (北海道)","市役所前停留場 (北海道)（しやくしょまえていりゅうじょう・函館市企業局交通部本線）","https://ja.wikipedia.org/wiki/市役所前停留場_(北海道)","北緯41度46分9.62秒東経140度43分31.45秒","所在地: 北海道函館市大手町12-9先、18-9先北緯41度46分9.62秒東経140度43分31.45秒﻿ / ﻿北緯41.7693389度 東経140.7254028度﻿ / 41.7693389; 140.7254028﻿ (市役所前停留場)座標: 北緯41度46分9.62秒東経140度43分31.45秒﻿ / ﻿北緯41.7693389度 東経140.7254028度﻿ / 41.7693389; 140.7254028﻿ (市役所前停留場);駅番号: DY18;所属事業者: 函館市企業局交通部;所属路線: 函館市電本線;キロ程: 0.3km（函館駅前起点）湯の川より6.8 km;駅構造: 地上駅（停留場）;ホーム: 2面2線;乗降人員-統計年度-: 377人/日-2019年-;開業年月日: 1913年10月30日","日本の鉄道駅一覧_しや-しん","箇条書き",""
"市役所前駅 (千葉県)","市役所前駅 (千葉県)（しやくしょまええき・千葉都市モノレール1号線）","https://ja.wikipedia.org/wiki/市役所前駅_(千葉県)","北緯35度36分25.9秒東経140度6分28秒","所在地: 千葉市中央区千葉港地先道路北緯35度36分25.9秒東経140度6分28秒﻿ / ﻿北緯35.607194度 東経140.10778度﻿ / 35.607194; 140.10778座標: 北緯35度36分25.9秒東経140度6分28秒﻿ / ﻿北緯35.607194度 東経140.10778度﻿ / 35.607194; 140.10778;駅番号: CM02;所属事業者: 千葉都市モノレール;所属路線: ■1号線（■2号線直通含む）;キロ程: 0.7 km（千葉みなと起点）;駅構造: 高架駅;ホーム: 相対式、2面2線;乗車人員-統計年度-: 2,460人/日（降車客含まず）-2018年-;開業年月日: 1995年（平成7年）8月1日;備考: 無人駅;1:  1号線;2: 千葉みなと方面","日本の鉄道駅一覧_しや-しん","箇条書き","相対式ホーム2面2線を持つ高架駅。駅員無配置。千葉市役所と連絡通路でつながっている。"
"市役所前駅 (長野県)","市役所前駅 (長野県)（しやくしょまええき・長野電鉄長野線）","https://ja.wikipedia.org/wiki/市役所前駅_(長野県)","北緯36度38分56.9秒東経138度11分29.3秒","駅番号: N2;所属事業者: 長野電鉄;所属路線: 長野線;キロ程: 0.4 km（長野起点）;電報略号: シヤ;駅構造: 地下駅;ホーム: 2面2線;乗車人員-統計年度-: 593人/日（降車客含まず）-2019年-;開業年月日: 1928年（昭和3年）6月24日;1: ■長野線;2: 上り","日本の鉄道駅一覧_しや-しん","箇条書き","相対式ホーム2面2線を有する地下駅。有人駅である。長野大通りの下に位置し、駅舎のある地下1階には駅務室、宿直室、電気室、機械室があり、ホームは地下2階にある。改札までの地下通路は横断地下道の役割も果たしている。エスカレーターは、2番線（地下2階）から北口の改札のある地下1階の間の上り専用のみ設置されている。"
"市役所前停留場 (愛知県)","市役所前停留場 (愛知県)（しやくしょまえていりゅうじょう・豊橋鉄道東田本線）","https://ja.wikipedia.org/wiki/市役所前停留場_(愛知県)","北緯34度46分2.16秒東経137度23分33.87秒","所在地: 愛知県豊橋市八町通三丁目北緯34度46分2.16秒東経137度23分33.87秒﻿ / ﻿北緯34.7672667度 東経137.3927417度﻿ / 34.7672667; 137.3927417座標: 北緯34度46分2.16秒東経137度23分33.87秒﻿ / ﻿北緯34.7672667度 東経137.3927417度﻿ / 34.7672667; 137.3927417;駅番号:  5;所属事業者: 豊橋鉄道;所属路線: 東田本線;キロ程: 1.4 km（駅前起点）;駅構造: 地上駅;ホーム: 2面2線;開業年月日: 1925年（昭和元年）頃;備考: 営門前駅として開業。","日本の鉄道駅一覧_しや-しん","箇条書き","相対式の上屋付き安全地帯2面2線を持つ。国道1号との併用軌道上にある。"
"市役所前駅 (和歌山県)","市役所前駅 (和歌山県)（しやくしょまええき・紀州鉄道線）","https://ja.wikipedia.org/wiki/市役所前駅_(和歌山県)","北緯33度53分24.14秒東経135度9分10.88秒","所在地: 和歌山県御坊市薗351-2北緯33度53分24.14秒東経135度9分10.88秒﻿ / ﻿北緯33.8900389度 東経135.1530222度﻿ / 33.8900389; 135.1530222座標: 北緯33度53分24.14秒東経135度9分10.88秒﻿ / ﻿北緯33.8900389度 東経135.1530222度﻿ / 33.8900389; 135.1530222;所属事業者: 紀州鉄道;所属路線: 紀州鉄道線;キロ程: 2.4 km（御坊起点）;駅構造: 地上駅;ホーム: 1面1線;乗車人員-統計年度-: 8人/日（降車客含まず）-2019年-;開業年月日: 1967年（昭和42年）8月30日;備考: 無人駅","日本の鉄道駅一覧_しや-しん","箇条書き","単式ホーム1面1線のみを持つ地上駅。無人駅である。ホームに上屋があるのみで駅舎や便所はないが、公衆電話と自動販売機が設置されている。"
"市役所前停留場 (広島県)","市役所前停留場 (広島県)（しやくしょまえていりゅうじょう・広島電鉄宇品線）","https://ja.wikipedia.org/wiki/市役所前停留場_(広島県)","北緯34度23分8.84秒東経132度27分16秒","所在地: 広島市中区国泰寺町1丁目北緯34度23分8.84秒東経132度27分16秒﻿ / ﻿北緯34.3857889度 東経132.45444度﻿ / 34.3857889; 132.45444﻿ (市役所前停留場)座標: 北緯34度23分8.84秒東経132度27分16秒﻿ / ﻿北緯34.3857889度 東経132.45444度﻿ / 34.3857889; 132.45444﻿ (市役所前停留場);駅番号: ●U4;所属事業者: 広島電鉄;所属路線: ■宇品線;キロ程: 1.1 km（紙屋町起点）;駅構造: 地上駅;ホーム: 2面2線;乗降人員-統計年度-: 3,545人/日-2019年-;開業年月日: 1912年（大正元年）11月23日;下りホーム:;上りホーム:","日本の鉄道駅一覧_しや-しん","箇条書き","広島市役所は当停留場の東に隣接している。"
"市役所前停留場 (愛媛県)","市役所前停留場 (愛媛県)（しやくしょまえていりゅうじょう・伊予鉄道城南線）","https://ja.wikipedia.org/wiki/市役所前停留場_(愛媛県)","北緯33度50分24.12秒東経132度45分53.77秒","所在地: 愛媛県松山市二番町四丁目北緯33度50分24.12秒東経132度45分53.77秒﻿ / ﻿北緯33.8400333度 東経132.7649361度﻿ / 33.8400333; 132.7649361﻿ (市役所前電停);駅番号: 21;所属事業者: 伊予鉄道;所属路線: 城南線;キロ程: 2.8 km（道後温泉起点）;駅構造: 地上駅;ホーム: 2面2線;乗降人員-統計年度-: 801人/日-2015年-;開業年月日: 1911年（明治44年）9月1日（八股電停として）;備考: * 1944年に八股停留場より改称;西側: ■2号線 環状;東側: ■1号線 環状","日本の鉄道駅一覧_しや-しん","箇条書き","かつて停留所前に歩道橋があり、松山城をバックに路面電車の撮影ができたが、歩道橋は地下駐車場の工事が始まった1996年に撤去された。"
"市役所前停留場 (鹿児島県)","市役所前停留場 (鹿児島県)（しやくしょまえていりゅうじょう・鹿児島市電第一期線）","https://ja.wikipedia.org/wiki/市役所前停留場_(鹿児島県)","北緯31度35分48.45秒東経130度33分28.46秒","所在地: 鹿児島県鹿児島市山下町北緯31度35分48.45秒東経130度33分28.46秒﻿ / ﻿北緯31.5967917度 東経130.5579056度﻿ / 31.5967917; 130.5579056﻿ (市役所前停留場);駅番号: ●I04●N04;所属事業者: 鹿児島市交通局;所属路線: 鹿児島市電第一期線（1系統・2系統）;キロ程: 2.4km（武之橋起点）鹿児島駅前から0.6 km;駅構造: 地上駅;ホーム: 2面2線;乗降人員-統計年度-: 1,378人/日-2015年-;開業年月日: 1914年10月3日;所属事業者: 鹿児島市交通局;所属路線: 鹿児島市電上町線（2系統）;キロ程: 0.0 km（市役所前起点）;開業年月日: 1948年（昭和23年）12月28日;廃止年月日: 1985年（昭和60年）10月1日;備考: 鹿児島市電上町線の廃止に伴い廃駅;所在地: 鹿児島県鹿児島市山下町北緯31度35分48.45秒東経130度33分28.46秒﻿ / ﻿北緯31.5967917度 東経130.5579056度﻿ / 31.5967917; 130.5579056﻿ (市役所前停留場);駅番号: ●I04●N04;所属事業者: 鹿児島市交通局;所属路線: 鹿児島市電第一期線（1系統・2系統）;キロ程: 2.4km（武之橋起点）鹿児島駅前から0.6 km;駅構造: 地上駅;ホーム: 2面2線;乗降人員-統計年度-: 1,378人/日-2015年-;開業年月日: 1914年10月3日;所属事業者: 鹿児島市交通局;所属路線: 鹿児島市電上町線（2系統）;キロ程: 0.0 km（市役所前起点）;開業年月日: 1948年（昭和23年）12月28日;廃止年月日: 1985年（昭和60年）10月1日;備考: 鹿児島市電上町線の廃止に伴い廃駅","日本の鉄道駅一覧_しや-しん","箇条書き","かつては鹿児島本線をオーバークロスし、鹿児島市清水町の清水町停留場まで行く旧2系統の上町線が当停留場から分岐していたが、国道の渋滞緩和策によって1985年10月1日限りで廃止となっている。現在は代替路線として路線バスが通っている。"
"尺土駅","尺土駅（しゃくどえき）","https://ja.wikipedia.org/wiki/尺土駅","北緯34度30分30.84秒東経135度43分15.83秒","所在地: 奈良県葛城市尺土228北緯34度30分30.84秒東経135度43分15.83秒﻿ / ﻿北緯34.5085667度 東経135.7210639度﻿ / 34.5085667; 135.7210639座標: 北緯34度30分30.84秒東経135度43分15.83秒﻿ / ﻿北緯34.5085667度 東経135.7210639度﻿ / 34.5085667; 135.7210639;所属事業者: 近畿日本鉄道（近鉄）;電報略号: シト;駅構造: 地上駅（橋上駅）;ホーム: 2面4線;乗車人員-統計年度-: 2,427人/日（降車客含まず）-2018年-;開業年月日: 1929年（昭和4年）3月29日;所属路線: F南大阪線;駅番号:  F23;キロ程: 32.3 km（大阪阿部野橋起点）;所属路線: P御所線;駅番号:  P23;キロ程: 0.0 km（尺土起点）;備考: *一部列車が南大阪線へ直通;1・2: P御所線;3・4: 上り","日本の鉄道駅一覧_しや-しん","箇条書き","島式2面4線のホームを持つ待避可能な橋上駅で、改札口は1ヶ所のみ。南大阪線と御所線は方向別でホームを共有している。ホーム有効長は8両分。古市寄りに引上線があり、御所線の線内折返し列車のほか、ラッシュ時に運転される橿原神宮前方面からの折返し列車が使用する。"
"社家駅","社家駅（しゃけえき）","https://ja.wikipedia.org/wiki/社家駅","北緯35度25分14.5秒東経139度22分38.5秒","所在地: 神奈川県海老名市社家115北緯35度25分14.5秒東経139度22分38.5秒﻿ / ﻿北緯35.420694度 東経139.377361度﻿ / 35.420694; 139.377361座標: 北緯35度25分14.5秒東経139度22分38.5秒﻿ / ﻿北緯35.420694度 東経139.377361度﻿ / 35.420694; 139.377361;所属事業者: 東日本旅客鉄道（JR東日本）;所属路線: ■相模線;キロ程: 11.6 km（茅ケ崎起点）;電報略号: ヤケ;駅構造: 地上駅;ホーム: 1面2線;乗車人員-統計年度-: 2,101人/日（降車客含まず）-2014年-;開業年月日: 1926年（大正15年）7月15日;備考: 無人駅;1: ■相模線;2: 下り","日本の鉄道駅一覧_しや-しん","箇条書き",""
"社台駅","社台駅（しゃだいえき）","https://ja.wikipedia.org/wiki/社台駅","北緯42度34分43.44秒東経141度25分3.08秒","所在地: 北海道白老郡白老町字社台北緯42度34分43.44秒東経141度25分3.08秒﻿ / ﻿北緯42.5787333度 東経141.4175222度﻿ / 42.5787333; 141.4175222﻿ (社台駅);駅番号: ○H22;所属事業者: 北海道旅客鉄道（JR北海道）;所属路線: ■室蘭本線;キロ程: 119.1 km（長万部起点）;電報略号: シタ;駅構造: 地上駅;ホーム: 1面2線;乗降人員-統計年度-: 14人/日-2014年-;開業年月日: 1907年（明治40年）12月25日;備考: 無人駅;1: ■室蘭本線;2: 下り","日本の鉄道駅一覧_しや-しん","箇条書き","開設当初は信号所、その後貨物駅となってから旅客を扱う駅になったという変わった経歴を持つ。"
"ジヤトコ前駅","ジヤトコ前駅（ジャトコまええき）","https://ja.wikipedia.org/wiki/ジヤトコ前駅","北緯35度9分27.92秒東経138度41分24.07秒","所在地: 〒417-0022 静岡県富士市依田原町7北緯35度9分27.92秒東経138度41分24.07秒﻿ / ﻿北緯35.1577556度 東経138.6900194度﻿ / 35.1577556; 138.6900194座標: 北緯35度9分27.92秒東経138度41分24.07秒﻿ / ﻿北緯35.1577556度 東経138.6900194度﻿ / 35.1577556; 138.6900194;駅番号: GD02;所属事業者: 岳南電車;所属路線: ■岳南線;キロ程: 2.3 km（吉原起点）;駅構造: 地上駅;ホーム: 1面1線;乗車人員-統計年度-: 87人/日（降車客含まず）-2019年-;乗降人員-統計年度-: 124人/日-2019年-;開業年月日: 1949年（昭和24年）11月18日;備考: 無人駅","日本の鉄道駅一覧_しや-しん","箇条書き","会社名のジヤトコが「ジャトコ」と読まれるのと同様に、駅名も「ジャトコまええき」という読みになっている。"
"十王駅","十王駅（じゅうおうえき）","https://ja.wikipedia.org/wiki/十王駅","北緯36度40分16.95秒東経140度41分10.21秒","所在地: 茨城県日立市十王町友部177北緯36度40分16.95秒東経140度41分10.21秒﻿ / ﻿北緯36.6713750度 東経140.6861694度﻿ / 36.6713750; 140.6861694座標: 北緯36度40分16.95秒東経140度41分10.21秒﻿ / ﻿北緯36.6713750度 東経140.6861694度﻿ / 36.6713750; 140.6861694;所属事業者: 東日本旅客鉄道（JR東日本）;所属路線: ■常磐線;キロ程: 156.6 km（日暮里起点）;電報略号: シユ;駅構造: 地上駅;ホーム: 1面2線;乗車人員-統計年度-: 2,633人/日（降車客含まず）-2020年-;開業年月日: 1897年（明治30年）2月25日;備考: 業務委託駅* 2004年に川尻駅から改称。;1: ■常磐線;2: 下り","日本の鉄道駅一覧_しや-しん","箇条書き","当駅は日立市の北部に位置し、旧・十王町の中心駅であり、国民宿舎鵜の岬、川尻海水浴場の最寄駅である。2004年（平成16年）3月13日より、川尻駅から当時合併前の町名である十王駅に改称された。"
"自由が丘駅","自由が丘駅（じゆうがおかえき・東急東横線・大井町線）","https://ja.wikipedia.org/wiki/自由が丘駅","北緯35度36分27秒東経139度40分8秒","所在地: 東京都目黒区自由が丘一丁目9-8北緯35度36分27秒東経139度40分8秒﻿ / ﻿北緯35.60750度 東経139.66889度﻿ / 35.60750; 139.66889座標: 北緯35度36分27秒東経139度40分8秒﻿ / ﻿北緯35.60750度 東経139.66889度﻿ / 35.60750; 139.66889;所属事業者: 東急電鉄;駅構造: 高架駅（東横線）地上駅（大井町線）;ホーム: 2面4線（東横線）2面2線（大井町線）;乗降人員-統計年度-: （東横線）64,988人/日（大井町線）39,273人/日（合計）104,261人/日-2020年-;開業年月日: 1927年（昭和2年）8月28日;所属路線: ■東横線;駅番号: TY07;キロ程: 7.0 km（渋谷起点）;所属路線: ■大井町線;駅番号: OM10;キロ程: 6.3 km（大井町起点）;1:  大井町線;2: 上り;3・4:  東横線;5・6: 上り","日本の鉄道駅一覧_しや-しん","箇条書き","↑都立大学駅"
"自由ヶ丘駅","自由ヶ丘駅（じゆうがおかえき・名古屋市営地下鉄名城線）","https://ja.wikipedia.org/wiki/自由ヶ丘駅","北緯35度10分31.7秒東経136度58分0.2秒","所在地: 名古屋市千種区自由ケ丘三丁目11北緯35度10分31.7秒東経136度58分0.2秒﻿ / ﻿北緯35.175472度 東経136.966722度﻿ / 35.175472; 136.966722座標: 北緯35度10分31.7秒東経136度58分0.2秒﻿ / ﻿北緯35.175472度 東経136.966722度﻿ / 35.175472; 136.966722;駅番号: M16;所属事業者: 名古屋市交通局（名古屋市営地下鉄）;所属路線: 名城線;キロ程: 3.8 km（大曽根起点）;駅構造: 地下駅;ホーム: 2面2線;乗車人員-統計年度-: 6,735人/日（降車客含まず）-2019年-;乗降人員-統計年度-: 13,653人/日-2019年-;開業年月日: 2003年（平成15年）12月13日;1:  名城線;2: 右回り","日本の鉄道駅一覧_しや-しん","箇条書き","計画時点での駅名は「千種台」であった。"
"修学院駅","修学院駅（しゅうがくいんえき）","https://ja.wikipedia.org/wiki/修学院駅","北緯35度3分0.81秒東経135度47分25.65秒","所在地: 京都市左京区山端壱町田町14-1北緯35度3分0.81秒東経135度47分25.65秒﻿ / ﻿北緯35.0502250度 東経135.7904583度﻿ / 35.0502250; 135.7904583﻿ (修学院駅)座標: 北緯35度3分0.81秒東経135度47分25.65秒﻿ / ﻿北緯35.0502250度 東経135.7904583度﻿ / 35.0502250; 135.7904583﻿ (修学院駅);駅番号:  E05;所属事業者: 叡山電鉄;所属路線: ■叡山本線;キロ程: 2.9 km（出町柳起点）;駅構造: 地上駅;ホーム: 2面2線;乗車人員-統計年度-: 1,858人/日（降車客含まず）-2017年-;開業年月日: 1925年（大正14年）9月27日","日本の鉄道駅一覧_しや-しん","箇条書き","開業当時は現在より約100メートル北側にあり、駅出口は現在駅前にあるプラザ修学院の裏の道に面していて、ここが駅前通りとなっていた。駅構造、配線等は現在とほぼ同じであった。駅業務ならびに運輸関係の事務所は駅西側、現在の北山通あたりにあり、駅前通を挟んで離宮道との間（現在の京福マンションの位置）にも事務所や倉庫があった。東側のホーム裏（現在の北山通の位置）は車庫裏というべき場所で、草むした線路の上に廃台車や部品が放置されていた。"
"十九条駅","十九条駅（じゅうくじょうえき）","https://ja.wikipedia.org/wiki/十九条駅","北緯35度23分44.82秒東経136度39分39.39秒","所在地: 岐阜県瑞穂市十九条北緯35度23分44.82秒東経136度39分39.39秒﻿ / ﻿北緯35.3957833度 東経136.6609417度﻿ / 35.3957833; 136.6609417座標: 北緯35度23分44.82秒東経136度39分39.39秒﻿ / ﻿北緯35.3957833度 東経136.6609417度﻿ / 35.3957833; 136.6609417;所属事業者: 樽見鉄道;所属路線: 樽見線;キロ程: 5.5 km（大垣起点）;駅構造: 地上駅;ホーム: 1面1線;乗降人員-統計年度-: 62人/日-2019年-;開業年月日: 1956年（昭和31年）3月20日","日本の鉄道駅一覧_しや-しん","箇条書き","単式ホーム1面1線を有する地上駅。無人駅である。"
"十字街停留場","十字街停留場（じゅうじがいていりゅうじょう）","https://ja.wikipedia.org/wiki/十字街停留場","北緯41度45分50.69秒東経140度43分7.06秒","所在地: 北海道函館市末広町8-6先、9-15先北緯41度45分50.69秒東経140度43分7.06秒﻿ / ﻿北緯41.7640806度 東経140.7186278度﻿ / 41.7640806; 140.7186278﻿ (十字街停留場)座標: 北緯41度45分50.69秒東経140度43分7.06秒﻿ / ﻿北緯41.7640806度 東経140.7186278度﻿ / 41.7640806; 140.7186278﻿ (十字街停留場);駅番号: DY20;所属事業者: 函館市企業局交通部;駅構造: 地上駅（停留場）;ホーム: 2面2線;乗降人員-統計年度-: 2,098人/日-2019年-;開業年月日: 1913年10月30日;所属路線: 函館市電本線;キロ程: 1.3km（函館駅前起点）湯の川より7.8 km;所属路線: 函館市電宝来・谷地頭線;キロ程: 0.0 km（十字街起点）","日本の鉄道駅一覧_しや-しん","箇条書き","元町西部地区に一番近い電停のため、花火大会やクリスマスファンタジー等のイベント開催時は無線機を携帯した運行指令員が配置される他、乗車整理員が乗客案内や料金の収受を行う。2系統と5系統の乗り換え停留所に指定されている。ただし、函館バスへの乗り継ぎ指定停留所は設定されていない。"
"十条駅 (東京都)","十条駅 (東京都)（じゅうじょうえき・東日本旅客鉄道埼京線）","https://ja.wikipedia.org/wiki/十条駅_(東京都)","北緯35度45分37秒東経139度43分20秒","所在地: 東京都北区上十条一丁目12-10北緯35度45分37秒東経139度43分20秒﻿ / ﻿北緯35.76028度 東経139.72222度﻿ / 35.76028; 139.72222座標: 北緯35度45分37秒東経139度43分20秒﻿ / ﻿北緯35.76028度 東経139.72222度﻿ / 35.76028; 139.72222;駅番号: JA14;所属事業者: 東日本旅客鉄道（JR東日本）;所属路線: ■埼京線（正式には赤羽線）*;キロ程: 3.5 km（池袋起点）大崎から16.9 km;電報略号: シウ;駅構造: 地上駅;ホーム: 2面2線;乗車人員-統計年度-: 23,855人/日（降車客含まず）-2020年-;開業年月日: 1910年（明治43年）11月1日;備考: 直営駅東京都区内駅;1:  埼京線;2: 南行;1:;2:","日本の鉄道駅一覧_しや-しん","箇条書き","線路名称上の当駅を通る路線は赤羽線であるが、運転系統上は埼京線として案内される。特定都区市内制度における「東京都区内」に属する。"
