"タイトル","コメント","URLアドレス","座標","詳細情報","親リスト","一覧抽出方法","前文"
"ANAインターコンチネンタルホテル東京","29ANAインターコンチネンタルホテル東京東京都港区84437階","https://ja.wikipedia.org/wiki/ANAインターコンチネンタルホテル東京","北緯35度40分5.62秒東経139度44分27.9秒","ホテルチェーン: IHG・ANAホテルズグループ;運営: IHG・ANAホテルズグループ;所有者: IHG・ANAホテルズグループ;前身: 東京全日空ホテル;階数: 地下3 - 36階;レストラン数: 11軒;部屋数: 844室;シングル数: 65室;ダブル数: 391室;ツイン数: 411室;スイート数: 30室;最頂部: 132.85m;開業: 1986年（昭和61年）6月7日;最寄駅: 東京メトロ溜池山王駅東京メトロ六本木一丁目駅;最寄IC: 首都高速都心環状線霞が関出入口;所在地: 〒107-0052東京都港区赤坂1-12-33;位置: 北緯35度40分5.62秒東経139度44分27.9秒﻿ / ﻿北緯35.6682278度 東経139.741083度﻿ / 35.6682278; 139.741083座標: 北緯35度40分5.62秒東経139度44分27.9秒﻿ / ﻿北緯35.6682278度 東経139.741083度﻿ / 35.6682278; 139.741083;公式サイト: 公式サイト;状態: 完成;建設期間: 1983年3月 - 1986年3月;用途: ホテル・フィットネスクラブ・エステサロン・ショップ・クリニック・駐車場;最頂部: なし;高さ: 132.85m;階数: 地下3階 地上36階 塔屋2階;敷地面積: 10,984.69 m²;建築面積: 8,940.98 m²;延床面積: 98,331.68 m²;構造形式: 鉄筋コンクリート造、鉄骨鉄筋コンクリート造、鉄骨造;駐車台数: 500台;設計: 観光企画設計社;構造エンジニア: 構造計画研究所;施工: 大成建設;ホテルチェーン: IHG・ANAホテルズグループ;運営: IHG・ANAホテルズグループ;所有者: IHG・ANAホテルズグループ;前身: 東京全日空ホテル;階数: 地下3 - 36階;レストラン数: 11軒;部屋数: 844室;シングル数: 65室;ダブル数: 391室;ツイン数: 411室;スイート数: 30室;最頂部: 132.85m;開業: 1986年（昭和61年）6月7日;最寄駅: 東京メトロ溜池山王駅東京メトロ六本木一丁目駅;最寄IC: 首都高速都心環状線霞が関出入口;所在地: 〒107-0052東京都港区赤坂1-12-33;位置: 北緯35度40分5.62秒東経139度44分27.9秒﻿ / ﻿北緯35.6682278度 東経139.741083度﻿ / 35.6682278; 139.741083座標: 北緯35度40分5.62秒東経139度44分27.9秒﻿ / ﻿北緯35.6682278度 東経139.741083度﻿ / 35.6682278; 139.741083;公式サイト: 公式サイト;状態: 完成;建設期間: 1983年3月 - 1986年3月;用途: ホテル・フィットネスクラブ・エステサロン・ショップ・クリニック・駐車場;最頂部: なし;高さ: 132.85m;階数: 地下3階 地上36階 塔屋2階;敷地面積: 10,984.69 m²;建築面積: 8,940.98 m²;延床面積: 98,331.68 m²;構造形式: 鉄筋コンクリート造、鉄骨鉄筋コンクリート造、鉄骨造;駐車台数: 500台;設計: 観光企画設計社;構造エンジニア: 構造計画研究所;施工: 大成建設","日本の大規模ホテル一覧","表形式","森ビルが開発を主導した赤坂から六本木にまたがる5.6ヘクタールにおよぶ再開発事業「アークヒルズ」内に、サントリーホール、テレビ朝日アーク放送センター、アーク森ビル、アークタワーズなどとともに、全日空が展開した全日空ホテルズの旗艦ホテル「東京全日空ホテル」として、1986年6月7日に開業した。運営は子会社の全日空エンタプライズが手掛けた。"
"千葉県","29東横INN成田空港本館千葉県成田市844","https://ja.wikipedia.org/wiki/千葉県","北緯35度36分16.4秒東経140度7分23.3秒","国: 日本;地方: 関東地方;団体コード: 12000-6;ISO 3166-2:JP: JP-12;面積: 5,157.61km2（境界未定部分あり）;総人口: 6,278,933人（推計人口、2021年6月1日）;人口密度: 1,217人/km2;隣接都道府県:  東京都 埼玉県 茨城県 神奈川県;県の木: マキ（1966年9月29日指定）;県の花: 菜の花（1954年4月NHK一般公募）;県の鳥: ホオジロ（1965年5月10日指定）;県の魚県民歌県民の日県のマスコット: タイ（1989年2月23日指定）千葉県民歌（1964年12月制定）6月15日チーバくん（2011年1月指定）;知事: 熊谷俊人;法人番号: 4000020120006;所在地: 〒260-8667千葉県千葉市中央区市場町1番1号北緯35度36分16.4秒東経140度7分23.3秒﻿ / ﻿北緯35.604556度 東経140.123139度﻿ / 35.604556; 140.123139;外部リンク: 千葉県;ウィキポータル: 日本の都道府県/千葉県;平均気温(℃): 25.6（8月）;最寒月: 3.3（1月）;降水量(mm): 200.8（9月）;最少月: 38.8（12月）;1: 千葉市;有形文化財: 28;絵画: 7;彫刻: 14;工芸品: 14;典籍: 1;書跡: 0;古文書: 5;考古資料: 3;歴史資料: 2;無形文化財: 0;民俗文化財: 2;無形民俗文化財: 6;記念物: 27;名勝: 4;天然記念物: 16;合計: 128;国: 日本;地方: 関東地方;団体コード: 12000-6;ISO 3166-2:JP: JP-12;面積: 5,157.61km2（境界未定部分あり）;総人口: 6,278,933人（推計人口、2021年6月1日）;人口密度: 1,217人/km2;隣接都道府県:  東京都 埼玉県 茨城県 神奈川県;県の木: マキ（1966年9月29日指定）;県の花: 菜の花（1954年4月NHK一般公募）;県の鳥: ホオジロ（1965年5月10日指定）;県の魚県民歌県民の日県のマスコット: タイ（1989年2月23日指定）千葉県民歌（1964年12月制定）6月15日チーバくん（2011年1月指定）;知事: 熊谷俊人;法人番号: 4000020120006;所在地: 〒260-8667千葉県千葉市中央区市場町1番1号北緯35度36分16.4秒東経140度7分23.3秒﻿ / ﻿北緯35.604556度 東経140.123139度﻿ / 35.604556; 140.123139;外部リンク: 千葉県;ウィキポータル: 日本の都道府県/千葉県;平均気温(℃): 25.6（8月）;最寒月: 3.3（1月）;降水量(mm): 200.8（9月）;最少月: 38.8（12月）;1: 千葉市;有形文化財: 28;絵画: 7;彫刻: 14;工芸品: 14;典籍: 1;書跡: 0;古文書: 5;考古資料: 3;歴史資料: 2;無形文化財: 0;民俗文化財: 2;無形民俗文化財: 6;記念物: 27;名勝: 4;天然記念物: 16;合計: 128","日本の大規模ホテル一覧","表形式","首都圏を構成し、都道府県人口・人口密度は第6位、面積は第28位の規模である。県の財政力指数は全国第5位、訪日旅客数は全国第3位であり、中心業務地区の幕張新都心、アジア地域有数の国際見本市会場である幕張メッセ、国際線旅客数・就航都市数・貿易額で日本一の成田国際空港、日本三大港湾である東京港湾の一角を担う千葉港、水揚げ量日本一で日本三大漁港の銚子漁港、集客施設来場者数日本一のディズニーリゾート、日本で唯一国際標準模式層断面及び地点に認定され、チバニアン（千葉時代）として地質年代の名称になる証拠となった地層千葉セクション、日本一の数を有する海水浴場、自然豊かな南房総国定公園・水郷筑波国定公園などを筆頭とした観光・リゾート地、優れた社会基盤、豊かな地域資源、バランスの取れた産業構造を核としている。学区別平均年収の最も高い地域は千葉市立打瀬小学校の学区で1064万円である。"
"東京ベイ有明ワシントンホテル","31東京ベイ有明ワシントンホテル東京都江東区83021階","https://ja.wikipedia.org/wiki/東京ベイ有明ワシントンホテル","北緯35度37分57.3秒東経139度47分34.7秒","正式名称: 東京ベイ有明ワシントンホテル;ホテルチェーン: ワシントンホテルチェーン;運営: 藤田観光;レストラン数: 3軒;部屋数: 830室;敷地面積: 9,899 m²;建築面積: 7,712 m²;延床面積: 70,113 m²;開業: 1999年;最寄駅: ゆりかもめ有明駅徒歩3分、りんかい線国際展示場駅徒歩4分;最寄IC: 首都高速道路湾岸線有明出入口;所在地: 〒135-0063東京都江東区有明3-7-11;位置: 北緯35度37分57.3秒東経139度47分34.7秒﻿ / ﻿北緯35.632583度 東経139.792972度﻿ / 35.632583; 139.792972座標: 北緯35度37分57.3秒東経139度47分34.7秒﻿ / ﻿北緯35.632583度 東経139.792972度﻿ / 35.632583; 139.792972;公式サイト: 公式サイト","日本の大規模ホテル一覧","表形式","藤田観光が運営するホテル・チェーン、「ワシントンホテル」のひとつであり、1999年（平成11年）に開業した。"
"沖縄県","32リザンシーパークホテル谷茶ベイ沖縄県恩納村82610階","https://ja.wikipedia.org/wiki/沖縄県","北緯26度12分44.8秒東経127度40分51.3秒","最北端: 硫黄鳥島;最南端: 波照間島;最東端: 北大東島;最西端: 与那国島;インペリアル換算: インペリアル換算123456789101112  4.2 6859  4.7 6859  6.3 7263  6.5 7566  9.1 8172  9.7 8477  5.6 9081  9.5 9081  10 8679  6 8273  4.3 7768  4.1 7061気温（°F）総降水量（in）;気候区分: Cfa;平均気温(℃): 26.7（7月）;最寒月: 14.5（1月）;降水量(mm): 309.5（6月）;最少月: 138.3（12月）;日照時間（時間）: 239.2（7月）;最短月: 78.3（1月）;1: 屋良朝苗やら ちょうびょう;2: 平良幸市たいら こういち;3: 西銘順治にしめ じゅんじ;4: 大田昌秀おおた まさひで;5: 稲嶺恵一いなみね けいいち;6: 仲井眞弘多なかいま ひろかず;7: 翁長雄志おなが たけし;8: 玉城デニーたまき デニー;最北端: 硫黄鳥島;最南端: 波照間島;最東端: 北大東島;最西端: 与那国島;インペリアル換算: インペリアル換算123456789101112  4.2 6859  4.7 6859  6.3 7263  6.5 7566  9.1 8172  9.7 8477  5.6 9081  9.5 9081  10 8679  6 8273  4.3 7768  4.1 7061気温（°F）総降水量（in）;気候区分: Cfa;平均気温(℃): 26.7（7月）;最寒月: 14.5（1月）;降水量(mm): 309.5（6月）;最少月: 138.3（12月）;日照時間（時間）: 239.2（7月）;最短月: 78.3（1月）;1: 屋良朝苗やら ちょうびょう;2: 平良幸市たいら こういち;3: 西銘順治にしめ じゅんじ;4: 大田昌秀おおた まさひで;5: 稲嶺恵一いなみね けいいち;6: 仲井眞弘多なかいま ひろかず;7: 翁長雄志おなが たけし;8: 玉城デニーたまき デニー;最北端: 硫黄鳥島;最南端: 波照間島;最東端: 北大東島;最西端: 与那国島;インペリアル換算: インペリアル換算123456789101112  4.2 6859  4.7 6859  6.3 7263  6.5 7566  9.1 8172  9.7 8477  5.6 9081  9.5 9081  10 8679  6 8273  4.3 7768  4.1 7061気温（°F）総降水量（in）;気候区分: Cfa;平均気温(℃): 26.7（7月）;最寒月: 14.5（1月）;降水量(mm): 309.5（6月）;最少月: 138.3（12月）;日照時間（時間）: 239.2（7月）;最短月: 78.3（1月）;1: 屋良朝苗やら ちょうびょう;2: 平良幸市たいら こういち;3: 西銘順治にしめ じゅんじ;4: 大田昌秀おおた まさひで;5: 稲嶺恵一いなみね けいいち;6: 仲井眞弘多なかいま ひろかず;7: 翁長雄志おなが たけし;8: 玉城デニーたまき デニー","日本の大規模ホテル一覧","表形式",""
"ヒルトン東京","33ヒルトン東京東京都新宿区81138階","https://ja.wikipedia.org/wiki/ヒルトン東京","北緯35度41分33.1秒東経139度41分27.8秒","正式名称: ヒルトン東京;運営: 日本ヒルトン;所有者: 東京都市開発;前身: 東京ヒルトンホテル;階数: 地下4階 - 地上38階;部屋数: 825室;開業: 1963年6月（現在地では1984年9月1日）;最寄駅: 東京メトロ西新宿駅;最寄IC: 首都高速4号新宿線新宿出入口;所在地: 〒160-0023東京都新宿区西新宿6丁目6番2号;位置: 北緯35度41分33.1秒東経139度41分27.8秒﻿ / ﻿北緯35.692528度 東経139.691056度﻿ / 35.692528; 139.691056座標: 北緯35度41分33.1秒東経139度41分27.8秒﻿ / ﻿北緯35.692528度 東経139.691056度﻿ / 35.692528; 139.691056;公式サイト: 公式サイト;開業日: 1984年9月;商業施設面積: 2,420 m²;店舗数: 29店;最寄駅: 東京メトロ西新宿駅;外部リンク: ヒルトン東京;正式名称: ヒルトン東京;運営: 日本ヒルトン;所有者: 東京都市開発;前身: 東京ヒルトンホテル;階数: 地下4階 - 地上38階;部屋数: 825室;開業: 1963年6月（現在地では1984年9月1日）;最寄駅: 東京メトロ西新宿駅;最寄IC: 首都高速4号新宿線新宿出入口;所在地: 〒160-0023東京都新宿区西新宿6丁目6番2号;位置: 北緯35度41分33.1秒東経139度41分27.8秒﻿ / ﻿北緯35.692528度 東経139.691056度﻿ / 35.692528; 139.691056座標: 北緯35度41分33.1秒東経139度41分27.8秒﻿ / ﻿北緯35.692528度 東経139.691056度﻿ / 35.692528; 139.691056;公式サイト: 公式サイト;開業日: 1984年9月;商業施設面積: 2,420 m²;店舗数: 29店;最寄駅: 東京メトロ西新宿駅;外部リンク: ヒルトン東京","日本の大規模ホテル一覧","表形式","1964年東京オリンピック開催による国際ホテル建設促進に則り、アメリカのヒルトン・インターナショナル（以下ヒルトン）が日本進出を図ることになった。"
"ホテルメトロポリタン","34ホテルメトロポリタン東京都豊島区80725階","https://ja.wikipedia.org/wiki/ホテルメトロポリタン","北緯35度43分42.5秒東経139度42分28.9秒","正式名称: ホテルメトロポリタン;ホテルチェーン: JR東日本ホテルズ;デベロッパー: JR東日本;設計: 観光企画設計社・鉄道会館設計事務所・日本国有鉄道東京建築工事局;施工: 大林組・清水建設・熊谷組共同企業体;運営: 日本ホテル;所有者: 東日本旅客鉄道・日本ホテル;階数: 地下2 - 地上25階;レストラン数: 9軒;部屋数: 807室;スイート数: 3室;敷地面積: 7,648.5m²;建築面積: 4,375.8m²;延床面積: 59,380.6m²;駐車場: 160台;開業: 1985年（昭和60年）6月2日;最寄駅: JR池袋駅西口より徒歩3分/メトロポリタン口より徒歩1分;最寄IC: 首都高速中央環状線西池袋出口より約5分;所在地: 〒171-8505東京都豊島区西池袋一丁目6番1号;位置: 北緯35度43分42.5秒東経139度42分28.9秒﻿ / ﻿北緯35.728472度 東経139.708028度﻿ / 35.728472; 139.708028座標: 北緯35度43分42.5秒東経139度42分28.9秒﻿ / ﻿北緯35.728472度 東経139.708028度﻿ / 35.728472; 139.708028;公式サイト: 公式サイト","日本の大規模ホテル一覧","表形式","2007年に実施された東日本旅客鉄道（JR東日本）の経営方針『選択と集中』によるホテル運営会社再編で（当ホテル運営企業を存続会社とした）日本ホテル株式会社が運営している。"
"名古屋市","35東横INN名古屋名駅南愛知県名古屋市805","https://ja.wikipedia.org/wiki/名古屋市","北緯35度10分53秒東経136度54分23秒","国: 日本;地方: 中部地方、東海地方;都道府県: 愛知県;市町村コード: 23100-2;法人番号: 3000020231002;面積: 326.45km2（境界未定部分あり）;総人口: 2,329,081人 （推計人口、2021年6月1日）;人口密度: 7,135人/km2;隣接自治体: 瀬戸市、春日井市、東海市、大府市、尾張旭市、豊明市、日進市、清須市、北名古屋市、あま市、長久手市、愛知郡東郷町、西春日井郡豊山町、海部郡大治町、蟹江町、飛島村;市の木: クスノキ;市の花: ユリ;市の歌: 名古屋市歌（1910年（明治43年）2月28日制定）;市長: 河村たかし;所在地: 〒460-8508愛知県名古屋市中区三の丸三丁目1番1号北緯35度10分53秒東経136度54分23秒﻿ / ﻿北緯35.18139度 東経136.90639度﻿ / 35.18139; 136.90639座標: 北緯35度10分53秒東経136度54分23秒﻿ / ﻿北緯35.18139度 東経136.90639度﻿ / 35.18139; 136.906392011年10月28日撮影;外部リンク: 公式ウェブサイト（日本語）;インペリアル換算: インペリアル換算123456789101112  2 4934  2.5 5135  4.6 5840  5 6849  5.9 7659  7.3 8267  8.3 8974  5.5 9276  9.1 8470  6.5 7459  3.1 6347  2.2 5338気温（°F）総降水量（in）;最高気温記録 °C（°F）: 21.0(69.8);平均最高気温 °C（°F）: 9.3(48.7);日平均気温 °C（°F）: 4.8(40.6);平均最低気温 °C（°F）: 1.1(34);最低気温記録 °C（°F）: −10.3(13.5);降水量mm （inch）: 50.8(2);降雪量cm （inch）: 4(1.6);平均降水日数 （≥0.5mm）: 6.3;平均降雪日数 （≥0cm）: 5.4;% 湿度: 64;平均月間日照時間: 174.5;千種区: 23101-1;東区: 23102-9;北区: 23103-7;西区: 23104-5;中村区: 23105-3;中区: 23106-1;昭和区: 23107-0;瑞穂区: 23108-8;熱田区: 23109-6;中川区: 23110-0;港区: 23111-8;南区: 23112-6;守山区: 23113-4;緑区: 23114-2;名東区: 23115-1;天白区: 23116-9;中日ドラゴンズ: 野球;名古屋ダイヤモンドドルフィンズ: バスケットボール;豊通ファイティングイーグルス名古屋: バスケットボール;大同特殊鋼フェニックス: ハンドボール;大同特殊鋼レッドスター: バレーボール;名古屋サイクロンズ: アメリカンフットボール;名古屋フラーテル: フィールドホッケー;名古屋グランパスエイト: サッカー;名古屋80D'sers: 野球;名古屋オーシャンズ: フットサル;三菱電機コアラーズ: バスケットボール;トヨタ自動車アンテロープス: バスケットボール;HC名古屋: ハンドボール;NGUラブリッジ名古屋: サッカー;TOP名古屋: 卓球;国: 日本;地方: 中部地方、東海地方;都道府県: 愛知県;市町村コード: 23100-2;法人番号: 3000020231002;面積: 326.45km2（境界未定部分あり）;総人口: 2,329,081人 （推計人口、2021年6月1日）;人口密度: 7,135人/km2;隣接自治体: 瀬戸市、春日井市、東海市、大府市、尾張旭市、豊明市、日進市、清須市、北名古屋市、あま市、長久手市、愛知郡東郷町、西春日井郡豊山町、海部郡大治町、蟹江町、飛島村;市の木: クスノキ;市の花: ユリ;市の歌: 名古屋市歌（1910年（明治43年）2月28日制定）;市長: 河村たかし;所在地: 〒460-8508愛知県名古屋市中区三の丸三丁目1番1号北緯35度10分53秒東経136度54分23秒﻿ / ﻿北緯35.18139度 東経136.90639度﻿ / 35.18139; 136.90639座標: 北緯35度10分53秒東経136度54分23秒﻿ / ﻿北緯35.18139度 東経136.90639度﻿ / 35.18139; 136.906392011年10月28日撮影;外部リンク: 公式ウェブサイト（日本語）;インペリアル換算: インペリアル換算123456789101112  2 4934  2.5 5135  4.6 5840  5 6849  5.9 7659  7.3 8267  8.3 8974  5.5 9276  9.1 8470  6.5 7459  3.1 6347  2.2 5338気温（°F）総降水量（in）;最高気温記録 °C（°F）: 21.0(69.8);平均最高気温 °C（°F）: 9.3(48.7);日平均気温 °C（°F）: 4.8(40.6);平均最低気温 °C（°F）: 1.1(34);最低気温記録 °C（°F）: −10.3(13.5);降水量mm （inch）: 50.8(2);降雪量cm （inch）: 4(1.6);平均降水日数 （≥0.5mm）: 6.3;平均降雪日数 （≥0cm）: 5.4;% 湿度: 64;平均月間日照時間: 174.5;千種区: 23101-1;東区: 23102-9;北区: 23103-7;西区: 23104-5;中村区: 23105-3;中区: 23106-1;昭和区: 23107-0;瑞穂区: 23108-8;熱田区: 23109-6;中川区: 23110-0;港区: 23111-8;南区: 23112-6;守山区: 23113-4;緑区: 23114-2;名東区: 23115-1;天白区: 23116-9;中日ドラゴンズ: 野球;名古屋ダイヤモンドドルフィンズ: バスケットボール;豊通ファイティングイーグルス名古屋: バスケットボール;大同特殊鋼フェニックス: ハンドボール;大同特殊鋼レッドスター: バレーボール;名古屋サイクロンズ: アメリカンフットボール;名古屋フラーテル: フィールドホッケー;名古屋グランパスエイト: サッカー;名古屋80D'sers: 野球;名古屋オーシャンズ: フットサル;三菱電機コアラーズ: バスケットボール;トヨタ自動車アンテロープス: バスケットボール;HC名古屋: ハンドボール;NGUラブリッジ名古屋: サッカー;TOP名古屋: 卓球","日本の大規模ホテル一覧","表形式","東京特別区部を除くと横浜市・大阪市に次ぐ全国第3位の人口を有する市。中部地方における行政・経済・文化の中枢で、東日本と西日本を結ぶ交通の要所となっている。"
"ヒルトン東京ベイ","36ヒルトン東京ベイ千葉県浦安市80111階","https://ja.wikipedia.org/wiki/ヒルトン東京ベイ","北緯35度37分37.2秒東経139度52分30.1秒","正式名称: ヒルトン東京ベイHilton Tokyo Bay;設計: 日本設計;施工: 清水建設竹中工務店日本建設三井建設;運営: ヒルトン・インターナショナル;所有者: 東京ベイヒルトン株式会社;前身: 東京ベイヒルトン インターナショナル;階数: 地下1階 - 地上11階;レストラン数: 7軒;部屋数: 828室;敷地面積: 36,121 m²;延床面積: 72,555 m²;駐車場: 400台;開業: 1988年（昭和63年）7月2日;最寄駅: ディズニーリゾートラインベイサイド・ステーション;最寄IC: 首都高速湾岸線浦安出入口,舞浜入口;所在地: 〒279-0031千葉県浦安市舞浜1-8;位置: 北緯35度37分37.2秒東経139度52分30.1秒﻿ / ﻿北緯35.627000度 東経139.875028度﻿ / 35.627000; 139.875028座標: 北緯35度37分37.2秒東経139度52分30.1秒﻿ / ﻿北緯35.627000度 東経139.875028度﻿ / 35.627000; 139.875028;公式サイト: 公式サイト;種類: 株式会社;市場情報: 非上場;本社所在地: 日本〒279-0031千葉県浦安市舞浜1番地8号;設立: 1988年（昭和63年）7月;業種: サービス業;事業内容: ホテル;代表者: 代表取締役社長 田村 康弘;資本金: 20億円;売上高: 39億3900万円（2020年12月31日時点）;営業利益: ▲30億7800万円（2020年12月31日時点）;経常利益: ▲22億5600万円（2020年12月31日時点）;純利益: ▲23億0600万円（2020年12月31日時点）;純資産: 56億0100万円（2020年12月31日時点）;総資産: 102億3600万円（2020年12月31日時点）;決算期: 12月31日;主要株主: 第一ビルディング;正式名称: ヒルトン東京ベイHilton Tokyo Bay;設計: 日本設計;施工: 清水建設竹中工務店日本建設三井建設;運営: ヒルトン・インターナショナル;所有者: 東京ベイヒルトン株式会社;前身: 東京ベイヒルトン インターナショナル;階数: 地下1階 - 地上11階;レストラン数: 7軒;部屋数: 828室;敷地面積: 36,121 m²;延床面積: 72,555 m²;駐車場: 400台;開業: 1988年（昭和63年）7月2日;最寄駅: ディズニーリゾートラインベイサイド・ステーション;最寄IC: 首都高速湾岸線浦安出入口,舞浜入口;所在地: 〒279-0031千葉県浦安市舞浜1-8;位置: 北緯35度37分37.2秒東経139度52分30.1秒﻿ / ﻿北緯35.627000度 東経139.875028度﻿ / 35.627000; 139.875028座標: 北緯35度37分37.2秒東経139度52分30.1秒﻿ / ﻿北緯35.627000度 東経139.875028度﻿ / 35.627000; 139.875028;公式サイト: 公式サイト;種類: 株式会社;市場情報: 非上場;本社所在地: 日本〒279-0031千葉県浦安市舞浜1番地8号;設立: 1988年（昭和63年）7月;業種: サービス業;事業内容: ホテル;代表者: 代表取締役社長 田村 康弘;資本金: 20億円;売上高: 39億3900万円（2020年12月31日時点）;営業利益: ▲30億7800万円（2020年12月31日時点）;経常利益: ▲22億5600万円（2020年12月31日時点）;純利益: ▲23億0600万円（2020年12月31日時点）;純資産: 56億0100万円（2020年12月31日時点）;総資産: 102億3600万円（2020年12月31日時点）;決算期: 12月31日;主要株主: 第一ビルディング","日本の大規模ホテル一覧","表形式","宴会施設は12箇所である。"
