"タイトル","コメント","URLアドレス","座標","詳細情報","親リスト","一覧抽出方法","前文"
"リーガロイヤルホテル","12リーガロイヤルホテル大阪府大阪市1,04230階","https://ja.wikipedia.org/wiki/リーガロイヤルホテル","北緯34度41分25.76秒東経135度29分14.41秒","種類: 株式会社;市場情報: 東証2部9713;本店所在地: 日本〒530-0005大阪市北区中之島5丁目3番68号;設立: 1932年（昭和7年）3月14日（株式会社新大阪ホテル）;業種: サービス業;法人番号: 2120001072198;代表者: 蔭山秀一（代表取締役社長）;資本金: 132億29百万円（2015年7月30日現在）;発行済株式総数: 普通株式：102,716,515株A種優先株式：300,000株;売上高: 連結：446億89百万円単独：315億6百万円;営業利益: 連結：12億72百万円単独：6億16百万円;純利益: 連結：26億95百万円単独：23億79百万円包括利益：29億21百万円;純資産: 連結：116億30百万円単独：138億31百万円;総資産: 連結：463億67百万円単独：409億20百万円;従業員数: 連結：1,977〔859〕人単独：1,331〔656〕人;決算期: 3月31日;主要株主: アサヒビール株式会社　19.20%森トラスト株式会社　18.77%サントリーホールディングス株式会社　10.05%関電不動産 株式会社　4.01%株式会社三井住友銀行　2.86%大阪ガス株式会社　2.86%株式会社竹中工務店　2.70%日本生命保険相互会社　1.58%三井住友海上火災保険株式会社　1.53%三井住友ファイナンス&リース株式会社　1.30%;主要子会社: 株式会社リーガロイヤルホテル広島 51.4%;関係する人物: 山本為三郎- 設立者;外部リンク: https://www.rihga.co.jp/;運営: 株式会社ロイヤルホテル;前身: 新大阪ホテル大阪ロイヤルホテル;階数: 地下2 - 30階;レストラン数: 21軒;部屋数: 1042室;シングル数: 363室;ダブル数: 122室;ツイン数: 423室;スイート数: 39室;駐車場: 840台;開業: 1965年10月11日;最寄駅: 京阪中之島駅;最寄IC: 阪神高速中之島西出入口;所在地: 〒530-0005大阪府大阪市北区中之島五丁目3番68号;公式サイト: 公式サイト;種類: 株式会社;市場情報: 東証2部9713;本店所在地: 日本〒530-0005大阪市北区中之島5丁目3番68号;設立: 1932年（昭和7年）3月14日（株式会社新大阪ホテル）;業種: サービス業;法人番号: 2120001072198;代表者: 蔭山秀一（代表取締役社長）;資本金: 132億29百万円（2015年7月30日現在）;発行済株式総数: 普通株式：102,716,515株A種優先株式：300,000株;売上高: 連結：446億89百万円単独：315億6百万円;営業利益: 連結：12億72百万円単独：6億16百万円;純利益: 連結：26億95百万円単独：23億79百万円包括利益：29億21百万円;純資産: 連結：116億30百万円単独：138億31百万円;総資産: 連結：463億67百万円単独：409億20百万円;従業員数: 連結：1,977〔859〕人単独：1,331〔656〕人;決算期: 3月31日;主要株主: アサヒビール株式会社　19.20%森トラスト株式会社　18.77%サントリーホールディングス株式会社　10.05%関電不動産 株式会社　4.01%株式会社三井住友銀行　2.86%大阪ガス株式会社　2.86%株式会社竹中工務店　2.70%日本生命保険相互会社　1.58%三井住友海上火災保険株式会社　1.53%三井住友ファイナンス&リース株式会社　1.30%;主要子会社: 株式会社リーガロイヤルホテル広島 51.4%;関係する人物: 山本為三郎- 設立者;外部リンク: https://www.rihga.co.jp/;運営: 株式会社ロイヤルホテル;前身: 新大阪ホテル大阪ロイヤルホテル;階数: 地下2 - 30階;レストラン数: 21軒;部屋数: 1042室;シングル数: 363室;ダブル数: 122室;ツイン数: 423室;スイート数: 39室;駐車場: 840台;開業: 1965年10月11日;最寄駅: 京阪中之島駅;最寄IC: 阪神高速中之島西出入口;所在地: 〒530-0005大阪府大阪市北区中之島五丁目3番68号;公式サイト: 公式サイト","日本の大規模ホテル一覧","表形式","大阪を代表する格調高い大型高級ホテルとして、国内外にその名を知られている。ホテルの設備などが整っていることや、外国の政府関係者がこのホテルをたびたび利用することから「大阪の迎賓館」とも呼ばれている。"
"ヨドバシ梅田","13ホテル阪急レスパイア大阪大阪府大阪市1,03035階","https://ja.wikipedia.org/wiki/ヨドバシ梅田#ホテル阪急レスパイア大阪","北緯34度42分15.1秒東経135度29分46.7秒","所在地: 〒530-0011大阪府大阪市北区大深町1-1;座標: 北緯34度42分15.1秒東経135度29分46.7秒﻿ / ﻿北緯34.704194度 東経135.496306度﻿ / 34.704194; 135.496306座標: 北緯34度42分15.1秒東経135度29分46.7秒﻿ / ﻿北緯34.704194度 東経135.496306度﻿ / 34.704194; 135.496306;開業日: 2001年11月22日;正式名称: ヨドバシカメラマルチメディア梅田;施設所有者: 株式会社ヨドバシカメラ;施設管理者: 株式会社ヨドバシ建物;敷地面積: 1万6,270 m²;延床面積: 11万3,548 m²;商業施設面積: 91,954 m²;中核店舗: ヨドバシカメラ;店舗数: 59;営業時間: 9:30 - 22:00;駐車台数: 1,000台;前身: 大阪鉄道管理局庁舎（旧・JR西日本本社ビル）↓OSAKA梅田ゴルフドーム;用途: 店舗;設計者: レールシティ西開発株式会社、安井・鹿島設計共同体;施工: 鹿島建設株式会社;管理運営: 株式会社ヨドバシカメラ;構造形式: SRC造;敷地面積: 1万6,270 m²;延床面積: 11万3,548 m²;階数: 地下2階地上13階建;竣工: 2001年11月;用途: 店舗・ホテル;設計者: 五洋建設株式会社一級建築士事務所;施工: 五洋建設;管理運営: 株式会社ヨドバシカメラ;延床面積: 約10万5,200 m²;階数: 地下4階地上35階建;高さ: 149.34m;着工: 2017年8月;竣工: 2019年11月;正式名称: ホテル阪急レスパイア大阪;ホテルチェーン: 阪急阪神第一ホテルグループ;運営: 阪急阪神ホテルズ;階数: 1階（入口）・9階（ロビー・フロント・レストラン・宴会場）・12階（客室） - 35階;レストラン数: 1軒;部屋数: 1030室;シングル数: 0室;ダブル数: 414室;ツイン数: 397室;駐車場: あり（地下2階-地下4階・ヨドバシ梅田と併用）420台;開業: 2019年（令和元年）11月27日;最寄駅: JR大阪駅阪急大阪梅田駅阪神大阪梅田駅Osaka Metro梅田駅・西梅田駅;最寄IC: 阪神高速道路梅田出入口;所在地: 〒530-0011大阪府大阪市北区大深町1-1;公式サイト: 公式サイト;補足: トリプル171室、フォース48室;所在地: 〒530-0011大阪府大阪市北区大深町1-1;座標: 北緯34度42分15.1秒東経135度29分46.7秒﻿ / ﻿北緯34.704194度 東経135.496306度﻿ / 34.704194; 135.496306座標: 北緯34度42分15.1秒東経135度29分46.7秒﻿ / ﻿北緯34.704194度 東経135.496306度﻿ / 34.704194; 135.496306;開業日: 2001年11月22日;正式名称: ヨドバシカメラマルチメディア梅田;施設所有者: 株式会社ヨドバシカメラ;施設管理者: 株式会社ヨドバシ建物;敷地面積: 1万6,270 m²;延床面積: 11万3,548 m²;商業施設面積: 91,954 m²;中核店舗: ヨドバシカメラ;店舗数: 59;営業時間: 9:30 - 22:00;駐車台数: 1,000台;前身: 大阪鉄道管理局庁舎（旧・JR西日本本社ビル）↓OSAKA梅田ゴルフドーム;用途: 店舗;設計者: レールシティ西開発株式会社、安井・鹿島設計共同体;施工: 鹿島建設株式会社;管理運営: 株式会社ヨドバシカメラ;構造形式: SRC造;敷地面積: 1万6,270 m²;延床面積: 11万3,548 m²;階数: 地下2階地上13階建;竣工: 2001年11月;用途: 店舗・ホテル;設計者: 五洋建設株式会社一級建築士事務所;施工: 五洋建設;管理運営: 株式会社ヨドバシカメラ;延床面積: 約10万5,200 m²;階数: 地下4階地上35階建;高さ: 149.34m;着工: 2017年8月;竣工: 2019年11月;正式名称: ホテル阪急レスパイア大阪;ホテルチェーン: 阪急阪神第一ホテルグループ;運営: 阪急阪神ホテルズ;階数: 1階（入口）・9階（ロビー・フロント・レストラン・宴会場）・12階（客室） - 35階;レストラン数: 1軒;部屋数: 1030室;シングル数: 0室;ダブル数: 414室;ツイン数: 397室;駐車場: あり（地下2階-地下4階・ヨドバシ梅田と併用）420台;開業: 2019年（令和元年）11月27日;最寄駅: JR大阪駅阪急大阪梅田駅阪神大阪梅田駅Osaka Metro梅田駅・西梅田駅;最寄IC: 阪神高速道路梅田出入口;所在地: 〒530-0011大阪府大阪市北区大深町1-1;公式サイト: 公式サイト;補足: トリプル171室、フォース48室;所在地: 〒530-0011大阪府大阪市北区大深町1-1;座標: 北緯34度42分15.1秒東経135度29分46.7秒﻿ / ﻿北緯34.704194度 東経135.496306度﻿ / 34.704194; 135.496306座標: 北緯34度42分15.1秒東経135度29分46.7秒﻿ / ﻿北緯34.704194度 東経135.496306度﻿ / 34.704194; 135.496306;開業日: 2001年11月22日;正式名称: ヨドバシカメラマルチメディア梅田;施設所有者: 株式会社ヨドバシカメラ;施設管理者: 株式会社ヨドバシ建物;敷地面積: 1万6,270 m²;延床面積: 11万3,548 m²;商業施設面積: 91,954 m²;中核店舗: ヨドバシカメラ;店舗数: 59;営業時間: 9:30 - 22:00;駐車台数: 1,000台;前身: 大阪鉄道管理局庁舎（旧・JR西日本本社ビル）↓OSAKA梅田ゴルフドーム;用途: 店舗;設計者: レールシティ西開発株式会社、安井・鹿島設計共同体;施工: 鹿島建設株式会社;管理運営: 株式会社ヨドバシカメラ;構造形式: SRC造;敷地面積: 1万6,270 m²;延床面積: 11万3,548 m²;階数: 地下2階地上13階建;竣工: 2001年11月;用途: 店舗・ホテル;設計者: 五洋建設株式会社一級建築士事務所;施工: 五洋建設;管理運営: 株式会社ヨドバシカメラ;延床面積: 約10万5,200 m²;階数: 地下4階地上35階建;高さ: 149.34m;着工: 2017年8月;竣工: 2019年11月;正式名称: ホテル阪急レスパイア大阪;ホテルチェーン: 阪急阪神第一ホテルグループ;運営: 阪急阪神ホテルズ;階数: 1階（入口）・9階（ロビー・フロント・レストラン・宴会場）・12階（客室） - 35階;レストラン数: 1軒;部屋数: 1030室;シングル数: 0室;ダブル数: 414室;ツイン数: 397室;駐車場: あり（地下2階-地下4階・ヨドバシ梅田と併用）420台;開業: 2019年（令和元年）11月27日;最寄駅: JR大阪駅阪急大阪梅田駅阪神大阪梅田駅Osaka Metro梅田駅・西梅田駅;最寄IC: 阪神高速道路梅田出入口;所在地: 〒530-0011大阪府大阪市北区大深町1-1;公式サイト: 公式サイト;補足: トリプル171室、フォース48室;所在地: 〒530-0011大阪府大阪市北区大深町1-1;座標: 北緯34度42分15.1秒東経135度29分46.7秒﻿ / ﻿北緯34.704194度 東経135.496306度﻿ / 34.704194; 135.496306座標: 北緯34度42分15.1秒東経135度29分46.7秒﻿ / ﻿北緯34.704194度 東経135.496306度﻿ / 34.704194; 135.496306;開業日: 2001年11月22日;正式名称: ヨドバシカメラマルチメディア梅田;施設所有者: 株式会社ヨドバシカメラ;施設管理者: 株式会社ヨドバシ建物;敷地面積: 1万6,270 m²;延床面積: 11万3,548 m²;商業施設面積: 91,954 m²;中核店舗: ヨドバシカメラ;店舗数: 59;営業時間: 9:30 - 22:00;駐車台数: 1,000台;前身: 大阪鉄道管理局庁舎（旧・JR西日本本社ビル）↓OSAKA梅田ゴルフドーム;用途: 店舗;設計者: レールシティ西開発株式会社、安井・鹿島設計共同体;施工: 鹿島建設株式会社;管理運営: 株式会社ヨドバシカメラ;構造形式: SRC造;敷地面積: 1万6,270 m²;延床面積: 11万3,548 m²;階数: 地下2階地上13階建;竣工: 2001年11月;用途: 店舗・ホテル;設計者: 五洋建設株式会社一級建築士事務所;施工: 五洋建設;管理運営: 株式会社ヨドバシカメラ;延床面積: 約10万5,200 m²;階数: 地下4階地上35階建;高さ: 149.34m;着工: 2017年8月;竣工: 2019年11月;正式名称: ホテル阪急レスパイア大阪;ホテルチェーン: 阪急阪神第一ホテルグループ;運営: 阪急阪神ホテルズ;階数: 1階（入口）・9階（ロビー・フロント・レストラン・宴会場）・12階（客室） - 35階;レストラン数: 1軒;部屋数: 1030室;シングル数: 0室;ダブル数: 414室;ツイン数: 397室;駐車場: あり（地下2階-地下4階・ヨドバシ梅田と併用）420台;開業: 2019年（令和元年）11月27日;最寄駅: JR大阪駅阪急大阪梅田駅阪神大阪梅田駅Osaka Metro梅田駅・西梅田駅;最寄IC: 阪神高速道路梅田出入口;所在地: 〒530-0011大阪府大阪市北区大深町1-1;公式サイト: 公式サイト;補足: トリプル171室、フォース48室","日本の大規模ホテル一覧","表形式","元々は旧大阪鉄道管理局庁舎（JR発足後はJR西日本本社屋）が置かれていた場所だが、旧国鉄の債務縮減のため、便利で地価が高い一等地を明け渡すことになり、JR西日本本社が現在の本社社屋（大阪市北区芝田2丁目）へ移転後の1992年に取り壊された。バブル崩壊後、長期的な用途が決まらないまま長らく更地のままとなっていた。長期的な用途が決定しない期間には、ドーム型ゴルフ練習場や木下大サーカス会場などとしても利用されたこともある。"
"シェラトン・グランデ・トーキョーベイ・ホテル","14シェラトン・グランデ・トーキョーベイ・ホテル千葉県浦安市1,01612階","https://ja.wikipedia.org/wiki/シェラトン・グランデ・トーキョーベイ・ホテル","","正式名称: シェラトン・グランデ・トーキョーベイ・ホテルSheraton Grande Tokyo Bay Hotel;運営: ケーヨーリゾート開発合同会社;所有者: ワン・エスジーティービー・ホールディング・エルピー;前身: シェラトン・グランデ・トーキョーベイ ホテル&タワーズ;階数: 地下1階- 12階;部屋数: 1016室;敷地面積: 51,260m²;延床面積: 107,1475m²;駐車場: 543台;開業: 1988年（昭和63年）4月14日;最寄駅: ディズニーリゾートラインベイサイド・ステーション;最寄IC: 首都高速湾岸線浦安出入口,舞浜入口;所在地: 〒279-0031千葉県浦安市舞浜1-9;公式サイト: 公式サイト","日本の大規模ホテル一覧","表形式","東京ディズニーリゾート内にある。スターウッド・ホテル&リゾート社がもつ「シェラトン」ブランドのホテルの一つで、2012年現在日本に存在するシェラトンとしては最古のホテル。1988年（昭和63年）4月14日開業。「ホテルオークラ東京ベイ」と東京ディズニーリゾートの駐車場「リゾートパーキング 3」の間に位置する。料飲施設は5箇所、宴会施設は14箇所。"
"東京ドームホテル","15東京ドームホテル東京都文京区1,00643階","https://ja.wikipedia.org/wiki/東京ドームホテル","北緯35度42分13.3秒東経139度45分12.6秒","正式名称: 東京ドームホテル;運営: 株式会社東京ドームホテル;所有者: 株式会社東京ドーム;階数: B3 - 43階;部屋数: 1,006室;スイート数: 27室;駐車場: 283台;最頂部: 155m;開業: 2000年（平成12年）6月1日;最寄駅: 都営地下鉄三田線水道橋駅;最寄IC: 首都高速道路飯田橋出入口;所在地: 〒112-8562東京都文京区後楽一丁目3番61号;位置: 北緯35度42分13.3秒東経139度45分12.6秒﻿ / ﻿北緯35.703694度 東経139.753500度﻿ / 35.703694; 139.753500座標: 北緯35度42分13.3秒東経139度45分12.6秒﻿ / ﻿北緯35.703694度 東経139.753500度﻿ / 35.703694; 139.753500;公式サイト: 公式サイト;種類: 株式会社;本社所在地: 日本〒112-8562東京都文京区後楽一丁目3番61号;設立: 1999年（平成11年）2月1日;業種: サービス業;法人番号: 8010001063129;事業内容: ホテル運営他;代表者: 棟方史幸（代表取締役社長）;資本金: 1億円;売上高: 142億3,200万円（2007年1月実績）;純利益: 5億2562万3000円（2018年01月31日時点）;総資産: 19億5007万8000円（2018年01月31日時点）;従業員数: 471名（2020年4月1日現在）;決算期: 1月31日;所有者: 株式会社東京ドーム;主要株主: 株式会社東京ドーム 100%;外部リンク: http://www.tokyodome-hotels.co.jp/;42F・43F: □;26F - 41F: ｜;25F: ■;9F - 24F: ■;8F: ｜;7F: ■;5F・6F: ■;3F・4F: ■;2F: ■;B1F - 1F: ■;B3F・B2F:;正式名称: 東京ドームホテル;運営: 株式会社東京ドームホテル;所有者: 株式会社東京ドーム;階数: B3 - 43階;部屋数: 1,006室;スイート数: 27室;駐車場: 283台;最頂部: 155m;開業: 2000年（平成12年）6月1日;最寄駅: 都営地下鉄三田線水道橋駅;最寄IC: 首都高速道路飯田橋出入口;所在地: 〒112-8562東京都文京区後楽一丁目3番61号;位置: 北緯35度42分13.3秒東経139度45分12.6秒﻿ / ﻿北緯35.703694度 東経139.753500度﻿ / 35.703694; 139.753500座標: 北緯35度42分13.3秒東経139度45分12.6秒﻿ / ﻿北緯35.703694度 東経139.753500度﻿ / 35.703694; 139.753500;公式サイト: 公式サイト;種類: 株式会社;本社所在地: 日本〒112-8562東京都文京区後楽一丁目3番61号;設立: 1999年（平成11年）2月1日;業種: サービス業;法人番号: 8010001063129;事業内容: ホテル運営他;代表者: 棟方史幸（代表取締役社長）;資本金: 1億円;売上高: 142億3,200万円（2007年1月実績）;純利益: 5億2562万3000円（2018年01月31日時点）;総資産: 19億5007万8000円（2018年01月31日時点）;従業員数: 471名（2020年4月1日現在）;決算期: 1月31日;所有者: 株式会社東京ドーム;主要株主: 株式会社東京ドーム 100%;外部リンク: http://www.tokyodome-hotels.co.jp/;42F・43F: □;26F - 41F: ｜;25F: ■;9F - 24F: ■;8F: ｜;7F: ■;5F・6F: ■;3F・4F: ■;2F: ■;B1F - 1F: ■;B3F・B2F:","日本の大規模ホテル一覧","表形式","東京ドームの社有地である旧後楽園球場跡地の再開発事業により、1997年（平成9年）に着工。"
"都ホテル 京都八条","17都ホテル 京都八条京都府京都市98610階","https://ja.wikipedia.org/wiki/都ホテル_京都八条","北緯34度59分1.6秒東経135度45分21.3秒","正式名称: 都ホテル 京都八条;ホテルチェーン: 都ホテルズ&リゾーツ;運営: 近鉄・都ホテルズ;所有者: 近畿日本鉄道;前身: 新・都ホテル（2019年3月31日までの名称）;階数: 地下2階（本館）／地下1階（サウスウィング） - 地上10階（本館）／地上7階（サウスウィング）階;部屋数: 986（本館714・サウスウィング272）室;開業: 1975年3月25日（本館）2005年9月23日（サウスウィング）;最寄駅: 京都駅;最寄IC: 名神高速道路京都南インターチェンジ;所在地: 〒601-8412京都市南区西九条院町17;位置: 北緯34度59分1.6秒東経135度45分21.3秒﻿ / ﻿北緯34.983778度 東経135.755917度﻿ / 34.983778; 135.755917座標: 北緯34度59分1.6秒東経135度45分21.3秒﻿ / ﻿北緯34.983778度 東経135.755917度﻿ / 34.983778; 135.755917;公式サイト: 公式サイト","日本の大規模ホテル一覧","表形式","1975年3月25日に、新・都ホテルとして開業。京都駅八条口に面している。東山区蹴上にあるウェスティン都ホテル京都（旧称・都ホテル）が高級ホテルなのに対し、駅前立地ということで観光だけでなくビジネス利用も視野に入れたホテルである。本館の設計は村野藤吾。"
