"タイトル","コメント","URLアドレス","座標","詳細情報","親リスト","一覧抽出方法","前文"
"新阪急ホテル","18大阪新阪急ホテル大阪府大阪市96110階","https://ja.wikipedia.org/wiki/新阪急ホテル","北緯34度42分18.212秒東経135度29分51.104秒","正式名称: 大阪新阪急ホテル;運営: 阪急阪神ホテルズ;階数: 地下2階 - 地上10階;部屋数: 961室;開業: 1964年（昭和39年）8月8日;最寄駅: 阪急電鉄梅田駅・JR大阪駅;最寄IC: 阪神高速11号池田線梅田出入口;所在地: 〒530-8310大阪府大阪市北区芝田一丁目1番35号;位置: 北緯34度42分18.212秒東経135度29分51.104秒﻿ / ﻿北緯34.70505889度 東経135.49752889度﻿ / 34.70505889; 135.49752889;公式サイト: 公式サイト;正式名称: 新阪急ホテルアネックス;運営: 阪急阪神ホテルズ;階数: 地上1階 - 地上17階;部屋数: 302室;開業: 1985年（昭和60年）7月12日;最寄駅: 阪急電鉄大阪梅田駅・JR大阪駅;最寄IC: 阪神高速11号池田線梅田出入口;所在地: 〒530-0012大阪府大阪市北区芝田一丁目8番1号;位置: 北緯34度42分25.261秒東経135度29分50.546秒﻿ / ﻿北緯34.70701694度 東経135.49737389度﻿ / 34.70701694; 135.49737389;公式サイト: 公式サイト;正式名称: 京都新阪急ホテル;運営: 阪急阪神ホテルズ;階数: 地下1階 - 地上9階;部屋数: 323室;開業: 1981年（昭和56年）7月7日;最寄駅: JR京都駅;最寄IC: 名神高速道路京都南IC;所在地: 〒600-8216京都府京都市下京区塩小路通新町東入東塩小路町579;位置: 北緯34度59分14.762秒東経135度45分27.871秒﻿ / ﻿北緯34.98743389度 東経135.75774194度﻿ / 34.98743389; 135.75774194;公式サイト: 公式サイト;正式名称: 大阪新阪急ホテル;運営: 阪急阪神ホテルズ;階数: 地下2階 - 地上10階;部屋数: 961室;開業: 1964年（昭和39年）8月8日;最寄駅: 阪急電鉄梅田駅・JR大阪駅;最寄IC: 阪神高速11号池田線梅田出入口;所在地: 〒530-8310大阪府大阪市北区芝田一丁目1番35号;位置: 北緯34度42分18.212秒東経135度29分51.104秒﻿ / ﻿北緯34.70505889度 東経135.49752889度﻿ / 34.70505889; 135.49752889;公式サイト: 公式サイト;正式名称: 新阪急ホテルアネックス;運営: 阪急阪神ホテルズ;階数: 地上1階 - 地上17階;部屋数: 302室;開業: 1985年（昭和60年）7月12日;最寄駅: 阪急電鉄大阪梅田駅・JR大阪駅;最寄IC: 阪神高速11号池田線梅田出入口;所在地: 〒530-0012大阪府大阪市北区芝田一丁目8番1号;位置: 北緯34度42分25.261秒東経135度29分50.546秒﻿ / ﻿北緯34.70701694度 東経135.49737389度﻿ / 34.70701694; 135.49737389;公式サイト: 公式サイト;正式名称: 京都新阪急ホテル;運営: 阪急阪神ホテルズ;階数: 地下1階 - 地上9階;部屋数: 323室;開業: 1981年（昭和56年）7月7日;最寄駅: JR京都駅;最寄IC: 名神高速道路京都南IC;所在地: 〒600-8216京都府京都市下京区塩小路通新町東入東塩小路町579;位置: 北緯34度59分14.762秒東経135度45分27.871秒﻿ / ﻿北緯34.98743389度 東経135.75774194度﻿ / 34.98743389; 135.75774194;公式サイト: 公式サイト;正式名称: 大阪新阪急ホテル;運営: 阪急阪神ホテルズ;階数: 地下2階 - 地上10階;部屋数: 961室;開業: 1964年（昭和39年）8月8日;最寄駅: 阪急電鉄梅田駅・JR大阪駅;最寄IC: 阪神高速11号池田線梅田出入口;所在地: 〒530-8310大阪府大阪市北区芝田一丁目1番35号;位置: 北緯34度42分18.212秒東経135度29分51.104秒﻿ / ﻿北緯34.70505889度 東経135.49752889度﻿ / 34.70505889; 135.49752889;公式サイト: 公式サイト;正式名称: 新阪急ホテルアネックス;運営: 阪急阪神ホテルズ;階数: 地上1階 - 地上17階;部屋数: 302室;開業: 1985年（昭和60年）7月12日;最寄駅: 阪急電鉄大阪梅田駅・JR大阪駅;最寄IC: 阪神高速11号池田線梅田出入口;所在地: 〒530-0012大阪府大阪市北区芝田一丁目8番1号;位置: 北緯34度42分25.261秒東経135度29分50.546秒﻿ / ﻿北緯34.70701694度 東経135.49737389度﻿ / 34.70701694; 135.49737389;公式サイト: 公式サイト;正式名称: 京都新阪急ホテル;運営: 阪急阪神ホテルズ;階数: 地下1階 - 地上9階;部屋数: 323室;開業: 1981年（昭和56年）7月7日;最寄駅: JR京都駅;最寄IC: 名神高速道路京都南IC;所在地: 〒600-8216京都府京都市下京区塩小路通新町東入東塩小路町579;位置: 北緯34度59分14.762秒東経135度45分27.871秒﻿ / ﻿北緯34.98743389度 東経135.75774194度﻿ / 34.98743389; 135.75774194;公式サイト: 公式サイト;正式名称: 大阪新阪急ホテル;運営: 阪急阪神ホテルズ;階数: 地下2階 - 地上10階;部屋数: 961室;開業: 1964年（昭和39年）8月8日;最寄駅: 阪急電鉄梅田駅・JR大阪駅;最寄IC: 阪神高速11号池田線梅田出入口;所在地: 〒530-8310大阪府大阪市北区芝田一丁目1番35号;位置: 北緯34度42分18.212秒東経135度29分51.104秒﻿ / ﻿北緯34.70505889度 東経135.49752889度﻿ / 34.70505889; 135.49752889;公式サイト: 公式サイト;正式名称: 新阪急ホテルアネックス;運営: 阪急阪神ホテルズ;階数: 地上1階 - 地上17階;部屋数: 302室;開業: 1985年（昭和60年）7月12日;最寄駅: 阪急電鉄大阪梅田駅・JR大阪駅;最寄IC: 阪神高速11号池田線梅田出入口;所在地: 〒530-0012大阪府大阪市北区芝田一丁目8番1号;位置: 北緯34度42分25.261秒東経135度29分50.546秒﻿ / ﻿北緯34.70701694度 東経135.49737389度﻿ / 34.70701694; 135.49737389;公式サイト: 公式サイト;正式名称: 京都新阪急ホテル;運営: 阪急阪神ホテルズ;階数: 地下1階 - 地上9階;部屋数: 323室;開業: 1981年（昭和56年）7月7日;最寄駅: JR京都駅;最寄IC: 名神高速道路京都南IC;所在地: 〒600-8216京都府京都市下京区塩小路通新町東入東塩小路町579;位置: 北緯34度59分14.762秒東経135度45分27.871秒﻿ / ﻿北緯34.98743389度 東経135.75774194度﻿ / 34.98743389; 135.75774194;公式サイト: 公式サイト","日本の大規模ホテル一覧","表形式","東京オリンピックや東海道新幹線開業に沸いた1964年（昭和39年）大阪キタの中心地・梅田に開業した。阪急東宝グループの創始者である小林一三が開業させた新橋第一ホテルにおける「特権階級向けではなくビジネスマンに使いやすいホテルを」という構想を、一三の死後、高度経済成長の時期に今度は大阪で実現させたものである。"
"帝国ホテル","19帝国ホテル東京都千代田区931本館17階、タワー31階","https://ja.wikipedia.org/wiki/帝国ホテル","北緯35度40分20.6秒東経139度45分30秒","種類: 株式会社;市場情報: 東証2部9708;本社所在地: 日本〒100-8558東京都千代田区内幸町1-1-1北緯35度40分20.6秒東経139度45分30秒﻿ / ﻿北緯35.672389度 東経139.75833度﻿ / 35.672389; 139.75833座標: 北緯35度40分20.6秒東経139度45分30秒﻿ / ﻿北緯35.672389度 東経139.75833度﻿ / 35.672389; 139.75833;設立: 1887年（明治20年）12月;業種: サービス業;法人番号: 8010001008711;事業内容: ホテル事業不動産賃貸事業 他;代表者: 定保英弥（代表取締役社長）;資本金: 14億8500万円;発行済株式総数: 5940万株 (2019年3月31日現在);売上高: 連結：584億2600万円単体： 579億7300万円(2019年3月31日現在);営業利益: 連結：50億3600万円単体：49億1100万円(2019年3月31日現在);経常利益: 連結：53億1400万円単体：51億6000万円(2019年3月31日現在);純利益: 連結：36億8600万円単体：35億7600万円(2019年3月31日現在);純資産: 連結：593億3500万円単体：585億2100万円(2019年3月31日現在);総資産: 連結：810億6700万円単体：789億4000万円(2019年3月31日現在);従業員数: 単体：1,853名連結： 1,940名(2019年3月31日現在);決算期: 毎年3月;主要株主: 三井不動産株式会社 33.16%アサヒビール株式会社 5.73%株式会社大和証券グループ本社5.12%株式会社みずほ銀行4.96%日本生命保険相互会社 4.91%富国生命保険相互会社 4.46%サッポロビール株式会社 4.20%清水建設株式会社 4.20%第一生命保険株式会社 3.93%鹿島建設株式会社 3.87%（2016年3月31日現在）;主要子会社: 株式会社帝国ホテルエンタープライズ株式会社帝国ホテルハイヤー株式会社帝国ホテルサービス株式会社帝国ホテルキッチン（株主：株式会社帝国ホテル 50%・株式会社ニチレイ 50%）;関係する人物: 渋沢栄一（初代会長）大倉喜七郎（元会長）小佐野賢治（元会長）犬丸徹三（元社長）犬丸一郎（元社長）藤居寛（元社長）大野勝巳（元社長）;外部リンク: www.imperialhotel.co.jp","日本の大規模ホテル一覧","表形式","日本を代表する高級ホテルであり、ホテルオークラ、ニューオータニとともに「御三家」（ホテル御三家）と呼ばれることもある。"
"グランドプリンスホテル新高輪","20グランドプリンスホテル新高輪東京都品川区91915階","https://ja.wikipedia.org/wiki/グランドプリンスホテル新高輪","北緯35度37分50.4秒東経139度44分0.8秒","","日本の大規模ホテル一覧","表形式",""
"京急イーエックスイン","21京急イーエックスイン品川駅前東京都品川区91830階","https://ja.wikipedia.org/wiki/京急イーエックスイン","","種類: 株式会社;略称: 京急EXイン;本社所在地: 日本〒220-0011神奈川県横浜市西区高島一丁目2番8号;設立: 2007年（平成19年）7月2日;業種: サービス業;法人番号: 9010401070244;事業内容: ビジネスホテルの運営および管理業務の受託;代表者: 四宮浩;資本金: 1,000万円;売上高: 41億円（2011年度実績）;純利益: ▲2億5263万1000円（2021年03月31日時点）;純資産: 11億2846万1000円（2021年03月31日時点）;総資産: 15億3803万3000円（2021年03月31日時点）;従業員数: 149名（2012年9月現在）;決算期: 3月;主要株主: 京浜急行電鉄株式会社 100%;外部リンク: https://www.keikyu-exinn.co.jp/","日本の大規模ホテル一覧","表形式","2008年（平成20年）10月1日から、西鉄イン・名鉄インと広範囲の業務提携を開始、ネットワークの拡大を図った。更に、2009年（平成21年）8月1日からは静岡鉄道系列の静鉄ホテルプレジオが加わることになり、同ネットワークは「Rail Innネットワーク」と名付けられた。更に2010年（平成22年）12月からは、富山地方鉄道の子会社である富山地鉄ホテルも加わった。ところが業務提携による相乗効果が当初予測したほど高まらなかったことから、2016年（平成28年）3月31日をもってネットワークは解散となり、同日をもって連携ポイントサービスも終了となった。"
"アパホテル&amp;リゾート 御堂筋本町駅タワー (存在しないページ)","22アパホテル&amp;リゾート〈御堂筋本町駅タワー〉大阪府大阪市91332階","https://ja.wikipedia.org/w/index.php?title=アパホテル&リゾート_御堂筋本町駅タワー&amp;action=edit&amp;redlink=1","","種類: 株式会社;市場情報: 非上場;本社所在地: 日本〒107-0052東京都港区赤坂3-2-3;本店所在地: 〒920-8541石川県金沢市大和町1-5;設立: 1988年4月1日;業種: サービス業;法人番号: 8010401047441;事業内容: 総合都市開発事業、ホテル事業、マンション事業、リゾート事業など;代表者: 代表取締役社長 元谷一志;資本金: 1000万円（グループ合算で18億1,200万円）;関係する人物: 元谷外志雄（グループ代表）;外部リンク: http://www.apa.co.jp/","日本の大規模ホテル一覧","表形式","1971年4月1日に小松信用金庫を退職した元谷外志雄が、同金庫の出資および小松市内の電話交換室跡を間借りして「信金開発株式会社」を設立。同年5月10日から住宅ローンをセットにした戸建注文住宅と建売住宅・分譲地の企画販売を開始する。"
"ホテルサンルート有明","23ホテルサンルート有明東京都江東区91220階","https://ja.wikipedia.org/wiki/ホテルサンルート有明","北緯35度37分55.4秒東経139度47分22秒","正式名称: 相鉄グランドフレッサ東京ベイ有明;ホテルチェーン: 相鉄ホテルズ;設計: 鹿島建設;運営: 相鉄ホテルマネジメント;前身: 1階 - 16階：ホテルサンルート有明17階 - 20階：ビーコンテ有明→オークウッドホテル&アパートメンツ有明→ホテルサンルート有明（プレミアムフロア）;階数: 地下1階 - 地上20階;部屋数: 912室;延床面積: 33,017.37 m²;最頂部: 74.80m;開業: 2009年6月25日;最寄駅: りんかい線国際展示場駅徒歩3分ゆりかもめ東京ビッグサイト駅徒歩3分;最寄IC: 首都高速湾岸線有明出入口;所在地: 〒135-0063東京都江東区有明三丁目6番6号;位置: 北緯35度37分55.4秒東経139度47分22秒﻿ / ﻿北緯35.632056度 東経139.78944度﻿ / 35.632056; 139.78944座標: 北緯35度37分55.4秒東経139度47分22秒﻿ / ﻿北緯35.632056度 東経139.78944度﻿ / 35.632056; 139.78944;公式サイト: 公式サイト","日本の大規模ホテル一覧","表形式","1階から16階まではサンルートホテルチェーン直営ホテル「ホテルサンルート有明」として、2009年6月25日に開業した。"
"新横浜プリンスホテル","24新横浜プリンスホテル神奈川県横浜市90442階","https://ja.wikipedia.org/wiki/新横浜プリンスホテル","北緯35度30分35秒東経139度37分9.9秒","ホテルチェーン: プリンスホテルズ&リゾーツ;デベロッパー: 西武鉄道;設計: 清水建設;施工: 清水建設;運営: プリンスホテル;階数: 地下3 - 42階;レストラン数: 7軒;部屋数: 904室;敷地面積: 12,720 m²;建築面積: 11,200 m²;延床面積: 127,194 m²;駐車場: 807台;開業: 1992年3月20日;最寄駅: 新横浜駅;所在地: 〒222-8533神奈川県横浜市港北区新横浜3-4;位置: 北緯35度30分35秒東経139度37分9.9秒﻿ / ﻿北緯35.50972度 東経139.619417度﻿ / 35.50972; 139.619417座標: 北緯35度30分35秒東経139度37分9.9秒﻿ / ﻿北緯35.50972度 東経139.619417度﻿ / 35.50972; 139.619417;公式サイト: 公式サイト;愛称: KOSÉ新横浜スケートセンター;正式名称: 新横浜スケートセンター;用途: アイススケート、アイスホッケーなど冬期屋内スポーツ全般;収容人数: 2,500人;管理運営: 西武鉄道;延床面積: 30m×60m（面積：約1,800m2） m²;竣工: 1990年;所在地: 〒222-0033神奈川県横浜市港北区新横浜2-11;ホテルチェーン: プリンスホテルズ&リゾーツ;デベロッパー: 西武鉄道;設計: 清水建設;施工: 清水建設;運営: プリンスホテル;階数: 地下3 - 42階;レストラン数: 7軒;部屋数: 904室;敷地面積: 12,720 m²;建築面積: 11,200 m²;延床面積: 127,194 m²;駐車場: 807台;開業: 1992年3月20日;最寄駅: 新横浜駅;所在地: 〒222-8533神奈川県横浜市港北区新横浜3-4;位置: 北緯35度30分35秒東経139度37分9.9秒﻿ / ﻿北緯35.50972度 東経139.619417度﻿ / 35.50972; 139.619417座標: 北緯35度30分35秒東経139度37分9.9秒﻿ / ﻿北緯35.50972度 東経139.619417度﻿ / 35.50972; 139.619417;公式サイト: 公式サイト;愛称: KOSÉ新横浜スケートセンター;正式名称: 新横浜スケートセンター;用途: アイススケート、アイスホッケーなど冬期屋内スポーツ全般;収容人数: 2,500人;管理運営: 西武鉄道;延床面積: 30m×60m（面積：約1,800m2） m²;竣工: 1990年;所在地: 〒222-0033神奈川県横浜市港北区新横浜2-11","日本の大規模ホテル一覧","表形式","西武鉄道がデベロッパーとなり併設のショッピングセンター「新横浜プリンスペペ」と同時に1992年3月に開業した。ホテルは42階建てで、円柱型の超高層ビルでは日本一の高さであり、幕張プリンスホテル（千葉市美浜区）がアパホテルに売却され「アパホテル&リゾート 東京ベイ幕張」となった2006年7月以降、プリンスホテルズ&リゾーツでホテル単体としても最高層の施設である（複合施設も含めればザ・プリンスギャラリー 東京紀尾井町や名古屋プリンスホテル スカイタワーの方が高層となる）。"
"アパホテル&amp;リゾート 札幌 (存在しないページ)","25アパホテル＆リゾート〈札幌〉北海道札幌市90314階","https://ja.wikipedia.org/w/index.php?title=アパホテル&リゾート_札幌&amp;action=edit&amp;redlink=1","","種類: 株式会社;市場情報: 非上場;本社所在地: 日本〒107-0052東京都港区赤坂3-2-3;本店所在地: 〒920-8541石川県金沢市大和町1-5;設立: 1988年4月1日;業種: サービス業;法人番号: 8010401047441;事業内容: 総合都市開発事業、ホテル事業、マンション事業、リゾート事業など;代表者: 代表取締役社長 元谷一志;資本金: 1000万円（グループ合算で18億1,200万円）;関係する人物: 元谷外志雄（グループ代表）;外部リンク: http://www.apa.co.jp/","日本の大規模ホテル一覧","表形式","1971年4月1日に小松信用金庫を退職した元谷外志雄が、同金庫の出資および小松市内の電話交換室跡を間借りして「信金開発株式会社」を設立。同年5月10日から住宅ローンをセットにした戸建注文住宅と建売住宅・分譲地の企画販売を開始する。"
"グランドニッコー東京 台場","26グランドニッコー東京 台場東京都港区88430階","https://ja.wikipedia.org/wiki/グランドニッコー東京_台場","北緯35度37分31.2秒東経139度46分19.5秒","ホテルチェーン: ニッコー・ホテルズ・インターナショナル;設計: 久米設計・観光企画設計社;施工: 大成・戸田・京急・住友・五洋・飛島・前田・西松・東亜・鉄建・フジタ・大都共同企業体;運営: 京急都市開発→ ホテル京急→ホテルグランパシフィック→グランドニッコー東京;所有者: 東京都→京浜急行電鉄→ヒューリック（底地）日本生命保険→京浜急行電鉄→グランブルー合同会社→ヒューリック（建物）;前身: ホテル・グランパシフィック・メリディアン→ホテル グランパシフィック LE DAIBA;階数: 地下3階 - 地上30階;部屋数: 884室;敷地面積: 20,870m²;延床面積: 123,229m²;駐車場: 438台;開業: 1998年6月1日;最寄駅: 台場駅;所在地: 〒135-8701東京都港区台場2丁目6番1号;位置: 北緯35度37分31.2秒東経139度46分19.5秒﻿ / ﻿北緯35.625333度 東経139.772083度﻿ / 35.625333; 139.772083座標: 北緯35度37分31.2秒東経139度46分19.5秒﻿ / ﻿北緯35.625333度 東経139.772083度﻿ / 35.625333; 139.772083;公式サイト: 公式サイト","日本の大規模ホテル一覧","表形式","東京臨海副都心の台場地区に、京浜急行電鉄が創業100周年事業の一環として日本生命保険とともに計画を進め、1998年6月1日、「ホテル・グランパシフィック・メリディアン」として開業。運営は京急の全額出資子会社である京急都市開発があたり、ホテル京急が運営する品川駅前のホテルパシフィック東京（2010年9月で営業終了）と同様、京急とル・メリディアンホテル&リゾート（後にスターウッド・ホテル&リゾート傘下）との提携に則り営業を始める。"
