"タイトル","コメント","URLアドレス","座標","詳細情報","親リスト","一覧抽出方法","前文"
"島根県","3232島根県しまねけん松江市松江市 中国6,708.23694,188103.51902 / ※","https://ja.wikipedia.org/wiki/島根県","北緯35度28分20.3秒東経133度3分1.8秒","国: 日本;地方: 中国地方、山陰地方中国・四国地方;団体コード: 32000-5;ISO 3166-2:JP: JP-32;面積: 6,708.26km2;総人口: 666,682人（推計人口、2021年7月1日）;人口密度: 99.4人/km2;隣接都道府県: 鳥取県、広島県、山口県;県の木: クロマツ;県の花: ボタン;県の鳥: ハクチョウ;他のシンボル: 県の魚：トビウオ県民歌：薄紫の山脈（1951年制定）;知事: 丸山達也;法人番号: 1000020320005;所在地: 〒690-8501島根県松江市殿町1番北緯35度28分20.3秒東経133度3分1.8秒﻿ / ﻿北緯35.472306度 東経133.050500度﻿ / 35.472306; 133.050500座標: 北緯35度28分20.3秒東経133度3分1.8秒﻿ / ﻿北緯35.472306度 東経133.050500度﻿ / 35.472306; 133.050500県庁舎位置;外部リンク: 公式ウェブサイト;ウィキポータル: 日本の都道府県/島根県;平均気温(°C): 25.6（8月）;最寒月: 3.9（2月）;降水量(mm): 211.6（9月）;最少月: 110.4（10月）;平均気温(°C): 26.5（8月）;最寒月: 4.9（1、2月）;降水量(mm): 246.3（7月）;最少月: 98.3（2月）;出雲地方: 松江市（旧制）;石見地方: 大田市（旧制）;隠岐地方: 隠岐郡;国: 日本;地方: 中国地方、山陰地方中国・四国地方;団体コード: 32000-5;ISO 3166-2:JP: JP-32;面積: 6,708.26km2;総人口: 666,682人（推計人口、2021年7月1日）;人口密度: 99.4人/km2;隣接都道府県: 鳥取県、広島県、山口県;県の木: クロマツ;県の花: ボタン;県の鳥: ハクチョウ;他のシンボル: 県の魚：トビウオ県民歌：薄紫の山脈（1951年制定）;知事: 丸山達也;法人番号: 1000020320005;所在地: 〒690-8501島根県松江市殿町1番北緯35度28分20.3秒東経133度3分1.8秒﻿ / ﻿北緯35.472306度 東経133.050500度﻿ / 35.472306; 133.050500座標: 北緯35度28分20.3秒東経133度3分1.8秒﻿ / ﻿北緯35.472306度 東経133.050500度﻿ / 35.472306; 133.050500県庁舎位置;外部リンク: 公式ウェブサイト;ウィキポータル: 日本の都道府県/島根県;平均気温(°C): 25.6（8月）;最寒月: 3.9（2月）;降水量(mm): 211.6（9月）;最少月: 110.4（10月）;平均気温(°C): 26.5（8月）;最寒月: 4.9（1、2月）;降水量(mm): 246.3（7月）;最少月: 98.3（2月）;出雲地方: 松江市（旧制）;石見地方: 大田市（旧制）;隠岐地方: 隠岐郡","都道府県#一覧","表形式","離島の隠岐島、竹島なども島根県の領域に含まれる。旧国名は出雲国、石見国、隠岐国であり、現在でも出雲地方・石見地方・隠岐地方の3つの地域に区分されることが多い。全国では、鳥取県に次いで2番目に人口が少ない。"
"千葉県","1212千葉県ちばけん千葉市千葉市 関東5,157.646,224,0271,206.85413 / 6","https://ja.wikipedia.org/wiki/千葉県","北緯35度36分16.4秒東経140度7分23.3秒","国: 日本;地方: 関東地方;団体コード: 12000-6;ISO 3166-2:JP: JP-12;面積: 5,157.61km2（境界未定部分あり）;総人口: 6,278,933人（推計人口、2021年6月1日）;人口密度: 1,217人/km2;隣接都道府県:  東京都 埼玉県 茨城県 神奈川県;県の木: マキ（1966年9月29日指定）;県の花: 菜の花（1954年4月NHK一般公募）;県の鳥: ホオジロ（1965年5月10日指定）;県の魚県民歌県民の日県のマスコット: タイ（1989年2月23日指定）千葉県民歌（1964年12月制定）6月15日チーバくん（2011年1月指定）;知事: 熊谷俊人;法人番号: 4000020120006;所在地: 〒260-8667千葉県千葉市中央区市場町1番1号北緯35度36分16.4秒東経140度7分23.3秒﻿ / ﻿北緯35.604556度 東経140.123139度﻿ / 35.604556; 140.123139;外部リンク: 千葉県;ウィキポータル: 日本の都道府県/千葉県;平均気温(℃): 25.6（8月）;最寒月: 3.3（1月）;降水量(mm): 200.8（9月）;最少月: 38.8（12月）;1: 千葉市;有形文化財: 28;絵画: 7;彫刻: 14;工芸品: 14;典籍: 1;書跡: 0;古文書: 5;考古資料: 3;歴史資料: 2;無形文化財: 0;民俗文化財: 2;無形民俗文化財: 6;記念物: 27;名勝: 4;天然記念物: 16;合計: 128;国: 日本;地方: 関東地方;団体コード: 12000-6;ISO 3166-2:JP: JP-12;面積: 5,157.61km2（境界未定部分あり）;総人口: 6,278,933人（推計人口、2021年6月1日）;人口密度: 1,217人/km2;隣接都道府県:  東京都 埼玉県 茨城県 神奈川県;県の木: マキ（1966年9月29日指定）;県の花: 菜の花（1954年4月NHK一般公募）;県の鳥: ホオジロ（1965年5月10日指定）;県の魚県民歌県民の日県のマスコット: タイ（1989年2月23日指定）千葉県民歌（1964年12月制定）6月15日チーバくん（2011年1月指定）;知事: 熊谷俊人;法人番号: 4000020120006;所在地: 〒260-8667千葉県千葉市中央区市場町1番1号北緯35度36分16.4秒東経140度7分23.3秒﻿ / ﻿北緯35.604556度 東経140.123139度﻿ / 35.604556; 140.123139;外部リンク: 千葉県;ウィキポータル: 日本の都道府県/千葉県;平均気温(℃): 25.6（8月）;最寒月: 3.3（1月）;降水量(mm): 200.8（9月）;最少月: 38.8（12月）;1: 千葉市;有形文化財: 28;絵画: 7;彫刻: 14;工芸品: 14;典籍: 1;書跡: 0;古文書: 5;考古資料: 3;歴史資料: 2;無形文化財: 0;民俗文化財: 2;無形民俗文化財: 6;記念物: 27;名勝: 4;天然記念物: 16;合計: 128","都道府県#一覧","表形式","首都圏を構成し、都道府県人口・人口密度は第6位、面積は第28位の規模である。県の財政力指数は全国第5位、訪日旅客数は全国第3位であり、中心業務地区の幕張新都心、アジア地域有数の国際見本市会場である幕張メッセ、国際線旅客数・就航都市数・貿易額で日本一の成田国際空港、日本三大港湾である東京港湾の一角を担う千葉港、水揚げ量日本一で日本三大漁港の銚子漁港、集客施設来場者数日本一のディズニーリゾート、日本で唯一国際標準模式層断面及び地点に認定され、チバニアン（千葉時代）として地質年代の名称になる証拠となった地層千葉セクション、日本一の数を有する海水浴場、自然豊かな南房総国定公園・水郷筑波国定公園などを筆頭とした観光・リゾート地、優れた社会基盤、豊かな地域資源、バランスの取れた産業構造を核としている。学区別平均年収の最も高い地域は千葉市立打瀬小学校の学区で1064万円である。"
"東京都","1313東京都とうきょうと新宿区（東京23区）世田谷区（東京23区） 関東2,190.9013,513,7346,168.16225 / 12","https://ja.wikipedia.org/wiki/東京都","北緯35度41分22.4秒東経139度41分30.2秒","国: 日本;地方: 関東地方;団体コード: 13000-1;ISO 3166-2:JP: JP-13;面積: 2,193.96km2（境界未定部分あり）;総人口: 13,957,977人（推計人口、2021年6月1日）;人口密度: 6,362人/km2;隣接都道府県:  埼玉県 千葉県 神奈川県 山梨県 静岡県;都の木: イチョウ;都の花: ソメイヨシノ;都の鳥: ユリカモメ;都の歌都民の日: 東京都歌、東京市歌10月1日;知事: 小池百合子;法人番号: 8000020130001;所在地: 〒163-8001東京都新宿区西新宿二丁目8番1号北緯35度41分22.4秒東経139度41分30.2秒﻿ / ﻿北緯35.689556度 東経139.691722度﻿ / 35.689556; 139.691722座標: 北緯35度41分22.4秒東経139度41分30.2秒﻿ / ﻿北緯35.689556度 東経139.691722度﻿ / 35.689556; 139.691722東京都庁舎;外部リンク: 公式ウェブサイト;ウィキポータル: 日本の都道府県/東京都;インペリアル換算: インペリアル換算123456789101112  2 5037  2.2 5137  4.6 5642  4.9 6651  5.4 7360  6.6 7866  6.1 8573  6.6 8876  8.3 8170  7.8 7160  3.7 6250  2 5441気温（°F）総降水量（in）;気候区分: Cfa;平均気温(°C): 26.0(8月);最寒月: 5.6(1月);降水量(mm): 193.2(9月);最少月: 33.2(12月);降水日数(日): 12.5(6月);最少月: 4.5(12月);国: 日本;地方: 関東地方;団体コード: 13000-1;ISO 3166-2:JP: JP-13;面積: 2,193.96km2（境界未定部分あり）;総人口: 13,957,977人（推計人口、2021年6月1日）;人口密度: 6,362人/km2;隣接都道府県:  埼玉県 千葉県 神奈川県 山梨県 静岡県;都の木: イチョウ;都の花: ソメイヨシノ;都の鳥: ユリカモメ;都の歌都民の日: 東京都歌、東京市歌10月1日;知事: 小池百合子;法人番号: 8000020130001;所在地: 〒163-8001東京都新宿区西新宿二丁目8番1号北緯35度41分22.4秒東経139度41分30.2秒﻿ / ﻿北緯35.689556度 東経139.691722度﻿ / 35.689556; 139.691722座標: 北緯35度41分22.4秒東経139度41分30.2秒﻿ / ﻿北緯35.689556度 東経139.691722度﻿ / 35.689556; 139.691722東京都庁舎;外部リンク: 公式ウェブサイト;ウィキポータル: 日本の都道府県/東京都;インペリアル換算: インペリアル換算123456789101112  2 5037  2.2 5137  4.6 5642  4.9 6651  5.4 7360  6.6 7866  6.1 8573  6.6 8876  8.3 8170  7.8 7160  3.7 6250  2 5441気温（°F）総降水量（in）;気候区分: Cfa;平均気温(°C): 26.0(8月);最寒月: 5.6(1月);降水量(mm): 193.2(9月);最少月: 33.2(12月);降水日数(日): 12.5(6月);最少月: 4.5(12月);国: 日本;地方: 関東地方;団体コード: 13000-1;ISO 3166-2:JP: JP-13;面積: 2,193.96km2（境界未定部分あり）;総人口: 13,957,977人（推計人口、2021年6月1日）;人口密度: 6,362人/km2;隣接都道府県:  埼玉県 千葉県 神奈川県 山梨県 静岡県;都の木: イチョウ;都の花: ソメイヨシノ;都の鳥: ユリカモメ;都の歌都民の日: 東京都歌、東京市歌10月1日;知事: 小池百合子;法人番号: 8000020130001;所在地: 〒163-8001東京都新宿区西新宿二丁目8番1号北緯35度41分22.4秒東経139度41分30.2秒﻿ / ﻿北緯35.689556度 東経139.691722度﻿ / 35.689556; 139.691722座標: 北緯35度41分22.4秒東経139度41分30.2秒﻿ / ﻿北緯35.689556度 東経139.691722度﻿ / 35.689556; 139.691722東京都庁舎;外部リンク: 公式ウェブサイト;ウィキポータル: 日本の都道府県/東京都;インペリアル換算: インペリアル換算123456789101112  2 5037  2.2 5137  4.6 5642  4.9 6651  5.4 7360  6.6 7866  6.1 8573  6.6 8876  8.3 8170  7.8 7160  3.7 6250  2 5441気温（°F）総降水量（in）;気候区分: Cfa;平均気温(°C): 26.0(8月);最寒月: 5.6(1月);降水量(mm): 193.2(9月);最少月: 33.2(12月);降水日数(日): 12.5(6月);最少月: 4.5(12月)","都道府県#一覧","表形式","区部（23区）、多摩地域（26市と西多摩郡3町1村）および島嶼部（2町7村）からなる。関東南西部にあって東西に細長い都域を有し、東部は東京湾に面する。西部は雲取山を最高峰とする関東山地となる。"
"徳島県","3636徳島県とくしまけん徳島市徳島市 四国4,146.93756,063182.32402 / ※","https://ja.wikipedia.org/wiki/徳島県","北緯34度3分56.7秒東経134度33分33.4秒","国: 日本;地方: 四国地方中国・四国地方;団体コード: 36000-7;ISO 3166-2:JP: JP-36;面積: 4,146.80km2;総人口: 714,181人（推計人口、2021年6月1日）;人口密度: 172人/km2;隣接都道府県: 香川県、愛媛県、高知県以下、海上を隔てて隣接兵庫県、和歌山県;県の木: ヤマモモ;県の花: すだちの花;県の鳥: シラサギ;県の色県の歌県のキャラクター: 藍色徳島県民の歌すだちくん、ちっかーず;知事: 飯泉嘉門;法人番号: 4000020360007;所在地: 〒770-8570徳島県徳島市万代町一丁目1番地北緯34度3分56.7秒東経134度33分33.4秒﻿ / ﻿北緯34.065750度 東経134.559278度﻿ / 34.065750; 134.559278座標: 北緯34度3分56.7秒東経134度33分33.4秒﻿ / ﻿北緯34.065750度 東経134.559278度﻿ / 34.065750; 134.559278県庁舎位置;外部リンク: 公式ウェブサイト;ウィキポータル: 日本の都道府県/徳島県;平均気温(°C): 27.8（8月）;最寒月: 6.1（1月）;年間平均: 16.6;降水量(mm): 210.0（9月）;最少月: 38.9（1月）;年間合計: 1453.8;国: 日本;地方: 四国地方中国・四国地方;団体コード: 36000-7;ISO 3166-2:JP: JP-36;面積: 4,146.80km2;総人口: 714,181人（推計人口、2021年6月1日）;人口密度: 172人/km2;隣接都道府県: 香川県、愛媛県、高知県以下、海上を隔てて隣接兵庫県、和歌山県;県の木: ヤマモモ;県の花: すだちの花;県の鳥: シラサギ;県の色県の歌県のキャラクター: 藍色徳島県民の歌すだちくん、ちっかーず;知事: 飯泉嘉門;法人番号: 4000020360007;所在地: 〒770-8570徳島県徳島市万代町一丁目1番地北緯34度3分56.7秒東経134度33分33.4秒﻿ / ﻿北緯34.065750度 東経134.559278度﻿ / 34.065750; 134.559278座標: 北緯34度3分56.7秒東経134度33分33.4秒﻿ / ﻿北緯34.065750度 東経134.559278度﻿ / 34.065750; 134.559278県庁舎位置;外部リンク: 公式ウェブサイト;ウィキポータル: 日本の都道府県/徳島県;平均気温(°C): 27.8（8月）;最寒月: 6.1（1月）;年間平均: 16.6;降水量(mm): 210.0（9月）;最少月: 38.9（1月）;年間合計: 1453.8","都道府県#一覧","表形式","県北部は粟が多く収穫されたことから「粟国」（あわのくに）、県南部は「長国」（ながのくに）であったが、後に統合され、令制国では阿波国（あわのくに）と呼ばれていた。"
"栃木県","0909栃木県とちぎけん宇都宮市宇都宮市 関東6,408.091,974,671308.22505 / 2","https://ja.wikipedia.org/wiki/栃木県","北緯36度33分55.6秒東経139度53分0.7秒","国: 日本;地方: 関東地方;団体コード: 09000-0;ISO 3166-2:JP: JP-9;面積: 6,408.09km2;総人口: 1,925,219人（推計人口、2021年6月1日）;人口密度: 300人/km2;隣接都道府県:  福島県 茨城県 群馬県 埼玉県;県の木: トチノキ;県の花: ヤシオツツジ;県の鳥: オオルリ;他のシンボル: 県の動物：ニホンカモシカ県民の歌：県民の歌県民の日：6月15日;知事: 福田富一;法人番号: 5000020090000;所在地: 〒320-8501栃木県宇都宮市塙田一丁目1番20号北緯36度33分55.6秒東経139度53分0.7秒﻿ / ﻿北緯36.565444度 東経139.883528度﻿ / 36.565444; 139.883528;外部リンク: 栃木県;ウィキポータル: 日本の都道府県/栃木県;平均気温(℃): 19.8(8月);最寒月: -4.1(1月);降水量(mm): 272.4(8月);最少月: 45.0(12月);国: 日本;地方: 関東地方;団体コード: 09000-0;ISO 3166-2:JP: JP-9;面積: 6,408.09km2;総人口: 1,925,219人（推計人口、2021年6月1日）;人口密度: 300人/km2;隣接都道府県:  福島県 茨城県 群馬県 埼玉県;県の木: トチノキ;県の花: ヤシオツツジ;県の鳥: オオルリ;他のシンボル: 県の動物：ニホンカモシカ県民の歌：県民の歌県民の日：6月15日;知事: 福田富一;法人番号: 5000020090000;所在地: 〒320-8501栃木県宇都宮市塙田一丁目1番20号北緯36度33分55.6秒東経139度53分0.7秒﻿ / ﻿北緯36.565444度 東経139.883528度﻿ / 36.565444; 139.883528;外部リンク: 栃木県;ウィキポータル: 日本の都道府県/栃木県;平均気温(℃): 19.8(8月);最寒月: -4.1(1月);降水量(mm): 272.4(8月);最少月: 45.0(12月);国: 日本;地方: 関東地方;団体コード: 09000-0;ISO 3166-2:JP: JP-9;面積: 6,408.09km2;総人口: 1,925,219人（推計人口、2021年6月1日）;人口密度: 300人/km2;隣接都道府県:  福島県 茨城県 群馬県 埼玉県;県の木: トチノキ;県の花: ヤシオツツジ;県の鳥: オオルリ;他のシンボル: 県の動物：ニホンカモシカ県民の歌：県民の歌県民の日：6月15日;知事: 福田富一;法人番号: 5000020090000;所在地: 〒320-8501栃木県宇都宮市塙田一丁目1番20号北緯36度33分55.6秒東経139度53分0.7秒﻿ / ﻿北緯36.565444度 東経139.883528度﻿ / 36.565444; 139.883528;外部リンク: 栃木県;ウィキポータル: 日本の都道府県/栃木県;平均気温(℃): 19.8(8月);最寒月: -4.1(1月);降水量(mm): 272.4(8月);最少月: 45.0(12月)","都道府県#一覧","表形式","県北部に日光国立公園が立地し、日光・那須は観光・保養地として知られる。"
"鳥取県","3131鳥取県とっとりけん鳥取市鳥取市 中国3,507.05573,648163.61902 / ※","https://ja.wikipedia.org/wiki/鳥取県","北緯35度30分14秒東経134度14分15.8秒","国: 日本;地方: 中国地方、山陰地方中国・四国地方;団体コード: 31000-0;ISO 3166-2:JP: JP-31;面積: 3,507.13km2;総人口: 549,941人（推計人口、2021年7月1日）;人口密度: 157人/km2;隣接都道府県: 兵庫県、島根県、岡山県、広島県;県の木: ダイセンキャラボク;県の花: 二十世紀梨の花;県の鳥: オシドリ;他のシンボル: 県民の日：9月12日県の魚：ヒラメ県の歌：鳥取県民歌『わきあがる力』県のキャラクター : トリピー;知事: 平井伸治;法人番号: 7000020310000;所在地: 〒680-8570鳥取県鳥取市東町一丁目220番地北緯35度30分14秒東経134度14分15.8秒﻿ / ﻿北緯35.50389度 東経134.237722度﻿ / 35.50389; 134.237722座標: 北緯35度30分14秒東経134度14分15.8秒﻿ / ﻿北緯35.50389度 東経134.237722度﻿ / 35.50389; 134.237722県庁舎位置;外部リンク: 公式ウェブサイト;ウィキポータル: 日本の都道府県/鳥取県;平均気温(°C): 25.5（8月）;最寒月: 3.5（1月）;降水量(mm): 244.2（9月）;最少月: 117.7（4月）;国: 日本;地方: 中国地方、山陰地方中国・四国地方;団体コード: 31000-0;ISO 3166-2:JP: JP-31;面積: 3,507.13km2;総人口: 549,941人（推計人口、2021年7月1日）;人口密度: 157人/km2;隣接都道府県: 兵庫県、島根県、岡山県、広島県;県の木: ダイセンキャラボク;県の花: 二十世紀梨の花;県の鳥: オシドリ;他のシンボル: 県民の日：9月12日県の魚：ヒラメ県の歌：鳥取県民歌『わきあがる力』県のキャラクター : トリピー;知事: 平井伸治;法人番号: 7000020310000;所在地: 〒680-8570鳥取県鳥取市東町一丁目220番地北緯35度30分14秒東経134度14分15.8秒﻿ / ﻿北緯35.50389度 東経134.237722度﻿ / 35.50389; 134.237722座標: 北緯35度30分14秒東経134度14分15.8秒﻿ / ﻿北緯35.50389度 東経134.237722度﻿ / 35.50389; 134.237722県庁舎位置;外部リンク: 公式ウェブサイト;ウィキポータル: 日本の都道府県/鳥取県;平均気温(°C): 25.5（8月）;最寒月: 3.5（1月）;降水量(mm): 244.2（9月）;最少月: 117.7（4月）","都道府県#一覧","表形式","日本海側にあり、山陰地方の東側を占める。面積は約3,507平方キロメートルと全国で7番目に小さく、人口は約55万人で最も少ない。基礎自治体は4市14町1村で、市の数も最も少ない。"
"富山県","1616富山県とやまけん富山市富山市 中部4,247.611,066,883251.21503 / 2","https://ja.wikipedia.org/wiki/富山県","北緯36度41分43.1秒東経137度12分40.7秒","国: 日本;地方: 中部地方、北陸地方;団体コード: 16000-8;ISO 3166-2:JP: JP-16;面積: 4,247.61km2（境界未定部分あり）;総人口: 1,028,910人（推計人口、2021年6月1日）;人口密度: 242人/km2;隣接都道府県: 石川県、岐阜県、新潟県、長野県;県の木: タテヤマスギ;県の花: チューリップ;県の鳥: ライチョウ;他のシンボル: 県の獣：ニホンカモシカ県の魚：ブリ、シロエビ、ホタルイカ県の歌：富山県民の歌マスコット：きときと君;知事: 新田八朗;法人番号: 7000020160008;所在地: 〒930-8501富山県富山市新総曲輪1番7号北緯36度41分43.1秒東経137度12分40.7秒﻿ / ﻿北緯36.695306度 東経137.211306度﻿ / 36.695306; 137.211306座標: 北緯36度41分43.1秒東経137度12分40.7秒﻿ / ﻿北緯36.695306度 東経137.211306度﻿ / 36.695306; 137.211306;外部リンク: 富山県公式ウェブサイト;ウィキポータル: 日本の都道府県/富山県;平均気温(°C): 25.4（8月）;最寒月: 2.1（2月）;降水量(mm): 245.3（12月）;最少月: 111.1（4月）;国: 日本;地方: 中部地方、北陸地方;団体コード: 16000-8;ISO 3166-2:JP: JP-16;面積: 4,247.61km2（境界未定部分あり）;総人口: 1,028,910人（推計人口、2021年6月1日）;人口密度: 242人/km2;隣接都道府県: 石川県、岐阜県、新潟県、長野県;県の木: タテヤマスギ;県の花: チューリップ;県の鳥: ライチョウ;他のシンボル: 県の獣：ニホンカモシカ県の魚：ブリ、シロエビ、ホタルイカ県の歌：富山県民の歌マスコット：きときと君;知事: 新田八朗;法人番号: 7000020160008;所在地: 〒930-8501富山県富山市新総曲輪1番7号北緯36度41分43.1秒東経137度12分40.7秒﻿ / ﻿北緯36.695306度 東経137.211306度﻿ / 36.695306; 137.211306座標: 北緯36度41分43.1秒東経137度12分40.7秒﻿ / ﻿北緯36.695306度 東経137.211306度﻿ / 36.695306; 137.211306;外部リンク: 富山県公式ウェブサイト;ウィキポータル: 日本の都道府県/富山県;平均気温(°C): 25.4（8月）;最寒月: 2.1（2月）;降水量(mm): 245.3（12月）;最少月: 111.1（4月）;国: 日本;地方: 中部地方、北陸地方;団体コード: 16000-8;ISO 3166-2:JP: JP-16;面積: 4,247.61km2（境界未定部分あり）;総人口: 1,028,910人（推計人口、2021年6月1日）;人口密度: 242人/km2;隣接都道府県: 石川県、岐阜県、新潟県、長野県;県の木: タテヤマスギ;県の花: チューリップ;県の鳥: ライチョウ;他のシンボル: 県の獣：ニホンカモシカ県の魚：ブリ、シロエビ、ホタルイカ県の歌：富山県民の歌マスコット：きときと君;知事: 新田八朗;法人番号: 7000020160008;所在地: 〒930-8501富山県富山市新総曲輪1番7号北緯36度41分43.1秒東経137度12分40.7秒﻿ / ﻿北緯36.695306度 東経137.211306度﻿ / 36.695306; 137.211306座標: 北緯36度41分43.1秒東経137度12分40.7秒﻿ / ﻿北緯36.695306度 東経137.211306度﻿ / 36.695306; 137.211306;外部リンク: 富山県公式ウェブサイト;ウィキポータル: 日本の都道府県/富山県;平均気温(°C): 25.4（8月）;最寒月: 2.1（2月）;降水量(mm): 245.3（12月）;最少月: 111.1（4月）","都道府県#一覧","表形式","中部地方の日本海側、新潟県を含めた場合の北陸地方のほぼ中央にある。"
"長崎県","4242長崎県ながさきけん長崎市長崎市 九州4,132.321,377,780333.42104 / 2","https://ja.wikipedia.org/wiki/長崎県","北緯32度44分41.4秒東経129度52分25.4秒","国: 日本;地方: 九州地方;団体コード: 42000-0;ISO 3166-2:JP: JP-42;面積: 4,130.88km2;総人口: 1,298,801人（推計人口、2021年6月1日）;人口密度: 314人/km2;隣接都道府県:  佐賀県 熊本県 福岡県;県の木: ヒノキ、ツバキ;県の花: 雲仙ツツジ;県の鳥: オシドリ;他のシンボル: 県の歌:南の風（1961年制定）県の獣:九州シカ県の魚（春）:タイ、イカ、アマダイ県の魚（夏）:アジ、イサキ、アワビ県の魚（秋）:サバ、トビウオ、ヒラメ県の魚（冬）:ブリ、イワシ、フグ;知事: 中村法道;法人番号: 4000020420000;所在地: 〒850-8570長崎県長崎市尾上町3番1号北緯32度44分41.4秒東経129度52分25.4秒﻿ / ﻿北緯32.744833度 東経129.873722度﻿ / 32.744833; 129.873722座標: 北緯32度44分41.4秒東経129度52分25.4秒﻿ / ﻿北緯32.744833度 東経129.873722度﻿ / 32.744833; 129.873722;外部リンク: 公式ウェブサイト;ウィキポータル: 日本の都道府県/長崎県;平均気温(°C): 26.0（8月）;最寒月: 6.6（1月）;降水量(mm): 346.9（7月）;最少月: 64.1（12月）;平均気温(°C):;最寒月:;降水量(mm):;最少月:;1: 長崎市;2: 佐世保市;3: 島原市;4: 諫早市;5: 大村市;6: 平戸市;7: 松浦市;8: 対馬市;9: 壱岐市;10: 五島市;11: 西海市;12: 雲仙市;13: 南島原市;14: 長与町;15: 時津町;16: 東彼杵町;17: 川棚町;18: 波佐見町;19: 小値賀町;20: 佐々町;21: 新上五島町;1: 西彼杵郡;2: 東彼杵郡;3: 北松浦郡;4: 南松浦郡;0: 長崎県","都道府県#一覧","表形式","五島列島、壱岐島、対馬など数多くの島嶼を含み、47都道府県中最も島が多いことで知られる。また、多島であるうえにリアス式海岸を多く擁することから海岸線の長さは47都道府県中第2位もしくは第1位となっている（※「地形」節にて詳説）。"
