"タイトル","コメント","URLアドレス","座標","詳細情報","親リスト","一覧抽出方法","前文"
"愛知県","2323愛知県あいちけん名古屋市名古屋市 中部5,172.407,484,0941,446.95415 / 8","https://ja.wikipedia.org/wiki/愛知県","北緯35度10分48.6秒東経136度54分23.1秒","国: 日本;地方: 中部地方、東海地方;団体コード: 23000-6;ISO 3166-2:JP: JP-23;面積: 5,172.92km2（境界未定部分あり）;総人口: 7,527,800人（推計人口、2021年6月1日）;人口密度: 1,455人/km2;隣接都道府県: 長野県、岐阜県、静岡県、三重県;県の木: ハナノキ;県の花: カキツバタ;県の鳥: コノハズク;他のシンボル: 県の魚:クルマエビ県民歌:われらが愛知;知事: 大村秀章;法人番号: 1000020230006;所在地: 〒460-8501愛知県名古屋市中区三の丸3丁目1番2号北緯35度10分48.6秒東経136度54分23.1秒﻿ / ﻿北緯35.180167度 東経136.906417度﻿ / 35.180167; 136.906417座標: 北緯35度10分48.6秒東経136度54分23.1秒﻿ / ﻿北緯35.180167度 東経136.906417度﻿ / 35.180167; 136.906417;外部リンク: 公式ウェブサイト;ウィキポータル: 日本の都道府県/愛知県;平均気温(°C): 27.1（8月）;最寒月: 3.8（1月）;降水量(mm): 252.3（9月）;最少月: 38.8（12月）;降水日数（日）: 13.3（6・7月）;最少月: 6.6（12月）;平成27年: 3,328,818;平成26年: 2,997,584;平成25年: 2,984,839;平成24年: 2,987,370;平成23年: 3,177,375;平成22年: 3,102,779;平成21年: 2,973,677;平成20年: 2,984,016;平成19年: 2,758,743;平成18年: 2,671,738;平成17年: 2,610,111;平成16年: 2,575,725;国: 日本;地方: 中部地方、東海地方;団体コード: 23000-6;ISO 3166-2:JP: JP-23;面積: 5,172.92km2（境界未定部分あり）;総人口: 7,527,800人（推計人口、2021年6月1日）;人口密度: 1,455人/km2;隣接都道府県: 長野県、岐阜県、静岡県、三重県;県の木: ハナノキ;県の花: カキツバタ;県の鳥: コノハズク;他のシンボル: 県の魚:クルマエビ県民歌:われらが愛知;知事: 大村秀章;法人番号: 1000020230006;所在地: 〒460-8501愛知県名古屋市中区三の丸3丁目1番2号北緯35度10分48.6秒東経136度54分23.1秒﻿ / ﻿北緯35.180167度 東経136.906417度﻿ / 35.180167; 136.906417座標: 北緯35度10分48.6秒東経136度54分23.1秒﻿ / ﻿北緯35.180167度 東経136.906417度﻿ / 35.180167; 136.906417;外部リンク: 公式ウェブサイト;ウィキポータル: 日本の都道府県/愛知県;平均気温(°C): 27.1（8月）;最寒月: 3.8（1月）;降水量(mm): 252.3（9月）;最少月: 38.8（12月）;降水日数（日）: 13.3（6・7月）;最少月: 6.6（12月）;平成27年: 3,328,818;平成26年: 2,997,584;平成25年: 2,984,839;平成24年: 2,987,370;平成23年: 3,177,375;平成22年: 3,102,779;平成21年: 2,973,677;平成20年: 2,984,016;平成19年: 2,758,743;平成18年: 2,671,738;平成17年: 2,610,111;平成16年: 2,575,725;国: 日本;地方: 中部地方、東海地方;団体コード: 23000-6;ISO 3166-2:JP: JP-23;面積: 5,172.92km2（境界未定部分あり）;総人口: 7,527,800人（推計人口、2021年6月1日）;人口密度: 1,455人/km2;隣接都道府県: 長野県、岐阜県、静岡県、三重県;県の木: ハナノキ;県の花: カキツバタ;県の鳥: コノハズク;他のシンボル: 県の魚:クルマエビ県民歌:われらが愛知;知事: 大村秀章;法人番号: 1000020230006;所在地: 〒460-8501愛知県名古屋市中区三の丸3丁目1番2号北緯35度10分48.6秒東経136度54分23.1秒﻿ / ﻿北緯35.180167度 東経136.906417度﻿ / 35.180167; 136.906417座標: 北緯35度10分48.6秒東経136度54分23.1秒﻿ / ﻿北緯35.180167度 東経136.906417度﻿ / 35.180167; 136.906417;外部リンク: 公式ウェブサイト;ウィキポータル: 日本の都道府県/愛知県;平均気温(°C): 27.1（8月）;最寒月: 3.8（1月）;降水量(mm): 252.3（9月）;最少月: 38.8（12月）;降水日数（日）: 13.3（6・7月）;最少月: 6.6（12月）;平成27年: 3,328,818;平成26年: 2,997,584;平成25年: 2,984,839;平成24年: 2,987,370;平成23年: 3,177,375;平成22年: 3,102,779;平成21年: 2,973,677;平成20年: 2,984,016;平成19年: 2,758,743;平成18年: 2,671,738;平成17年: 2,610,111;平成16年: 2,575,725;国: 日本;地方: 中部地方、東海地方;団体コード: 23000-6;ISO 3166-2:JP: JP-23;面積: 5,172.92km2（境界未定部分あり）;総人口: 7,527,800人（推計人口、2021年6月1日）;人口密度: 1,455人/km2;隣接都道府県: 長野県、岐阜県、静岡県、三重県;県の木: ハナノキ;県の花: カキツバタ;県の鳥: コノハズク;他のシンボル: 県の魚:クルマエビ県民歌:われらが愛知;知事: 大村秀章;法人番号: 1000020230006;所在地: 〒460-8501愛知県名古屋市中区三の丸3丁目1番2号北緯35度10分48.6秒東経136度54分23.1秒﻿ / ﻿北緯35.180167度 東経136.906417度﻿ / 35.180167; 136.906417座標: 北緯35度10分48.6秒東経136度54分23.1秒﻿ / ﻿北緯35.180167度 東経136.906417度﻿ / 35.180167; 136.906417;外部リンク: 公式ウェブサイト;ウィキポータル: 日本の都道府県/愛知県;平均気温(°C): 27.1（8月）;最寒月: 3.8（1月）;降水量(mm): 252.3（9月）;最少月: 38.8（12月）;降水日数（日）: 13.3（6・7月）;最少月: 6.6（12月）;平成27年: 3,328,818;平成26年: 2,997,584;平成25年: 2,984,839;平成24年: 2,987,370;平成23年: 3,177,375;平成22年: 3,102,779;平成21年: 2,973,677;平成20年: 2,984,016;平成19年: 2,758,743;平成18年: 2,671,738;平成17年: 2,610,111;平成16年: 2,575,725","都道府県#一覧","表形式",""
"青森県","0202青森県あおもりけん青森市青森市 東北9,645.401,308,649135.74003 / 2","https://ja.wikipedia.org/wiki/青森県","北緯40度49分28.6秒東経140度44分26秒","国: 日本;地方: 東北地方;団体コード: 02000-1;ISO 3166-2:JP: JP-02;面積: 9,645.64km2;総人口: 1,217,512人（推計人口、2021年6月1日）;人口密度: 126人/km2;隣接都道府県: 岩手県、秋田県、（津軽海峡を挟んで）北海道;県の木: ヒバ;県の花: リンゴの花;県の鳥: ハクチョウ;他のシンボル: 県の魚 : ヒラメ県の歌 : 青森県賛歌（1971年制定）県民の歌 : 青い森のメッセージ（2001年制定）;知事: 三村申吾;法人番号: 2000020020001;所在地: 〒030-8570青森県青森市長島一丁目1番1号北緯40度49分28.6秒東経140度44分26秒﻿ / ﻿北緯40.824611度 東経140.74056度﻿ / 40.824611; 140.74056;外部リンク: 公式ウェブサイト;ウィキポータル: 日本の都道府県/青森県;平均気温(°C): 23.0（8月）;最寒月: −1.4（1月）;降水量(mm): 148.6（12月）;最少月: 60.7（4月）;平均気温(°C): 21.5（8月）;最寒月: −0.4（1月）;降水量(mm): 168.5（8月）;最少月: 55.0（2月）;東青地域県民局: 青森市、東津軽郡;中南地域県民局: 弘前市、黒石市、平川市、中津軽郡、南津軽郡;西北地域県民局: 五所川原市、つがる市、西津軽郡、北津軽郡;下北地域県民局: むつ市、下北郡;上北地域県民局: 十和田市、三沢市、上北郡;三八地域県民局: 八戸市、三戸郡;西暦: 青森県民の平均寿命西暦男性平均寿命女性平均寿命1965年65.32歳（全国47位）71.77歳（全国47位）1970年67.82歳（全国47位）74.68歳（全国47位）1975年69.69歳（全国47位）76.50歳（全国47位）1980年71.41歳（全国47位）78.39歳（全国47位）1985年73.05歳（全国47位）79.90歳（全国47位）1990年74.18歳（全国47位）81.49歳（全国47位）1995年74.71歳（全国47位）82.51歳（全国47位）2000年75.67歳（全国47位）83.69歳（全国47位）2005年76.27歳（全国47位）84.80歳（全国47位）;1: 青森市;2: 弘前市;3: 八戸市;4: 黒石市;5: 五所川原市;6: 十和田市;7: 三沢市;8: むつ市;9: つがる市;10: 平川市;11: 平内町;12: 今別町;13: 蓬田村;14: 外ヶ浜町;15: 鰺ヶ沢町;16: 深浦町;17: 西目屋村;18: 藤崎町;19: 大鰐町;20: 田舎館村;21: 板柳町;22: 鶴田町;23: 中泊町;24: 野辺地町;25: 七戸町;26: 六戸町;27: 横浜町;28: 東北町;29: 六ヶ所村;30: おいらせ町;31: 大間町;32: 東通村;33: 風間浦村;34: 佐井村;35: 三戸町;36: 五戸町;37: 田子町;38: 南部町;39: 階上町;40: 新郷村;国: 日本;地方: 東北地方;団体コード: 02000-1;ISO 3166-2:JP: JP-02;面積: 9,645.64km2;総人口: 1,217,512人（推計人口、2021年6月1日）;人口密度: 126人/km2;隣接都道府県: 岩手県、秋田県、（津軽海峡を挟んで）北海道;県の木: ヒバ;県の花: リンゴの花;県の鳥: ハクチョウ;他のシンボル: 県の魚 : ヒラメ県の歌 : 青森県賛歌（1971年制定）県民の歌 : 青い森のメッセージ（2001年制定）;知事: 三村申吾;法人番号: 2000020020001;所在地: 〒030-8570青森県青森市長島一丁目1番1号北緯40度49分28.6秒東経140度44分26秒﻿ / ﻿北緯40.824611度 東経140.74056度﻿ / 40.824611; 140.74056;外部リンク: 公式ウェブサイト;ウィキポータル: 日本の都道府県/青森県;平均気温(°C): 23.0（8月）;最寒月: −1.4（1月）;降水量(mm): 148.6（12月）;最少月: 60.7（4月）;平均気温(°C): 21.5（8月）;最寒月: −0.4（1月）;降水量(mm): 168.5（8月）;最少月: 55.0（2月）;東青地域県民局: 青森市、東津軽郡;中南地域県民局: 弘前市、黒石市、平川市、中津軽郡、南津軽郡;西北地域県民局: 五所川原市、つがる市、西津軽郡、北津軽郡;下北地域県民局: むつ市、下北郡;上北地域県民局: 十和田市、三沢市、上北郡;三八地域県民局: 八戸市、三戸郡;西暦: 青森県民の平均寿命西暦男性平均寿命女性平均寿命1965年65.32歳（全国47位）71.77歳（全国47位）1970年67.82歳（全国47位）74.68歳（全国47位）1975年69.69歳（全国47位）76.50歳（全国47位）1980年71.41歳（全国47位）78.39歳（全国47位）1985年73.05歳（全国47位）79.90歳（全国47位）1990年74.18歳（全国47位）81.49歳（全国47位）1995年74.71歳（全国47位）82.51歳（全国47位）2000年75.67歳（全国47位）83.69歳（全国47位）2005年76.27歳（全国47位）84.80歳（全国47位）;1: 青森市;2: 弘前市;3: 八戸市;4: 黒石市;5: 五所川原市;6: 十和田市;7: 三沢市;8: むつ市;9: つがる市;10: 平川市;11: 平内町;12: 今別町;13: 蓬田村;14: 外ヶ浜町;15: 鰺ヶ沢町;16: 深浦町;17: 西目屋村;18: 藤崎町;19: 大鰐町;20: 田舎館村;21: 板柳町;22: 鶴田町;23: 中泊町;24: 野辺地町;25: 七戸町;26: 六戸町;27: 横浜町;28: 東北町;29: 六ヶ所村;30: おいらせ町;31: 大間町;32: 東通村;33: 風間浦村;34: 佐井村;35: 三戸町;36: 五戸町;37: 田子町;38: 南部町;39: 階上町;40: 新郷村","都道府県#一覧","表形式","県の人口は全国31位、面積は全国8位。令制国の陸奥国（むつのくに、りくおうのくに）北部にあたる。"
"秋田県","0505秋田県あきたけん秋田市秋田市 東北11,637.541,022,83987.92503 / 2","https://ja.wikipedia.org/wiki/秋田県","北緯39度43分07秒東経140度06分09秒","国: 日本;地方: 東北地方;団体コード: 05000-8;ISO 3166-2:JP: JP-05;面積: 11,637.52km2;総人口: 939,855人（推計人口、2021年7月1日）;人口密度: 80.8人/km2;隣接都道府県: 青森県、岩手県、宮城県、山形県;県の木: 秋田杉;県の花: フキノトウ;県の鳥: ヤマドリ;県の魚県の歌: ハタハタ秋田県民歌、県民の歌;知事: 佐竹敬久;法人番号: 1000020050008;所在地: 〒010-8570秋田県秋田市山王四丁目1番1号（本庁）〒010-8572秋田県秋田市山王三丁目1番1号（第二庁舎）;外部リンク: 秋田県ホームページ 美の国あきたネット;ウィキポータル: 日本の都道府県/秋田県;平均気温(℃): 23.9(8月);最寒月: 0.4(1月);降水量(mm): 167.3(7月);最少月: 58.3(2月);平均気温(℃): 22.8(8月);最寒月: -3.1(1月);降水量(mm): 165.8(7月);最少月: 58.9(2月)","都道府県#一覧","表形式","秋田県の海岸は、遠浅で上陸しやすく、海岸付近には身を隠せる防風林が多いため、密入国を図る工作員にとって、絶好の場所である。夜間は人が少なく、近隣住民に見られ無い上、八峰町には無人島である雄島が海岸近くにあり、北朝鮮の工作員に中継点として使われているという。"
"石川県","1717石川県いしかわけん金沢市金沢市 中部4,186.151,154,343275.81903 / 2","https://ja.wikipedia.org/wiki/石川県","北緯36度35分40.6秒東経136度37分32.3秒","国: 日本;地方: 中部地方、北陸地方;団体コード: 17000-3;ISO 3166-2:JP: JP-17;面積: 4,186.09km2;総人口: 1,127,758人（推計人口、2021年6月1日）;人口密度: 269人/km2;隣接都道府県: 富山県、岐阜県、福井県;県の木: アテ;県の花: クロユリ;県の鳥: イヌワシ;他のシンボル: 県の歌：石川県民の歌マスコット：ひゃくまんさん;知事: 谷本正憲;法人番号: 2000020170003;所在地: 〒920-8580石川県金沢市鞍月一丁目1番地北緯36度35分40.6秒東経136度37分32.3秒﻿ / ﻿北緯36.594611度 東経136.625639度﻿ / 36.594611; 136.625639座標: 北緯36度35分40.6秒東経136度37分32.3秒﻿ / ﻿北緯36.594611度 東経136.625639度﻿ / 36.594611; 136.625639;外部リンク: 石川県;ウィキポータル: 日本の都道府県/石川県;平均気温(°C): 25.2（8月）;最寒月: 2.4（2月）;降水量(mm): 256.9（12月）;最少月: 103.9（4月）;1950年（昭和25年）: 450,593;1960年（昭和35年）: 496,132;1970年（昭和45年）: 545,127;1980年（昭和55年）: 567,684;1990年（平成2年）: 606,265;2000年（平成12年）: 614,694;2005年（平成17年）: 596,324;小松市: 単位:億円4,8744,1183,5852,1972,0961,6791,364756590555407381242233181102927135小松市白山市金沢市能美市川北町加賀市かほく市宝達志水町志賀町七尾市羽咋市津幡町中能登町野々市町※輪島市珠洲市能登町穴水町内灘町;国: 日本;地方: 中部地方、北陸地方;団体コード: 17000-3;ISO 3166-2:JP: JP-17;面積: 4,186.09km2;総人口: 1,127,758人（推計人口、2021年6月1日）;人口密度: 269人/km2;隣接都道府県: 富山県、岐阜県、福井県;県の木: アテ;県の花: クロユリ;県の鳥: イヌワシ;他のシンボル: 県の歌：石川県民の歌マスコット：ひゃくまんさん;知事: 谷本正憲;法人番号: 2000020170003;所在地: 〒920-8580石川県金沢市鞍月一丁目1番地北緯36度35分40.6秒東経136度37分32.3秒﻿ / ﻿北緯36.594611度 東経136.625639度﻿ / 36.594611; 136.625639座標: 北緯36度35分40.6秒東経136度37分32.3秒﻿ / ﻿北緯36.594611度 東経136.625639度﻿ / 36.594611; 136.625639;外部リンク: 石川県;ウィキポータル: 日本の都道府県/石川県;平均気温(°C): 25.2（8月）;最寒月: 2.4（2月）;降水量(mm): 256.9（12月）;最少月: 103.9（4月）;1950年（昭和25年）: 450,593;1960年（昭和35年）: 496,132;1970年（昭和45年）: 545,127;1980年（昭和55年）: 567,684;1990年（平成2年）: 606,265;2000年（平成12年）: 614,694;2005年（平成17年）: 596,324;小松市: 単位:億円4,8744,1183,5852,1972,0961,6791,364756590555407381242233181102927135小松市白山市金沢市能美市川北町加賀市かほく市宝達志水町志賀町七尾市羽咋市津幡町中能登町野々市町※輪島市珠洲市能登町穴水町内灘町","都道府県#一覧","表形式","本州の中央部、日本海側の北陸地方に位置する。県域は令制国の加賀国と能登国に当たる。"
"茨城県","0808茨城県いばらきけん水戸市水戸市 関東6,096.932,917,857478.64407 / 4","https://ja.wikipedia.org/wiki/茨城県","北緯36度20分30.2秒東経140度26分48.6秒","国: 日本;地方: 関東地方;団体コード: 08000-4;ISO 3166-2:JP: JP-08;面積: 6,097.19km2;総人口: 2,842,654人（推計人口、2021年7月1日）;人口密度: 466人/km2;隣接都道府県:  福島県 栃木県 埼玉県 千葉県;県の木: ウメ;県の花: バラ;県の鳥: ヒバリ;他のシンボル: 県のさかな：ヒラメ（1995年（平成7年）6月19日指定県民の歌：茨城県民の歌県民体操：茨城県民体操;知事: 大井川和彦;法人番号: 2000020080004;所在地: 〒310-8555茨城県水戸市笠原町978番地6北緯36度20分30.2秒東経140度26分48.6秒﻿ / ﻿北緯36.341722度 東経140.446833度﻿ / 36.341722; 140.446833;外部リンク: 公式ウェブサイト;ウィキポータル: 日本の都道府県/茨城県;平均気温（°C）: 23.4（8月）;最寒月: 3.5（1月）;降水量（mm）: 206.7（9月）;最少月: 30.0（12月）;いばらき自民党: 34;茨城県民フォーラム: 4;公明党: 4;日本共産党: 1;立憲民主党: 　　1;無所属: 17;欠員: 0","都道府県#一覧","表形式","都道府県人口は全国11位、面積は全国24位である。"
"岩手県","0303岩手県いわてけん盛岡市盛岡市 東北15,275.021,279,81483.83303 / 2","https://ja.wikipedia.org/wiki/岩手県","北緯39度42分12.6秒東経141度9分9.8秒","国: 日本;地方: 東北地方;団体コード: 03000-7;ISO 3166-2:JP: JP-03;面積: 15,275.01km2;総人口: 1,199,489人（推計人口、2021年7月1日）;人口密度: 78.5人/km2;隣接都道府県: 青森県、宮城県、秋田県;県の木: ナンブアカマツ;県の花: キリ;県の鳥: キジ;県の魚県の歌: ナンブサケ岩手県民の歌;知事: 達増拓也;法人番号: 4000020030007;所在地: 〒020-8570岩手県盛岡市内丸10番1号北緯39度42分12.6秒東経141度9分9.8秒﻿ / ﻿北緯39.703500度 東経141.152722度﻿ / 39.703500; 141.152722﻿ (岩手県庁)座標: 北緯39度42分12.6秒東経141度9分9.8秒﻿ / ﻿北緯39.703500度 東経141.152722度﻿ / 39.703500; 141.152722﻿ (岩手県庁);外部リンク: 公式ウェブサイト;ウィキポータル: 日本の都道府県/岩手県;平均気温(°C): 21.1（8月）;最寒月: −1.1（1月）;降水量(mm): 196.4（9月）;最少月: 36.0（12月）;平均気温(°C): 22.0（8月）;最寒月: −1.3（1月）;降水量(mm): 179.2（9月）;最少月: 49.5（2月）;国: 日本;地方: 東北地方;団体コード: 03000-7;ISO 3166-2:JP: JP-03;面積: 15,275.01km2;総人口: 1,199,489人（推計人口、2021年7月1日）;人口密度: 78.5人/km2;隣接都道府県: 青森県、宮城県、秋田県;県の木: ナンブアカマツ;県の花: キリ;県の鳥: キジ;県の魚県の歌: ナンブサケ岩手県民の歌;知事: 達増拓也;法人番号: 4000020030007;所在地: 〒020-8570岩手県盛岡市内丸10番1号北緯39度42分12.6秒東経141度9分9.8秒﻿ / ﻿北緯39.703500度 東経141.152722度﻿ / 39.703500; 141.152722﻿ (岩手県庁)座標: 北緯39度42分12.6秒東経141度9分9.8秒﻿ / ﻿北緯39.703500度 東経141.152722度﻿ / 39.703500; 141.152722﻿ (岩手県庁);外部リンク: 公式ウェブサイト;ウィキポータル: 日本の都道府県/岩手県;平均気温(°C): 21.1（8月）;最寒月: −1.1（1月）;降水量(mm): 196.4（9月）;最少月: 36.0（12月）;平均気温(°C): 22.0（8月）;最寒月: −1.3（1月）;降水量(mm): 179.2（9月）;最少月: 49.5（2月）","都道府県#一覧","表形式","東北地方の北部（北東北）に所在し、北は青森県、西は秋田県、南は宮城県と境界を接している。面積は15,275.01km2で、日本の都道府県としては、北海道に次いで2番目に広い。県の人口およそ125万人のうち、100万人以上（7割強）は、内陸部の北上盆地に集中している。盆地と海岸部以外は山地や丘陵地が多く、緑豊かな県である。"
"愛媛県","3838愛媛県えひめけん松山市松山市 四国5,676.101,385,840244.22004 / 2","https://ja.wikipedia.org/wiki/愛媛県","北緯33度50分29.8秒東経132度45分56.4秒","国: 日本;地方: 四国地方中国・四国地方;団体コード: 38000-8;ISO 3166-2:JP: JP-38;面積: 5,676.23km2;総人口: 1,324,882人（推計人口、2021年7月1日）;人口密度: 233人/km2;隣接都道府県: 徳島県、香川県、高知県、広島県以下、海上を隔てて隣接山口県、大分県;県の木: マツ;県の花: みかんの花;県の鳥: コマドリ;他のシンボル: 県の魚: マダイ県の獣: ニッポンカワウソ県の歌: 愛媛の歌県民の日: 2月20日（県政発足記念日）マスコットキャラクター: みきゃん;知事: 中村時広;法人番号: 1000020380008;所在地: 〒790-8570愛媛県松山市一番町四丁目4番地2北緯33度50分29.8秒東経132度45分56.4秒﻿ / ﻿北緯33.841611度 東経132.765667度﻿ / 33.841611; 132.765667﻿ (愛媛県)座標: 北緯33度50分29.8秒東経132度45分56.4秒﻿ / ﻿北緯33.841611度 東経132.765667度﻿ / 33.841611; 132.765667﻿ (愛媛県)県庁舎位置;外部リンク: 愛媛県;ウィキポータル: 日本の都道府県/愛媛県;平均気温(°C):;最寒月:;降水量(mm):;最少月:;国: 日本;地方: 四国地方中国・四国地方;団体コード: 38000-8;ISO 3166-2:JP: JP-38;面積: 5,676.23km2;総人口: 1,324,882人（推計人口、2021年7月1日）;人口密度: 233人/km2;隣接都道府県: 徳島県、香川県、高知県、広島県以下、海上を隔てて隣接山口県、大分県;県の木: マツ;県の花: みかんの花;県の鳥: コマドリ;他のシンボル: 県の魚: マダイ県の獣: ニッポンカワウソ県の歌: 愛媛の歌県民の日: 2月20日（県政発足記念日）マスコットキャラクター: みきゃん;知事: 中村時広;法人番号: 1000020380008;所在地: 〒790-8570愛媛県松山市一番町四丁目4番地2北緯33度50分29.8秒東経132度45分56.4秒﻿ / ﻿北緯33.841611度 東経132.765667度﻿ / 33.841611; 132.765667﻿ (愛媛県)座標: 北緯33度50分29.8秒東経132度45分56.4秒﻿ / ﻿北緯33.841611度 東経132.765667度﻿ / 33.841611; 132.765667﻿ (愛媛県)県庁舎位置;外部リンク: 愛媛県;ウィキポータル: 日本の都道府県/愛媛県;平均気温(°C):;最寒月:;降水量(mm):;最少月:","都道府県#一覧","表形式","令制国の伊予国に当たる。"
"大分県","4444大分県おおいたけん大分市大分市 九州6,340.611,166,729184.01803 / 2","https://ja.wikipedia.org/wiki/大分県","北緯33度14分17.3秒東経131度36分45.4秒","国: 日本;地方: 九州地方;団体コード: 44000-1;ISO 3166-2:JP: JP-44;面積: 6,340.73km2（境界未定部分あり）;総人口: 1,117,562人（推計人口、2021年6月1日）;人口密度: 176人/km2;隣接都道府県:  福岡県 熊本県 宮崎県 愛媛県 山口県;県の木: 豊後梅;県の花: 豊後梅;県の鳥: めじろ;他のシンボル: 県の歌：未制定県民の日：11月14日;知事: 広瀬勝貞;法人番号: 1000020440001;所在地: 〒870-8501大分県大分市大手町3丁目1番1号北緯33度14分17.3秒東経131度36分45.4秒﻿ / ﻿北緯33.238139度 東経131.612611度﻿ / 33.238139; 131.612611座標: 北緯33度14分17.3秒東経131度36分45.4秒﻿ / ﻿北緯33.238139度 東経131.612611度﻿ / 33.238139; 131.612611県庁舎位置;外部リンク: 公式ウェブサイト;ウィキポータル: 日本の都道府県/大分県;平均気温(°C): 26.9（8月）;最寒月: 5.3（1月）;降水量(mm): 296.9（6月）;最少月: 30.7（12月）","都道府県#一覧","表形式","全国的に知名度が高い別府温泉や由布院温泉をはじめとする多くの温泉を有し、源泉数（4,445か所）、湧出量（279,253リットル/分）ともに日本一であり、「日本一のおんせん県おおいた」をキャッチフレーズに温泉をアピールしている。"
