"タイトル","コメント","URLアドレス","座標","詳細情報","親リスト","一覧抽出方法","前文"
"長野県","2020長野県ながのけん長野市長野市 中部13,561.562,099,759154.87705 / 2","https://ja.wikipedia.org/wiki/長野県","北緯36度39分4.6秒東経138度10分51.4秒","国: 日本;地方: 中部地方、甲信越地方、信越地方;団体コード: 20000-0;ISO 3166-2:JP: JP-20;面積: 13,561.56km2（境界未定部分あり）;総人口: 2,023,439人（推計人口、2021年6月1日）;人口密度: 149人/km2;隣接都道府県: 群馬県、埼玉県、新潟県、富山県、山梨県、岐阜県、静岡県、愛知県;県の木: 白樺;県の花: リンドウ;県の鳥: 雷鳥;他のシンボル: 県歌:信濃の国県獣:ニホンカモシカ長野冬季五輪開催記念日:2月7日;知事: 阿部守一;法人番号: 1000020200000;所在地: 〒380-8570長野県長野市大字南長野字幅下692番地2北緯36度39分4.6秒東経138度10分51.4秒﻿ / ﻿北緯36.651278度 東経138.180944度﻿ / 36.651278; 138.180944座標: 北緯36度39分4.6秒東経138度10分51.4秒﻿ / ﻿北緯36.651278度 東経138.180944度﻿ / 36.651278; 138.180944長野県庁 本館棟;外部リンク: 長野県公式ホームページ;特記事項: 県庁舎位置の標高：371.3 m;ウィキポータル: 日本の都道府県/長野県;平均気温(°C): 23.6（8月）;最寒月: −1.4（1月）;降水量(mm): 296.7（1月）;最少月: 76.7（4月）;平均気温(°C): 24.3（8月）;最寒月: −0.6（1月）;降水量(mm): 155.9（9月）;最少月: 23.3（12月）;北信地方: 長野 都市圏51万4136人;中信地方: 松本 都市圏37万1850人;東信地方: 上田 都市圏20万5775人;南信地方: 飯田 都市圏14万1286人;国: 日本;地方: 中部地方、甲信越地方、信越地方;団体コード: 20000-0;ISO 3166-2:JP: JP-20;面積: 13,561.56km2（境界未定部分あり）;総人口: 2,023,439人（推計人口、2021年6月1日）;人口密度: 149人/km2;隣接都道府県: 群馬県、埼玉県、新潟県、富山県、山梨県、岐阜県、静岡県、愛知県;県の木: 白樺;県の花: リンドウ;県の鳥: 雷鳥;他のシンボル: 県歌:信濃の国県獣:ニホンカモシカ長野冬季五輪開催記念日:2月7日;知事: 阿部守一;法人番号: 1000020200000;所在地: 〒380-8570長野県長野市大字南長野字幅下692番地2北緯36度39分4.6秒東経138度10分51.4秒﻿ / ﻿北緯36.651278度 東経138.180944度﻿ / 36.651278; 138.180944座標: 北緯36度39分4.6秒東経138度10分51.4秒﻿ / ﻿北緯36.651278度 東経138.180944度﻿ / 36.651278; 138.180944長野県庁 本館棟;外部リンク: 長野県公式ホームページ;特記事項: 県庁舎位置の標高：371.3 m;ウィキポータル: 日本の都道府県/長野県;平均気温(°C): 23.6（8月）;最寒月: −1.4（1月）;降水量(mm): 296.7（1月）;最少月: 76.7（4月）;平均気温(°C): 24.3（8月）;最寒月: −0.6（1月）;降水量(mm): 155.9（9月）;最少月: 23.3（12月）;北信地方: 長野 都市圏51万4136人;中信地方: 松本 都市圏37万1850人;東信地方: 上田 都市圏20万5775人;南信地方: 飯田 都市圏14万1286人","都道府県#一覧","表形式","令制国名の信濃国にちなみ「信州」とも呼ばれている。海に面していない内陸県であり、日本アルプスを始め大規模な山岳地があるため可住地面積率は低い。キャッチフレーズはしあわせ信州。"
"奈良県","2929奈良県ならけん奈良市奈良市 近畿3,690.941,365,008369.83903 / 2","https://ja.wikipedia.org/wiki/奈良県","北緯34度41分6.7秒東経135度49分58.6秒","国: 日本;地方: 近畿地方;団体コード: 29000-9;ISO 3166-2:JP: JP-29;面積: 3,690.94km2;総人口: 1,315,605人（推計人口、2021年7月1日）;人口密度: 356人/km2;隣接都道府県:  三重県 京都府 大阪府 和歌山県;県の木: スギ;県の花: ナラヤエザクラ;県の鳥: コマドリ;他のシンボル: 県のさかな：キンギョ、アユ、アマゴ県の歌：奈良県民の歌;知事: 荒井正吾;法人番号: 1000020290009;所在地: 〒630-8501奈良県奈良市登大路町30北緯34度41分6.7秒東経135度49分58.6秒﻿ / ﻿北緯34.685194度 東経135.832944度﻿ / 34.685194; 135.832944﻿ (奈良県)座標: 北緯34度41分6.7秒東経135度49分58.6秒﻿ / ﻿北緯34.685194度 東経135.832944度﻿ / 34.685194; 135.832944﻿ (奈良県)県庁舎位置;外部リンク: 奈良県;ウィキポータル: 日本の都道府県/奈良県;平均気温(℃): 26.6（8月）;最寒月: 3.8（1月）;降水量(mm): 208.5（6月）;最少月: 40.7（12月）","都道府県#一覧","表形式","紀伊半島内陸部にあり、令制国の大和国の領域を占め、北西部の盆地部を除けば険しい山々がそびえており、人口の偏りがかなり大きい。都道府県面積は全国で8番目に狭く内陸8県では最も狭い。"
"新潟県","1515新潟県にいがたけん新潟市新潟市 中部12,584.102,305,098183.23006 / 2","https://ja.wikipedia.org/wiki/新潟県","北緯37度54分8.9秒東経139度1分23.4秒","国: 日本;地方: 中部地方、北陸地方甲信越地方、信越地方北信越地方、上信越地方広域関東圏;団体コード: 15000-2;ISO 3166-2:JP: JP-15;面積: 12,584.18km2（境界未定部分あり）;総人口: 2,184,315人（推計人口、2021年6月1日）;人口密度: 174人/km2;隣接都道府県: 山形県、福島県、群馬県、長野県、富山県;県の木: ユキツバキ;県の花: チューリップ;県の鳥: トキ;他のシンボル: 県の草花: 雪割草（2008年（平成20年）3月1日指定）県の鑑賞魚: 錦鯉（2017年（平成29年）5月5日指定）県の石:ヒスイ輝石岩、自然金、石炭紀-ペルム紀海生動物化石群（2016年（平成28年）5月10日指定）県の歌: 新潟県民歌（1948年（昭和23年）3月28日発表）;知事: 花角英世;法人番号: 5000020150002;所在地: 〒950-8570新潟県新潟市中央区新光町4番地1北緯37度54分8.9秒東経139度1分23.4秒﻿ / ﻿北緯37.902472度 東経139.023167度﻿ / 37.902472; 139.023167座標: 北緯37度54分8.9秒東経139度1分23.4秒﻿ / ﻿北緯37.902472度 東経139.023167度﻿ / 37.902472; 139.023167新潟県庁舎;外部リンク: 新潟県;ウィキポータル: 日本の都道府県/新潟県;平均気温(°C): 26.0（8月）;最寒月: 2.9（1月）;降水量(mm): 358.0（12月）;最少月: 88.4（5月）;平均気温(°C): 25.6（8月）;最寒月: 2.1（1月）;降水量(mm): 222.8（12月）;最少月: 85.2（5月）;安塚: 799 cm;高田: 413 cm;能生: 505 cm;関山: 1061 cm;津南: 1301 cm;湯沢: 1054 cm;十日町: 967 cm;小出: 900 cm;守門: 1243 cm;柏崎: 290 cm;長岡: 477 cm;新津: 249 cm;新潟: 139 cm;津川: 658 cm;下関: 519 cm;相川: 67 cm;国: 日本;地方: 中部地方、北陸地方甲信越地方、信越地方北信越地方、上信越地方広域関東圏;団体コード: 15000-2;ISO 3166-2:JP: JP-15;面積: 12,584.18km2（境界未定部分あり）;総人口: 2,184,315人（推計人口、2021年6月1日）;人口密度: 174人/km2;隣接都道府県: 山形県、福島県、群馬県、長野県、富山県;県の木: ユキツバキ;県の花: チューリップ;県の鳥: トキ;他のシンボル: 県の草花: 雪割草（2008年（平成20年）3月1日指定）県の鑑賞魚: 錦鯉（2017年（平成29年）5月5日指定）県の石:ヒスイ輝石岩、自然金、石炭紀-ペルム紀海生動物化石群（2016年（平成28年）5月10日指定）県の歌: 新潟県民歌（1948年（昭和23年）3月28日発表）;知事: 花角英世;法人番号: 5000020150002;所在地: 〒950-8570新潟県新潟市中央区新光町4番地1北緯37度54分8.9秒東経139度1分23.4秒﻿ / ﻿北緯37.902472度 東経139.023167度﻿ / 37.902472; 139.023167座標: 北緯37度54分8.9秒東経139度1分23.4秒﻿ / ﻿北緯37.902472度 東経139.023167度﻿ / 37.902472; 139.023167新潟県庁舎;外部リンク: 新潟県;ウィキポータル: 日本の都道府県/新潟県;平均気温(°C): 26.0（8月）;最寒月: 2.9（1月）;降水量(mm): 358.0（12月）;最少月: 88.4（5月）;平均気温(°C): 25.6（8月）;最寒月: 2.1（1月）;降水量(mm): 222.8（12月）;最少月: 85.2（5月）;安塚: 799 cm;高田: 413 cm;能生: 505 cm;関山: 1061 cm;津南: 1301 cm;湯沢: 1054 cm;十日町: 967 cm;小出: 900 cm;守門: 1243 cm;柏崎: 290 cm;長岡: 477 cm;新津: 249 cm;新潟: 139 cm;津川: 658 cm;下関: 519 cm;相川: 67 cm","都道府県#一覧","表形式","日本海に面しており、県内は地理的観点から一般的に上越地方、中越地方、下越地方、佐渡地方の4地域に大きく分けられる（#地域区分で後述）。"
"兵庫県","2828兵庫県ひょうごけん神戸市神戸市 近畿8,400.905,536,989659.14112 / 6","https://ja.wikipedia.org/wiki/兵庫県","北緯34度41分28.5秒東経135度10分59.1秒","国: 日本;地方: 近畿地方;団体コード: 28000-3;ISO 3166-2:JP: JP-28;面積: 8,400.94km2;総人口: 5,446,455人（推計人口、2021年6月1日）;人口密度: 648人/km2;隣接都道府県:  京都府 大阪府 鳥取県 岡山県 和歌山県 香川県 徳島県;県の木: クスノキ;県の花: ノジギク;県の鳥: コウノトリ;県の歌: 兵庫県民歌（1947年制定）;知事: 井戸敏三;法人番号: 8000020280003;所在地: 〒650-8567兵庫県神戸市中央区下山手通五丁目10番1号北緯34度41分28.5秒東経135度10分59.1秒﻿ / ﻿北緯34.691250度 東経135.183083度﻿ / 34.691250; 135.183083座標: 北緯34度41分28.5秒東経135度10分59.1秒﻿ / ﻿北緯34.691250度 東経135.183083度﻿ / 34.691250; 135.183083県庁舎位置;外部リンク: 兵庫県ホームページ;ウィキポータル: 日本の都道府県/兵庫県;平均気温(°C): 25.9（8月）;最寒月: 4.2（2月）;降水量(mm): 255.6（1月）;最少月: 104.1（4月）;降水日数（日）: 22.4（1月）;最少月: 9.1（8月）;平均気温(°C): 25.4（8月）;最寒月: 2.3（1月）;降水量(mm): 272.8（7月）;最少月: 54.9（12月）;降水日数（日）: 13.4（6月）;最少月: 7.5（11月）;国: 日本;地方: 近畿地方;団体コード: 28000-3;ISO 3166-2:JP: JP-28;面積: 8,400.94km2;総人口: 5,446,455人（推計人口、2021年6月1日）;人口密度: 648人/km2;隣接都道府県:  京都府 大阪府 鳥取県 岡山県 和歌山県 香川県 徳島県;県の木: クスノキ;県の花: ノジギク;県の鳥: コウノトリ;県の歌: 兵庫県民歌（1947年制定）;知事: 井戸敏三;法人番号: 8000020280003;所在地: 〒650-8567兵庫県神戸市中央区下山手通五丁目10番1号北緯34度41分28.5秒東経135度10分59.1秒﻿ / ﻿北緯34.691250度 東経135.183083度﻿ / 34.691250; 135.183083座標: 北緯34度41分28.5秒東経135度10分59.1秒﻿ / ﻿北緯34.691250度 東経135.183083度﻿ / 34.691250; 135.183083県庁舎位置;外部リンク: 兵庫県ホームページ;ウィキポータル: 日本の都道府県/兵庫県;平均気温(°C): 25.9（8月）;最寒月: 4.2（2月）;降水量(mm): 255.6（1月）;最少月: 104.1（4月）;降水日数（日）: 22.4（1月）;最少月: 9.1（8月）;平均気温(°C): 25.4（8月）;最寒月: 2.3（1月）;降水量(mm): 272.8（7月）;最少月: 54.9（12月）;降水日数（日）: 13.4（6月）;最少月: 7.5（11月）","都道府県#一覧","表形式","南北に長い県域を持ち、近畿地方の府県で最大の面積を持つ。北は日本海、南は瀬戸内海の2つの海に接している県である。本州で2つの海に接している県は、両端である青森県と山口県を除けば兵庫県のみである。本州を青森県から山口県まで陸路で縦断しようとすると、必ず本県を通ることになる。"
"広島県","3434広島県ひろしまけん広島市広島市 中国8,479.382,844,963335.52307 / 4","https://ja.wikipedia.org/wiki/広島県","北緯34度23分47.3秒東経132度27分35.1秒","国: 日本;地方: 中国地方、山陽地方中国・四国地方;団体コード: 34000-6;ISO 3166-2:JP: JP-34;面積: 8,479.63km2;総人口: 2,780,982人（推計人口、2021年6月1日）;人口密度: 328人/km2;隣接都道府県: 鳥取県、島根県、岡山県、山口県、愛媛県、※香川県香川県とは海上で隣接、愛媛県とは瀬戸内海の瓢箪島内に陸上の県境を有する;県の木: モミジ;県の花: モミジ;県の鳥: アビ;県の魚県の歌: カキ（広島かき）未制定;知事: 湯崎英彦;法人番号: 7000020340006;所在地: 〒730-8511広島県広島市中区基町10番52号北緯34度23分47.3秒東経132度27分35.1秒﻿ / ﻿北緯34.396472度 東経132.459750度﻿ / 34.396472; 132.459750﻿ (広島県)座標: 北緯34度23分47.3秒東経132度27分35.1秒﻿ / ﻿北緯34.396472度 東経132.459750度﻿ / 34.396472; 132.459750﻿ (広島県)県庁舎位置;外部リンク: 広島県;ウィキポータル: 日本の都道府県/広島県;平均気温(°C):;最寒月:;降水量(mm):;最少月:;平均気温(°C):;最寒月:;降水量(mm):;最少月:;国: 日本;地方: 中国地方、山陽地方中国・四国地方;団体コード: 34000-6;ISO 3166-2:JP: JP-34;面積: 8,479.63km2;総人口: 2,780,982人（推計人口、2021年6月1日）;人口密度: 328人/km2;隣接都道府県: 鳥取県、島根県、岡山県、山口県、愛媛県、※香川県香川県とは海上で隣接、愛媛県とは瀬戸内海の瓢箪島内に陸上の県境を有する;県の木: モミジ;県の花: モミジ;県の鳥: アビ;県の魚県の歌: カキ（広島かき）未制定;知事: 湯崎英彦;法人番号: 7000020340006;所在地: 〒730-8511広島県広島市中区基町10番52号北緯34度23分47.3秒東経132度27分35.1秒﻿ / ﻿北緯34.396472度 東経132.459750度﻿ / 34.396472; 132.459750﻿ (広島県)座標: 北緯34度23分47.3秒東経132度27分35.1秒﻿ / ﻿北緯34.396472度 東経132.459750度﻿ / 34.396472; 132.459750﻿ (広島県)県庁舎位置;外部リンク: 広島県;ウィキポータル: 日本の都道府県/広島県;平均気温(°C):;最寒月:;降水量(mm):;最少月:;平均気温(°C):;最寒月:;降水量(mm):;最少月:","都道府県#一覧","表形式","臨海部（瀬戸内海工業地域）を中心に工業（自動車産業、製鉄、造船）が発展。広島都市圏、福山都市圏と県内に二つの大きな都市圏を持つ。県庁所在地の広島市は政令指定都市であり中国・四国地方最大の都市である。一方で海・山の豊富な自然にも恵まれ、農業・漁業も盛んである。このことから産業分布が日本平均に近く、県民所得も中位にあり「日本国の縮図」とも呼ばれることがある。"
"福井県","1818福井県ふくいけん福井市福井市 中部4,190.43787,099187.81702 / 2","https://ja.wikipedia.org/wiki/福井県","北緯36度3分54.7秒東経136度13分18秒","国: 日本;地方: 中部地方、北陸地方;団体コード: 18000-9;ISO 3166-2:JP: JP-18;面積: 4,190.49km2;総人口: 762,549人（推計人口、2021年6月1日）;人口密度: 182人/km2;隣接都道府県: 石川県、岐阜県、滋賀県、京都府;県の木: 松;県の花: 水仙;県の鳥: つぐみ;他のシンボル: 県の魚：越前蟹県の歌：福井県民歌マスコット：Juratic、はぴりゅうふるさとの日：2月7日;知事: 杉本達治;法人番号: 4000020180009;所在地: 〒910-8580福井県福井市大手三丁目17番1号北緯36度3分54.7秒東経136度13分18秒﻿ / ﻿北緯36.065194度 東経136.22167度﻿ / 36.065194; 136.22167座標: 北緯36度3分54.7秒東経136度13分18秒﻿ / ﻿北緯36.065194度 東経136.22167度﻿ / 36.065194; 136.22167県庁舎位置;外部リンク: 福井県;ウィキポータル: 日本の都道府県/福井県;平均気温(°C): 25.6（8月）;最寒月: 3.1（2月）;降水量(mm): 224.0（12月）;最少月: 121.4（4月）;国: 日本;地方: 中部地方、北陸地方;団体コード: 18000-9;ISO 3166-2:JP: JP-18;面積: 4,190.49km2;総人口: 762,549人（推計人口、2021年6月1日）;人口密度: 182人/km2;隣接都道府県: 石川県、岐阜県、滋賀県、京都府;県の木: 松;県の花: 水仙;県の鳥: つぐみ;他のシンボル: 県の魚：越前蟹県の歌：福井県民歌マスコット：Juratic、はぴりゅうふるさとの日：2月7日;知事: 杉本達治;法人番号: 4000020180009;所在地: 〒910-8580福井県福井市大手三丁目17番1号北緯36度3分54.7秒東経136度13分18秒﻿ / ﻿北緯36.065194度 東経136.22167度﻿ / 36.065194; 136.22167座標: 北緯36度3分54.7秒東経136度13分18秒﻿ / ﻿北緯36.065194度 東経136.22167度﻿ / 36.065194; 136.22167県庁舎位置;外部リンク: 福井県;ウィキポータル: 日本の都道府県/福井県;平均気温(°C): 25.6（8月）;最寒月: 3.1（2月）;降水量(mm): 224.0（12月）;最少月: 121.4（4月）","都道府県#一覧","表形式","北陸地方で最も人口が少ない県である。"
"福岡県","4040福岡県ふくおかけん福岡市福岡市 九州4,986.405,102,8711,023.46011 / 6","https://ja.wikipedia.org/wiki/福岡県","北緯33度36分22.4秒東経130度25分5.1秒","国: 日本;地方: 九州地方;団体コード: 40000-9;ISO 3166-2:JP: JP-40;面積: 4,986.52km2（境界未定部分あり）;総人口: 5,118,023人（推計人口、2021年5月1日）;人口密度: 1,026人/km2;隣接都道府県:  佐賀県 熊本県 大分県 山口県 長崎県;県の木: ツツジ;県の花: ウメ;県の鳥: ウグイス;県の歌: 希望の光（1970年制定）;知事: 服部誠太郎;法人番号: 6000020400009;所在地: 〒812-8577福岡県福岡市博多区東公園7番7号北緯33度36分22.4秒東経130度25分5.1秒﻿ / ﻿北緯33.606222度 東経130.418083度﻿ / 33.606222; 130.418083﻿ (福岡県)座標: 北緯33度36分22.4秒東経130度25分5.1秒﻿ / ﻿北緯33.606222度 東経130.418083度﻿ / 33.606222; 130.418083﻿ (福岡県);外部リンク: 福岡県;特記事項: 県内総生産：174,447億円（2000年、全国第9位）法人番号：6000020400009;ウィキポータル: 日本の都道府県/福岡県;平均気温(°C): 28.1（8月）;最寒月: 6.6（1月）;降水量(mm): 277.9（7月）;最少月: 59.8（12月）;国: 日本;地方: 九州地方;団体コード: 40000-9;ISO 3166-2:JP: JP-40;面積: 4,986.52km2（境界未定部分あり）;総人口: 5,118,023人（推計人口、2021年5月1日）;人口密度: 1,026人/km2;隣接都道府県:  佐賀県 熊本県 大分県 山口県 長崎県;県の木: ツツジ;県の花: ウメ;県の鳥: ウグイス;県の歌: 希望の光（1970年制定）;知事: 服部誠太郎;法人番号: 6000020400009;所在地: 〒812-8577福岡県福岡市博多区東公園7番7号北緯33度36分22.4秒東経130度25分5.1秒﻿ / ﻿北緯33.606222度 東経130.418083度﻿ / 33.606222; 130.418083﻿ (福岡県)座標: 北緯33度36分22.4秒東経130度25分5.1秒﻿ / ﻿北緯33.606222度 東経130.418083度﻿ / 33.606222; 130.418083﻿ (福岡県);外部リンク: 福岡県;特記事項: 県内総生産：174,447億円（2000年、全国第9位）法人番号：6000020400009;ウィキポータル: 日本の都道府県/福岡県;平均気温(°C): 28.1（8月）;最寒月: 6.6（1月）;降水量(mm): 277.9（7月）;最少月: 59.8（12月）","都道府県#一覧","表形式","九州地方北部に位置し、九州地方の県では最も人口が多い。県庁所在地の福岡市は、九州地方最大の人口を擁する都市であり、西日本においても大阪市に次ぐ人口を擁する都市である。福岡市と北九州市の2つの政令指定都市を抱え、いわゆる三大都市圏以外では人口密度が1,000人/km2を超える唯一の県である。"
"福島県","0707福島県ふくしまけん福島市いわき市 東北13,783.751,913,606138.85905 / 2","https://ja.wikipedia.org/wiki/福島県","北緯37度45分1秒東経140度28分3.9秒","国: 日本;地方: 東北地方;団体コード: 07000-9;ISO 3166-2:JP: JP-07;面積: 13,783.90km2;総人口: 1,816,747人（推計人口、2021年7月1日）;人口密度: 132人/km2;隣接都道府県: 宮城県、山形県、茨城県、栃木県、群馬県、新潟県;県の木: ケヤキ;県の花: ネモトシャクナゲ;県の鳥: キビタキ;県の歌県民の日: 福島県県民の歌8月21日;知事: 内堀雅雄;法人番号: 7000020070009;所在地: 〒960-8670福島県福島市杉妻町2番16号北緯37度45分1秒東経140度28分3.9秒﻿ / ﻿北緯37.75028度 東経140.467750度﻿ / 37.75028; 140.467750;外部リンク: 公式ウェブサイト;ウィキポータル: 日本の都道府県/福島県;平均気温(°C): 23.7（8月）;最寒月: 1.8（1月）;降水量(mm): 238.8（9月）;最少月: 22.1（12月）;平均気温(°C): 23.3（8月）;最寒月: 0.2（1月）;降水量(mm): 228.2（8月）;最少月: 25.0（12月）;平均気温(°C): 20.2（8月）;最寒月: −4.5（2月）;降水量(mm): 234.5（7月）;最少月: 114.7（4月）;会津229,385人（会津若松市他）:;県中516,144人（郡山市他）:;南会津023,717人（南会津町他）:;県南137,592人（白河市他）:","都道府県#一覧","表形式","面積は北海道、岩手県に次ぐ全国3位、都道府県別の人口は全国21位、人口密度は全国40位である（いずれも2015年10月1日時点の国勢調査および全国都道府県市区町村別面積調による）。"
