"タイトル","コメント","URLアドレス","座標","詳細情報","親リスト","一覧抽出方法","前文"
"岐阜県","2121岐阜県ぎふけん岐阜市岐阜市 中部10,621.292,032,533191.44205 / 2","https://ja.wikipedia.org/wiki/岐阜県","北緯35度23分28.3秒東経136度43分19.9秒","国: 日本;地方: 中部地方、東海地方;団体コード: 21000-5;ISO 3166-2:JP: JP-21;面積: 10,621.29km2（境界未定部分あり）;総人口: 1,966,878人（推計人口、2021年6月1日）;人口密度: 185人/km2;隣接都道府県: 富山県、石川県、福井県、長野県、愛知県、三重県、滋賀県;県の木: イチイ;県の花: レンゲソウ;県の鳥: ライチョウ;県の魚県の歌: アユ岐阜県民の歌;知事: 古田肇;法人番号: 4000020210005;所在地: 〒500-8570岐阜県岐阜市薮田南二丁目1番1号北緯35度23分28.3秒東経136度43分19.9秒﻿ / ﻿北緯35.391194度 東経136.722194度﻿ / 35.391194; 136.722194座標: 北緯35度23分28.3秒東経136度43分19.9秒﻿ / ﻿北緯35.391194度 東経136.722194度﻿ / 35.391194; 136.722194県庁舎位置;外部リンク: 公式ウェブサイト;ウィキポータル: 日本の都道府県/岐阜県;平均気温(°C): 23.3（8月）;最寒月: −1.1（2月）;降水量(mm): 270.6（7月）;最少月: 140.0（4月）;降水日数（日）: 22.8（1月）;最少月: 10.9（8月）;平均気温(°C): 25.7（8月）;最寒月: 1.5（1月）;降水量(mm): 277.5（7月）;最少月: 48.0（12月）;降水日数（日）: 16.1（7月）;最少月: 7.5（12月）;平成16年: 932,813;平成17年: 923,189;平成18年: 925,960;平成19年: 878,060;平成20年: 882,135;平成21年: 1,005,740;平成22年: 918,712;平成23年: 859,050;平成24年: 870,096;平成25年: 919,029;平成26年: 890,748;平成27年: 974,599;平成28年: 927,643;平成29年: 920,505;平成30年: 1,117,624;国: 日本;地方: 中部地方、東海地方;団体コード: 21000-5;ISO 3166-2:JP: JP-21;面積: 10,621.29km2（境界未定部分あり）;総人口: 1,966,878人（推計人口、2021年6月1日）;人口密度: 185人/km2;隣接都道府県: 富山県、石川県、福井県、長野県、愛知県、三重県、滋賀県;県の木: イチイ;県の花: レンゲソウ;県の鳥: ライチョウ;県の魚県の歌: アユ岐阜県民の歌;知事: 古田肇;法人番号: 4000020210005;所在地: 〒500-8570岐阜県岐阜市薮田南二丁目1番1号北緯35度23分28.3秒東経136度43分19.9秒﻿ / ﻿北緯35.391194度 東経136.722194度﻿ / 35.391194; 136.722194座標: 北緯35度23分28.3秒東経136度43分19.9秒﻿ / ﻿北緯35.391194度 東経136.722194度﻿ / 35.391194; 136.722194県庁舎位置;外部リンク: 公式ウェブサイト;ウィキポータル: 日本の都道府県/岐阜県;平均気温(°C): 23.3（8月）;最寒月: −1.1（2月）;降水量(mm): 270.6（7月）;最少月: 140.0（4月）;降水日数（日）: 22.8（1月）;最少月: 10.9（8月）;平均気温(°C): 25.7（8月）;最寒月: 1.5（1月）;降水量(mm): 277.5（7月）;最少月: 48.0（12月）;降水日数（日）: 16.1（7月）;最少月: 7.5（12月）;平成16年: 932,813;平成17年: 923,189;平成18年: 925,960;平成19年: 878,060;平成20年: 882,135;平成21年: 1,005,740;平成22年: 918,712;平成23年: 859,050;平成24年: 870,096;平成25年: 919,029;平成26年: 890,748;平成27年: 974,599;平成28年: 927,643;平成29年: 920,505;平成30年: 1,117,624","都道府県#一覧","表形式","日本の人口重心中央に位置し、その地形は変化に富んでいる。内陸県である。"
"京都府","2626京都府きょうとふ京都市京都市 近畿4,612.202,610,140565.92606 / 4","https://ja.wikipedia.org/wiki/京都府","北緯35度1分15.7秒東経135度45分20.1秒","国: 日本;地方: 近畿地方;団体コード: 26000-2;ISO 3166-2:JP: JP-26;面積: 4,612.20km2;総人口: 2,569,856人（推計人口、2021年6月1日）;人口密度: 557人/km2;隣接都道府県:  福井県 三重県 滋賀県 大阪府 兵庫県 奈良県;府の木: 北山杉;府の花: しだれ桜、嵯峨ぎく、ナデシコ;府の鳥: オオミズナギドリ;府の歌: 京都府の歌（1984年制定）;知事: 西脇隆俊;法人番号: 2000020260002;所在地: 〒602-8570京都府京都市上京区下立売通新町西入藪の内町85番地3北緯35度1分15.7秒東経135度45分20.1秒﻿ / ﻿北緯35.021028度 東経135.755583度﻿ / 35.021028; 135.755583座標: 北緯35度1分15.7秒東経135度45分20.1秒﻿ / ﻿北緯35.021028度 東経135.755583度﻿ / 35.021028; 135.755583;外部リンク: 公式ウェブサイト;ウィキポータル: 日本の都道府県/京都府;平均気温(°C): 26.3（8月）;最寒月: 4.8（2月）;降水量(mm): 213.3（12月);最少月: 101.8（4月）;降水日数（日）: 22.4（1月）;最少月: 8.3（8月）;間人: 2.2;宮津: 5.9;舞鶴: 6.5;福知山: 10.7;美山: 3.5;園部: 10.5;京都: 15.4;京田辺: 9.1;北部: 海の京都;南部: 森の京都;: 　1234567891011121314151617181920212223242526","都道府県#一覧","表形式","令制国でいう山城国の全域、丹波国の東部および丹後国の全域を府域とする。恭仁京（木津川市）や長岡京（向日市・長岡京市・京都市西京区）、平安京（京都市）など、日本の首都が置かれていた歴史がある古都である。"
"熊本県","4343熊本県くまもとけん熊本市熊本市 九州7,409.321,786,969241.24504 / 2","https://ja.wikipedia.org/wiki/熊本県","北緯32度47分23秒東経130度44分29.9秒","国: 日本;地方: 九州地方;団体コード: 43000-5;ISO 3166-2:JP: JP-43;面積: 7,409.48km2（境界未定部分あり）;総人口: 1,726,763人（推計人口、2021年7月1日）;人口密度: 233人/km2;隣接都道府県:  福岡県 大分県 宮崎県 鹿児島県 長崎県;県の木: クスノキ;県の花: リンドウ;県の鳥: ヒバリ;他のシンボル: 県の魚：クルマエビ県の歌：熊本県民の歌マスコット：くまモン;知事: 蒲島郁夫;法人番号: 7000020430005;所在地: 〒862-8570熊本県熊本市中央区水前寺6丁目18番1号北緯32度47分23秒東経130度44分29.9秒﻿ / ﻿北緯32.78972度 東経130.741639度﻿ / 32.78972; 130.741639﻿ (熊本県)座標: 北緯32度47分23秒東経130度44分29.9秒﻿ / ﻿北緯32.78972度 東経130.741639度﻿ / 32.78972; 130.741639﻿ (熊本県)県庁舎位置;外部リンク: 熊本県;ウィキポータル: 日本の都道府県/熊本県;平均気温(℃): 24.0（8月）;最寒月: 1.6(1月);降水量(mm): 530.0（6月）;最少月: 52.4（12月）","都道府県#一覧","表形式","令制国の肥後国に当たる。有明海、不知火海、東シナ海に面している。"
"群馬県","1010群馬県ぐんまけん前橋市高崎市 関東6,362.281,973,476310.23505 / 2","https://ja.wikipedia.org/wiki/群馬県","北緯36度23分26.4秒東経139度3分37.6秒","国: 日本;地方: 関東地方;団体コード: 10000-5;ISO 3166-2:JP: JP-10;面積: 6,362.28km2;総人口: 1,930,232人（推計人口、2021年7月1日）;人口密度: 303人/km2;隣接都道府県:  埼玉県 新潟県 長野県 栃木県 福島県;県の木: クロマツ;県の花: レンゲツツジ;県の鳥: ヤマドリ;県の魚県の歌県民の日マスコット: アユ群馬県の歌10月28日ぐんまちゃん;知事: 山本一太;法人番号: 7000020100005;所在地: 〒371-8570群馬県前橋市大手町一丁目1番1号北緯36度23分26.4秒東経139度3分37.6秒﻿ / ﻿北緯36.390667度 東経139.060444度﻿ / 36.390667; 139.060444﻿ (群馬県)座標: 北緯36度23分26.4秒東経139度3分37.6秒﻿ / ﻿北緯36.390667度 東経139.060444度﻿ / 36.390667; 139.060444﻿ (群馬県);外部リンク: 群馬県;ウィキポータル: 日本の都道府県/群馬県;平均気温（°C）: 24.3（8月）;最寒月: -0.3（1月）;降水量（mm）: 169.5（9月）;最少月: 36.7（12月）;降水日数（日）: 15.4（7月）;最少月: 6.4（12月）;国: 日本;地方: 関東地方;団体コード: 10000-5;ISO 3166-2:JP: JP-10;面積: 6,362.28km2;総人口: 1,930,232人（推計人口、2021年7月1日）;人口密度: 303人/km2;隣接都道府県:  埼玉県 新潟県 長野県 栃木県 福島県;県の木: クロマツ;県の花: レンゲツツジ;県の鳥: ヤマドリ;県の魚県の歌県民の日マスコット: アユ群馬県の歌10月28日ぐんまちゃん;知事: 山本一太;法人番号: 7000020100005;所在地: 〒371-8570群馬県前橋市大手町一丁目1番1号北緯36度23分26.4秒東経139度3分37.6秒﻿ / ﻿北緯36.390667度 東経139.060444度﻿ / 36.390667; 139.060444﻿ (群馬県)座標: 北緯36度23分26.4秒東経139度3分37.6秒﻿ / ﻿北緯36.390667度 東経139.060444度﻿ / 36.390667; 139.060444﻿ (群馬県);外部リンク: 群馬県;ウィキポータル: 日本の都道府県/群馬県;平均気温（°C）: 24.3（8月）;最寒月: -0.3（1月）;降水量（mm）: 169.5（9月）;最少月: 36.7（12月）;降水日数（日）: 15.4（7月）;最少月: 6.4（12月）","都道府県#一覧","表形式","米麦栽培・養蚕・繊維工業などの伝統産業に加え、畜産・野菜栽培・機械工業が盛んで、県北西部は温泉・保養地である。利根川上流ダム群の豊かな水量は県内はもとより、東京都を始めとする関東の電力・上水道の供給源となっている。県南東部は都市化が進み、首都圏整備法の都市開発区域に指定され、工業地域を形成している。"
"高知県","3939高知県こうちけん高知市高知市 四国7,103.91728,461102.53402 / ※","https://ja.wikipedia.org/wiki/高知県","北緯33度33分34.9秒東経133度31分51.7秒","国: 日本;地方: 四国地方中国・四国地方;団体コード: 39000-3;ISO 3166-2:JP: JP-39;面積: 7,103.86km2;総人口: 683,634人（推計人口、2021年7月1日）;人口密度: 96.2人/km2;隣接都道府県: 徳島県、愛媛県、大分県- 海峡を挟んで隣接。;県の木: ヤナセスギ;県の花: ヤマモモ;県の鳥: ヤイロチョウ;他のシンボル: 県の魚：カツオ県の歌：高知県民の歌（1953年制定）県のキャラクター : くろしおくん;知事: 浜田省司;法人番号: 5000020390003;所在地: 〒780-8570高知県高知市丸ノ内一丁目2番20号北緯33度33分34.9秒東経133度31分51.7秒﻿ / ﻿北緯33.559694度 東経133.531028度﻿ / 33.559694; 133.531028﻿ (高知県)座標: 北緯33度33分34.9秒東経133度31分51.7秒﻿ / ﻿北緯33.559694度 東経133.531028度﻿ / 33.559694; 133.531028﻿ (高知県)県庁舎位置;外部リンク: 高知県;ウィキポータル: 日本の都道府県/高知県;平均気温(°C): 26.7（8月）;最寒月: 6.9（1月）;降水量(mm): 321.2（6月）;最少月: 55.3（12月）;平均気温(°C): 26.2（8月）;最寒月: 4.6（1月）;降水量(mm): 343.0（7月）;最少月: 54.8（12月）;国: 日本;地方: 四国地方中国・四国地方;団体コード: 39000-3;ISO 3166-2:JP: JP-39;面積: 7,103.86km2;総人口: 683,634人（推計人口、2021年7月1日）;人口密度: 96.2人/km2;隣接都道府県: 徳島県、愛媛県、大分県- 海峡を挟んで隣接。;県の木: ヤナセスギ;県の花: ヤマモモ;県の鳥: ヤイロチョウ;他のシンボル: 県の魚：カツオ県の歌：高知県民の歌（1953年制定）県のキャラクター : くろしおくん;知事: 浜田省司;法人番号: 5000020390003;所在地: 〒780-8570高知県高知市丸ノ内一丁目2番20号北緯33度33分34.9秒東経133度31分51.7秒﻿ / ﻿北緯33.559694度 東経133.531028度﻿ / 33.559694; 133.531028﻿ (高知県)座標: 北緯33度33分34.9秒東経133度31分51.7秒﻿ / ﻿北緯33.559694度 東経133.531028度﻿ / 33.559694; 133.531028﻿ (高知県)県庁舎位置;外部リンク: 高知県;ウィキポータル: 日本の都道府県/高知県;平均気温(°C): 26.7（8月）;最寒月: 6.9（1月）;降水量(mm): 321.2（6月）;最少月: 55.3（12月）;平均気温(°C): 26.2（8月）;最寒月: 4.6（1月）;降水量(mm): 343.0（7月）;最少月: 54.8（12月）","都道府県#一覧","表形式",""
"埼玉県","1111埼玉県さいたまけんさいたま市さいたま市 関東3,797.757,261,2711,912.06315 / 7","https://ja.wikipedia.org/wiki/埼玉県","北緯35度51分26秒東経139度38分56.9秒","国: 日本;地方: 関東地方;団体コード: 11000-1;ISO 3166-2:JP: JP-11;面積: 3,797.75km2（境界未定部分あり）;総人口: 7,343,791人（推計人口、2021年6月1日）;人口密度: 1,934人/km2;隣接都道府県:  東京都 千葉県 茨城県 栃木県 群馬県 山梨県 長野県;県の木: ケヤキ;県の花: サクラソウ;県の鳥: シラコバト;他のシンボル: 県の魚:ムサシトミヨ県の蝶:ミドリシジミ県のマスコット:コバトン・さいたまっち県の歌:埼玉県歌埼玉県民の日:11月14日;知事: 大野元裕;法人番号: 1000020110001;所在地: 〒330-9301埼玉県さいたま市浦和区高砂三丁目15番1号北緯35度51分26秒東経139度38分56.9秒﻿ / ﻿北緯35.85722度 東経139.649139度﻿ / 35.85722; 139.649139;外部リンク: 公式ウェブサイト;ウィキポータル: 日本の都道府県/埼玉県;平均気温(℃): 25.0（8月）;最寒月: 1.3（1月）;降水量(mm): 242.1（9月）;最少月: 19.0（12月）;国: 日本;地方: 関東地方;団体コード: 11000-1;ISO 3166-2:JP: JP-11;面積: 3,797.75km2（境界未定部分あり）;総人口: 7,343,791人（推計人口、2021年6月1日）;人口密度: 1,934人/km2;隣接都道府県:  東京都 千葉県 茨城県 栃木県 群馬県 山梨県 長野県;県の木: ケヤキ;県の花: サクラソウ;県の鳥: シラコバト;他のシンボル: 県の魚:ムサシトミヨ県の蝶:ミドリシジミ県のマスコット:コバトン・さいたまっち県の歌:埼玉県歌埼玉県民の日:11月14日;知事: 大野元裕;法人番号: 1000020110001;所在地: 〒330-9301埼玉県さいたま市浦和区高砂三丁目15番1号北緯35度51分26秒東経139度38分56.9秒﻿ / ﻿北緯35.85722度 東経139.649139度﻿ / 35.85722; 139.649139;外部リンク: 公式ウェブサイト;ウィキポータル: 日本の都道府県/埼玉県;平均気温(℃): 25.0（8月）;最寒月: 1.3（1月）;降水量(mm): 242.1（9月）;最少月: 19.0（12月）","都道府県#一覧","表形式","首都圏を構成し、都道府県別の人口は東京都、神奈川県、大阪府、愛知県に次ぐ全国第5位。人口密度は東京都、大阪府、神奈川県に次ぐ第4位である。県の財政力指数は全国第4位。令制国の武蔵国の一部に相当する。面積は第39位で、可住地面積比率は第3位の規模である。村は、東秩父村の1村のみである。"
"佐賀県","4141佐賀県さがけん佐賀市佐賀市 九州2,440.64833,245341.42002 / 2","https://ja.wikipedia.org/wiki/佐賀県","北緯33度14分57.9秒東経130度17分58.5秒","国: 日本;地方: 九州地方;団体コード: 41000-4;ISO 3166-2:JP: JP-41;面積: 2,440.68km2;総人口: 804,931人（推計人口、2021年6月1日）;人口密度: 330人/km2;隣接都道府県:  福岡県 長崎県;県の木: クスノキ;県の花: クスの花;県の鳥: カササギ（カチガラス）;県の歌: 県歌「佐賀県民の歌」さが・ふるさとの歌「栄の国から」佐賀県準県歌「風はみらい色」;知事: 山口祥義;法人番号: 1000020410004;所在地: 〒840-8570佐賀県佐賀市城内一丁目1番59号北緯33度14分57.9秒東経130度17分58.5秒﻿ / ﻿北緯33.249417度 東経130.299583度﻿ / 33.249417; 130.299583座標: 北緯33度14分57.9秒東経130度17分58.5秒﻿ / ﻿北緯33.249417度 東経130.299583度﻿ / 33.249417; 130.299583県庁舎位置;外部リンク: 佐賀県;ウィキポータル: 日本の都道府県/佐賀県;平均気温(°C): 25.4（8月）;最寒月: 5.3（1月）;降水量(mm): 324.3（7月）;最少月: 56.5（12月）","都道府県#一覧","表形式","唐津・伊万里・有田などは古くから陶磁器の産地として有名で、玄界灘と有明海の2つの海に接する。令制国の肥前国東部に相当する。明治の府県制成立の際、同国は佐賀県と長崎県の2県として分立した。九州地方の中では最も面積、経済規模が小さい県である一方で、人口密度は全国で16番目に高い。"
"滋賀県","2525滋賀県しがけん大津市大津市 近畿4,017.381,413,184351.81904 / 2","https://ja.wikipedia.org/wiki/滋賀県","北緯35度0分15.7秒東経135度52分6.6秒","国: 日本;地方: 近畿地方;団体コード: 25000-7;ISO 3166-2:JP: JP-25;面積: 4,017.38km2（境界未定部分あり）;総人口: 1,409,671人（推計人口、2021年7月1日）;人口密度: 351人/km2;隣接都道府県:  福井県 岐阜県 三重県 京都府;県の木: モミジ;県の花: シャクナゲ;県の鳥: カイツブリ;他のシンボル: 県民の歌 - 滋賀県民の歌シンボルマーク - Mother Lakeイメージキャラクター - うぉーたん、キャッフィーびわ湖の日 - 7月1日;知事: 三日月大造;法人番号: 7000020250007;所在地: 〒520-8577滋賀県大津市京町四丁目1番1号北緯35度0分15.7秒東経135度52分6.6秒﻿ / ﻿北緯35.004361度 東経135.868500度﻿ / 35.004361; 135.868500座標: 北緯35度0分15.7秒東経135度52分6.6秒﻿ / ﻿北緯35.004361度 東経135.868500度﻿ / 35.004361; 135.868500;外部リンク: 公式ウェブサイト;ウィキポータル: 日本の都道府県/滋賀県;平均気温（℃）:;最寒月:;降水量(mm): 320.1（12月）;最少月: 159.1（5月）;降水日数（日）: 21.8（1月）;最少月: 10.0（8月）;平均気温（℃）:;最寒月:;降水量(mm): 299.8（12月）;最少月: 161.2（8月）;降水日数（日）: 21.7（1月）;最少月: 9.7（8月）;長浜: 3.6;今津: 0.6;南小松: 2.2;彦根: 2.0;東近江: 6.2;大津: 5.9;信楽: 0.2;土山: 0.5;大津市: 25201-8;彦根市: 25202-6;長浜市: 25203-4;近江八幡市: 25204-2;草津市: 25206-9;守山市: 25207-7;栗東市: 25208-5;甲賀市: 25209-3;野洲市: 25210-7;湖南市: 25211-5;高島市: 25212-3;東近江市: 25213-1;米原市: 25214-0;日野町: 25383-9;竜王町: 25384-7;愛荘町: 25425-8;豊郷町: 25441-0;甲良町: 25442-8;多賀町: 25443-6;滋賀県: 25000-7","都道府県#一覧","表形式","令制国の近江国（江州）と完全に一致する。県名は大津が属していた郡名「滋賀郡」から採用された。「滋賀」の発音は、共通語では「し」にアクセントを置く（頭高型アクセント）が、地元では「が」にアクセントを置く（尾高型アクセント）ことが多い（「滋賀県」とする場合は共通語も地元の方言も同じアクセント）。"
"静岡県","2222静岡県しずおかけん静岡市浜松市 中部7,778.703,701,181475.83508 / 4","https://ja.wikipedia.org/wiki/静岡県","北緯34度54分59秒東経138度18分59秒","国: 日本;地方: 中部地方、東海地方;団体コード: 22000-1;ISO 3166-2:JP: JP-22;面積: 7,777.42km2（境界未定部分あり）;総人口: 3,613,694人（推計人口、2021年7月1日）;人口密度: 465人/km2;隣接都道府県:  神奈川県 山梨県 長野県 愛知県 東京都;県の木: モクセイ（キンモクセイ）;県の花: ツツジ;県の鳥: サンコウチョウ;県の歌県愛唱歌県民の日: 静岡県歌しずおか賛歌〜富士よ夢よ友よ8月21日;知事: 川勝平太;法人番号: 7000020220001;所在地: 〒420-8601静岡県静岡市葵区追手町 9-6北緯34度54分59秒東経138度18分59秒﻿ / ﻿北緯34.91639度 東経138.31639度﻿ / 34.91639; 138.31639座標: 北緯34度54分59秒東経138度18分59秒﻿ / ﻿北緯34.91639度 東経138.31639度﻿ / 34.91639; 138.31639県庁舎位置;外部リンク: 公式ウェブサイト;ウィキポータル: 日本の都道府県/静岡県;平均気温(℃): 26.7（8月）;最寒月: 5.8（1月）;降水量(mm): 262.2（9月）;最少月: 50.1（12月）;静岡市: 221007;浜松市: 221309;沼津市: 222038;熱海市: 222054;三島市: 222062;富士宮市: 222071;伊東市: 222089;島田市: 222097;富士市: 222101;磐田市: 222119;焼津市: 222127;掛川市: 222135;藤枝市: 222143;御殿場市: 222151;袋井市: 222160;下田市: 222194;裾野市: 222208;湖西市: 222216;伊豆市: 222224;御前崎市: 222232;菊川市: 222241;伊豆の国市: 222259;牧之原市: 222267;東伊豆町: 223018;河津町: 223026;南伊豆町: 223042;松崎町: 223051;西伊豆町: 223069;函南町: 223255;清水町: 223417;長泉町: 223425;小山町: 223441;吉田町: 224243;川根本町: 224294;森町: 224618;国: 日本;地方: 中部地方、東海地方;団体コード: 22000-1;ISO 3166-2:JP: JP-22;面積: 7,777.42km2（境界未定部分あり）;総人口: 3,613,694人（推計人口、2021年7月1日）;人口密度: 465人/km2;隣接都道府県:  神奈川県 山梨県 長野県 愛知県 東京都;県の木: モクセイ（キンモクセイ）;県の花: ツツジ;県の鳥: サンコウチョウ;県の歌県愛唱歌県民の日: 静岡県歌しずおか賛歌〜富士よ夢よ友よ8月21日;知事: 川勝平太;法人番号: 7000020220001;所在地: 〒420-8601静岡県静岡市葵区追手町 9-6北緯34度54分59秒東経138度18分59秒﻿ / ﻿北緯34.91639度 東経138.31639度﻿ / 34.91639; 138.31639座標: 北緯34度54分59秒東経138度18分59秒﻿ / ﻿北緯34.91639度 東経138.31639度﻿ / 34.91639; 138.31639県庁舎位置;外部リンク: 公式ウェブサイト;ウィキポータル: 日本の都道府県/静岡県;平均気温(℃): 26.7（8月）;最寒月: 5.8（1月）;降水量(mm): 262.2（9月）;最少月: 50.1（12月）;静岡市: 221007;浜松市: 221309;沼津市: 222038;熱海市: 222054;三島市: 222062;富士宮市: 222071;伊東市: 222089;島田市: 222097;富士市: 222101;磐田市: 222119;焼津市: 222127;掛川市: 222135;藤枝市: 222143;御殿場市: 222151;袋井市: 222160;下田市: 222194;裾野市: 222208;湖西市: 222216;伊豆市: 222224;御前崎市: 222232;菊川市: 222241;伊豆の国市: 222259;牧之原市: 222267;東伊豆町: 223018;河津町: 223026;南伊豆町: 223042;松崎町: 223051;西伊豆町: 223069;函南町: 223255;清水町: 223417;長泉町: 223425;小山町: 223441;吉田町: 224243;川根本町: 224294;森町: 224618;国: 日本;地方: 中部地方、東海地方;団体コード: 22000-1;ISO 3166-2:JP: JP-22;面積: 7,777.42km2（境界未定部分あり）;総人口: 3,613,694人（推計人口、2021年7月1日）;人口密度: 465人/km2;隣接都道府県:  神奈川県 山梨県 長野県 愛知県 東京都;県の木: モクセイ（キンモクセイ）;県の花: ツツジ;県の鳥: サンコウチョウ;県の歌県愛唱歌県民の日: 静岡県歌しずおか賛歌〜富士よ夢よ友よ8月21日;知事: 川勝平太;法人番号: 7000020220001;所在地: 〒420-8601静岡県静岡市葵区追手町 9-6北緯34度54分59秒東経138度18分59秒﻿ / ﻿北緯34.91639度 東経138.31639度﻿ / 34.91639; 138.31639座標: 北緯34度54分59秒東経138度18分59秒﻿ / ﻿北緯34.91639度 東経138.31639度﻿ / 34.91639; 138.31639県庁舎位置;外部リンク: 公式ウェブサイト;ウィキポータル: 日本の都道府県/静岡県;平均気温(℃): 26.7（8月）;最寒月: 5.8（1月）;降水量(mm): 262.2（9月）;最少月: 50.1（12月）;静岡市: 221007;浜松市: 221309;沼津市: 222038;熱海市: 222054;三島市: 222062;富士宮市: 222071;伊東市: 222089;島田市: 222097;富士市: 222101;磐田市: 222119;焼津市: 222127;掛川市: 222135;藤枝市: 222143;御殿場市: 222151;袋井市: 222160;下田市: 222194;裾野市: 222208;湖西市: 222216;伊豆市: 222224;御前崎市: 222232;菊川市: 222241;伊豆の国市: 222259;牧之原市: 222267;東伊豆町: 223018;河津町: 223026;南伊豆町: 223042;松崎町: 223051;西伊豆町: 223069;函南町: 223255;清水町: 223417;長泉町: 223425;小山町: 223441;吉田町: 224243;川根本町: 224294;森町: 224618","都道府県#一覧","表形式","直線距離にて県域の東西が155km、南北に118kmと全国13番目に広大な県域を保ち、全国10位の約360万人の人口を有する。旧令制国の伊豆国のほとんど、駿河国、遠江国の凡そ3国に相当する県である。地域によって住民の意識、方言、文化面に大きな違いが見られる。北側は広大な南アルプス、南側は駿河湾、遠州灘に面する。23市10区12町の自治体があり、村はない。"
